comment_id,video_id,username,comment_text,digg_count,create_time,clean_text
7509058339934896914,7481885307785235729,Ad Sắn,K có mùi gì .,0,1748338891,k có mùi gì .
7495916513688617735,7481885307785235729,1️⃣9️⃣9️⃣8️⃣🐯,Mua 1 lần và thôi😅,0,1745279146,mua 1 lần và thôi
7494627900966142738,7481885307785235729,Cơ điện lạnh hoài anh,Rồi khi nào đi khám tiếp😂,0,1744979053,rồi khi nào đi khám tiếp
7494539463051281170,7481885307785235729,khoai tây,phải công nhận vừa thơm vừa sạch vết bẩn.giá cả lại ok giờ chỉ giặt loại này giặt song k cần xả com pho,0,1744958468,phải công nhận vừa thơm vừa sạch vết bẩn.giá cả lại ok giờ chỉ giặt loại này giặt song k cần xả com pho
7500569656421073685,7481885307785235729,金彦🎀,"thơm thật mà, bột khỏi bàn",0,1746362475,"thơm thật mà, bột khỏi bàn"
7490560902124503826,7481885307785235729,Khải Nguyễn,Nc giặt aba mãi đỉnh,0,1744032132,nc giặt aba mãi đỉnh
7484136972715197191,7481885307785235729,Hữu Thuận,Ô Mô mải đỉnh,0,1742536454,ô mô mải đỉnh
7513541573477614357,7481885307785235729,𝑇 𝑖 𝑒̂ 𝑛 ♡,Cũng mua thử và đã dùng loại khác,0,1749382727,cũng mua thử và đã dùng loại khác
7506030362826294024,7481885307785235729,rittoo19,tiktoker chứ bộ là cha là mẹ à😂😂,1,1747633902,tiktoker chứ bộ là cha là mẹ à
7482014039557374738,7481885307785235729,dinhvu,Nhận tiền r thì cái j chả khen được 😂😂😂,3,1742042162,nhận tiền r thì cái j chả khen được
7482022110358766344,7481885307785235729,lê thảo my,làm tưởng gì,1,1742044040,làm tưởng gì
7482022635913970449,7481885307785235729,Hoàng Chu,mua nước giặt ở đây nhà @Thanh Lan,1,1742044162,mua nước giặt ở đây nhà
7530245356388909841,7481885307785235729,pình Định,Lúc giặt thì thơm phơi r chả ocfn mùi,0,1753271885,lúc giặt thì thơm phơi r chả ocfn mùi
7494653318070895377,7481885307785235729,socola,thôi tôi sợ đồ trên mạng rồi,0,1744984973,thôi tôi sợ đồ trên mạng rồi
7513265515248616210,7481885307785235729,PhúcHíu,Mua 1 lần duy nhất k có lần thứ 2 @Quốc Đạt,1,1749318457,mua 1 lần duy nhất k có lần thứ 2
7551855565619626770,7481885307785235729,Từn Vy,zx,0,1758303402,zx
7509747676709667591,7481885307785235729,an🍭,"htrc t thử sài ké có 1 lần xog t đặt vội
.comfort dùng cái này đó h thích điên",0,1748499399,htrc t thử sài ké có 1 lần xog t đặt vội .comfort dùng cái này đó h thích điên
7522306586179273490,7481885307785235729,Long160,Rồi có ngày lại ngòi tò,0,1751423491,rồi có ngày lại ngòi tò
7520597558470378247,7481885307785235729,kenny pham,bắt bà hết chúng Noa đi.,0,1751025576,bắt bà hết chúng noa đi.
7501947007783994128,7481885307785235729,Thảo thảo,Ômô muông nam,0,1746683164,ômô muông nam
7513391940197827345,7481885307785235729,hongquangdien,thì trong số đó nhân phẩm điều thua rau cải ngoài chợ... cũng có nhóm đi tò rồi,0,1749347891,thì trong số đó nhân phẩm điều thua rau cải ngoài chợ... cũng có nhóm đi tò rồi
7495649645369754375,7481885307785235729,Khanh Ho,uh này thom thiệt nha,0,1745216949,uh này thom thiệt nha
7542875402142925576,7482011948876369169,Ghiền,Tẩy cỡ đấy da nào chịu nổi,6,1756212539,tẩy cỡ đấy da nào chịu nổi
7542855642072941320,7482011948876369169,Trai aov nhg kh tồi !,Dùng để đánh răng đc kh ạ,2,1756207942,dùng để đánh răng đc kh ạ
7482053529462391568,7482011948876369169,Bắc Phoi,Gio hang dau,1,1742051353,gio hang dau
7482699815437435690,7482011948876369169,MeiiY,"Tẩy sạch mà nhanh gọn nữa nè, dùng tiện lắm luôm",4,1742201900,"tẩy sạch mà nhanh gọn nữa nè, dùng tiện lắm luôm"
7506683162408534802,7482011948876369169,Trinh 81,Vãi thật😂😂,0,1747785903,vãi thật
7482699804171649838,7482011948876369169,Hana Như,tẩy được ký ức người yêu cũ không ạ✨,0,1742201919,tẩy được ký ức người yêu cũ không ạ
7482700200176861994,7482011948876369169,Hong Ngoc My,"nhà mình cũng dùng loại tẩy okay này, giá rẻ á",0,1742202022,"nhà mình cũng dùng loại tẩy okay này, giá rẻ á"
7484938059457479431,7482011948876369169,Hani,xài sạch mà còn an toàn nữa,0,1742722963,xài sạch mà còn an toàn nữa
7501893764144677652,7482011948876369169,Gấu kute,sao mua 1 cũng bằng giá mua 3 nhể,0,1746670777,sao mua 1 cũng bằng giá mua 3 nhể
7500476660656751368,7482011948876369169,Emmthuyy,ủa sao 1 chai 85 mà 3 chai cx 85,1,1746340826,ủa sao 1 chai 85 mà 3 chai cx 85
7482699636524712747,7482011948876369169,Phương 2k3,E này e cũng dùng sạch lắm,1,1742201850,e này e cũng dùng sạch lắm
7482700030903862059,7482011948876369169,Linh Cua,da đen quá đổ vô người có trắng ko ạ kkk💞,0,1742202028,da đen quá đổ vô người có trắng ko ạ kkk
7482036794831373072,7482011948876369169,˙✧˖°📷 ༘ ⋆｡˚ꜱữɑ.ɕɦυɑ,:(((,1,1742047458,:(((
7482047819820401439,7482011948876369169,Băng Băng,Sạch ko dị bà thơ,1,1742050055,sạch ko dị bà thơ
7547267423759057671,7482011948876369169,𝙈ạnh  𝙏ài,=)) hặn là cháy hàng=)),0,1757235139,=)) hặn là cháy hàng=))
7482758506405626642,7482716285403548935,Hữu Chén,Tính khôn lõi mà nhân viên nhìn thấu 😂😂,24826,1742215504,tính khôn lõi mà nhân viên nhìn thấu
7482735117095682832,7482716285403548935,happy 993,đứng hình tim đập dồn dập khó thở 😂,15744,1742210065,đứng hình tim đập dồn dập khó thở
7483046575100412680,7482716285403548935,Cat,Didn’t understand a word but understood everything 🤣,843,1742282575,didnt understand a word but understood everything
7482736086436791058,7482716285403548935,Golfer,"Chị đơ cái mặt chị ra, đứng tim, chết lặng😂",9909,1742210278,"chị đơ cái mặt chị ra, đứng tim, chết lặng"
7482748084545897224,7482716285403548935,Mạnh 😗😗🦛🦛,Chị tính quay khỏi trả mà chơi dị đoá,1127,1742213077,chị tính quay khỏi trả mà chơi dị đoá
7482752431337718529,7482716285403548935,無名くん,"Khoan có kịch bản cả đó , rồi cái video bạn đang xem là ai quay , phải nói TQ content hay",3647,1742214089,"khoan có kịch bản cả đó , rồi cái video bạn đang xem là ai quay , phải nói tq content hay"
7483284479025496837,7482716285403548935,?,que paso XDDD,17,1742337968,que paso xddd
7482959897173689143,7482716285403548935,Ediyopper,permainan selesai 🤣🤣,2310,1742262402,permainan selesai
7482740526224671496,7482716285403548935,N.T.T,mất 3s cô ấy mới phản ứng kịp. 😄😄😄😄😄😄😄,802,1742211312,mất 3s cô ấy mới phản ứng kịp.
7482790074048856850,7482716285403548935,Vũ.,Cố ấy said: ko đúng kịch bản mà😳😳,497,1742222840,cố ấy said: ko đúng kịch bản mà
7483463131449656072,7482716285403548935,Seppy Go 🐂,Langsung ganti permainan🗿😭,79,1742379555,langsung ganti permainan
7483361554643272468,7482716285403548935,k e i,puas bgt lagi ketawanya😭😭,533,1742355914,puas bgt lagi ketawanya
7483051869707895559,7482716285403548935,Eteq,t bị mê cái giọng cười ấy :)))),1,1742283800,t bị mê cái giọng cười ấy :))))
7483097801955525393,7482716285403548935,dann,langsung pusing bjirr wkwk,1360,1742294502,langsung pusing bjirr wkwk
7483475706275676929,7482716285403548935,ica,belum selesai ngomong jir lahh😭,54,1742382497,belum selesai ngomong jir lahh
7483385359763636999,7482716285403548935,✍🏻,someone please explain in english,287,1742361452,someone please explain in english
7482744413526409991,7482716285403548935,Duy IKer,lần sau chừa nha mài😂😂😂😂😂,142,1742212212,lần sau chừa nha mài
7482737829005984530,7482716285403548935,Dưa hấu chấm mắm tôm 🍉,Nước đi này hẳn chị chưa ngờ tới,101,1742210684,nước đi này hẳn chị chưa ngờ tới
7482796713267790610,7482716285403548935,JO🪽,"""ko cần nói nữa gobi"" đủ lắm rồi..!",97,1742224388,"""ko cần nói nữa gobi"" đủ lắm rồi..!"
7483096797276128008,7482716285403548935,𝑴𝒚🥀𝓡𝓸𝓼𝓲𝓮♡🐿️,"Chị nhân viên ""Nhìn thấu hồng trần"" =)))",17,1742294257,"chị nhân viên ""nhìn thấu hồng trần"" =)))"
7483306922177250055,7482716285403548935,vuongthuysinh89,Đủ wow chưa😂,8,1742343213,đủ wow chưa
7483364595223233288,7482716285403548935,ARGAZA,Langsung lupa ingatan 😭,14,1742356610,langsung lupa ingatan
7483358285400687368,7482716285403548935,user5967103262483,the woman was too stunned to speak~,15,1742355145,the woman was too stunned to speak~
7482814272813941512,7482716285403548935,mt🧘🏻,t nói là t có thể cười đến chết được luôn,51,1742228478,t nói là t có thể cười đến chết được luôn
7483113579408573202,7482716285403548935,️,lah emangnya kenapa ga paham soalnya 😭,48,1742298169,lah emangnya kenapa ga paham soalnya
7502727362308997895,7482716285403548935,meyyyyyyyyy,"maksudnya apa?, dia ngomong apa?",9,1746864855,"maksudnya apa?, dia ngomong apa?"
7482765275034534711,7482716285403548935,saltnpepper🇿🇦,Ok..translate to English please thank you 👀,84,1742217099,ok..translate to english please thank you
7482747598215971592,7482716285403548935,(づ｡◕‿‿◕｡)づ,chị xịt keo😂,43,1742212962,chị xịt keo
7483348686853473042,7482716285403548935,Nguyên Đạt,đang uống cà phê mén sặc,7,1742352913,đang uống cà phê mén sặc
7482802465777484551,7482716285403548935,ân,đủ wow r do,30,1742225731,đủ wow r do
7482738028151554817,7482716285403548935,Quốc Vũ Nguyễn,😂 Chị đứng hình,17,1742210730,chị đứng hình
7482789739876860689,7482716285403548935,Thần chú diệt cali・ 30/04/1975,NV: mài tính khôn lỏi hả :)))),5,1742222775,nv: mài tính khôn lỏi hả :))))
7483012557125747464,7482716285403548935,Cactus star,It's normal.,17,1742274647,it's normal.
7482963221479342856,7482716285403548935,trầm tính,Nhỏ kiểu: k lẽ đây là sự thật,5,1742263180,nhỏ kiểu: k lẽ đây là sự thật
7483083675468038919,7482716285403548935,Song Nhi 🎀,là sao vậyy chưa hiểu😭,114,1742291207,là sao vậyy chưa hiểu
7482741010700698388,7482716285403548935,Hoang Anh Tu,nụ cười của kẻ chiến thắng có khác giòn tan luôn 🤣,6,1742211426,nụ cười của kẻ chiến thắng có khác giòn tan luôn
7482769389106119442,7482716285403548935,Pin Pon5018,Con e lớn vậy rùi à giờ mún tìm tiktok của 2 ae này ko thấy lun,20,1742218035,con e lớn vậy rùi à giờ mún tìm tiktok của 2 ae này ko thấy lun
7482767558807372551,7482716285403548935,Minh-Phương,😂😂😂Chưa kịp hồi chiêu,7,1742217603,chưa kịp hồi chiêu
7499100145380918024,7482716285403548935,iya lagi iya lagi,muka stress nya dapat lagi 🤣,3,1746020325,muka stress nya dapat lagi
7484599292608594694,7482716285403548935,Leumoe,cameraman? ☕🗿,4,1742644120,cameraman?
7489031107797730056,7482716285403548935,Com đỗ nghèo khỉ,cái này khó nha brooo,1,1743675949,cái này khó nha brooo
7497152221256155920,7482716285403548935,🐍,mở bài xong kết bài luôn,1,1745566789,mở bài xong kết bài luôn
7483451174110511890,7482716285403548935,Phan Manh Quyen,ngơ luôn,1,1742376780,ngơ luôn
7483547240336245521,7482716285403548935,Ghec ăn cáa,"em không sao,chị nhân viên 1sao🥰",1,1742399140,"em không sao,chị nhân viên 1sao"
7483475484077851400,7482716285403548935,Chíp🐣,Nụ cười đã tắt 😂,1,1742382431,nụ cười đã tắt
7483771810027176721,7482716285403548935,ghét ăng cá 🐟,Chị k ngờ đc chứ zì,1,1742451422,chị k ngờ đc chứ zì
7483451481304744721,7482716285403548935,_hoàng<>lượng_190,Nước cờ này chưa hề nghĩ 😅,1,1742376853,nước cờ này chưa hề nghĩ
7483767357903618824,7482716285403548935,Theros Wuan,"Ta nói giận tím người sẽ ko bao giờ quay lại tiệm này thêm bất cứ lần nào nữa , thề 😂",1,1742450386,"ta nói giận tím người sẽ ko bao giờ quay lại tiệm này thêm bất cứ lần nào nữa , thề"
7483501552335930130,7482716285403548935,LàVìEm,Sao ko chọn thằng quay nè,1,1742388499,sao ko chọn thằng quay nè
7483768839244907282,7482716285403548935,安 思 嬌.,"Nhân viên: anh kia là người nhà của em, em không nỡ nên làm phiền chị r",1,1742450740,"nhân viên: anh kia là người nhà của em, em không nỡ nên làm phiền chị r"
7483249463353508616,7482716285403548935,Cười mỉm 😌,Tao đơ cái mặt tao ra luôn 🙄🙄,1,1742329830,tao đơ cái mặt tao ra luôn
7483207710621500168,7482716285403548935,C🌻,Chưa đủ wowwww,1,1742320094,chưa đủ wowwww
7483530605330809621,7482716285403548935,LTNS XD,Biết 2ae nhà này hồi nhỏ này bé xíu xem mấy cái vid bị ông anh troll hài điên,1,1742395257,biết 2ae nhà này hồi nhỏ này bé xíu xem mấy cái vid bị ông anh troll hài điên
7483753782150251284,7482716285403548935,husinanjas,yg HP nya bunyi teraktir makan semua. 😁😁😁,2,1742447234,yg hp nya bunyi teraktir makan semua.
7483730142616912647,7482716285403548935,nhim iu ♡,buồn cũng kh yên nữa tr,1,1742441729,buồn cũng kh yên nữa tr
7483713545148187400,7482716285403548935,2 0 0 4,Bà này giờ lớn quá r nhỉ!😂,1,1742437867,bà này giờ lớn quá r nhỉ!
7483352370530665223,7482716285403548935,𝑨𝒓𝒂𝒏𝒆𝒂𝒆.,đã tao,1,1742353782,đã tao
7483114310857753364,7482716285403548935,Bộiii,Giỡn v có nên k tr=))),1,1742298351,giỡn v có nên k tr=)))
7483491945865757448,7482716285403548935,ARGAZA,"🙍‍♀️: Apa ini Hidup macam apa ini, dia gktau cara mainya ya?",2,1742386269,": apa ini hidup macam apa ini, dia gktau cara mainya ya?"
7483174787829859079,7482716285403548935,Roy🫧,zậy cái đt quay bả của ai :))),1,1742312412,zậy cái đt quay bả của ai :)))
7483346871110124296,7482716285403548935,A,Chị đơ cái mặt chị ra lun,1,1742352490,chị đơ cái mặt chị ra lun
7483133728974226183,7482716285403548935,vợ cute,Không qua mắt đc chuỵ đâu cưng,1,1742302853,không qua mắt đc chuỵ đâu cưng
7483144068480320263,7482716285403548935,seazne ꪔ̤̮,cười bay luôn á,1,1742305270,cười bay luôn á
7483336274553455367,7482716285403548935,Khánh Dươnggg 🇻🇳🇨🇿,Có vậy thôi mà tao cười chếc luôn đó,1,1742350020,có vậy thôi mà tao cười chếc luôn đó
7485009197596345105,7482716285403548935,jexii,plot twist itu bukan hp nya,2,1742739529,plot twist itu bukan hp nya
7483074164154204936,7482716285403548935,Tui là Đẳng nè,Nhất dương chỉ 🥰,1,1742288995,nhất dương chỉ
7483065190738150151,7482716285403548935,Vĩ nhà ở WAYS STATION ✅,tính như trời tính😂,1,1742286903,tính như trời tính
7483331554900574984,7482716285403548935,Kiều Linh,NỤ CƯỜI ĐÃ TẮT...ĐẰNG SAU NƯƠC MẮT 😅,1,1742348926,nụ cười đã tắt...đằng sau nươc mắt
7483134089442149138,7482716285403548935,Quốc Huy,-1 khách quen,1,1742302943,-1 khách quen
7483063323077034759,7482716285403548935,Cây láp Luxury ✨💅🏻,+1 máy dứt khoát 🥰,1,1742286466,+1 máy dứt khoát
7483166591363023623,7482716285403548935,Nguyễn Phương Nam,Trối làm sao được 😂😂😂,1,1742310506,trối làm sao được
7483085821336421127,7482716285403548935,Cẩm Hồng ღ,cj xịt keo,1,1742291705,cj xịt keo
7483082109679223559,7482716285403548935,Candy Nguyen3363,Nhìn mặt nhỉ đúng tiếu luôn 😂,2,1742290838,nhìn mặt nhỉ đúng tiếu luôn
7483162416789865224,7482716285403548935,nhung gay cac anh¿,"""chị cũng không ngờ luôn""",1,1742309537,"""chị cũng không ngờ luôn"""
7482767095840441109,7482760520085458194,HaKu,Bamilu nhượng thương hiệu của vinh phải khum ạ,5,1742217493,bamilu nhượng thương hiệu của vinh phải khum ạ
7482816906773398279,7482760520085458194,Cá,Ai đi ăn r cho mình xin review thật sự với 😂,5,1742229090,ai đi ăn r cho mình xin review thật sự với
7483049547477156625,7482760520085458194,Bông hoa nhỏ 123,giá cả 1 mâm ăn như bạn bao nhiêu vậy,2,1742283260,giá cả 1 mâm ăn như bạn bao nhiêu vậy
7482762001782506247,7482760520085458194,Tuan Anh,Ngay gần nhà,1,1742216310,ngay gần nhà
7483018136624399112,7482760520085458194,Kem Kem🤎,Quán này mới mở nè trời ơi phải đi thử mới được mong chờ mãi😆,1,1742275954,quán này mới mở nè trời ơi phải đi thử mới được mong chờ mãi
7483017841517265671,7482760520085458194,Dan Le,đừng để bạn thân t thấy,1,1742275879,đừng để bạn thân t thấy
7485754770088362769,7482760520085458194,Quỳnh bei,Ăn ngon nha hôm bữa đi ăn no lê la mà rẻ nữa mỗi tội phục vụ hơi lâu nc viu rộng rãi ăn cũng ok nhưng nhanh hơn thì ok,1,1742913116,ăn ngon nha hôm bữa đi ăn no lê la mà rẻ nữa mỗi tội phục vụ hơi lâu nc viu rộng rãi ăn cũng ok nhưng nhanh hơn thì ok
7485349195504943893,7482760520085458194,Lê Luân - Kids Mom Hà Trung,Xin menu ạ,1,1742818692,xin menu ạ
7489300691345982215,7482760520085458194,Tý Hà Tĩnh,Đồ ăn ngon quá ạ,1,1743738712,đồ ăn ngon quá ạ
7489300121470010130,7482760520085458194,Bamilu_Vinh,Quán mới mở mà đồ ăn ngon quá mn ạ,1,1743738581,quán mới mở mà đồ ăn ngon quá mn ạ
7483195762147853063,7482760520085458194,Phanh le,Thương hiệu trong Vinh phải k a,3,1742317302,thương hiệu trong vinh phải k a
7489301229564101384,7482760520085458194,Quốc Duy🖤,Quán đồ ăn ngon như này thì đi thử thôi nào các con vợ,1,1743738845,quán đồ ăn ngon như này thì đi thử thôi nào các con vợ
7482768515888710408,7482760520085458194,Việt Sương Gió,quán k có bát toàn hứng bàn tay🤣🤣,2,1742217822,quán k có bát toàn hứng bàn tay
7483859580331803399,7482760520085458194,Nhi nhi,Đến ăn món muốn ăn thì đúng hôm k có,1,1742471866,đến ăn món muốn ăn thì đúng hôm k có
7483089462810149652,7482760520085458194,🥱🥱🥱🥱,Bamilu nhượng thương hiệu . Quán chính ở thành phố Vinh.,2,1742292553,bamilu nhượng thương hiệu . quán chính ở thành phố vinh.
7489300730500973330,7482760520085458194,Tý Hà Tĩnh,Quán mới mở ở Thanh Hoá nè mn,1,1743738729,quán mới mở ở thanh hoá nè mn
7494138197934523144,7482760520085458194,Tý Hà Tĩnh,Tuyệt vời mn ơi,1,1744865039,tuyệt vời mn ơi
7483080648573633300,7482760520085458194,𝐇u𝐲ề𝐧 𝐓r𝐚n𝐠,Đối diện nhà m hnao bán vậy ah để sang thẩm nào ☺️☺️,1,1742290505,đối diện nhà m hnao bán vậy ah để sang thẩm nào
7482969161192538888,7482760520085458194,VanGiap1984ĐBG,Nhượng thương hiệu về Thanh Hoá rồi. Quán này đồ ăn ngon,1,1742264558,nhượng thương hiệu về thanh hoá rồi. quán này đồ ăn ngon
7483222978617770770,7482760520085458194,Nguyễn Rain,có lương đi ăn ạ,1,1742323650,có lương đi ăn ạ
7482781463945069320,7482760520085458194,Hưng béo 🥲,Quá đã chị ơi 😍,1,1742220841,quá đã chị ơi
7483088347464991496,7482760520085458194,Hoàng tử raumania 🛤️🌱,Bamilu 111 đội cung mới ăn lúc trưa mới ăn. Ngon và rẻ,1,1742292292,bamilu 111 đội cung mới ăn lúc trưa mới ăn. ngon và rẻ
7534284467475038994,7482760520085458194,Hà Sam,địa chỉ ạ,0,1754212311,địa chỉ ạ
7483891609990808328,7482760520085458194,ram,"@✮ @🐽snhan cte🐽 @𝖒𝖊̀𝖔, @Bống 🤍 @.bicutephomaique @Ngo Duc Manh💙 @Lê Lâm @STung @𝓚𝓱á𝓷𝓱𝓥â𝓷 ê gần trg mig nè",5,1742479313,cte ê gần trg mig nè
7490891367708377874,7482760520085458194,🔮🪬,@Linh ú🫧 @Hà Anh✨ @tet cte~ gần chợ tthi,2,1744109078,~ gần chợ tthi
7483399154186748690,7482760520085458194,um..,@Bống 🤍 @𝙃𝙪𝙤𝙣𝙜𝙂𝙞𝙖𝙣𝙜 @🐽snhan cte🐽 @✮,3,1742364658,cte
7483465222884524820,7482760520085458194,Hà Vy 👩‍🏫,nào đi @Đoán đi :)),2,1742380041,nào đi :))
7483093327991128840,7482760520085458194,Linh Trang,@Nguyễn Rain,2,1742293452,ễn rain
7483110388238648072,7482760520085458194,phuong0107,@🤭 phương thảo 🤭  tề m,1,1742297421,phương thảo tề m
7483401461209367317,7482760520085458194,𝙑𝙪 𝙏𝙝 𝙃𝙪𝙮𝙚𝙣,@💞Anh Nguyễn ❤️ @Nữ phụ ngôn tình,2,1742365194,nguyễn
7483023694165869330,7482760520085458194,Hà,Đặng@Đặng Cường,1,1742277246,đặng
7482947303737770770,7482760520085458194,Chenny'ss Hạnh'ss,@Fb: Trung Nè 🎭,1,1742259456,: trung nè
7482950773719827208,7482760520085458194,Quin Anz🍀,Cho mấy đứa vào đây đỡ nghĩ pải ăn gì @Phương Chu ĐXBB,1,1742260275,cho mấy đứa vào đây đỡ nghĩ pải ăn gì
7483023742134993671,7482760520085458194,Gu học bá,@nguyễn thảo nhun rủ đi ăn nè :)),1,1742277251,ễn thảo nhun rủ đi ăn nè :))
7549234308804903696,7482769267323047186,່8h ăn đậu,"Khuyên thật, mấy ông đừng ham những người con gái xinh đẹp, yêu vào khổ lắm. Chàng trai khôn ngoan sẽ chọn người nhan sắc bình thường nhưng mà biết yêu chiều quan tâm ấy. Còn chị này để mình, mình chịu khổ quen rồi..",1,1757693089,"khuyên thật, mấy ông đừng ham những người con gái xinh đẹp, yêu vào khổ lắm. chàng trai khôn ngoan sẽ chọn người nhan sắc bình thường nhưng mà biết yêu chiều quan tâm ấy. còn chị này để mình, mình chịu khổ quen rồi.."
7482770636546032392,7482769267323047186,Minh Thuý Store,Yêu quá gái mẹ chúc con gái sớm lấy lại xu hướng nhé ❤️,343,1742218318,yêu quá gái mẹ chúc con gái sớm lấy lại xu hướng nhé
7482774445481657106,7482769267323047186,soitkcum2,Thái nghĩa đăng lại kìa,196,1742219204,thái nghĩa đăng lại kìa
7482786926870774546,7482769267323047186,If,bạn này ngày càng xinh luôn ý 😋,19,1742222109,bạn này ngày càng xinh luôn ý
7559919152581657352,7482769267323047186,Tổng Tài 👤,chị...chị ăn cơm chuaa,1,1760180849,chị...chị ăn cơm chuaa
7561311609483526932,7482769267323047186,ᡣ𐭩𝙃ồ𝙣𝙜𝙝à𝙞𝙣𝙝𝙞,Xinh thiss,1,1760505060,xinh thiss
7483521545919660818,7482769267323047186,𝒛𝒂𝒏𝒉,xinhh nhaa,1,1742393152,xinhh nhaa
7482782424101126919,7482769267323047186,trầm tính nhất a1🥶,Góc quay đưa em đến với Mitt😻,10,1742221065,góc quay đưa em đến với mitt
7527322454730638098,7482769267323047186,><,ê nói thiệt bả cười xinh vãi,1,1752591337,ê nói thiệt bả cười xinh vãi
7483841304201478919,7482769267323047186,BM Music🎧🎶🎶,Iu mít😳,1,1742467606,iu mít
7495459570757600007,7482769267323047186,vincom.plaza.thanhhoa,Gái Thanh Hoá xinh iu quá,2,1745172705,gái thanh hoá xinh iu quá
7483466287592784648,7482769267323047186,hàn lượng✌️,ko đấy,1,1742380293,ko đấy
7491173938732630804,7482769267323047186,𝙈ó𝙉✨,xik ht phần rou😭,1,1744174872,xik ht phần rou
7482772102207505160,7482769267323047186,nq,xinhh nha ngdepp🫶🏻,2,1742218661,xinhh nha ngdepp
7493157781689516807,7482769267323047186,Dubnium,Hữu duyên bl hết tháng,1,1744636763,hữu duyên bl hết tháng
7483174314192372487,7482769267323047186,ᥫ᭡jem bống ఌ︎,e cần c đuoc hummm,1,1742312304,e cần c đuoc hummm
7483003569702322952,7482769267323047186,ê,tut make đi mít yeu oiii,5,1742272564,tut make đi mít yeu oiii
7491305834342105874,7482769267323047186,bnq,Anh Tuấn 6 đăng lại kìaa😋,2,1744205569,anh tuấn 6 đăng lại kìaa
7482772038488326933,7482769267323047186,#anhnhoem,xik z💗,2,1742218650,xik z
7483034254978319120,7482769267323047186,Thắp Lửa Văn Chương,iu lắm mit oiii,1,1742279722,iu lắm mit oiii
7482864810885284626,7482769267323047186,😋,cung là 2 vd đó nhưng mà càng ngày càng xinh roai😝😭,2,1742274786,cung là 2 vd đó nhưng mà càng ngày càng xinh roai
7483179924092125959,7482769267323047186,đàn ông làm khổ bố,vkk tôi hay vk a khác ^^ 😌,1,1742313617,vkk tôi hay vk a khác ^^
7483159763666535175,7482769267323047186,Hoàng Lê Phú,video đầu tiên gái t tim video,1,1742308921,video đầu tiên gái t tim video
7493164894503256850,7482769267323047186,loser in love?,chị dùng dthoại gì v,1,1744638418,chị dùng dthoại gì v
7483027926029452039,7482769267323047186,em xùuuu 🍼,xinh vay trrrrr,1,1742278229,xinh vay trrrrr
