comment_id,video_id,username,comment_text,digg_count,create_time,clean_text
7551660307081478919,7551652773650042128,🇻🇳- Lê Anh Chiều- 🇻🇳,Tôi đề nghị chị chủ quán cứ giữ thái độ căng thẳng đó cho tới khi có lệnh thi hành án😆,670,1758257934,tôi đề nghị chị chủ quán cứ giữ thái độ căng thẳng đó cho tới khi có lệnh thi hành án
7551690951107216149,7551652773650042128,istore27,Tổng tài giả giàu gặp thiếu gia giả nghèo😂,125,1758265072,tổng tài giả giàu gặp thiếu gia giả nghèo
7551658815700124423,7551652773650042128,Nhạc trẻ xưa và hài,Tổng tài mới trùng sinh chưa liên kết hệ thống ak,54,1758257590,tổng tài mới trùng sinh chưa liên kết hệ thống ak
7551655225322373895,7551652773650042128,Hung Vu,dù là nhân viên hay con chủ quán cũng k nên làm như vậy,772,1758256755,dù là nhân viên hay con chủ quán cũng k nên làm như vậy
7551702077026632468,7551652773650042128,Ringleader Lee,Sau khi tổng tài bị chủ quán đuổi về 😁,40,1758267662,sau khi tổng tài bị chủ quán đuổi về
7551668036722737928,7551652773650042128,Sơn Đạt paint,độ ngầu đâu hết rồi,6,1758259739,độ ngầu đâu hết rồi
7551662773215134472,7551652773650042128,Quynhanh🎀🧸🩷,Tổng tài dỏm đụng trúng tổng tài thật trong vai nhân viên làm thêm =))) hơn cả tiểu thuyết,84,1758258512,tổng tài dỏm đụng trúng tổng tài thật trong vai nhân viên làm thêm =))) hơn cả tiểu thuyết
7551764549528896264,7551652773650042128,Cỏ May,nếu đó mà là nhân viên con nhà nghèo thì s. sợ phải quỳ xin lỗi ngược.. tụi nó nghĩ bắt nạt ai cũng đc. hả dạ qá,25,1758282208,nếu đó mà là nhân viên con nhà nghèo thì s. sợ phải quỳ xin lỗi ngược.. tụi nó nghĩ bắt nạt ai cũng đc. hả dạ qá
7551658318127055623,7551652773650042128,Mẹ Mật 96,Tổng tài ở VN bị CA nhốt gần hết rồi nên hạn chế thể hiện nhé các bạn,149,1758257477,tổng tài ở vn bị ca nhốt gần hết rồi nên hạn chế thể hiện nhé các bạn
7551732882021401351,7551652773650042128,SIBAYSTORE,Lên nào đoàn mình ơi,5,1758274836,lên nào đoàn mình ơi
7551709054176428818,7551652773650042128,Tú,Chủ tịch giả giàu gặp ngay chủ quán giả nghèo :))),8,1758269288,chủ tịch giả giàu gặp ngay chủ quán giả nghèo :)))
7551655332780606226,7551652773650042128,Hải Đăng.68M1,thể hiện lại như lúc ban đầu nào tổng tài .chắc tâm t ác nên t thấy vui😂,135,1758256778,thể hiện lại như lúc ban đầu nào tổng tài .chắc tâm t ác nên t thấy vui
7551752226487010055,7551652773650042128,Duy khánh DQ 💚,không đơn giản xin lỗi là xong,0,1758279336,không đơn giản xin lỗi là xong
7551703838794564372,7551652773650042128,nn_3542,Nhìn cái thần thái của cô đó là biết k phải thường rồi 😂kiểu tầng lớp k cần tiền 😁,18,1758268075,nhìn cái thần thái của cô đó là biết k phải thường rồi kiểu tầng lớp k cần tiền
7551689984164512519,7551652773650042128,Toản Lê,Đeo sợi day nịt là biết tổng tài rồi 😂😂,256,1758264844,đeo sợi day nịt là biết tổng tài rồi
7551698400448004871,7551652773650042128,soi giun đũa,"Hắn nhấp một ngụm cà phê muối, ánh mắt lạnh lùng hướng ra ngoài khung cửa nơi gió thổi dữ dội. Khóe môi khẽ cong, giọng trầm thấp vang lên:
“Trời lạnh rồi, bảo quản gia chuẩn bị chỗ trong tù, ta muốn vào đó tránh gió.”",5,1758266810,"hắn nhấp một ngụm cà phê muối, ánh mắt lạnh lùng hướng ra ngoài khung cửa nơi gió thổi dữ dội. khóe môi khẽ cong, giọng trầm thấp vang lên: trời lạnh rồi, bảo quản gia chuẩn bị chỗ trong tù, ta muốn vào đó tránh gió."
7551657532894380801,7551652773650042128,𝓧𝓾𝓪̂𝓷 𝓗𝓲𝓮̂̀𝓷,Vị tổng tài giả nghèo đến quán cà phê thử lòng tương tác giấu thân phận không ngờ công an bế lên phường,9,1758257300,vị tổng tài giả nghèo đến quán cà phê thử lòng tương tác giấu thân phận không ngờ công an bế lên phường
7551690598416712455,7551652773650042128,tritrantrong94,Không bênh ai nhưng tới xl là còn đeo khẩu trang là không thật lòng 😂,38,1758264990,không bênh ai nhưng tới xl là còn đeo khẩu trang là không thật lòng
7551689086399988496,7551652773650042128,😊😊SẮP ĐỔI TÊN 😅😅,style qua cái dây thắt lưng là biết tổng tài ko bình thường rồi,6,1758264800,style qua cái dây thắt lưng là biết tổng tài ko bình thường rồi
7551717853565551367,7551652773650042128,Thạch Hạo TV.🛠️,Người ta biết lỗi rồi mình cũng nên tha thứ bao dung rộng lượng cho người ta sữa sai đi mà....Mới đầu người ta ko nghĩ nó đến nghiêm trọng nhưng giờ ai cũng có cái sai mà cho người ta sữa lỗi nha các chế đẹp ơi,67,1758271336,người ta biết lỗi rồi mình cũng nên tha thứ bao dung rộng lượng cho người ta sữa sai đi mà....mới đầu người ta ko nghĩ nó đến nghiêm trọng nhưng giờ ai cũng có cái sai mà cho người ta sữa lỗi nha các chế đẹp ơi
7551691863943152400,7551652773650042128,Sea Say Sữa,Quán cafe chỉ là 1 mảng siêu nhỏ li ti để ngta rửa ... thực ra đằng sau ngta tài chính khiếp cỡ nào ae ko biết đc âu,74,1758265290,quán cafe chỉ là 1 mảng siêu nhỏ li ti để ngta rửa ... thực ra đằng sau ngta tài chính khiếp cỡ nào ae ko biết đc âu
7551697623775871760,7551652773650042128,Kafe,Ơ đúng kịch bản phải là tổng tài đến duổi cả quán vì cả toà nhà là của tổng tài chứ nhỉ,10,1758266679,ơ đúng kịch bản phải là tổng tài đến duổi cả quán vì cả toà nhà là của tổng tài chứ nhỉ
7551655771822408455,7551652773650042128,Dũng,Tổng tài đeo dây nịt vậy là hiểu.đúng tổng tài,22,1758256879,tổng tài đeo dây nịt vậy là hiểu.đúng tổng tài
7551702809989612296,7551652773650042128,NTL,"lúc chỉ tay ra hiệu oai lắm cơ mà, phong thái lắm mà",20,1758267831,"lúc chỉ tay ra hiệu oai lắm cơ mà, phong thái lắm mà"
7551671972054287122,7551652773650042128,Hoa Bỉ Ngạn,ko giống phim nhể. tưởng phải cầm điện thoại alo cái là 2 phút sau 2 mc chủ quán quỳ năn nỉ xin tổng tài chứ,5,1758260653,ko giống phim nhể. tưởng phải cầm điện thoại alo cái là 2 phút sau 2 mc chủ quán quỳ năn nỉ xin tổng tài chứ
7551700680714257160,7551652773650042128,Nha Sỹ 193💉🦷,Kịch bản: tổng tài sẽ về mách bố là chủ tịch lớn và ông bố sẽ mua đứt quán cafe này. Hết phim,11,1758267339,kịch bản: tổng tài sẽ về mách bố là chủ tịch lớn và ông bố sẽ mua đứt quán cafe này. hết phim
7551655896754111240,7551652773650042128,15/01/92 ❤️❤️❤️,tổng tài mà cũng sợ bồi thường ak 😁l,12,1758256910,tổng tài mà cũng sợ bồi thường ak l
7551661041953620757,7551652773650042128,Ahihi.,Theo kịch bản là tổng tài mua lại quán mà ta.🤭🤭,5,1758258111,theo kịch bản là tổng tài mua lại quán mà ta.
7551690333928506132,7551652773650042128,Trai nè,Đúng kịch bản: để tổng tài xuống giọng như này thì chị kia ít nhất phải cấp bật tông sư 😳,10,1758264930,đúng kịch bản: để tổng tài xuống giọng như này thì chị kia ít nhất phải cấp bật tông sư
7551698900253344528,7551652773650042128,Đinh Trung Hiếu,"dù sao bạn này cũng bản lĩnh, dám làm dám đối diện.",6,1758266927,"dù sao bạn này cũng bản lĩnh, dám làm dám đối diện."
7551664851451314960,7551652773650042128,cuthethoi268,Tiền nhiều là xong hết :))) sợ mỗi ng ta không cần tiền thôi :)),6,1758258998,tiền nhiều là xong hết :))) sợ mỗi ng ta không cần tiền thôi :))
7551772970986963719,7551652773650042128,Ngọc Thanh,nếu là nhân viên bình thường thì anh ấy có đến để xin lỗi không,4,1758284171,nếu là nhân viên bình thường thì anh ấy có đến để xin lỗi không
7552557899068408583,7551652773650042128,SơN vũ KanG,Còn bịt khẩu trang để che bộ mặt ch má,1,1758466924,còn bịt khẩu trang để che bộ mặt ch má
7553180697881510664,7551652773650042128,Tam Ngyễn Văn,Đúng rồi núi cao sẽ có ngọn núi cao hơn..tuyệt....,1,1758611932,đúng rồi núi cao sẽ có ngọn núi cao hơn..tuyệt....
7552101175911482130,7551652773650042128,lạ lắm,Tui like chị chủ ! Quá chuẩn,1,1758360583,tui like chị chủ ! quá chuẩn
7551785026951217928,7551652773650042128,Tú Anh,Nếu không có áp lực dư luận. ko gặp phải nhà gia thế chắc gì em đã xin lỗi,2,1758286976,nếu không có áp lực dư luận. ko gặp phải nhà gia thế chắc gì em đã xin lỗi
7551683874565866248,7551652773650042128,Hoa Hồng Đen,cứ phải để cho chịu trách nhiệm trước pháp luật. để học bài học làm người và luật pháp. còn răn đe bao kẻ khác có tư duy giang hồ thời hiện đại,4,1758263424,cứ phải để cho chịu trách nhiệm trước pháp luật. để học bài học làm người và luật pháp. còn răn đe bao kẻ khác có tư duy giang hồ thời hiện đại
7551667172511384327,7551652773650042128,Phan Huy,Tổng tài thật sự 🤭 là mẹ nạn nhân,4,1758259537,tổng tài thật sự là mẹ nạn nhân
7551792427162911496,7551652773650042128,HUGO,Tui thik thái độ của cô này nè,3,1758288698,tui thik thái độ của cô này nè
7551721344884425492,7551652773650042128,bình đu đủ,vậy mới được chứ...Tổng tài hả..lo côi lại. Tổng cộng bao nhiêu tiền 😁😁😁,4,1758272150,vậy mới được chứ...tổng tài hả..lo côi lại. tổng cộng bao nhiêu tiền
7551769718311535381,7551652773650042128,Hoà Lê,Có đk thì nên theo vụ này tới cùng Chị ơi! Ủng hộ Chị,2,1758283410,có đk thì nên theo vụ này tới cùng chị ơi! ủng hộ chị
7551847578855342864,7551652773650042128,Hưng 🍏,Đúng kiểu tiên nhân bất khả lộ😂,1,1758301542,đúng kiểu tiên nhân bất khả lộ
7551837203736150801,7551652773650042128,caheomac,thích câu ( e kg đủ tư cách gọi điện cho chị),1,1758299123,thích câu ( e kg đủ tư cách gọi điện cho chị)
7551663317745369874,7551652773650042128,Văn Linh,đáng lẽ tổng tài chỉ cần đưa thư ký riêng và luật sư riêng tới để đàm phán lv mà nhỉ. giống trong mấy bộ phim aya,4,1758258639,đáng lẽ tổng tài chỉ cần đưa thư ký riêng và luật sư riêng tới để đàm phán lv mà nhỉ. giống trong mấy bộ phim aya
7551711403561124629,7551652773650042128,Sò 65,Nay nhìn ngoan thế tổng tài 😁😁😁😁😁,4,1758269834,nay nhìn ngoan thế tổng tài
7551698104036639496,7551652773650042128,duong3x6,bà đó chính là vợ của chiến thần long điện tôi đã gặp ở điện thần long,2,1758266741,bà đó chính là vợ của chiến thần long điện tôi đã gặp ở điện thần long
7551740728646763265,7551652773650042128,Hello,Tổng tài gốc mạnh và nhiều tiền lắm,1,1758276669,tổng tài gốc mạnh và nhiều tiền lắm
7551819192782455559,7551652773650042128,Nguyễn Tuân,Chị này rất lịch sự. Vẫn chị em được với thể loại này,1,1758294930,chị này rất lịch sự. vẫn chị em được với thể loại này
7551783501337232136,7551652773650042128,Duy,Tổng tài thua là quán này nổi lắm nè,1,1758286620,tổng tài thua là quán này nổi lắm nè
7551701841122984722,7551652773650042128,Khiêm Nhã Trần,hoan hô cô chủ quán,1,1758267608,hoan hô cô chủ quán
7551702359761535751,7551652773650042128,Xuân Nghĩa,Chủ quán họ còn văn minh ấy. Thôi xin nhẹ tỏi 8 .,2,1758267730,chủ quán họ còn văn minh ấy. thôi xin nhẹ tỏi 8 .
7551735233339638546,7551652773650042128,Trần Thuyết,Đúng theo kịch bản thì tổng tài phải mua luôn quán cf này chứ,2,1758275381,đúng theo kịch bản thì tổng tài phải mua luôn quán cf này chứ
7551693826667250450,7551652773650042128,Phạm Cường Mẫn,Đây mới là tổng tài 😂,2,1758265740,đây mới là tổng tài
7551668815252243218,7551652773650042128,Hùng,Hóng clip tổng tài quỳ xuống đi từ ngoài cửa vào xin lỗi gia đình 😂😂😂,2,1758259917,hóng clip tổng tài quỳ xuống đi từ ngoài cửa vào xin lỗi gia đình
7551662604977701649,7551652773650042128,Sửa chữa Anh Minh,em không có tư cách gì để : Yêu thương nhau gì đâu mà chỉ còn là niềm đau,2,1758258483,em không có tư cách gì để : yêu thương nhau gì đâu mà chỉ còn là niềm đau
7551667720770274056,7551652773650042128,KIMTHOA🐣,Lúc đó tưởng thế là ngầu🤣 giờ em xl chị,2,1758259664,lúc đó tưởng thế là ngầu giờ em xl chị
7551667453111386896,7551652773650042128,khám phá nét đẹp việt,có gì đó sai sai sao mình xem tổng tài bển trung họ ngầu đến phút cuối mà sao vn mình nó lạ vậy 😂😅kk,2,1758259609,có gì đó sai sai sao mình xem tổng tài bển trung họ ngầu đến phút cuối mà sao vn mình nó lạ vậy kk
7551660782330610448,7551652773650042128,Nguyenhuu Tien 67k1,"giám đốc ăn hiếp nhân viên,, nhưng đụng nhầm con chủ tịch vs cái kết,, 🤣🤣🤣",2,1758258100,"giám đốc ăn hiếp nhân viên,, nhưng đụng nhầm con chủ tịch vs cái kết,,"
7551661162342712085,7551652773650042128,Bảo Bảo,A công nhân giả làm tổng tài gặp chủ tài phiệt giả làm nhân viên và cái kết,2,1758258135,a công nhân giả làm tổng tài gặp chủ tài phiệt giả làm nhân viên và cái kết
7551662264609309448,7551652773650042128,Mr. Fly,Đi xin lỗi mà còn bịt khẩu trang,2,1758258392,đi xin lỗi mà còn bịt khẩu trang
7551704928914834183,7551652773650042128,Vận Tải Hà Nội,Tổng tài cơ mà,1,1758268327,tổng tài cơ mà
7551721248282379015,7551652773650042128,mekongdelta 6414,tao coi tổng tài riết ngán. lần này coi tổng tài cốt truyện này mới quá. hay quá,1,1758272128,tao coi tổng tài riết ngán. lần này coi tổng tài cốt truyện này mới quá. hay quá
7551758643056034568,7551652773650042128,90% cơ thể là cồn,“Chị - em” là tử tế lắm gòi.,1,1758280833,chị - em là tử tế lắm gòi.
7551668430841152274,7551652773650042128,Lãng tử Bên Em,khi các bác ra tay thì hãy nghĩ hậu quả đã,1,1758259831,khi các bác ra tay thì hãy nghĩ hậu quả đã
7551797148301345543,7551652773650042128,hoangdung8286,"phải mình mình cũng không cho xin,",1,1758289921,"phải mình mình cũng không cho xin,"
7551659076607722248,7551652773650042128,Hoàng Quân,chàng tổng giả nghèo và cậu chủ tài phiệt giả làm nhân viên 😂,2,1758257652,chàng tổng giả nghèo và cậu chủ tài phiệt giả làm nhân viên
7551662951775044353,7551652773650042128,Minh Tiệp 🇻🇳,Nhìn bà chị ăn mặc kiểu giản dị nhưng đầy quý phái và sang trọng thế kia thì tổng tài quả này mệt rồi 🤣,2,1758258558,nhìn bà chị ăn mặc kiểu giản dị nhưng đầy quý phái và sang trọng thế kia thì tổng tài quả này mệt rồi
7551701811451921160,7551652773650042128,anuska_nguyen,Đưa Bố lên mua luôn quán cf mà Chị chủ k chịu nên đuổi 2 bố con về😂😂😂,1,1758267599,đưa bố lên mua luôn quán cf mà chị chủ k chịu nên đuổi 2 bố con về
7551775610928038674,7551652773650042128,Phuc lee,Rất dứt khoát 👍 ủng hộ chị,1,1758284788,rất dứt khoát ủng hộ chị
7551734076924576519,7551652773650042128,Dong Dong,Có 3 tỷ mà đòi làm tổng tài tui cũng lạy mấy chú luôn,1,1758275112,có 3 tỷ mà đòi làm tổng tài tui cũng lạy mấy chú luôn
7551691228804547336,7551652773650042128,Ngọc Đạt,này thì tổng tài 😂,1,1758265139,này thì tổng tài
7551699644491039495,7551652773650042128,Tran Ngoc37,"đã quá muộn rồi, quá 24h rồi",1,1758267101,"đã quá muộn rồi, quá 24h rồi"
7551659330802680593,7551652773650042128,Vĩ Trần,Cứ để cơ quan ca xử lý theo quy định của pháp luật,3,1758257709,cứ để cơ quan ca xử lý theo quy định của pháp luật
7551692914256331541,7551652773650042128,Sơn Đây Rồi,Cty vốn 3 tỏi mà như này 30 tỏi chắc nó xử luôn bạn nv kia quá 😂,2,1758265533,cty vốn 3 tỏi mà như này 30 tỏi chắc nó xử luôn bạn nv kia quá
7551661270694937362,7551652773650042128,Khánh,"Tưởng đâu phất tay cho đàn em ""Dẹp..dẹp..dẹp hết"" chớ, ai ngờ là khoanh tay 😂😂😂😂",2,1758258164,"tưởng đâu phất tay cho đàn em ""dẹp..dẹp..dẹp hết"" chớ, ai ngờ là khoanh tay"
7551723367319896840,7551652773650042128,THC,Còn hơn kịch bản phim Hàn 😂😂😂😂,1,1758272619,còn hơn kịch bản phim hàn
7551669271371662096,7551652773650042128,Chí Công,tổng tài mới chịu à,1,1758260029,tổng tài mới chịu à
7551738483535282951,7551652773650042128,Toni tèo idol,Chứ không phải tổng tài hôm nay đến thu mua quán à,1,1758276138,chứ không phải tổng tài hôm nay đến thu mua quán à
7551690162032526101,7551652773650042128,Chíp🐥,"Kết quả của việc hay coi phim Tổng tài ( con chủ tịch , thiếu gia nhà tài phiệt) quá nhiều",1,1758264890,"kết quả của việc hay coi phim tổng tài ( con chủ tịch , thiếu gia nhà tài phiệt) quá nhiều"
7551663361521894152,7551652773650042128,TK,Tổng tài bảo đợi cơ quan công an vào cuộc để có cái nhìn khách quan cơ mà. Yêu cầu trích xuất camera đầy đủ cơ mà.,2,1758258649,tổng tài bảo đợi cơ quan công an vào cuộc để có cái nhìn khách quan cơ mà. yêu cầu trích xuất camera đầy đủ cơ mà.
7551680830465327879,7551652773650042128,Phi hùng6868,Bây giờ thì ko oai nữa ah,1,1758262714,bây giờ thì ko oai nữa ah
7551699283038241543,7551652773650042128,Bao công,Gặp nhà giàu k thiếu tiền nữa thì hoi nhọc,1,1758267014,gặp nhà giàu k thiếu tiền nữa thì hoi nhọc
7551689380667376385,7551652773650042128,Thúy kiều,Tổng tài đeo dây nịt mắc cười vãi. Hiểu luôn.,4,1758264707,tổng tài đeo dây nịt mắc cười vãi. hiểu luôn.
7551716806026429202,7551652773650042128,Hoài Nam,Tổng tài ăn mặc tôi không thấy tí thời trang sang xịn nào vậy ta,1,1758271094,tổng tài ăn mặc tôi không thấy tí thời trang sang xịn nào vậy ta
7551701090476851985,7551652773650042128,Duy Nguyen,tổng tài gặp phải chủ tịch hội đồng quản trị.,1,1758267443,tổng tài gặp phải chủ tịch hội đồng quản trị.
7551710199704077063,7551652773650042128,Rong rêu,"t nhớ vụ trang nemo giật khẩu trang,cái kết đi du lịch 6 tháng về 😁😁😁",1,1758269556,"t nhớ vụ trang nemo giật khẩu trang,cái kết đi du lịch 6 tháng về"
7551700483191194384,7551652773650042128,Tiên Sư Cụ,Sao t nghe giống bắn rap nhỉ ? Liệu có ông nào remix thành nhạc k nhỉ ?? :))),1,1758267295,sao t nghe giống bắn rap nhỉ ? liệu có ông nào remix thành nhạc k nhỉ ?? :)))
7551692695133340423,7551652773650042128,TGNHT,kể tới xin lỗi đưa 1 tay lên phán: giờ tôi cho chị cơ hội để nhận lời xin lỗi của tôi có khi chị lại đổi ý 🙄,1,1758265484,kể tới xin lỗi đưa 1 tay lên phán: giờ tôi cho chị cơ hội để nhận lời xin lỗi của tôi có khi chị lại đổi ý
7551665900199576338,7551652773650042128,Cậu ba 18+,Tổng tài gặp chủ tịch giả nghèo và cái kết 🤣,1,1758259242,tổng tài gặp chủ tịch giả nghèo và cái kết
7551720004238443271,7551652773650042128,8th2,tôi cho phép chị tha lỗi cho tôi😂😂,1,1758271839,tôi cho phép chị tha lỗi cho tôi
7551666107020182290,7551652773650042128,xuân thanh,cũng đàn anh có đẳng cấp chỉ cần khoát tay có đàn em xử liền còn gã đàn em không biết có xử lý không,1,1758259433,cũng đàn anh có đẳng cấp chỉ cần khoát tay có đàn em xử liền còn gã đàn em không biết có xử lý không
7551696400736879378,7551652773650042128,Tú Bờmm,"Hay lắm chị chủ quán ơi, tầm này k cần bồi thường, cần để pháp luật xử lý nghiêm minh để làm gương cho xã hội",1,1758266340,"hay lắm chị chủ quán ơi, tầm này k cần bồi thường, cần để pháp luật xử lý nghiêm minh để làm gương cho xã hội"
7551665223465681685,7551652773650042128,minh duc,thằng em giả vờ làm nv phụ bưng bê ám ảnh cả đời,1,1758259087,thằng em giả vờ làm nv phụ bưng bê ám ảnh cả đời
7551740116051428103,7551717824595643665,Trung Quốc Vi Vu,"Ngày dì mình mất, dượng ngồi khóc cả ngày bên mộ dì, dượng trồng rất hoa mười giờ trên mộ dì và nói rằng ngày nào cũng sẽ ra thăm dì. Được qua trăm ngày của dì thì dượng cũng kiếm dì khác. 🙂",4049,1758276521,"ngày dì mình mất, dượng ngồi khóc cả ngày bên mộ dì, dượng trồng rất hoa mười giờ trên mộ dì và nói rằng ngày nào cũng sẽ ra thăm dì. được qua trăm ngày của dì thì dượng cũng kiếm dì khác."
7552420477693100818,7551717824595643665,Mai 9395🇻🇳,"mưa tới đâu mát mặt tới đó, sau này ổng có lấy người khác là chuyện của sau này, còn bây giờ thì trong thâm tâm ổng vẫn còn rất thương yêu vợ nên mới làm được vậy",81,1758434927,"mưa tới đâu mát mặt tới đó, sau này ổng có lấy người khác là chuyện của sau này, còn bây giờ thì trong thâm tâm ổng vẫn còn rất thương yêu vợ nên mới làm được vậy"
7551752609541276423,7551717824595643665,Thái Dương,Nói thật đàn ông luôn chung tình hơn phụ nữ,2340,1758279429,nói thật đàn ông luôn chung tình hơn phụ nữ
7551742126414512904,7551717824595643665,Em_***,"Tôi vẫn không tin vào trên đời có tình yêu, nhưng sau khi xem clip tôi tin trên đời có tình yêu đích thực, chẳng qua là mình gặp chưa đúng người.",759,1758276986,"tôi vẫn không tin vào trên đời có tình yêu, nhưng sau khi xem clip tôi tin trên đời có tình yêu đích thực, chẳng qua là mình gặp chưa đúng người."
7551810820796285704,7551717824595643665,Phạm Nhật Tùng,"Thật xin lỗi nếu a ko vừa ý. Nhưng mình nghỉ chị ko ở lại đoạn đường đó đâu,tấm lòng a còn đẹp hơn 1000 gốc hoa hồng nên chị ấy sẽ chọn về bên a...",202,1758293070,"thật xin lỗi nếu a ko vừa ý. nhưng mình nghỉ chị ko ở lại đoạn đường đó đâu,tấm lòng a còn đẹp hơn 1000 gốc hoa hồng nên chị ấy sẽ chọn về bên a..."
7552029364842578706,7551717824595643665,Triệu Mẫn 1998,"đàn ông chung tình lắm, ck cũ tao ôm bồ mà miệng nói tao thương vợ ở nhà nhất",553,1758343864,"đàn ông chung tình lắm, ck cũ tao ôm bồ mà miệng nói tao thương vợ ở nhà nhất"
7551775229769630471,7551717824595643665,❤️LÊ NGUYÊN💘 💔(🌹🇻🇳🇻🇳🌹),đâu phải đàn ông họ vô tình như các chế nói... họ cũng âm thầm ôm đau mà nhớ mà thương mà 😭👍,15,1758284693,đâu phải đàn ông họ vô tình như các chế nói... họ cũng âm thầm ôm đau mà nhớ mà thương mà
7551773448906588944,7551717824595643665,Tạp văn hoá,"Nàng bỏ ta.rời bỏ cả trần thế
Khóc không được,đau cũng chẳng thể buông.
Đem nhánh hoa trồng nơi nàng nằm lại
Để mong nàng đi mãi cạnh bên ta",18,1758284284,"nàng bỏ ta.rời bỏ cả trần thế khóc không được,đau cũng chẳng thể buông. đem nhánh hoa trồng nơi nàng nằm lại để mong nàng đi mãi cạnh bên ta"
7552411433758589697,7551717824595643665,DuyTung_BG,Dẫu biết rằng ai rồi cũng có hạnh phúc mới nhưng cách anh tri ân với vk quá cố của mình thật tuyệt ❤,19,1758432826,dẫu biết rằng ai rồi cũng có hạnh phúc mới nhưng cách anh tri ân với vk quá cố của mình thật tuyệt
7552067509928657685,7551717824595643665,Katty Nguyễn ❤️,Ng đàn ông như vậy liệu còn được mấy ng . Hiện diện trước mặt đã ko trân trọng thì lấy gì khuyất mặt lại thương nhớ.,54,1758352748,ng đàn ông như vậy liệu còn được mấy ng . hiện diện trước mặt đã ko trân trọng thì lấy gì khuyất mặt lại thương nhớ.
