comment_id,video_id,username,comment_text,digg_count,create_time,clean_text
7322425383285572353,7321176669312666882,Chen Gumr,A ơi cái thùng đựng rác hôm e đi ngang qua khu chế biến bên trong thấy các bạn còn chỉ trút rác ra r tráng qua 1 lần nước đó a=)) a dũng cảm zị,2139,1704885281,a ơi cái thùng đựng rác hôm e đi ngang qua khu chế biến bên trong thấy các bạn còn chỉ trút rác ra r tráng qua 1 lần nước đó a=)) a dũng cảm zị
7323080118757933842,7321176669312666882,🐰,thích cái cách anh ấy lấy xô rác để đựng nc :)),1026,1705037471,thích cái cách anh ấy lấy xô rác để đựng nc :))
7321718041347080962,7321176669312666882,Duy Long,dồi heo ko phải dồi lợn thì là dồi j vậy,2142,1704720343,dồi heo ko phải dồi lợn thì là dồi j vậy
7321759543963878151,7321176669312666882,Tragg Xingg,Xô đấy mỗi khi mình ăn toàn để rác thôi🤧,2111,1704729999,xô đấy mỗi khi mình ăn toàn để rác thôi
7328361353965716226,7321176669312666882,Fong,"Ủa... Đi ăn Dookki mà sợ ko đủ thời gian nữa hả.
Chứ t zô ăn thì tầm 30' là ngán rồi. Mặc dù thèm lắm, nhưng ko lúc nào t ăn nhiều đc 😂",245,1706267116,"ủa... đi ăn dookki mà sợ ko đủ thời gian nữa hả. chứ t zô ăn thì tầm 30' là ngán rồi. mặc dù thèm lắm, nhưng ko lúc nào t ăn nhiều đc"
7323166131966411527,7321176669312666882,Bibeosida🤧,ơ dooki chỗ nào ăn thịt miễn phí á =))),126,1705057495,ơ dooki chỗ nào ăn thịt miễn phí á =)))
7528285510205866760,7321176669312666882,Hoàng phúc 🏐⚽️🥇,Dồi heo mình ăn thấy giống dồi lợn 😂,7,1752815566,dồi heo mình ăn thấy giống dồi lợn
7321751932544205570,7321176669312666882,Cao Vy,mì đó mà 30k một gói tin đc ko koreno mik mua hình như có mười mấy nghìn một gói :)),218,1704728237,mì đó mà 30k một gói tin đc ko koreno mik mua hình như có mười mấy nghìn một gói :))
7326093041131373314,7321176669312666882,shibal saekkiya,cái gì 100 lần có 15tr thôi cơ mà :),37,1705738991,cái gì 100 lần có 15tr thôi cơ mà :)
7321239203093512962,7321176669312666882,Lily,thịt ở dokki bị hôi kh dám ăn,101,1704608860,thịt ở dokki bị hôi kh dám ăn
7322791922362647298,7321176669312666882,Ph Nhi🐽,Cái xô lớn đó để đựng rác mà ah,8,1704970374,cái xô lớn đó để đựng rác mà ah
7345921950370317058,7321176669312666882,Duy Anh đấyyy,Giờ mới hiểu tại sao nv Dookki luôn hỏi bạn đã biết cách ăn Dookki chưa :)),6,1710355771,giờ mới hiểu tại sao nv dookki luôn hỏi bạn đã biết cách ăn dookki chưa :))
7372163507557057300,7321176669312666882,akiko ୨ৎ,T ăn cùng mấy con bạn t chắc quán lỗ=)),9,1716465613,t ăn cùng mấy con bạn t chắc quán lỗ=))
7324654894157529858,7321176669312666882,@...,thích cái cách anh ấy lấy đồ đựng rác làm đồ lấy nước uống,63,1705404141,thích cái cách anh ấy lấy đồ đựng rác làm đồ lấy nước uống
7329104367096005394,7321176669312666882,Baran,ủa anh đùa hả bữa nhớ lúc lâu đi ăn cái đó là xô rác màaa :))),18,1706440094,ủa anh đùa hả bữa nhớ lúc lâu đi ăn cái đó là xô rác màaa :)))
7328701754882491137,7321176669312666882,sa tế hành tím🍜,ở dokki cs dồi heo mik ăn thì rất giống dồi lợn 🤡,8,1706346366,ở dokki cs dồi heo mik ăn thì rất giống dồi lợn
7361442482511364881,7321176669312666882,đẹp trai chơi cờ🤓,Mình ăn dồi heo thấy rất giống dồi lợn:),12,1713969404,mình ăn dồi heo thấy rất giống dồi lợn:)
7334028879335834376,7321176669312666882,Thành Nguyễn,chấm đầu nọ ăn đầu kia khôn nhể,5,1707586673,chấm đầu nọ ăn đầu kia khôn nhể
7321678221267010322,7321176669312666882,iamhung07zzz,dooki 150k à mn,12,1704711068,dooki 150k à mn
7439735525222728456,7321176669312666882,Oanh Chuu,"30k 1 gói mì á, bà nào bán 30k z trời",2,1732198413,"30k 1 gói mì á, bà nào bán 30k z trời"
7463926922722231056,7321176669312666882,m7,ăn đc 20p là no r 🥰,2,1737830953,ăn đc 20p là no r
7450497914339738376,7321176669312666882,áo số 10 a3,1 gói mỳ đó mà 30k hả,1,1734704230,1 gói mỳ đó mà 30k hả
7433422092471927568,7321176669312666882,Pịa nướng💩😋,Chắm ở Cà Mau ăn ở Hà Nội,1,1730728456,chắm ở cà mau ăn ở hà nội
7490456625343218452,7321176669312666882,𝓣𝓱𝓪̀𝓷𝓱¹⁷ ᴰᵀᴰ,Dồi heo ăn rất giống dồi lợn???🤔🤔🤔,1,1744007859,dồi heo ăn rất giống dồi lợn???
7426232171281302279,7321176669312666882,່,Chấm 1 đường ăn 1 đường😅,1,1729054421,chấm 1 đường ăn 1 đường
7525574835298190088,7321176669312666882,300k lên 2m,r bộ đi lấy nc có vài phút th cần gì lấy thùng đựng rác ra để cho nc vô vậy😭????,1,1752184459,r bộ đi lấy nc có vài phút th cần gì lấy thùng đựng rác ra để cho nc vô vậy????
7444881352723809031,7321176669312666882,nhuw ys >.<,chấm Cà Mau ăn Hà Nội,1,1733396528,chấm cà mau ăn hà nội
7506346695702266632,7321176669312666882,Anh Hào Đỗ,lấy thùng rác đựng nước uống. Tuyệt vời 😳,1,1747707546,lấy thùng rác đựng nước uống. tuyệt vời
7529580646266045191,7321176669312666882,Tuoilonsanhvai,Lòng heo vs lòng lợn khác nhau ko anh,1,1753117114,lòng heo vs lòng lợn khác nhau ko anh
7508415837058319124,7321176669312666882,khngbnhthng,"Xem 2s lướt,qlai xem bl..",1,1748189301,"xem 2s lướt,qlai xem bl.."
7461060242995200776,7321176669312666882,nàng tiên biết múa🧚‍♀️,ăn thừa phạt bnhiu a,1,1737163489,ăn thừa phạt bnhiu a
7436899973159699207,7321176669312666882,Voucher Resort&Hotel 5⭐️ 40%,90 phút đủ để thưởng thức với ăn no rồi cần gì phải làm v ta. Miếng ăn bỏ tiền ra mà còn phải khổ như vậy nữa hã,1,1731538227,90 phút đủ để thưởng thức với ăn no rồi cần gì phải làm v ta. miếng ăn bỏ tiền ra mà còn phải khổ như vậy nữa hã
7528051779906732808,7321176669312666882,Dũng chocopie,chấm cà mau cắn hà nội,1,1752761149,chấm cà mau cắn hà nội
7451502935576789792,7321176669312666882,кαу ⋆˚𝜗𝜚˚⋆,tunhien thấy giống Wooin,1,1734938282,tunhien thấy giống wooin
7525753993235317511,7321176669312666882,(thi)fan.freenbeck🇻🇳 love,ăn mà có thời gian k thấy thoải mái tí nào,1,1752226153,ăn mà có thời gian k thấy thoải mái tí nào
7528085504094225173,7321176669312666882,Manh Hung 🥷🏽,Thau đó để rác mà a 😅,1,1752769006,thau đó để rác mà a
7538381975356506887,7321176669312666882,thái tử gia bắc cực,chấm ở hà nội ăn ở cà mau,0,1755166337,chấm ở hà nội ăn ở cà mau
7424172238583399175,7321176669312666882,ducthai0709,t ăn dookki bị ôg bàn cạnh nhảy mất cái đựng rác😭,0,1728574807,t ăn dookki bị ôg bàn cạnh nhảy mất cái đựng rác
7442721202114446101,7321176669312666882,Hoàng-Phúc KaKaKa🐧🐢🐟🦦🐫🦏,Lấy xô rác để đựng nước hả anh,0,1732893574,lấy xô rác để đựng nước hả anh
7431175312090350354,7321176669312666882,HogPhan,cho mik hỏi ăn dookki có giống buffet ko mn,0,1730205335,cho mik hỏi ăn dookki có giống buffet ko mn
7490891884253741842,7321176669312666882,☘️🤏🔥[đùng đoàng],nhìn tuởng wooin,0,1744109198,nhìn tuởng wooin
7517364894829167368,7321176669312666882,kem aventus😋,doookki có thù với ông n à mng :)),0,1750272916,doookki có thù với ông n à mng :))
7443465551262204690,7321176669312666882,minnie_3795,Ớ mì free à mn? Mình chưa bh ăn mì lun vì no,0,1733066884,ớ mì free à mn? mình chưa bh ăn mì lun vì no
7513900355790455559,7321176669312666882,🐝,Wooin,0,1749466263,wooin
7466418746618397447,7321176669312666882,Lạy Bố,ăn để ngon chứ ăn để lại kh bao h đc đâu,0,1738411098,ăn để ngon chứ ăn để lại kh bao h đc đâu
7445232455207125768,7321176669312666882,Anh Nguyễn Quốc,lấy xô rác rót nc ôg ơi=)),0,1733478274,lấy xô rác rót nc ôg ơi=))
7331802614902358785,7326166155746462978,ChangBauTroii,"Cơm tấm Hồng calmette rất ngon nha, giá cũng hợp lý nữa 🥰🥰",43,1707068347,"cơm tấm hồng calmette rất ngon nha, giá cũng hợp lý nữa"
7330222778598310677,7326166155746462978,Meomeo,Vừa thấy top 1 cơm tấm Huyền là lướt liền,90,1706700578,vừa thấy top 1 cơm tấm huyền là lướt liền
7349578893052035841,7326166155746462978,Quay_Den,Cơm tấm Hậu Giang Quận 6 nữa bạn ơi 🥺🥺🥺,3,1711207201,cơm tấm hậu giang quận 6 nữa bạn ơi
7339107788247958290,7326166155746462978,Nathan Huynh,"thêm quán ngon. cơm tấm Ba Há, Hưng Phú P.9 Q.8. kế bên trường anh ngữ Apolo... ngon giá ổn...",9,1708769202,"thêm quán ngon. cơm tấm ba há, hưng phú p.9 q.8. kế bên trường anh ngữ apolo... ngon giá ổn..."
7434864959379391233,7326166155746462978,Thỏ,cơm tấm mãi đỉnh,1,1731064400,cơm tấm mãi đỉnh
7326886034817090306,7326166155746462978,🔰 Kim Long exciter 🔰,V là mng chưa ăn thử quán “ Năm đủ “ Q6 rồi,10,1705923613,v là mng chưa ăn thử quán năm đủ q6 rồi
7348881390290764562,7326166155746462978,Duy (Wen),Cơm tấm Dung; Nguyễn Thái Sơn Gò Vấp; Gần ngã tư NTS- Phan Văn Trị ❤️,0,1711044795,cơm tấm dung; nguyễn thái sơn gò vấp; gần ngã tư nts- phan văn trị
7347984982520939272,7326166155746462978,Minh Ngọc House,Thấy ở SG quán cơm tấm nào cũng ngon 😂,1,1710836085,thấy ở sg quán cơm tấm nào cũng ngon
7348324489057420034,7326166155746462978,HẦU Cần Thơ,cơm tấm ngon quá,0,1710915141,cơm tấm ngon quá
7339869117183361813,7326166155746462978,ℝ𝔸𝕐𝕄𝕆ℕ𝔻,bà Huyền bán chè chớ cơm tấm gì😂,3,1708946543,bà huyền bán chè chớ cơm tấm gì
7356836032816382727,7326166155746462978,Thổ Địa Phú Quốc,Ai mà Mê Cơm Tấm chất xỉu lên xỉu xuống,0,1712896879,ai mà mê cơm tấm chất xỉu lên xỉu xuống
7444128717167559431,7326166155746462978,Kinh Tế và Chính Trị,Quá ngọt,1,1733221289,quá ngọt
7331810147142796039,7326166155746462978,Lọ Lem 🏰,Tại sao phải là có câu TT siêu mê ?,5,1707070089,tại sao phải là có câu tt siêu mê ?
7326169985121878802,7326166155746462978,ngco_hnuu,sớm ạaaa,1,1705756885,sớm ạaaa
7326955249993401106,7326166155746462978,thang16039x,"Huyền vẫn nhớt, bự thôi chứ ướp quá ngọt 😌",4,1705939718,"huyền vẫn nhớt, bự thôi chứ ướp quá ngọt"
7326167598205764359,7326166155746462978,3TV Official,Đã quá nè 🥰,1,1705756326,đã quá nè
7328088104732410632,7326166155746462978,Hủ Tiếu Mì Bò Kho 😪,Ở khu đó chỉ có Huyền vs Hà đối đầu nhau,1,1706203486,ở khu đó chỉ có huyền vs hà đối đầu nhau
7334561642187604756,7326166155746462978,jaunetriste,thèm dữ chài,1,1707710818,thèm dữ chài
7326706275361800961,7326166155746462978,KennyNguyen,ba ghiền giờ vứt,2,1705881808,ba ghiền giờ vứt
7333412035453240065,7326166155746462978,Ahihi,Z là chưa ăn thử cơm tấm 390 CMT8 ròi,0,1707443084,z là chưa ăn thử cơm tấm 390 cmt8 ròi
7339923365484135186,7326166155746462978,惠琴,Thiếu cơm tấm Tuyết cây gõ rồi. 😹😁,0,1708959087,thiếu cơm tấm tuyết cây gõ rồi.
7402910331268236052,7326166155746462978,SM Travel Sai Gòn - Nha Trang,thua cơm tấm của Độ,0,1723624382,thua cơm tấm của độ
7333312257932657416,7326166155746462978,Bảo Đăng,Cơm tấm đêm bên q6 hơi bị ngon nha,0,1707419837,cơm tấm đêm bên q6 hơi bị ngon nha
7337986871849108226,7326166155746462978,phuongthaonguyen0511,"Cơm tấm Huyền ăn 1 lần k quay lại, ăn chè ăn cơm nó ngọt như vậy đó,",0,1708508229,"cơm tấm huyền ăn 1 lần k quay lại, ăn chè ăn cơm nó ngọt như vậy đó,"
7472339856678830866,7326166155746462978,quynhanhdo168,mê cơm tấm sg,0,1739789717,mê cơm tấm sg
7340245854730601224,7326166155746462978,NTD,cơm tấm bãi rác ở lê văn linh q4 nữa. gần camet đó,0,1709034173,cơm tấm bãi rác ở lê văn linh q4 nữa. gần camet đó
7326547083442864916,7326166155746462978,dang suy nghi,cơm tấm 3 chị emm bao đuỷnh 🤤🤤,0,1705844778,cơm tấm 3 chị emm bao đuỷnh
7339386719818908423,7326166155746462978,Hột Mít,Cơm Tấm Ba Há - Quận 8 đi ạ 🥰,0,1708834146,cơm tấm ba há - quận 8 đi ạ
7373599166868898568,7326166155746462978,Anh Lan,cơm tấm ngọc diệp bạn ăn chưa,0,1716799850,cơm tấm ngọc diệp bạn ăn chưa
7369920222885413648,7326166155746462978,Amy Nguyen,Thiếu cơm tấm Hẻm 33 Nguyễn Đình Chính là qá thiếu xót 😆,0,1715943283,thiếu cơm tấm hẻm 33 nguyễn đình chính là qá thiếu xót
7357765425546167058,7326166155746462978,Em bé Lem,Thủ đức thì thử cơm tấm sườn chà bá. 178 hiệp bình. Mình thấy ngonnn,0,1713113271,thủ đức thì thử cơm tấm sườn chà bá. 178 hiệp bình. mình thấy ngonnn
7496438824906638098,7326166155746462978,Thọ Euros,"Cơm tấm song như 580 lê văn thọ f15 gv mới ra minh ăn thấy bén lắm, phải 8đ trở lên ak hen , sach sẽ thoáng mát mới ra binh dân lắm ak @comtamsongnhu",0,1745400689,"cơm tấm song như 580 lê văn thọ f15 gv mới ra minh ăn thấy bén lắm, phải 8đ trở lên ak hen , sach sẽ thoáng mát mới ra binh dân lắm ak"
7332240983700898580,7326166155746462978,🏳️‍🌈 Cậu Hai  🏳️‍🌈,"vậy cho hỏi, cơm tấm sườn không,ba năm ka mắc hay rẻ",0,1707170693,"vậy cho hỏi, cơm tấm sườn không,ba năm ka mắc hay rẻ"
7339136401584734978,7326166155746462978,Huy hiền Nguyễn,cơm tấm hùng võ văn tần cũng ngon,0,1708775877,cơm tấm hùng võ văn tần cũng ngon
7326254750662984449,7326166155746462978,Bi 🍀,T thix cơm tấm Tài BT,0,1705776639,t thix cơm tấm tài bt
7326611385856099073,7326166155746462978,.thanh♎️💙,Trước giờ vẫn trung thành với cơm tấm Huyền 😊,0,1705859669,trước giờ vẫn trung thành với cơm tấm huyền
7331607817285976833,7326166155746462978,PHÁT CỦ CHI,Cơm tấm nhìn ngon quá,0,1707022996,cơm tấm nhìn ngon quá
7408578770304746258,7326166155746462978,lặng,các quan cơm tấm ...bún ngta nấu trà đá j mk thơm vậy mn nhỉ...e mua các loại trà vệ fa uống mk k thấy thơm dk như ngoài quán,0,1724944165,các quan cơm tấm ...bún ngta nấu trà đá j mk thơm vậy mn nhỉ...e mua các loại trà vệ fa uống mk k thấy thơm dk như ngoài quán
7374860535185638150,7326166155746462978,TK ⚜️ 🇻🇳 ✅,"Nghe tui , tui thích nhất quán cơm ở ngay cái đường quẹo vô trong lương định của á k nhớ lắm hình như tên là cơm tấm dâu tây",0,1717093537,"nghe tui , tui thích nhất quán cơm ở ngay cái đường quẹo vô trong lương định của á k nhớ lắm hình như tên là cơm tấm dâu tây"
7327763957791589122,7326166155746462978,Lộccccccc,"Bà bán cơm tấm đầu hẻm tôi là ngon nhất , ngon bổ rẻ và cực sạch sẻ 😅😅",0,1706128064,"bà bán cơm tấm đầu hẻm tôi là ngon nhất , ngon bổ rẻ và cực sạch sẻ"
7496868021963080456,7326166155746462978,Thọ Euros,"Cơm tấm song như 580 lê văn thọ f15 gv mới ra minh ăn thấy bén lắm, sốt ngon lạ lắm nhá, phải 8đ trở lên ak , sach sẽ thoáng mát @comtamsongnhu tư 17h -23h",0,1745500630,"cơm tấm song như 580 lê văn thọ f15 gv mới ra minh ăn thấy bén lắm, sốt ngon lạ lắm nhá, phải 8đ trở lên ak , sach sẽ thoáng mát -23h"
7402914757181440784,7326166155746462978,星辰,Cơm tấm giới quang Q6 nha siêuu ngonnnnn 35K,0,1723625413,cơm tấm giới quang q6 nha siêuu ngonnnnn 35k
7339221521493426952,7326166155746462978,Thuỳ Lynnh,Bình thạnh cơm tấm chỗ nào ngon ạ?,0,1708795680,bình thạnh cơm tấm chỗ nào ngon ạ?
7346279753957360392,7326166155746462978,Tran Khanhvy ✿,"Sao k thấy ai review quán cơm tấm đêm 111 gò vấp hết ta , chả ở đây siêu ngon 😋",0,1710439054,"sao k thấy ai review quán cơm tấm đêm 111 gò vấp hết ta , chả ở đây siêu ngon"
7339319949195969281,7326166155746462978,Andy👑,"Cơm tấm 3 ghiền thì sườn ngon, nước mắm dở thật sự",0,1708818636,"cơm tấm 3 ghiền thì sườn ngon, nước mắm dở thật sự"
7345110046593139474,7326166155746462978,CuLi,Cơm Tấm Đồng Sài Gòn Quận 1 11G Nguyễn Thị Minh Khai bao ngon,0,1710166710,cơm tấm đồng sài gòn quận 1 11g nguyễn thị minh khai bao ngon
7339483353491653394,7326166155746462978,Ế kệ tui,Xin tổng hợp địa điểm TT ăn để né ạ. 🙄,0,1708856640,xin tổng hợp địa điểm tt ăn để né ạ.
7478291074399388424,7326166155746462978,Ly Cơm Tấm,nhìn đã con mắt quá,0,1741175340,nhìn đã con mắt quá
7343782026149446408,7326166155746462978,ℓâӎ⁹⁶,Vậy là bạn chưa đến với khu Bà Điểm Hóc Môn chúng tôi rồi 😊,0,1709857516,vậy là bạn chưa đến với khu bà điểm hóc môn chúng tôi rồi
7531036004045259538,7326166155746462978,lap xuong nha my,Thèm xỉu,0,1753455965,thèm xỉu
7393003881674998544,7326166155746462978,STEEL,ba ghiền ăn thấy quá ngọt,0,1721317883,ba ghiền ăn thấy quá ngọt
7454348061784687392,7326166155746462978,MyMèoAnh ✨,Bào nào bán online qua bên kho si khalu coi hang qc mà giá ngay xưởng ok lắm á,0,1735600680,bào nào bán online qua bên kho si khalu coi hang qc mà giá ngay xưởng ok lắm á
7382650663510409991,7326166155746462978,i am dog,Mai đi sài gòn rồi để đến ăn thử:D,0,1718907315,mai đi sài gòn rồi để đến ăn thử:d
7332346606714618625,7326166155746462978,Lê Minh Tâm,Cơm tắm mai đoàn văn bơ cũng ok,0,1707195071,cơm tắm mai đoàn văn bơ cũng ok
7454415774669865761,7326166155746462978,MyAliAnh,tui mới biết bên kho si khalu hang toàn hotrend mà giá nhập tốt lắm nè bà nào bán online tham khảo coi,0,1735616475,tui mới biết bên kho si khalu hang toàn hotrend mà giá nhập tốt lắm nè bà nào bán online tham khảo coi
7339225171298108162,7326166155746462978,Dĩm,vìa long xuyên ăn ngon nhứt 😇,0,1708796558,vìa long xuyên ăn ngon nhứt
7353569179855782674,7326166155746462978,QUÂN 1983,3 quán này đều có tiếng nhưng vị chưa fai là Top nha ad...,0,1712136257,3 quán này đều có tiếng nhưng vị chưa fai là top nha ad...
7357331628719211281,7326166155746462978,Minh Quang Nè,mê cái quán số 2 🥰,0,1713012276,mê cái quán số 2
7391518502396625682,7326166155746462978,K. Jeremy,80k rất nhiều quán bán ngon. tùy khẩu vị. tui ăn ở đg 46 cá sấu hoa cà thủ đức 30k là no và ngon,0,1720972022,80k rất nhiều quán bán ngon. tùy khẩu vị. tui ăn ở đg 46 cá sấu hoa cà thủ đức 30k là no và ngon
7460193042504811296,7326166155746462978,MaiAliLan,Bào nào bán online qua bên tong kho si quan ao khalu coi hang qc mà giá ngay xưởng ok lắm á,0,1736961577,bào nào bán online qua bên tong kho si quan ao khalu coi hang qc mà giá ngay xưởng ok lắm á
7456283655216841480,7326166155746462978,Zoe 🍓,bây giờ 3 ghiền ko ngon,0,1736051329,bây giờ 3 ghiền ko ngon
7326719590153880338,7326166155746462978,Triều bodboy,ma có ban thiếu ko hà,0,1705889509,ma có ban thiếu ko hà
7487471209639084807,7326205280994397447,Phương Thảo,t nhớ k nhầm là phá đường tàu là để phá đường của địch mà,32,1743312753,t nhớ k nhầm là phá đường tàu là để phá đường của địch mà
7529867788691096341,7326205280994397447,deocoten,thơ hay 👍,2,1753183982,thơ hay
7495009396638860040,7326205280994397447,13th3,đúng là nem chua toàn lá,6,1745067873,đúng là nem chua toàn lá
7465731395831923474,7326205280994397447,khang,tôi là dân nông cống,3,1738251065,tôi là dân nông cống
7483754953979446034,7326205280994397447,user6067829189763,🥰🥰🥰 tuyet đó ban,1,1742447496,tuyet đó ban
7515405347335897864,7326205280994397447,Xiaopang,"Thơ hay, thưởng nem chua, rau má",6,1749816670,"thơ hay, thưởng nem chua, rau má"
7509502131158745864,7326205280994397447,28%,@🤍 Thủ đô thiêng liêng❤️,1,1748442219,thủ đô thiêng liêng
7485374654954586898,7326205280994397447,H.,Ê nông cống đây @mini 8315🫶🌷 @🌹Milyyuni đªy🌷,1,1742824612,ê nông cống đây đy
7496834214342001415,7326205280994397447,meomeomoe,Dố tá dô tà 🤡,1,1745492751,dố tá dô tà
7326793976484496135,7326709132352900354,Thủy tiên,"hay nhỉ, cả tay chân đều như nhau,y như đang chạy thật ấy, còn lúc nhanh lúc chậm",1254,1705902174,"hay nhỉ, cả tay chân đều như nhau,y như đang chạy thật ấy, còn lúc nhanh lúc chậm"
7326904694974350098,7326709132352900354,Nhím,thấy hậu trường rồi thật sự rất nể phục anh này vì quá trình tập luyện của anh,728,1705927949,thấy hậu trường rồi thật sự rất nể phục anh này vì quá trình tập luyện của anh
7327079533613826817,7326709132352900354,doboi,Tutor basic attack 😇,4,1705968716,tutor basic attack
7326714626326299393,7326709132352900354,🇻🇳 ❤️ Hiểu Nè 🤗 💕 🇻?,"Sao thấy chân chạy rõ ràng mà người nhút nhít luôn, mà sao vẫn ko đi tới đâu vậy 😳",56,1705883758,"sao thấy chân chạy rõ ràng mà người nhút nhít luôn, mà sao vẫn ko đi tới đâu vậy"
7326729029033362181,7326709132352900354,Trùm xóm,chạy thế này khi nào thì về kịp đón Giao thừa vậy 😂,81,1705887060,chạy thế này khi nào thì về kịp đón giao thừa vậy
7326824211359810311,7326709132352900354,A Nờ Am,"Nhìn như công việc của sếp giao, vẫn làm mà chả tới đâu. 🤣😂",283,1705909217,"nhìn như công việc của sếp giao, vẫn làm mà chả tới đâu."
7327094950763234055,7326709132352900354,Toan Nguyen,Chỗ này nó đặt máy chạy ak,11,1705972262,chỗ này nó đặt máy chạy ak
7326929273096143617,7326709132352900354,Sorylove,"Mình rất nể những người có tài, mình rất quý họ và mong muốn được học hỏi🤝",11,1705933676,"mình rất nể những người có tài, mình rất quý họ và mong muốn được học hỏi"
7326971539630670600,7326709132352900354,Thích Bú Sữa,Nếu bạn ko ngại thì người xung quanh ngại 👍,7,1705943517,nếu bạn ko ngại thì người xung quanh ngại
7330252192744112897,7326709132352900354,Lâm Quốc Đăng,Làm dc vầy chắc tập cũng ghê lắm,2,1706707355,làm dc vầy chắc tập cũng ghê lắm
7326757537998816018,7326709132352900354,Huy.Rs.94,Xem hậu trường khác hẳn 🤣,7,1705893695,xem hậu trường khác hẳn
7337572006550536962,7326709132352900354,Kiều Changg,Chạy như chạy🤭,1,1708411640,chạy như chạy
7327124849116840712,7326709132352900354,Bắp Ca,Các tóp tóp cơ VN đã xem và chuẩn bị đạo cụ. 🙂,3,1705979214,các tóp tóp cơ vn đã xem và chuẩn bị đạo cụ.
7354174405873189648,7326709132352900354,Đồ Mẹ và bé: đẹp lại rẻ,Vũ điệu chạy như ko chạy😎😎,1,1712277195,vũ điệu chạy như ko chạy
7348748423796196098,7326709132352900354,Nguyen Thanh Tung,Trước có ông VN làm rùi nhưng ko dẻo như này,1,1711013849,trước có ông vn làm rùi nhưng ko dẻo như này
7326954282232595207,7326709132352900354,GG,아무리 달려도 제자리.. 인생 참...,1,1705939489,.. ...
7326934735808463622,7326709132352900354,Leonardo's Gabriel,really cool 🤩🥰,3,1705934949,really cool
7327180510307795714,7326709132352900354,Ủa vậy hả,chạy như đang bị tào tháo rượt đi 😂,1,1705992189,chạy như đang bị tào tháo rượt đi
7334827871889163010,7326709132352900354,⚜️Lê Cường⚜️,Coi hậu trường mới nhìn ra là ko bao giờ nhìn thấy gót chân phải,2,1707772775,coi hậu trường mới nhìn ra là ko bao giờ nhìn thấy gót chân phải
7327191085414630151,7326709132352900354,Banhdz🙄,xem hậu trường xong cái ngã ngửa:)),1,1705994633,xem hậu trường xong cái ngã ngửa:))
7326890184875115272,7326709132352900354,Ðình Lên,ng ngoài nhìn thấy kiểu 🗿,2,1705924566,ng ngoài nhìn thấy kiểu
7532508254271062792,7326709132352900354,Quốc Khánh House,bảo sao ko bao giờ quay hết chân 😂,3,1753798750,bảo sao ko bao giờ quay hết chân
7327156246816195346,7326709132352900354,Thành NG,thay wifi mới đi ah hơi lag 🥰,1,1705986516,thay wifi mới đi ah hơi lag
7326921471993037569,7326709132352900354,BinBin1831,hướng dẫn ACE cái skill này đc ko fen,1,1705931863,hướng dẫn ace cái skill này đc ko fen
