comment_id,video_id,username,comment_text,digg_count,create_time,clean_text
7384081885457040135,7384024954133597441,Rau Lang Singapore,không đi sn bùi trà à 😂😂😂,11,1719240546,không đi sn bùi trà à
7384090622699782919,7384024954133597441,Me hacoi,Xinhhh quãiiiiii ❤️😗,7,1719242606,xinhhh quãiiiiii
7384365268291601160,7384024954133597441,𝐕ᴉ𝚞 ơ 𝐇𝚒𝐧ａ𝚝ａ 𝐇𝚢𝚞𝚐𝐚❥,thiên an thứ 2,270,1719306523,thiên an thứ 2
7384611417519129361,7384024954133597441,at,mấy đứa trong cmt ngộ,5,1719363857,mấy đứa trong cmt ngộ
7384039140738417426,7384024954133597441,b tran,slay quá chế ơii,6,1719230611,slay quá chế ơii
7384025592557699848,7384024954133597441,htn,lần đầu tien xem sớm ă😅,40,1719227438,lần đầu tien xem sớm ă
7384231926507209492,7384024954133597441,:),chị fan jack hả 😭,103,1719275549,chị fan jack hả
7384056718689157905,7384024954133597441,Ⓝ︵,chị sài son hãng nào vậy,8,1719234694,chị sài son hãng nào vậy
7384105485383861013,7384024954133597441,Pé Bắp Chơi Playy✅,Đom đóm là sao nữa vậy mn,21,1719246073,đom đóm là sao nữa vậy mn
7384053733661311761,7384024954133597441,H.Giang🤞🏻,Slay quáa😳🥰,18,1719233996,slay quáa
7384038266993853192,7384024954133597441,Khải Quan (NG)🥰,ê xinh 😒😒,13,1719230388,ê xinh
7384028647738999568,7384024954133597441,jebbi0798,xin in4 son ik bà🥰,13,1719228156,xin in4 son ik bà
7384029534750851857,7384024954133597441,#𝑩𝒖𝒏𝒏𝒊୨ৎ,e xin in4 son với ii,7,1719228366,e xin in4 son với ii
7384097703153713921,7384024954133597441,yuk loe,ê colorkey thỏi đó xài nhanh hết k bây🥺,6,1719244231,ê colorkey thỏi đó xài nhanh hết k bây
7407043739791999752,7384024954133597441,M.C  ꧁❤꧂,khỏi nhảy cũng cuốn,1,1724586765,khỏi nhảy cũng cuốn
7403774797975339792,7384024954133597441,ℙℕ𝔸𝕋♡,Ôi mai gót chính quá chị hà 💋,1,1723825656,ôi mai gót chính quá chị hà
7385100546439201543,7384024954133597441,Em yêu 🧡,Xinh gái quá ạ 🥰🥰,1,1719477722,xinh gái quá ạ
7388146253727122177,7384024954133597441,Hải Đăng,Xinh+ giỏi+có hiếu+ giàu+ sang+slay,3,1720186863,xinh+ giỏi+có hiếu+ giàu+ sang+slay
7387986382591181588,7384024954133597441,🦋༒ఓAⁿʰTʰưఓ༒🦋,top những idol tôi thấy slay nhất🤡🤡🤡,1,1720149643,top những idol tôi thấy slay nhất
7387438435054748432,7384024954133597441,?,ngta đc mời🤲🙏 tha🙄,1,1720022059,ngta đc mời tha
7392496601668862736,7384024954133597441,Ng Trung,ủa đây là Hà hả,1,1721199760,ủa đây là hà hả
7387389245231973137,7384024954133597441,Phúc Võ,hải sản alo em nha chị ơi 😅,1,1720010611,hải sản alo em nha chị ơi
7385478039663592199,7384024954133597441,Khải Đăng(Dany)🌊,ả ta biết ả ta slay👍,1,1719565616,ả ta biết ả ta slay
7385409506924446472,7384024954133597441,CONFIDENT BEAUTY,Xinh thế nàng oi 😍,2,1719549655,xinh thế nàng oi
7388027579302052624,7384024954133597441,Shop HQ 1,lúc đầu tưởng bả ngậm xúc xích -),1,1720159246,lúc đầu tưởng bả ngậm xúc xích -)
7386123830828450577,7384024954133597441,Mai Phuong,ldol của đời em đầy òi 😍🫶🫰🌷💗,1,1719715989,ldol của đời em đầy òi
7385737243178713873,7384024954133597441,vô tri 🍀🇻🇳,chị Hà đỉnh🥰🥰,1,1719625977,chị hà đỉnh
7404690372452369160,7384024954133597441,Chú Heo Con🐷,Xinh quá chị,1,1724038830,xinh quá chị
7385135126944318224,7384024954133597441,HuỳnhthịThuTrang💋,Son màu j thế ạ,1,1719485777,son màu j thế ạ
7403191615035212564,7384024954133597441,??????,Đẹp quá chị ơi!,1,1723689878,đẹp quá chị ơi!
7385398085357617936,7384024954133597441,klinh dth,chị sài gì mà mặt trắng v ạ,1,1719547011,chị sài gì mà mặt trắng v ạ
7403380550154634005,7384024954133597441,ne 🤰🏼,cs người này,1,1723733862,cs người này
7403396852773716753,7384024954133597441,Thu Uyên,xinh giỏi ngoan hiền đáng yêu= võ nữ ngân hà,1,1723737660,xinh giỏi ngoan hiền đáng yêu= võ nữ ngân hà
7385195446010839809,7384024954133597441,vợ cả sanemi<3×,ước j được chị hà môi rep một lần 😳😳,1,1719499824,ước j được chị hà môi rep một lần
7392919530648371986,7384024954133597441,Thuy Tien,Bà này đại sứ colorkey hay gì á bây nghĩ tới colorkey là t nghĩ tới bả luôn á,1,1721298231,bà này đại sứ colorkey hay gì á bây nghĩ tới colorkey là t nghĩ tới bả luôn á
7388892175846884104,7384024954133597441,🖇️,mắt chị nó thế hay là cố tình v :)😎,1,1720360528,mắt chị nó thế hay là cố tình v :)
7391683710900306709,7384024954133597441,Tất,chị này giống chị vân ở team gãy😊😊😊😊😊,1,1721010490,chị này giống chị vân ở team gãy
7385132311492215568,7384024954133597441,Rùa 🍭🐢,Em đang sài luô😁,0,1719485119,em đang sài luô
7408537223740588818,7384024954133597441,bảo nhi,em thik xem cj nhảy 😂😂,0,1724934495,em thik xem cj nhảy
7385748312974590738,7384024954133597441,𝘚ó𝘤 ☆°♪ 🐳,iem có ai thích đâu ạ?:)) chung tềnh với 1 mình Hà thooiii:)),0,1719628543,iem có ai thích đâu ạ?:)) chung tềnh với 1 mình hà thooiii:))
7385523633840063233,7384024954133597441,làm ồn sẽ tỉnh,Chinh qué cj oi,0,1719576235,chinh qué cj oi
7385931798071821074,7384024954133597441,bôngg,emm,0,1719671262,emm
7385749934555284231,7384024954133597441,Tớ là Y. T 🌷🐰,Bả trang điểm đỉnh ghê,0,1719628959,bả trang điểm đỉnh ghê
7414057904011543314,7384024954133597441,Ngọc 2k13,chị Hà môi 1000 điểm nha,0,1726219877,chị hà môi 1000 điểm nha
7385741874642518801,7384024954133597441,[ khánh linh á] ✓,xinh vãi ò🥰,0,1719627054,xinh vãi ò
7386134259327812370,7384024954133597441,nhim^~^,êm cj iu oi🥰,0,1719718405,êm cj iu oi
7395204843100750609,7384024954133597441,đồ xinh và rẻ nè,Son j z,0,1721830316,son j z
7385063899287192340,7384024954133597441,🎀𝐵.𝒩𝒽𝓊 𐙚🫧,colorkey màu mấy c oi,0,1719469202,colorkey màu mấy c oi
7386126371699639060,7384024954133597441,𝓗𝓞𝓐𝓘  𝓐𝓝𝓗 (≧▽≦),ước được chị rep 1 lần,0,1719716577,ước được chị rep 1 lần
7416322246882427656,7384024954133597441,Le Trinh,là em,0,1726747086,là em
7392802985362932487,7384024954133597441,Hà Store khẩu trang,Mũi như bị vẹo ý,0,1721271088,mũi như bị vẹo ý
7434927969254867719,7384024954133597441,~Ngọc~,bả xink . tui mê bộ son của bả lém lun á,0,1731079070,bả xink . tui mê bộ son của bả lém lun á
7385908397239976705,7384024954133597441,Riviu Đơn Giản ‧₊˚🖇️✩,xinh vại,0,1719665821,xinh vại
7410976064522044181,7384024954133597441,tâm hồn đau khổ 😔😔,xinh hi,0,1725502333,xinh hi
7441410653087286034,7384024954133597441,Alyssaʚɞ,vậy mà top 2 luôn,0,1732588444,vậy mà top 2 luôn
7385428452827349778,7384024954133597441,Pay iu♥️,mãi keooo♥️♥️♥️,0,1719554105,mãi keooo
7385424720071672593,7384024954133597441,~°•Hena•°~,"cj dùng son giống e nè,iu ghê 😳",0,1719553203,"cj dùng son giống e nè,iu ghê"
7385029456924017426,7384024954133597441,loyin crystal,Slay ác,0,1719461168,slay ác
7385000548376707848,7384024954133597441,Q.Anh🧸,chị Ngân Hà à,0,1719454483,chị ngân hà à
7397656702613308168,7384024954133597441,dtrang ᝰ.ᐟ,E có vòng cổ giống cj hà💗,0,1722401174,e có vòng cổ giống cj hà
7385351183818588936,7384024954133597441,chip,bl hài😂,0,1719536081,bl hài
7384940635511685895,7384024954133597441,Giangg,mi đẹp he,0,1719440496,mi đẹp he
7392375532154307335,7384024954133597441,Quỳnh Giao 🥑🥑🥑,son này tui cx có nè 🥰,0,1721171584,son này tui cx có nè
7386191175479264018,7384024954133597441,🧸朱氏玉阗🐮🐮🐮,đánh son kiểu j chị,0,1719731655,đánh son kiểu j chị
7393948932311728914,7384798879021141255,QUỲNH  NGUYÊN 29N1*20F1,đây không phải là thiếu đồng cảm . mà đây là vô cảm . vô lương tâm . vô đạo đức . vô văn hóa. đm thằng ra quy định này chắc cả họ nhà nó chuyên làm nghề đòi nợ thuê chứ nhà giá đ. é . o gì nó .,2376,1721537909,đây không phải là thiếu đồng cảm . mà đây là vô cảm . vô lương tâm . vô đạo đức . vô văn hóa. đm thằng ra quy định này chắc cả họ nhà nó chuyên làm nghề đòi nợ thuê chứ nhà giá đ. é . o gì nó .
7392938115667739410,7384798879021141255,Nguyễn Đình Hưng,nếu đúng là nguyên nhân này thì cho ông hiệu trưỡng nghĩ việc ngay lập tức,1057,1721302550,nếu đúng là nguyên nhân này thì cho ông hiệu trưỡng nghĩ việc ngay lập tức
7396649573853561618,7384798879021141255,Dịp Hải,đuổi hiệu trưởng đi,1613,1722166688,đuổi hiệu trưởng đi
7408819853472613127,7384798879021141255,🇻🇳 ❤️ Phước PS ❤️ 🇻🇳,Quy định nào của bộ giáo dục là chậm học phí 2 ngày là hủy KQ...?,534,1725000300,quy định nào của bộ giáo dục là chậm học phí 2 ngày là hủy kq...?
7392866983870317332,7384798879021141255,Giáo Nguyễn,Có tiền mà không học cũng lấy được bằng tiến sĩ kìa,380,1721286003,có tiền mà không học cũng lấy được bằng tiến sĩ kìa
7394297446049268481,7384798879021141255,duatthach,đề nghị cơ quan chức năng vào cuộc không để mất đi một tương lai của cháu,562,1721619080,đề nghị cơ quan chức năng vào cuộc không để mất đi một tương lai của cháu
7396660256350536466,7384798879021141255,Hoàng Bi,"hiệu trưởng lỡ nhận bì thư của các em thi rớt rồi, nên trường lỡ đủ chỉ tiêu nên em này chỉ là lý do thế thân thôi",294,1722169173,"hiệu trưởng lỡ nhận bì thư của các em thi rớt rồi, nên trường lỡ đủ chỉ tiêu nên em này chỉ là lý do thế thân thôi"
7392943593869443847,7384798879021141255,nguyễn văn sính,giờ xã hội còn nhiều bất công lắm ko riêng trường hợp cháu bé này.,259,1721303827,giờ xã hội còn nhiều bất công lắm ko riêng trường hợp cháu bé này.
7392808635628421895,7384798879021141255,Nguyễn hai,giờ ko có tiền thì đúng cũng thành sai 😥,123,1721272407,giờ ko có tiền thì đúng cũng thành sai
7408885354859889416,7384798879021141255,MinhTuấn Nguyen652 :))))),"bây giờ giáo dục là kinh doanh, chứ không phải vì sự nghiệp trồng người",55,1725015548,"bây giờ giáo dục là kinh doanh, chứ không phải vì sự nghiệp trồng người"
7396931387956134664,7384798879021141255,TÔI,một xã hội đào tạo tiền là trên hết đạo đức là một thứ không còn trong đất nước mình,77,1722234435,một xã hội đào tạo tiền là trên hết đạo đức là một thứ không còn trong đất nước mình
7392935953444913938,7384798879021141255,Thủy,đúng rồi phải nên án mạnh mẽ về việc lại để giúp đỡ Em ấy,30,1721302044,đúng rồi phải nên án mạnh mẽ về việc lại để giúp đỡ em ấy
7396567042746368775,7384798879021141255,👑🇻🇳Xuân Tâm🇻🇳👑,"Bộ giáo dục vào cuộc ngay, có thể đây là sai từ sở",65,1722147476,"bộ giáo dục vào cuộc ngay, có thể đây là sai từ sở"
7396691542554362631,7384798879021141255,ThanhBao,đuổi t hiệu trưởng ngay và liền...hok có tâm,49,1722176460,đuổi t hiệu trưởng ngay và liền...hok có tâm
7408811686041387784,7384798879021141255,Tamtran,Đau lòng lắm. Ai đã từng chạy tiền học con mới cảm thấy đau lòng .thương con quá,28,1724998396,đau lòng lắm. ai đã từng chạy tiền học con mới cảm thấy đau lòng .thương con quá
7384967880238269202,7384798879021141255,𝔂𝓮𝓷🦋,ồh kinh doanh chứ học hành gì,19,1719446837,ồh kinh doanh chứ học hành gì
7408975280994517768,7384798879021141255,Bé Bự Yêu Nước,chính xác là hiệu trưởng nên nghỉ nhường cho em vào học,5,1725036487,chính xác là hiệu trưởng nên nghỉ nhường cho em vào học
7397635107874652935,7384798879021141255,Lê Tiến,Thế mới rõ sự phân biệt giầu nghèo. Những nhà có tiền nó chỉ muốn con mình học cùng nhà giàu chưa ko muốn cho con học cùng con nhà nghèo,6,1722396147,thế mới rõ sự phân biệt giầu nghèo. những nhà có tiền nó chỉ muốn con mình học cùng nhà giàu chưa ko muốn cho con học cùng con nhà nghèo
7409577479486604039,7384798879021141255,Nguyễn Dung 71,ngày xưa đi học xó mù chữ còn giờ là chữ phải mua,1,1725176696,ngày xưa đi học xó mù chữ còn giờ là chữ phải mua
7392928063875662600,7384798879021141255,Dương Kiều 7x,Tiền làm mất hết tính người😍,26,1721300216,tiền làm mất hết tính người
7384870382400324360,7384798879021141255,Lê Kim Thị Hương,Ngày xưa không vậy đâu..giờ không có tiền con mình không có chữ,58,1719424131,ngày xưa không vậy đâu..giờ không có tiền con mình không có chữ
7397192759758717714,7384798879021141255,Lê Định 123789,gởi cho bác tô xem nhé,248,1722293157,gởi cho bác tô xem nhé
7384806536654603015,7384798879021141255,Hoangvan Hoangvan,tìm hiệu trưởng trường này,14,1719409264,tìm hiệu trưởng trường này
7392626282205856530,7384798879021141255,HIEP GA CHOI,😂 chắc lại có thóc của nhà napf nhét con ko đủ điểm vào đó rồi,38,1721229947,chắc lại có thóc của nhà napf nhét con ko đủ điểm vào đó rồi
7408831928935170823,7384798879021141255,khang,hủy để nhận đứa khác tiền gấp 100 lền...giờ là vậy..chuyển trường cũng mất tiền,21,1725003111,hủy để nhận đứa khác tiền gấp 100 lền...giờ là vậy..chuyển trường cũng mất tiền
7384802056437842705,7384798879021141255,Trần Ngọc Như Ý,nghe mà thương cho con quá vậy 🥺🥺🥺,11,1719408232,nghe mà thương cho con quá vậy
7392900218909442824,7384798879021141255,Bình Đại ca,giáo dục nhân văn là giúp đỡ chứ không phải nhẫn tâm,7,1721293723,giáo dục nhân văn là giúp đỡ chứ không phải nhẫn tâm
7405767103448269576,7384798879021141255,Hồng Phúc,trường học bệnh viện cơ quan là những nơi tôi không dám tới,5,1724289529,trường học bệnh viện cơ quan là những nơi tôi không dám tới
7408825096226784001,7384798879021141255,VỹVuiVẽ,Ông Thích Tâm Phúc từng nói ko thằng BS nào cứu mài nếu mày ko có tèn :)) tèn là vạn năng ko tèn chúg nó khênh chuẩn ko cần chỉnh 👍,52,1725001523,ông thích tâm phúc từng nói ko thằng bs nào cứu mài nếu mày ko có tèn :)) tèn là vạn năng ko tèn chúg nó khênh chuẩn ko cần chỉnh
7393922091038360336,7384798879021141255,shop thời trang nữ MỸ HẠNH,buồn thật,10,1721531659,buồn thật
7392900096075088641,7384798879021141255,báođộngđỏ,"làm đơn kháng nghị gửi bgh nhà trường,xin xem xét,k thì gửi thẳng đơn với kqht lên bộ giáo dục.nguoi nhà nên theo đuổi,cdm sẽ hỗ trợ bên ngoài",6,1721293705,"làm đơn kháng nghị gửi bgh nhà trường,xin xem xét,k thì gửi thẳng đơn với kqht lên bộ giáo dục.nguoi nhà nên theo đuổi,cdm sẽ hỗ trợ bên ngoài"
7392995770626065159,7384798879021141255,HUYỀN ANH shop,Tiên học TIỀN 😞,5,1721315971,tiên học tiền
7392918405995168529,7384798879021141255,Toàn,ở VN mà xảy ra chuyện như vậy thì k có gì làm lạ.......nản....,7,1721297970,ở vn mà xảy ra chuyện như vậy thì k có gì làm lạ.......nản....
7396673293317899025,7384798879021141255,123 👨‍👩‍👧,ko còn giáo dục nữa. chỉ tiền tiền🥺🥺🥺,8,1722172220,ko còn giáo dục nữa. chỉ tiền tiền
7405403736077583112,7384798879021141255,Hoàng Vân,"😳Mình bị shock khi các trường ĐH công bố tiền học phí, tăng gấp hơn 10 lần khi ngày trước mình đi học, hỏi thử những GĐ diện khó khăn thì làm sao có",16,1724204922,"mình bị shock khi các trường đh công bố tiền học phí, tăng gấp hơn 10 lần khi ngày trước mình đi học, hỏi thử những gđ diện khó khăn thì làm sao có"
7385042052289495815,7384798879021141255,Đậu Fake,Nền giáo dục ở lĩnh vực kinh doanh nên thế,12,1719464104,nền giáo dục ở lĩnh vực kinh doanh nên thế
7396910486526919441,7384798879021141255,VTNN SẾT HIỀN (Em The),Ngta thường gia hạn 1 tuần mà trường này kỳ vậy 😏,5,1722227453,ngta thường gia hạn 1 tuần mà trường này kỳ vậy
7408825010967823122,7384798879021141255,oanh đai bàng,Trường này thì chắc là giáo viên kể cả ban giám hiệu mà sao lại đối xử với học sinh như vậy .,7,1725001499,trường này thì chắc là giáo viên kể cả ban giám hiệu mà sao lại đối xử với học sinh như vậy .
7396637494550741767,7384798879021141255,Minh Lê,chưa vô học mà đã thiếu tiền thì khi nhập học làm j đủ tiền mà theo học...đó là nhà trường nghĩ zậy chứ k phải tui 😅😅😂,72,1722165581,chưa vô học mà đã thiếu tiền thì khi nhập học làm j đủ tiền mà theo học...đó là nhà trường nghĩ zậy chứ k phải tui
7385011687546127120,7384798879021141255,Hoàng Mến,chả hiểu kiểu gì,5,1719457048,chả hiểu kiểu gì
7396705976050680583,7384798879021141255,R ¹ U ⁹ O ⁸ U ³,có khác nào vùi dập nhân tài 😴,8,1722179817,có khác nào vùi dập nhân tài
7405391673264587536,7384798879021141255,Thích Thì Theo,giờ lương tháng nó cao hơn lương tâm thương e thật sự...nhà khó khăn nếu 1.2 trường hợp thì miễn giảm cho e nó cũng đâu sau vậy mà.,7,1724202121,giờ lương tháng nó cao hơn lương tâm thương e thật sự...nhà khó khăn nếu 1.2 trường hợp thì miễn giảm cho e nó cũng đâu sau vậy mà.
7408811695021949697,7384798879021141255,Nguyễn Đăng Nhân,đúng là bằng cấp là mua là thật. không đủ tiền thì không có bằng,6,1724998400,đúng là bằng cấp là mua là thật. không đủ tiền thì không có bằng
7392773747687670536,7384798879021141255,Ngọc Luân,tại sao nhiều người ăn học mà như zạy chứ,5,1721264283,tại sao nhiều người ăn học mà như zạy chứ
7408939447692100359,7384798879021141255,💕🏇Huỳnh Nguyễn 1978💕,"Trường học là nơi các e thắp sáng ước mơ, sao nhà trường lại ác cảm nư vậy. Đề nghị Bộ giáo dục vào cuộc để giúp đỡ cho e được theo đuổi ước mơ của mình, cũng như tạo điều kiện cho nhân tài của đất nước được phát triển.",6,1725028143,"trường học là nơi các e thắp sáng ước mơ, sao nhà trường lại ác cảm nư vậy. đề nghị bộ giáo dục vào cuộc để giúp đỡ cho e được theo đuổi ước mơ của mình, cũng như tạo điều kiện cho nhân tài của đất nước được phát triển."
7392936660919370512,7384798879021141255,Sương Khói,lương tâm ở đâu trong hoàn cảnh này???🥺🥺🥺,5,1721302222,lương tâm ở đâu trong hoàn cảnh này???
7395020901676794631,7384798879021141255,Sang Anh,trường nhà giàu mà chứa chung nào trường nhà nghèo đâu mà vào dc với đâu phải trường tư thiện đâu vào dc,5,1721787491,trường nhà giàu mà chứa chung nào trường nhà nghèo đâu mà vào dc với đâu phải trường tư thiện đâu vào dc
7405617365067514641,7384798879021141255,"tóc'húi'cua""sinh'tồn",víc toy ri là trường quốc tế hả .😐,12,1724254664,víc toy ri là trường quốc tế hả .
7508694748854698773,7384798879021141255,Sùng a vyy🆑,"kiểu j cx phải có ng bênh trườg, t kh bênh😇",3,1748254244,"kiểu j cx phải có ng bênh trườg, t kh bênh"
7410799064780325639,7384798879021141255,`¹☆☆JENNY NGUYỄN ☆☆╮,giờ là kinh doanh giáo dục mà,2,1725461120,giờ là kinh doanh giáo dục mà
7457921053982212882,7384798879021141255,Hạt cát sa mạc,trường nào giờ trả thế.. nó nghĩ 1người thì k ảnh hưởng đến trường,3,1736432567,trường nào giờ trả thế.. nó nghĩ 1người thì k ảnh hưởng đến trường
7410037034143154945,7384798879021141255,Trần Minh Công,Thôi con ơi. Trường nào cũng đc. Quan trọng ý chí phấn đấu vương lên của con. Môi trường như vậy kg phù hợp với con đâu con nhé,2,1725283699,thôi con ơi. trường nào cũng đc. quan trọng ý chí phấn đấu vương lên của con. môi trường như vậy kg phù hợp với con đâu con nhé
7409720762354942727,7384798879021141255,🇻🇳🐝🌈,toi e qua 😭,1,1725210056,toi e qua
7409992014421345040,7384798879021141255,Cẩm Tú,Nhà trường này thật vô cảm! Thật quá bất công cho em,1,1725273219,nhà trường này thật vô cảm! thật quá bất công cho em
7416386281125462802,7384798879021141255,Tờ Linh 97 (ĐƯA E VỀ NHÀ♥️♥️),Tại sao như vậy,1,1726761996,tại sao như vậy
7409927267592405761,7384798879021141255,Hữu Hạnh,"ngày xưa đi học để lấy kiến thức
còn bây giờ là đi mua kiến thức
buồn cho xã hội người giàu làm lạnh đạo",1,1725258143,ngày xưa đi học để lấy kiến thức còn bây giờ là đi mua kiến thức buồn cho xã hội người giàu làm lạnh đạo
7410650604714443537,7384798879021141255,thương thương,cháu tôi giờ chưa có kết quả đi học hỏi thì nhà trường bảo không biết từ từ ko tìm thấy hồ sơ 🙄,1,1725426557,cháu tôi giờ chưa có kết quả đi học hỏi thì nhà trường bảo không biết từ từ ko tìm thấy hồ sơ
7435469501313155847,7384798879021141255,vietbro_shop,Tuyệt vời có những nhà trường như này thì lớp trẻ và tương lai đất nước bị người đi trước dập tắt,1,1731205157,tuyệt vời có những nhà trường như này thì lớp trẻ và tương lai đất nước bị người đi trước dập tắt
7409668674048738055,7384798879021141255,Phạm Huyền,giờ ở nhà trường là nơi kinh doanh của các thầy cô chứ k phải nơi trồng người nữa,1,1725197929,giờ ở nhà trường là nơi kinh doanh của các thầy cô chứ k phải nơi trồng người nữa
7493752258958656263,7384798879021141255,the margaret..,“Bệnh viện có thể cứu người xấu chứ không thể cứu người nghèo”,1,1744775179,bệnh viện có thể cứu người xấu chứ không thể cứu người nghèo
7410664791499146000,7384798879021141255,Khôi Lâm,nói thiệt lúc nhỏ tao đi học k đống học phí chỉ khi lên đại học mới tốn tiền vì lúc nhỏ nghèo lắm thầy cô có nhắc có nói nhưng tao vẫn lì và học cũng may lúc đó học phí chưa là tất cả với trường,1,1725429859,nói thiệt lúc nhỏ tao đi học k đống học phí chỉ khi lên đại học mới tốn tiền vì lúc nhỏ nghèo lắm thầy cô có nhắc có nói nhưng tao vẫn lì và học cũng may lúc đó học phí chưa là tất cả với trường
7409694762721313544,7384798879021141255,Mysaya,Cái sự việc này sao bà bộ trưởng không vào mà lên tiếng,1,1725204004,cái sự việc này sao bà bộ trưởng không vào mà lên tiếng
7410228436432454416,7384798879021141255,Dương tỉnh 1981,"bình thường mà, đâu phải mỗi nhà trường,, bệnh viện không tiền cũng vậy mà,,",1,1725328269,"bình thường mà, đâu phải mỗi nhà trường,, bệnh viện không tiền cũng vậy mà,,"
7410822291472319252,7384798879021141255,An nhiên 1978,Khổ thân cháu quá,0,1725466526,khổ thân cháu quá
7410400386987213575,7384798879021141255,Quang Tóc Dài,Tao đi xin làm công nhân ko giám khoe bằng đại học,0,1725368296,tao đi xin làm công nhân ko giám khoe bằng đại học
7418056846827029266,7384798879021141255,Han Ho,con người với con người mà như vậy ?,0,1727150956,con người với con người mà như vậy ?
7410284786801836808,7384798879021141255,Tuấn Vinh,nói lên lương tâm nhà giáo của trường...,0,1725341382,nói lên lương tâm nhà giáo của trường...
7507613454682391314,7384798879021141255,yuri hanamitchi,có hai ngày mà tôi tưởng hai năm,0,1748002481,có hai ngày mà tôi tưởng hai năm
7410008807981662994,7384798879021141255,taxi đat daksong,khi xh của đồng tiền,0,1725277123,khi xh của đồng tiền
7409982541015319304,7384798879021141255,Khánh,mong bác tô Lâm xem,0,1725271008,mong bác tô lâm xem
7415437434924139272,7384798879021141255,Sang Duyên Nam Định,hóng vụ nayg,0,1726541077,hóng vụ nayg
