comment_id,video_id,username,comment_text,digg_count,create_time,clean_text
7491303498043474706,7491300024945528082,Trịnh Tâm 1979,"quá trời tội nghiệp , tại sao nhà nước không hổ trợ cho các em học sinh hoàn cảnh như vây chứ... em ấy rất hiếu học",28,1744205025,"quá trời tội nghiệp , tại sao nhà nước không hổ trợ cho các em học sinh hoàn cảnh như vây chứ... em ấy rất hiếu học"
7491303048943289096,7491300024945528082,🍀nghèo mà có tình🍀,"ngoài kia còn bao e khổ cực lắm,thương e nhiều🥰",28,1744204927,"ngoài kia còn bao e khổ cực lắm,thương e nhiều"
7491314790309561095,7491300024945528082,tien đầu to,thay nguoi dan vn co giau manh chua ma nghi dinh 168 co hop t hop ly o,2,1744207656,thay nguoi dan vn co giau manh chua ma nghi dinh 168 co hop t hop ly o
7491305622655615762,7491300024945528082,Pháp sư hệ nước,"xin lỗi ko giúp dc các em , anh từ thiện cho mẹ bắp hết rồi 😭",72,1744205521,"xin lỗi ko giúp dc các em , anh từ thiện cho mẹ bắp hết rồi"
7491313081831097106,7491300024945528082,Đức Apple,bởi vn mình còn nghèo lắm ae ạ,6,1744207264,bởi vn mình còn nghèo lắm ae ạ
7491329731745317639,7491300024945528082,Bắp Ngô,thà ủng hộ kera ủng cái nầy ý nghĩa hơn,0,1744211134,thà ủng hộ kera ủng cái nầy ý nghĩa hơn
7491360761613419272,7491300024945528082,Đại Đạo,16 tỉ đổ vào đây phải tốt không?,0,1744218364,16 tỉ đổ vào đây phải tốt không?
7491308018912936712,7491300024945528082,Phương Mai 🦊,con hòa đâu vào xem nè,2,1744206088,con hòa đâu vào xem nè
7492054730790896391,7491300024945528082,Chu Chữa Lành,đứa trẻ mà sau này sẽ có tất cả 🥰🥰,0,1744379944,đứa trẻ mà sau này sẽ có tất cả
7491312040947581697,7491300024945528082,Đình Vũ  38p,thầy bạn mk.kk,0,1744207032,thầy bạn mk.kk
7491302846580146952,7491300024945528082,Ra quân đổi tên,Thấy tội mấy em nhỏ quá ❤️❤️❤️,1,1744204874,thấy tội mấy em nhỏ quá
7491314801374020370,7491300024945528082,Tường An,đây mới là nơi cần các tấm lòng vàng,3,1744207656,đây mới là nơi cần các tấm lòng vàng
7491312067065037576,7491300024945528082,Đời Lạc Lối,16 tỷ phải vào những việc này,4,1744207020,16 tỷ phải vào những việc này
7491329983244927750,7491300024945528082,🤡,k ai hỏi nhưng mà thà bỏ 16 tỉ ủng hộ ai đó cho mấy bạn này phải hơn k,4,1744211214,k ai hỏi nhưng mà thà bỏ 16 tỉ ủng hộ ai đó cho mấy bạn này phải hơn k
7491339845966971668,7491300024945528082,Mèo Ka,nếu tôi giàu tôi sẽ tự mình đi giúp đỡ người cần giúp đỡ,3,1744213496,nếu tôi giàu tôi sẽ tự mình đi giúp đỡ người cần giúp đỡ
7491303285173797639,7491300024945528082,Live Bâng,thương lắm những hoàn cảnh này với người miền núi nghèo khó🥰,0,1744204976,thương lắm những hoàn cảnh này với người miền núi nghèo khó
7491329075438191367,7491300024945528082,Long Lee,miễn học phí rồi nhưng nghèo quá thì chịu thôi,0,1744210984,miễn học phí rồi nhưng nghèo quá thì chịu thôi
7491311145057174293,7491300024945528082,tuấn tú,Tự nhiên nghẹn họng 😔,0,1744206813,tự nhiên nghẹn họng
7491302775059743496,7491300024945528082,Ca Heo 1991,thấy thương bé quá. nhà nước mình có hổ trợ cho các bé không????,0,1744204864,thấy thương bé quá. nhà nước mình có hổ trợ cho các bé không????
7491543011408691986,7491300024945528082,pyjr59,Vụ 16 tỷ đâu rồi mn 😂😂,0,1744260804,vụ 16 tỷ đâu rồi mn
7491304051385238279,7491300024945528082,Trai đất Vĩnh,máy anh trên có thấy ko,0,1744205155,máy anh trên có thấy ko
7491303839686083335,7491300024945528082,luanle_1368,rớt nước mắt 🥺,0,1744205104,rớt nước mắt
7491545412869063432,7491300024945528082,️　 　  ️　 　  ️　 　  ️,khổ quá khổ,0,1744261354,khổ quá khổ
7491328552744665864,7491300024945528082,pk_td,nghe giọng ông thầy t còn sợ:)),0,1744210868,nghe giọng ông thầy t còn sợ:))
7491311403983192850,7491300024945528082,Bình rượu mơ,Hs vùng cao học thêm sao nổi mà điểm vẫn đủ mà TP HN nhiều trung tâm điểm lại thiếu 😁😁😁😁,0,1744206867,hs vùng cao học thêm sao nổi mà điểm vẫn đủ mà tp hn nhiều trung tâm điểm lại thiếu
7491303557497422610,7491300024945528082,Nam29122014,😳 Thấy tội quá.,0,1744205038,thấy tội quá.
7491543379629851400,7491300024945528082,Nguyễn Dung,thấy thương không các bạn vùng cao khổ quá thấy không bác tô Lâm ơi,0,1744260883,thấy thương không các bạn vùng cao khổ quá thấy không bác tô lâm ơi
7492608884801291015,7491300024945528082,Meoiiw,@Về 50kg đổi tên :/,1,1744508970,:/
7491471409912513287,7491300024945528082,Minh Thuận,@Nguyễn Linh,0,1744244178,ễn linh
7491327641385157394,7491300024945528082,Người ngoài hành lang,bữa nói 16 tỷ giúp mẹ bé bắp phí quá thì toàn bị táp giờ bọn nó quay xe hết rồi ha 😂,0,1744210656,bữa nói 16 tỷ giúp mẹ bé bắp phí quá thì toàn bị táp giờ bọn nó quay xe hết rồi ha
7492433798485115669,7491300024945528082,Ngoc Hieu,bọn quan tham nhũng chúng có nhìn thấy clip này không ta,0,1744468200,bọn quan tham nhũng chúng có nhìn thấy clip này không ta
7491328958668292872,7491300024945528082,Hoàng Tâm,Cay sống mũi. Xưa nhà nghèo lắm mà cũng không đến nỗi không mua nổi cái bút chì. Thương em vô cùng,0,1744210953,cay sống mũi. xưa nhà nghèo lắm mà cũng không đến nỗi không mua nổi cái bút chì. thương em vô cùng
7497951076683989767,7491300024945528082,em vy xihgai ><,trường toii trường toii ai thắc mắc nhắn tin riêng ạ 😆,0,1745752784,trường toii trường toii ai thắc mắc nhắn tin riêng ạ
7491326330089440007,7491300024945528082,Vu Thespike🏐,những hoàn cảnh như này mới đáng từ thiện quyên góp chứ như mẹ bé bắp thì🤡🤡,0,1744210343,những hoàn cảnh như này mới đáng từ thiện quyên góp chứ như mẹ bé bắp thì
7491318801121903368,7491300024945528082,Thành Jindo,cho con chau di minh kho se mang mien vui cho em con mho,0,1744208597,cho con chau di minh kho se mang mien vui cho em con mho
7491474433967063815,7491300024945528082,tú đẹp trai,17 vô chỗ này mới gọi là công đức vô lượng làm phước đúng chỗ nè,0,1744244845,17 vô chỗ này mới gọi là công đức vô lượng làm phước đúng chỗ nè
7491452584030044948,7491300024945528082,HƯNGVĨNH LONG🐓81,"học sinh vùng cao thì ko bút chì để viết
còn mạnh thường quân thì ủng những tiktok cơ 😂😂😂
ủng hộ những ca sĩ bẩn kêu gọi quyên góp😡😡😡",0,1744239767,học sinh vùng cao thì ko bút chì để viết còn mạnh thường quân thì ủng những tiktok cơ ủng hộ những ca sĩ bẩn kêu gọi quyên góp
7491529623067558664,7491510870976040200,Diệp sáu,Sao năm nay cháy hoài vậy trời nam mô a di đà phật,8,1744257682,sao năm nay cháy hoài vậy trời nam mô a di đà phật
7491518141936780039,7491510870976040200,HẢI NAM KỲ,nhà thành thị nhỏ quá...bị cháy khó thoát thân,2,1744255007,nhà thành thị nhỏ quá...bị cháy khó thoát thân
7491556391946699528,7491510870976040200,THANH.BÙI,Đau sót quá,1,1744263915,đau sót quá
7491537623305372433,7491510870976040200,Thư Nguyễn.GĐDS Mộc An,😭Nam mô Đại Nguyện Địa Tạng Vương Bồ Tát Nguyện cho những người đã mất được vãng sanh về Tây phương cực lạc,0,1744259551,nam mô đại nguyện địa tạng vương bồ tát nguyện cho những người đã mất được vãng sanh về tây phương cực lạc
7491524465021633298,7491510870976040200,𝐏han 𝐌inh 𝐍hí,quá thương tâm 🥺🥺🥺,0,1744256481,quá thương tâm
7491548805372838674,7491510870976040200,Tran Vo,nam mô adidaphat,0,1744262140,nam mô adidaphat
7491519754713432840,7491510870976040200,Tinh ăn mù làm,"mùa nóng đến rồi, thời 5.0 rồi tìm hiểu và sớm bỏ tiền mua hệ thống cảm biến phát hiện khói đi",0,1744255385,"mùa nóng đến rồi, thời 5.0 rồi tìm hiểu và sớm bỏ tiền mua hệ thống cảm biến phát hiện khói đi"
7491542523346944776,7491510870976040200,cau2_tv,sao lại khóa trái,0,1744260692,sao lại khóa trái
7491549748965917448,7491510870976040200,Hoa hồng,nam mô a Di Đà y,0,1744262364,nam mô a di đà y
7491539826228347668,7491510870976040200,Duy Bảo,lại cháy!!!!🥺🥺🥺🥺,0,1744260059,lại cháy!!!!
7491532649028403976,7491510870976040200,Phạm Huỳnh,đau lòng .nam mô a Di Đà Phật,0,1744258393,đau lòng .nam mô a di đà phật
7491532643017556754,7491510870976040200,Huong Tran,nam mô a di đà phâtf,0,1744258389,nam mô a di đà phâtf
7491538906141311752,7491510870976040200,tamnguyen18.88,trời gần nhà mà k biết j luôn..adi đà phật.,0,1744259853,trời gần nhà mà k biết j luôn..adi đà phật.
7491520213659697927,7491510870976040200,Park Ji Sung,vừa hô hào F4 nhận bằng khen của Bộ. giờ bị vậy. đường NKKN nó bự và trôngs vậy. tất cả các hẻm cũng kg sâu. 😏😏,0,1744255508,vừa hô hào f4 nhận bằng khen của bộ. giờ bị vậy. đường nkkn nó bự và trôngs vậy. tất cả các hẻm cũng kg sâu.
7491516128549143304,7491510870976040200,Nguyễn Huệ,Nam mô Đại từ Đại Bi cứu khổ cứu nạn quán thế âm bồ tát,1,1744254543,nam mô đại từ đại bi cứu khổ cứu nạn quán thế âm bồ tát
7491516122777469716,7491510870976040200,Kim liên Tran,adidaphat adidaphat adidaphat adidaphat adidaphat adidaphat adidaphat adidaphat adidaphat,0,1744254538,adidaphat adidaphat adidaphat adidaphat adidaphat adidaphat adidaphat adidaphat adidaphat
7491564500333265672,7491510870976040200,Kem Nè,"nhung may cô con gái đi hoc đại học ở sg nên sống xót, đau lòng xót xa vô cùng",0,1744265803,"nhung may cô con gái đi hoc đại học ở sg nên sống xót, đau lòng xót xa vô cùng"
7491531929730286353,7491510870976040200,1179kieuem_,Nam mô a di đà phật Nam mô a di đà phật Nam mô a di đà phật Nam mô a di đà phật,0,1744258234,nam mô a di đà phật nam mô a di đà phật nam mô a di đà phật nam mô a di đà phật
7491512052709196564,7491510870976040200,Long Ddaij Bangf,Thành kính phân ưu,1,1744253594,thành kính phân ưu
7491533124222354183,7491510870976040200,THUÝ LÊ,nam mô đai bi quan thế âm bồ tát,0,1744258512,nam mô đai bi quan thế âm bồ tát
7491532920692933392,7491510870976040200,Hoàng Yến,Thành kính phân ưu!,0,1744258454,thành kính phân ưu!
7491527617126056722,7491510870976040200,Ngọc Bùi 🇻🇳❤️🇫🇷,nó nhỏ xíu kẹt trong hóc vậy mà 🥺,0,1744257225,nó nhỏ xíu kẹt trong hóc vậy mà
7491560183295460114,7491556162215759111,Hân Miu 💋,Quá loạn 😔,28,1744264797,quá loạn
7491598632145388296,7491556162215759111,NTT1707,Ngáo đá ak😂😂😂,6,1744273759,ngáo đá ak
7491559300416357136,7491556162215759111,Dudu&Bubu,Chỉ sợ luật VN nhẹ quá với những tp như này t,1142,1744264602,chỉ sợ luật vn nhẹ quá với những tp như này t
7491559254840918791,7491556162215759111,Nhi Đặng🇻🇳,giờ ra đường nguy hiểm quá,564,1744264587,giờ ra đường nguy hiểm quá
7491610874458587912,7491556162215759111,ℕ𝕒𝕞𝕞✯✯😅,mấy thằng ngoài đó vô đây làm đủ trò,6,1744276601,mấy thằng ngoài đó vô đây làm đủ trò
7491635608902107912,7491556162215759111,minhh,gwen cute,17,1744282354,gwen cute
7491620589862519560,7491556162215759111,Giang,chắc nghiện GTA,6,1744278856,chắc nghiện gta
7491558995217040148,7491556162215759111,Minh Phát Duom Nguyen,Quá manh động,5,1744264519,quá manh động
7491561122010186514,7491556162215759111,⠀ ⠀ ⠀ ⠀ ⠀᠌cậu ba,tao tin có nhiều đứa nghĩ không có lửa làm sao có khói 😌,12,1744265015,tao tin có nhiều đứa nghĩ không có lửa làm sao có khói
7491558538360406791,7491556162215759111,hương rừng,nguy hiểm vô cùng,33,1744264410,nguy hiểm vô cùng
7491563808278135560,7491556162215759111,ko sợ ma 👻,gặp t chắc ko cần đến công an 😏,31,1744265648,gặp t chắc ko cần đến công an
7491560809026683666,7491556162215759111,Phan Cườnq,Quá nguy hiểm không nên để đối tượng này ngoài xã hội,204,1744264941,quá nguy hiểm không nên để đối tượng này ngoài xã hội
7491626740931724050,7491556162215759111,niêmung,chắc t ra ngoài mặc áo giáp lv3 thoii,29,1744280293,chắc t ra ngoài mặc áo giáp lv3 thoii
7491629058411102984,7491556162215759111,của hàng xe máy công Nguyễn,chiến này lâu ra rồi cứ an tâm ra đường,3,1744280839,chiến này lâu ra rồi cứ an tâm ra đường
7491597412097983250,7491556162215759111,×մâղ հìềղ,"cố ý vào tù để trả thù thằng kia, t coi phim review thấy z kkk",7,1744273471,"cố ý vào tù để trả thù thằng kia, t coi phim review thấy z kkk"
7491616994049114898,7491556162215759111,Baogiovuidoiten,Đang nhập vai GATA5 à,2,1744278031,đang nhập vai gata5 à
7491659918438073105,7491556162215759111,PHÁN QUANG,Sao ông trời k cho tui đậu ngay đèn xanh đèn đỏ chỗ đó nhĩ,1,1744288023,sao ông trời k cho tui đậu ngay đèn xanh đèn đỏ chỗ đó nhĩ
7491618194282988306,7491556162215759111,Nhựt Phan,"Mấy đứa hay bảo ko có lửa sao có khói, thì đây này",8,1744278314,"mấy đứa hay bảo ko có lửa sao có khói, thì đây này"
7491594600953758471,7491556162215759111,Lam Phạm Dang,luật vn cái cần phạt thì không phạt gì đâu ko😎,6,1744272819,luật vn cái cần phạt thì không phạt gì đâu ko
7491625725511254805,7491556162215759111,Tòng Siêu Cúp,Làm vậy có vui đâu,1,1744280053,làm vậy có vui đâu
7491896672428655378,7491556162215759111,﹝ 𝐓rần 𝐀n ﹞,làm đơn là có tiền luôn😂,1,1744343144,làm đơn là có tiền luôn
7491615044527506194,7491556162215759111,Khánh,H ra dường sợ thế,1,1744277569,h ra dường sợ thế
7491661248167723784,7491556162215759111,ʚရှီɞ🐦‍⬛Đɛɳ•ɳè ᝰ.ᐟ,GTA5 phiên bản live action à 🤡,4,1744288330,gta5 phiên bản live action à
7491659337481585429,7491556162215759111,Bảo huỳnh 🍭🌈,tại không muốn lang thang nữa muốn có chổ ở ổn định á,1,1744287884,tại không muốn lang thang nữa muốn có chổ ở ổn định á
7491628419169288968,7491556162215759111,TRANG 5h33_15/12/1984,video không dành cho mình,1,1744280682,video không dành cho mình
7491644719848981256,7491556162215759111,UN,tưởng trong đó văn minh lắm mà cứ chê thủ đô như thật,4,1744284474,tưởng trong đó văn minh lắm mà cứ chê thủ đô như thật
7491662698700047125,7491556162215759111,commentchovui,chắc nó muốn nổi trên tiktok đó mà kkk,1,1744288666,chắc nó muốn nổi trên tiktok đó mà kkk
7491632330147595016,7491556162215759111,Nhỏ,Trường hợp này phải phạt thật nặng,1,1744281592,trường hợp này phải phạt thật nặng
7491638336029967111,7491556162215759111,Mộc-1988,Nó bị sao thế nhỉ,1,1744282989,nó bị sao thế nhỉ
7491657456546267911,7491556162215759111,Ziiin8386,Lang thang là sao,1,1744287447,lang thang là sao
7491654363393032961,7491556162215759111,DƯƠNG CẢNH 63,nguy hiểm wua,1,1744286737,nguy hiểm wua
7491630772555055890,7491556162215759111,Thích Tập Chân,sau ra đường chắc phải sắm bộ áo giáp 😔,3,1744281229,sau ra đường chắc phải sắm bộ áo giáp
7491625296854352657,7491556162215759111,Trung tài xế 83 t1,"quá bất ngờ, có nghề chưa chắc né kịp,",1,1744279975,"quá bất ngờ, có nghề chưa chắc né kịp,"
7491562348265964289,7491556162215759111,HVD✅,Những người như nào đó mới đi tò .nên không bao giờ muốn những người đi tò ra tò rất nguy hiểm,4,1744265325,những người như nào đó mới đi tò .nên không bao giờ muốn những người đi tò ra tò rất nguy hiểm
7491586665175057160,7491556162215759111,ʜ.ɢɪᴀʙᴀ̉ᴏ ✓,Cái biẻn số kìa,3,1744270966,cái biẻn số kìa
7491627610997392148,7491556162215759111,Sóc,bị tóm rồi 🤣,1,1744280490,bị tóm rồi
7491576200369455873,7491556162215759111,TUỆ TRINH,bộ luật mới hết rùi có camarra,1,1744268537,bộ luật mới hết rùi có camarra
7491562358502900488,7491556162215759111,Pasu,😆😆😆 câu chỗ anh em mình khuyên thật ...,1,1744265301,câu chỗ anh em mình khuyên thật ...
7491575276729254674,7491556162215759111,TRần Biên 🇻🇳,Nguy hiểm quá.,1,1744268314,nguy hiểm quá.
7491574844242182929,7491556162215759111,Fast,Không có đá làm sao có khói,1,1744268226,không có đá làm sao có khói
7491658995209454354,7491556162215759111,a3_64,mai chiều chắc hết dám chờ đèn đỏ luôn,1,1744287810,mai chiều chắc hết dám chờ đèn đỏ luôn
7491647542142501639,7491556162215759111,Đỗ đỗ đỗ đỗ,Về đồn mấy a cưng lắm😂,1,1744285140,về đồn mấy a cưng lắm
7491563526780437256,7491556162215759111,Khỉ  Con Bella,sợ quă,1,1744265573,sợ quă
7491563344257008402,7491556162215759111,Huỳnh Mai,chắc muốn ăn lười làm nên đang kiếm người nuôi😆😆😆😆,1,1744265530,chắc muốn ăn lười làm nên đang kiếm người nuôi
7491572391229260550,7491556162215759111,Nam Vũ,quá mạnh động,1,1744267693,quá mạnh động
7491562468817240852,7491556162215759111,giám đốc bốc,trong ý lạ vậy,1,1744265325,trong ý lạ vậy
7491569504188678933,7491556162215759111,Quang Vĩ,ko còn tác dụng gì cho xh thì nhà nước tự biết phải làm gì rồi đó. còn xảy ra thì biết lỗi của ai liền,1,1744266972,ko còn tác dụng gì cho xh thì nhà nước tự biết phải làm gì rồi đó. còn xảy ra thì biết lỗi của ai liền
7491610633802580743,7491556162215759111,Nguyễn Thị Kim Yên,Mong công an vào cuộc khẩn trương,1,1744276552,mong công an vào cuộc khẩn trương
7491574001657463559,7491556162215759111,Phong Yêu Bông Review,cho đi chunq thân dùm con đi cho dân nhờ vã,1,1744268020,cho đi chunq thân dùm con đi cho dân nhờ vã
7491569298051154695,7491556162215759111,hangovan272,thôi Xong rồi lượm ơi,1,1744266923,thôi xong rồi lượm ơi
7491576150461743880,7491556162215759111,Thiynn.03,Trời ơi là trời .sợ hãi vậy😢,1,1744268515,trời ơi là trời .sợ hãi vậy
7491615574890644232,7491556162215759111,trung HHL,dạo này nhiều anh hùng quá,1,1744277702,dạo này nhiều anh hùng quá
7491624343132259080,7491556162215759111,Phan Phú Nguyên 🍬🫵,Chắc nay ra đường mặc áo giáp quá kk,1,1744279736,chắc nay ra đường mặc áo giáp quá kk
7491628957198435080,7491556162215759111,oh.🥀,Càng ngày càng sợ thế giới này🥶,1,1744280814,càng ngày càng sợ thế giới này
7491563321771377426,7491556162215759111,650+ thì đổi tên,chắc làm nv gia nhập hội chớ gì,1,1744265526,chắc làm nv gia nhập hội chớ gì
7491661704880456465,7491556162215759111,Huy đây rồi,Nó làm như chơi game siêu quậy pc vậy kkk,2,1744288439,nó làm như chơi game siêu quậy pc vậy kkk
7491618790183781138,7491556162215759111,(SongTử T5),hok có đá là sao có khói nè 😂😂😂,1,1744278439,hok có đá là sao có khói nè
7491630238175494930,7491556162215759111,Thiên Bình ngây 🎄,hên k có độc,1,1744281104,hên k có độc
7491576981420884737,7491556162215759111,Anh DươngGia 01,"Yên tâm thì đi chống phơi nghiễm nữa, rõ chán😏😏😏",2,1744268727,"yên tâm thì đi chống phơi nghiễm nữa, rõ chán"
7491560584346993409,7491556162215759111,kietnguyen11436,Thằng nào bán đồ . Ngon quá đó.lên tiếng đi 😂😂😂,3,1744264905,thằng nào bán đồ . ngon quá đó.lên tiếng đi
7491616373845377799,7491556162215759111,tên là Huy🫥,tiền về,1,1744277881,tiền về
7491562732078416647,7491556162215759111,Explain Nation,"30 tháng tư, Đọc 30 trên 4, chịu ông BTV rồi đó",4,1744265396,"30 tháng tư, đọc 30 trên 4, chịu ông btv rồi đó"
7491560444965307142,7491556162215759111,danhdo,😂😂😂 giờ teo thái cũng k thua j cam,1,1744264886,giờ teo thái cũng k thua j cam
7491647941457052424,7491556162215759111,Thi Hà,Hóng Phần 2,1,1744285233,hóng phần 2
7491613252801364743,7491556162215759111,YoungTobie🦆,đệ gwen😫,3,1744277159,đệ gwen
7491561075599688456,7491556162215759111,skeleton,1 tỏi 500 cho mỗi người không rút kiện,4,1744265002,1 tỏi 500 cho mỗi người không rút kiện
7491654302961222420,7491556162215759111,huynh long 88 AG,chắc o nhà hết gạo hết cơm rồi......,0,1744286706,chắc o nhà hết gạo hết cơm rồi......
7491646312292746002,7491556162215759111,Buồn Trong Anh,thấy Mĩ đánh thuế cao quá nên muốn ăn cơm nhà nước miễn phí mà,0,1744284853,thấy mĩ đánh thuế cao quá nên muốn ăn cơm nhà nước miễn phí mà
7491568175063827207,7491556162215759111,Baboc,may cho nó gặp toàn dân hiền chứ gặp mấy ông trời là công an tới ko kịp đâu,0,1744266664,may cho nó gặp toàn dân hiền chứ gặp mấy ông trời là công an tới ko kịp đâu
7491643816253866760,7491556162215759111,Trung Đức,Chơi GTA 300 phút / ngày chăng?,0,1744284269,chơi gta 300 phút / ngày chăng?
7506845500076098311,7491556162215759111,iamtung,T có làm j đâu,0,1747823680,t có làm j đâu
7491562635487380242,7491556162215759111,Bùi Nguyên,nó bị gì z ta,0,1744265376,nó bị gì z ta
7491657249867629329,7491556162215759111,đo_đen68,cái j cũng phải có lý do của nó 😳😳😳,0,1744287403,cái j cũng phải có lý do của nó
7491616890806469383,7491556162215759111,hongphuoc💤,trên hóng hớt đường phố có,0,1744278010,trên hóng hớt đường phố có
7491636139682988816,7491556162215759111,khắc tiệp,khổ mấy nạn nhân.... đang tung tăng thả hồn vào thiên nhiên...thì đột nhiên vận hạn ập tới... ko biết chuyện gì luôn,0,1744282492,khổ mấy nạn nhân.... đang tung tăng thả hồn vào thiên nhiên...thì đột nhiên vận hạn ập tới... ko biết chuyện gì luôn
7491639362355086098,7491556162215759111,Tran Anhkhoa,sợ thế,0,1744283225,sợ thế
7491624651518526224,7491556162215759111,nguyen vu~,k có đá lm sao có khói🤣,0,1744279828,k có đá lm sao có khói
7491570088807039751,7491556162215759111,trần bá 1975,"ra khỏi cộng đồng,,quá nguy hiểm",0,1744267104,"ra khỏi cộng đồng,,quá nguy hiểm"
7491562093272072980,7491556162215759111,TN20F1,may là nó kg phải họ Nguyễn đấy,0,1744265238,may là nó kg phải họ nguyễn đấy
7491604016037479175,7491556162215759111,Minh Hiếu,Ko có đá thì làm sao có khói,0,1744275008,ko có đá thì làm sao có khói
7491562057650127637,7491556162215759111,Kiếp Phong Trần,xh giờ loạn rồi,0,1744265232,xh giờ loạn rồi
7491579366192579335,7491556162215759111,trẻ con thích chơi đồ hiệu,gta hả,0,1744269263,gta hả
7491636108112315154,7491556162215759111,Vũ 3m Bẻ đôi,GTA Quá 181phut,0,1744282470,gta quá 181phut
7491575459865854738,7491556162215759111,Phú Quốc,Mới xem ở trên bị tóm r🙂,0,1744268361,mới xem ở trên bị tóm r
7491652636544254728,7491556162215759111,Hồng Quân,Chơi GTA ít thôi,1,1744286326,chơi gta ít thôi
7491632948518830868,7491556162215759111,Gate,tưởng thế là ngầu,1,1744281744,tưởng thế là ngầu
7492005991023231752,7491556162215759111,Lanniuu ✿,@@ℋ𝒾ℯ̂̀𝓃 ra đường cũng sợ nữa,1,1744368593,ra đường cũng sợ nữa
7491660118405972744,7491556162215759111,@Oanh Hànn ☘️☘️,@•I’m Smile• sau này về quê cũng sợ nha😅,1,1744288064,smile sau này về quê cũng sợ nha
7491586988686279432,7491560518151392520,Vũ Hoàng Khánh,nụ hôn tử thần,41,1744271049,nụ hôn tử thần
7491565428826080021,7491560518151392520,Đời Vô Định,nụ hôn nhớ đời 😂,126,1744266018,nụ hôn nhớ đời
7511298190562706177,7491560518151392520,Phạm Đình Thư Cát,🥺hên quá mình chỉ thích bạn trai BL mà thôi,59,1748860401,hên quá mình chỉ thích bạn trai bl mà thôi
7511359556552327954,7491560518151392520,Xuan Truong Dang,40t vào đọc cmt xem Hickey là gì 🤣,34,1748874686,40t vào đọc cmt xem hickey là gì
7491570842648986384,7491560518151392520,8x thích nghe nhạc  hay,😂😂 từ tuổi này chưa biết yêu còn bị gặp báo đăng mấy vụ này.. chắc ở vậy luôn yêu thương gì tầm này.kkk,9,1744267287,từ tuổi này chưa biết yêu còn bị gặp báo đăng mấy vụ này.. chắc ở vậy luôn yêu thương gì tầm này.kkk
