comment_id,video_id,username,comment_text,digg_count,create_time,clean_text
7542348055010935559,7538488835701804306,.,s k ph nước hoa minh béo😭,0,1756089760,s k ph nước hoa minh béo
7547271201560855312,7538488835701804306,ÔNG KẸ🥏🖤⬛⚫,1k v,0,1757236021,1k v
7545134232647205633,7538488835701804306,hung,9ke,0,1756738471,9ke
7541404571206173447,7538488835701804306,phuongbetua,tiền ship muốn bệnh luôn,0,1755870085,tiền ship muốn bệnh luôn
7541407158908486416,7538488835701804306,Ⓗⓞàⓝⓖ‿ ⓓⓘễⓝ,59k🙂🙂🙂,0,1755870692,59k
7542732691297403666,7538488835701804306,baovip🧸,9k ship 30,0,1756179312,9k ship 30
7542554203602076423,7538488835701804306,༒︎Ҩ.ℳ¡ทɦℒℯ˚₊· ͟͟͞͞➳❥,Ah e t free ship 9k thật hả giảm 93%,0,1756137760,ah e t free ship 9k thật hả giảm 93%
7541660058527630087,7538488835701804306,Huy nhỏ 👶🏻,Sao cs 1k,0,1755929573,sao cs 1k
7542395631276884754,7538488835701804306,Nam Nguyễn 🤕,9k:)))),0,1756100839,9k:))))
7541395647095833351,7538488835701804306,L,t tưởng bán cái set đồ ăn🥰,0,1755868011,t tưởng bán cái set đồ ăn
7541443290580009735,7538488835701804306,cặc,9k =),0,1755879101,9k =)
7541760075016274706,7538488835701804306,Đ.bao,t 9k😂,0,1755952861,t 9k
7539485193482240776,7538488835701804306,VTP,9k:),0,1755423197,9k:)
7541387791100298002,7538488835701804306,🐻,😂 t 1k 😂,0,1755866178,t 1k
7541398924351931144,7538488835701804306,LUÂN MÊ ANIME 🤓,tao sài nước hoa minh béo💀,0,1755868770,tao sài nước hoa minh béo
7541409879283106568,7538488835701804306,Trung hòa ✅️,t 9.300,0,1755871322,t 9.300
7540202623405966096,7538488835701804306,gà đá bm,ấn chơi đc 9k nek,0,1755590244,ấn chơi đc 9k nek
7540528162749842183,7538488835701804306,𝘿𝙉𝙆💤,12k free ship mà k thích mua,0,1755666032,12k free ship mà k thích mua
7539175186395464455,7538488835701804306,Ng Nhất Huy,có bán nC hoa itachim ko,0,1755351016,có bán nc hoa itachim ko
7543640146525930261,7538488835701804306,Chiếc lược ngà🌿,team 150k🥰,0,1756390598,team 150k
7542037014998565640,7538488835701804306,Ngọc Lê,tui 0đ,0,1756017345,tui 0đ
7540928386919809810,7538488835701804306,adu e Dat,có 1k,0,1755759217,có 1k
7539309794576057096,7538488835701804306,HDuy🚬,9k :)),0,1755382379,9k :))
7545344423007814418,7538488835701804306,...,miễn ship,0,1756787406,miễn ship
7541685467302265618,7538488835701804306,KhĐăng♠,ấn chs 1k,0,1755935488,ấn chs 1k
7545144358376407815,7538488835701804306,yi sang vn,1đ secret lun💀,0,1756740823,1đ secret lun
7541979647668437768,7538488835701804306,Hanzo,200k lun,0,1756003980,200k lun
7541389841146282759,7538488835701804306,Thanh Thương,9.300đ 😁,0,1755866657,9.300đ
7544346607329182471,7538488835701804306,Cheese🧀,đã mua ủng hộ shop 10 cái,0,1756555084,đã mua ủng hộ shop 10 cái
7542109259669521170,7538488835701804306,Chung Tín là bố!,23k free ship có nên mua hay ko?,0,1756034160,23k free ship có nên mua hay ko?
7546607684003513106,7538488835701804306,...NTHAHA^^,vãi cả 9k,0,1757081530,vãi cả 9k
7541338520910021384,7538488835701804306,¹²..,9k -),0,1755854708,9k -)
7542273003493917447,7538488835701804306,(A+B)²=A²+2AB+B²⚡,9k=),0,1756072295,9k=)
7548339787494998791,7538488835701804306,Huy cù,Có 9đ,0,1757484826,có 9đ
7543991155714114312,7538488835701804306,Kà ri✿,chủ tus hog bt cầm đũa s hả( chỉ hỏi hoi),0,1756472323,chủ tus hog bt cầm đũa s hả( chỉ hỏi hoi)
7542370520530371345,7538488835701804306,mister cat😶‍🌫️,9k bao ship,0,1756094998,9k bao ship
7542534531091677970,7538488835701804306,Nhatlam🥀,1đ :),0,1756133179,1đ :)
7539986055727219474,7538488835701804306,qquy176,12k :)),0,1755539814,12k :))
7546136268246287105,7538488835701804306,iuu Hot Wheels💞,😂hâha😂,0,1756971810,hâha
7546980192513524487,7538488835701804306,DRT đức,tôi 1đ luôn,0,1757168264,tôi 1đ luôn
7541595657678766855,7538488835701804306,NGÂN 4 TỦI😆😆😆,9k freeship,0,1755914582,9k freeship
7545185318895600391,7538488835701804306,Thị Hương Trần,1k free shop😳,0,1756750361,1k free shop
7539856760242406152,7538488835701804306,Đạt,sao có 5 k thí,0,1755509712,sao có 5 k thí
7541607743876317960,7538488835701804306,LD tiến,ấn mua 1₫,0,1755917398,ấn mua 1
7541659082211328776,7538488835701804306,mậm đàn bà,9k free ship^^,0,1755929345,9k free ship^^
7541671843226206984,7538488835701804306,Ferich,9k=)),0,1755932318,9k=))
7545349321630548743,7538488835701804306,Fitbest,1đ free ship 💀💀,0,1756788549,1đ free ship
7541678883071640338,7538488835701804306,qahhh🐸🫰🏻,"ấn chơi 9.000 , ấn mua 9.000🤪",0,1755933956,"ấn chơi 9.000 , ấn mua 9.000"
7543966347543511826,7538488835701804306,Mijnz 🍄,làm t tưởng đồ ăn :(,0,1756466549,làm t tưởng đồ ăn :(
7545381219522560786,7538488835701804306,chó đẹp zai✅,trang,0,1756795973,trang
7564434467504816903,7538488835701804306,hiền,ê tui có 9k à,0,1761232153,ê tui có 9k à
7540954559267603217,7538488835701804306,️,ấn chs đc 1k,0,1755765310,ấn chs đc 1k
7542040058184254264,7538488835701804306,Anh Tên Là Đạt,Ko ấn🤔,0,1756018073,ko ấn
7549065169637999381,7538488835701804306,Thang Huynh,9 000 mà,0,1757653712,9 000 mà
7544660491210294024,7538488835701804306,kuto_skibidi,t có 1 đồng à:),0,1756628165,t có 1 đồng à:)
7538650827160011538,7538645226533948688,꧁༺Hoari Thạch༻꧂,nó coi phim nhật quá nên tưởng ngoài đời dễ như trong phim,165,1755228933,nó coi phim nhật quá nên tưởng ngoài đời dễ như trong phim
7538646923307582209,7538645226533948688,Tuấn,coi phim quá 180p 😅,120,1755228028,coi phim quá 180p
7538667539602752274,7538645226533948688,nguyễn hoàng thế đức,đoán vội gốc par.kyy 🤣🤣🤣,30,1755232823,đoán vội gốc par.kyy
7538673049245352722,7538645226533948688,FPT vô địch thì đổi tên ⚡️,nghiện phim hành động Nhật Bản nặng r 😅,4,1755234108,nghiện phim hành động nhật bản nặng r
7538672937508094728,7538645226533948688,Đức Thọ,Thanh niên xem phim Nhật quá 180p đây mà 🤣🤣🤣,17,1755234079,thanh niên xem phim nhật quá 180p đây mà
7538668991369184008,7538645226533948688,Ancient小Raion,Thanh niên xem sét quá 180 🤣🤣,3,1755233162,thanh niên xem sét quá 180
7538679896395711252,7538645226533948688,Tuấn Anh 1982,bạn gái thật mạnh mẽ 🥰🥰🥰🥰,1,1755235702,bạn gái thật mạnh mẽ
7538678660459807495,7538645226533948688,Thủy Trần,con tôi hai đứa con gái đều học võ để tự vệ đa số trẻ giờ được cho học nên đừng manh động,5,1755235410,con tôi hai đứa con gái đều học võ để tự vệ đa số trẻ giờ được cho học nên đừng manh động
7538676186705789714,7538645226533948688,Tin Học Thành Công,coi phim nhật quá 180p,1,1755234838,coi phim nhật quá 180p
7538677945155617556,7538645226533948688,Đăng Hải 1989❤️,Xem phim nhật nhiều quá ấy mà,2,1755235249,xem phim nhật nhiều quá ấy mà
7538647837187212040,7538645226533948688,Kecođơn 1983,dạo này luật pháp làm căng quá mà mn không sợ hay sao,2,1755228237,dạo này luật pháp làm căng quá mà mn không sợ hay sao
7538683872407749384,7538645226533948688,Không Tồn Tại,coi phim Nhật chi vậy...,4,1755236630,coi phim nhật chi vậy...
7538746897236214546,7538645226533948688,Đức đầu chọc,Parky thì ghê rồi,2,1755251300,parky thì ghê rồi
7538667117199115015,7538645226533948688,Linh nhân kiệt,Kaka. Nghĩ bên nhật à😂,7,1755232726,kaka. nghĩ bên nhật à
7538672244957184769,7538645226533948688,Đức Sigma,kịch bản đẹp tiếc là ko xảy. ra,3,1755233919,kịch bản đẹp tiếc là ko xảy. ra
7538670446007616272,7538645226533948688,60km/h 🐧,VN chứ có p nhật đâu 3 🤣,1,1755233507,vn chứ có p nhật đâu 3
7538768403705512721,7538645226533948688,Trần Hậu,Ôi gửi nhầm,1,1755256309,ôi gửi nhầm
7538649659087864594,7538645226533948688,XemNgayMeoHay,Thấy gái xinh nên không làm chủ được hành động,0,1755228666,thấy gái xinh nên không làm chủ được hành động
7538658734281917202,7538645226533948688,camnamquay@gmail.com,😅 xưa đi bus tôi cũng bị...nhớ dùng dầu gội mùi hãng Gille.tte .Mà tôi có dám làm to chuyện đâu...🤣🤣🤣🤣🤣..nam nhân cũng khổ lắm.,1,1755230771,xưa đi bus tôi cũng bị...nhớ dùng dầu gội mùi hãng gille.tte .mà tôi có dám làm to chuyện đâu.....nam nhân cũng khổ lắm.
7538663614677304072,7538645226533948688,Ông Chú Vui Tính U30 🥰,xem phim nhật nhiều quá 😌,1,1755231905,xem phim nhật nhiều quá
7538714800349053704,7538645226533948688,.,ơ nhầm nhầm,1,1755243826,ơ nhầm nhầm
7538654969404195591,7538645226533948688,Tuyên lê,chắc nhầm đang Việt Nam tưởng đâu bên Nhật😁😁,1,1755229897,chắc nhầm đang việt nam tưởng đâu bên nhật
7538671190559179528,7538645226533948688,"tele""lyly9xx""toàn videos hót",nhật ký t có,0,1755233669,nhật ký t có
7538667321330909960,7538645226533948688,hướnghaihào,ko có 500k hả e,0,1755232773,ko có 500k hả e
7538661152777257746,7538645226533948688,Hoàng Tuấn,"đưa 1 số nhân chứng về làm việc, người ta cũng rãnh lắm",0,1755231340,"đưa 1 số nhân chứng về làm việc, người ta cũng rãnh lắm"
7538659161397166865,7538645226533948688,Lẵng lẽ nhìn em,xem phim nhiều quá 😂,0,1755230875,xem phim nhiều quá
7538674835515245320,7538645226533948688,Lê Hoàng,Xem phim nhật quá 190 r kkk,0,1755234523,xem phim nhật quá 190 r kkk
7539049948089926407,7538645226533948688,Lâm kiệt,Chắc kiềm không đc rồi 😆,0,1755321861,chắc kiềm không đc rồi
7538721793483768583,7538645226533948688,Do,ông đó chc Xem phim Nhật quá 180p òi,0,1755245460,ông đó chc xem phim nhật quá 180p òi
7538679476348814087,7538645226533948688,Parameshvaravarman,chắc cũng vì hoàn cảnh thôi 😔,0,1755235599,chắc cũng vì hoàn cảnh thôi
7538746174368744199,7538645226533948688,Thiên Ân,bro thực sự nghĩ mik là main trg bộ phim nhật,0,1755251136,bro thực sự nghĩ mik là main trg bộ phim nhật
7538651525238555410,7538645226533948688,Ngôi Nhà Xanh GLC,đấy . bắt đầu rồi đấy 😳😳,0,1755229095,đấy . bắt đầu rồi đấy
7538748285100507922,7538645226533948688,tin tôi làm dog,coi phim siếc thú Nhật nhiều quá mà:)),0,1755251621,coi phim siếc thú nhật nhiều quá mà:))
7538661718315795208,7538645226533948688,Thái,chỉ chờ ae gọi tên B Thái.,0,1755231468,chỉ chờ ae gọi tên b thái.
7538660100861379345,7538645226533948688,Tiến Lê Hữu,kkk tuổi 35 mà,0,1755231095,kkk tuổi 35 mà
7538805243951399688,7538645226533948688,lâm,xem quá 180 phút,0,1755264884,xem quá 180 phút
7538668623734784776,7538645226533948688,FPT X FLASH⚡,xem phim sẽ nhiều quá,0,1755233081,xem phim sẽ nhiều quá
7538681292751209234,7538645226533948688,Thích Cà Phê ko mê trà,"Ngưỡng mộ cô gái, làm tốt lắm cô gái❤️❤️❤️",0,1755236029,"ngưỡng mộ cô gái, làm tốt lắm cô gái"
7538662604484100865,7538645226533948688,Huỳnh,"công lý giờ mất cân bằng nhỉ, sao lại thế nhỉ, um nói thế thôi chứ k nên dính vào công lý, ra sao thì rất chi là nhứt đầu😂😂😂",0,1755231681,"công lý giờ mất cân bằng nhỉ, sao lại thế nhỉ, um nói thế thôi chứ k nên dính vào công lý, ra sao thì rất chi là nhứt đầu"
7538683116475712263,7538645226533948688,🗿🗿🗿🗿🗿,xem phim nhật quá nhiều:,0,1755236450,xem phim nhật quá nhiều:
7538650336535610128,7538645226533948688,Trần Nghĩa ✅,luyện phim nhật quá rồi,0,1755228821,luyện phim nhật quá rồi
7538723600665510677,7538645226533948688,👾,ăn sáng kiểu Pháp,0,1755245875,ăn sáng kiểu pháp
7538762178984788756,7538645226533948688,Thiện,@@k.anhh🐋 sợ chưa,0,1755254858,sợ chưa
7538663207213810440,7538645226533948688,???,t tưởng câu chuyện liên quân nữa chứ 🤡,2,1755231818,t tưởng câu chuyện liên quân nữa chứ
7538660773330961160,7538645226533948688,toàn chuyên sản xuất bội gà,chắc xem phim nhật quá 181p😂😂😂,0,1755231249,chắc xem phim nhật quá 181p
7538671459775300370,7538645226533948688,anime love🥰🥰❤️❤️,Namkiki bản chất không giấu vào đâu được😂😂😂😂,2,1755233737,namkiki bản chất không giấu vào đâu được
7538718626863743752,7538645226533948688,thuận,@NTT🤫(Bé Mèo)🍀coi phim nhật quá nhiều và ảo tưởng 🤣,1,1755244722,(bé mèo)coi phim nhật quá nhiều và ảo tưởng
7538651016460911381,7538645226533948688,Zing 👀,Nên công bố thông tin danh tính hình ảnh để gia đình và dòng họ hảnh diện về anh ấy 🤔🤔🤔🤔,2,1755228978,nên công bố thông tin danh tính hình ảnh để gia đình và dòng họ hảnh diện về anh ấy
7538654443085857544,7538645226533948688,Trung Kiên 😍,C ơi là C bật ctr shift n hời nhiều r đó🤣🤣🤣,1,1755229773,c ơi là c bật ctr shift n hời nhiều r đó
7538747673647842066,7538645226533948688,kha,hảo namkyky 🤡,0,1755251480,hảo namkyky
7538679117068698376,7538645226533948688,Nguyễn Văn Liệu,"nguyên nhân là do trong người chị kia có con dán, anh kia chỉ làm ơn bắt hộ thôi nhé",0,1755235517,"nguyên nhân là do trong người chị kia có con dán, anh kia chỉ làm ơn bắt hộ thôi nhé"
7538673279902728978,7538645226533948688,Phướcnefk,mấy cái này không làm căn thì mốt mấy thằng biến thái nó mạnh động hơn,0,1755234160,mấy cái này không làm căn thì mốt mấy thằng biến thái nó mạnh động hơn
7538662504688386834,7538645226533948688,Nguyễn Thẩm,nó đang nghĩ ủa trên phim nó cũng làm như này mà ta . mấy cô kia chịu ngây ấy mà này kì vậy 🤣🤣,0,1755231769,nó đang nghĩ ủa trên phim nó cũng làm như này mà ta . mấy cô kia chịu ngây ấy mà này kì vậy
7538733441246233365,7538645226533948688,bulking đến ngưỡng chubby,ở đây là vùng không thể chạm vào,0,1755248169,ở đây là vùng không thể chạm vào
7538701451020174087,7538645226533948688,bắp k16 ☃️☃️☃️,"mặc quần ngắn tít thế kia
tôi cũng muốn xàm chứ nói j 🤣🤣🤣",0,1755240717,mặc quần ngắn tít thế kia tôi cũng muốn xàm chứ nói j
7538666046333797137,7538645226533948688,Hùng Kenllyr_74🇻🇳,Ko nhu nhật bỏm dc đâu😂😂😂,0,1755232478,ko nhu nhật bỏm dc đâu
7538664562229445396,7538645226533948688,Phạm Văn Dũng,Ăn mặc như thế thì n chẳng gợi dục lên,0,1755232128,ăn mặc như thế thì n chẳng gợi dục lên
7538669620111344391,7538645226533948688,Con sâu đang ở đâu 😉,này thì JAV 😅,0,1755233306,này thì jav
7538664138269885202,7538645226533948688,conareDo store,có vả lắm thì bỏ 500k đi muốn chùa thì thế thôi 🤣🤣🤣🤣,0,1755232034,có vả lắm thì bỏ 500k đi muốn chùa thì thế thôi
7538694998742467336,7538645226533948688,Kamishiro,"đời người có bao nhiêu, phải biết tranh thủ cơ hội
hiếm lắm mới được ngồi cạnh gái 😤",0,1755239215,"đời người có bao nhiêu, phải biết tranh thủ cơ hội hiếm lắm mới được ngồi cạnh gái"
7538662373403804424,7538645226533948688,Anh Chu,nhiễm văn hoá Nhật chứ VN trước giờ ko dám sàm sỡ ở chỗ công cộng,0,1755231623,nhiễm văn hoá nhật chứ vn trước giờ ko dám sàm sỡ ở chỗ công cộng
7538651640796414740,7538645226533948688,Nguyễn Minh Thiện,đụng nhầm ổ kiến lửa rồi.,0,1755229126,đụng nhầm ổ kiến lửa rồi.
7538693780012368648,7538645226533948688,Nhân vật Phụ,Xem sẽ quá 180p,0,1755238936,xem sẽ quá 180p
7539034991943533330,7538645226533948688,NEF丶Tiến-TVT,Mới mở mà yêu râu xanh đã xậm nhập r,0,1755318378,mới mở mà yêu râu xanh đã xậm nhập r
7538758365628498695,7538645226533948688,Moonchan:3,bà nhihonghot010 có cờ líp gốc,0,1755253969,bà nhihonghot010 có cờ líp gốc
7538692085261042439,7538645226533948688,QuocBao☄️,nắm tay thì nắm đi còn làm quá,0,1755238538,nắm tay thì nắm đi còn làm quá
7538690241399178005,7538645226533948688,Họ Trần,chuyên tàu định mệnh 🤣🤣,0,1755238111,chuyên tàu định mệnh
7538659569606673159,7538645226533948688,Huu Nghia,Tụi nó ăn mặt v hèn gì tụi nó đi tò hết,0,1755230968,tụi nó ăn mặt v hèn gì tụi nó đi tò hết
7538688683252171528,7538645226533948688,Kim Hoàng,sợ nhất là gặp những thằng biến thái này ạ nhe phụ nữ khi gặp nên la lên chứ mắc cỡ là hại bản thân mình ạ,0,1755237744,sợ nhất là gặp những thằng biến thái này ạ nhe phụ nữ khi gặp nên la lên chứ mắc cỡ là hại bản thân mình ạ
7538656593996677906,7538645226533948688,Thích Đủ Thứ,200k,0,1755230282,200k
7538653506761458450,7538645226533948688,Nguyen🐞,ảo phim à🥰,0,1755229555,ảo phim à
7538683018334438160,7538645226533948688,"""Cậu Ba"" 🐎",có 500 là có gái đẹp rồi,0,1755236702,có 500 là có gái đẹp rồi
7538722588557132551,7538645226533948688,Chú bán cà phê thân thiện☕️,Xem AV quá 180p,0,1755245640,xem av quá 180p
7538681374350246664,7538645226533948688,ngtanphat,chuyến này mềm người🔥,0,1755236042,chuyến này mềm người
7555087517906420487,7538681293203049748,Linh linhs 24,On,0,1759055900,on
7538948980622885640,7538681293203049748,gái độc thân 😘,chanh chanh,2,1755298711,chanh chanh
7539700870058656533,7538681293203049748,loan bé 😞,chanh,1,1755473428,chanh
7538756661206713096,7538709535360290049,Nguyễn tùng,trước công bệnh viện hay sao ấy bác sĩ chạy ra quá tr..nếu vậy thật là mai mắn,6,1755253575,trước công bệnh viện hay sao ấy bác sĩ chạy ra quá tr..nếu vậy thật là mai mắn
7538765652372308757,7538709535360290049,꧁༺Luộc Nhừ Như Hầm༻꧂,bac sĩ ở sẵn đay hay sao mà chạy ra nhanh dữ vay,0,1755255667,bac sĩ ở sẵn đay hay sao mà chạy ra nhanh dữ vay
7539860947100844807,7538709535360290049,Huynh Thanh Hoang,Thấy bên @79 CLUB đang có quả tân thũ 79 cành kìa 😂 nhặt vội,6,1755510686,thấy bên nhặt vội
7538733513084814088,7538709535360290049,Trang Thị,a men,0,1755248181,a men
7538745891693183761,7538736985767202049,trương thuý,thấy tội người bị bắt,2,1755251069,thấy tội người bị bắt
7546897138275631890,7538736985767202049,Xem tranh,Chưa chết mà,0,1757148927,chưa chết mà
7539015989532394260,7538736985767202049,Ẩm Thực Bùi Gia,Ở thái bình còn nghe tiếng,0,1755313957,ở thái bình còn nghe tiếng
7538780509216752400,7538736985767202049,Khi Tương Lai Mơ Hồ,sao nhẹ tay vậy mấy anh 🙄,1,1755259126,sao nhẹ tay vậy mấy anh
7538780283631551248,7538736985767202049,Khi Tương Lai Mơ Hồ,dạo này lên mạng tháy quá nhiều vụ coooop quá....,1,1755259081,dạo này lên mạng tháy quá nhiều vụ coooop quá....
7546885124060414738,7538736985767202049,Anh Tuấn,ko làm mà muốn có ăn hả con,0,1757146127,ko làm mà muốn có ăn hả con
7547002817501545223,7538736985767202049,Letung111,May không chui đầu vào ghế đá thì song rồi,0,1757173530,may không chui đầu vào ghế đá thì song rồi
7546996582208258834,7538736985767202049,Bình an là đuoc 1979,ko thương tiết chúc nào cho vừa,0,1757172079,ko thương tiêt chúc nao cho vưa
7546801351285867285,7538736985767202049,Lê Văn,ma mấy nhìn không ra,0,1757126857,ma mấy nhìn không ra
7538817555869664008,7538736985767202049,nguyncnhtintien,Bat dc là xong rồi,0,1755267754,bat dc là xong rồi
7546993427888685832,7538736985767202049,Tiến lên,Nhìn tướng mấy anh bắt chuyện Ngiệp khong phải dân,0,1757171341,nhìn tướng mấy anh bắt chuyện ngiệp khong phải dân
7546821684913947399,7538736985767202049,Nguyen Thi,Có đói đến máy . Cũng không bao giờ đi ăn cướp ăn trộm,0,1757131357,có đói đến máy . cũng không bao giờ đi ăn cướp ăn trộm
7545143809891451655,7538746083271281927,doge,"đố ai đếm được lá rừng
đố ai đếm được mấy tầng trời cao
đố ai đếm đủ vì sao
đố ai đếm được công lao Bác Hồ.",1308,1756740697,đố ai đếm được lá rừng đố ai đếm được mấy tầng trời cao đố ai đếm đủ vì sao đố ai đếm được công lao bác hồ.
7541556055349347093,7538746083271281927,Cheer up38🇻🇳,Đời đời nhớ ơn Bác,1742,1755905371,đời đời nhớ ơn bác
7545111755727913735,7538746083271281927,Đại dương bao la,Cứ thấy hình ảnh bác trên phim tài lệu la mình lại chảy nước mắt,1364,1756733233,cứ thấy hình ảnh bác trên phim tài lệu la mình lại chảy nước mắt
7541497974733030145,7538746083271281927,anhhanhh2020,"Từ bỏ. Bác đã là đứa trẻ đặc biệt, nhìn thấu vấn đề. Khâm phục và rất rất kính trọng Bác. Yêu Bác",700,1755891850,"từ bỏ. bác đã là đứa trẻ đặc biệt, nhìn thấu vấn đề. khâm phục và rất rất kính trọng bác. yêu bác"
7544717143150772999,7538746083271281927,chip✨💮🫠,luôn luôn bt ơn tổ quốc Việt Nam 🥰,317,1756641357,luôn luôn bt ơn tổ quốc việt nam
7542026537266348821,7538746083271281927,Quỳnh Anh@.@,Không có Bác Hồ thì thế hệ chúng ta có thời gian cầm điện thoại lướt không ạ! Con xin nguyện cả đời không bao giờ quên công ơn vĩ đại của Người!,23,1756014904,không có bác hồ thì thế hệ chúng ta có thời gian cầm điện thoại lướt không ạ! con xin nguyện cả đời không bao giờ quên công ơn vĩ đại của người!
7540677742775714567,7538746083271281927,nashi_huynh,BÁC luôn trong tim chúng cháu Tự hào dân tộc VIÊT NAM,20,1755700859,bác luôn trong tim chúng cháu tự hào dân tộc viêt nam
7541828678916408072,7538746083271281927,Quỳnh Nguyễn DaiLy,Về quê Bác nghe hướng dẫn viên nói .khóc như mưa Bác khổ quá luôn☹️,815,1755968834,về quê bác nghe hướng dẫn viên nói .khóc như mưa bác khổ quá luôn
7545563650162950919,7538746083271281927,Hương Hươngg,"Đố ai đếm được lá rừng.🇻🇳
Đố ai đếm được mấy tầng trời cao.
Đố ai đếm được vì sao .
Đố ai đếm được công lao BÁC HỒ🥰🥰♥️",5,1756838449,đố ai đếm được lá rừng. đố ai đếm được mấy tầng trời cao. đố ai đếm được vì sao . đố ai đếm được công lao bác hồ
7538828935967834897,7538746083271281927,Thuy Pham,"Bác của chúng tôi đấy. Tự hào dân tộc, biết ơn Bác cô cùng tận",191,1755270401,"bác của chúng tôi đấy. tự hào dân tộc, biết ơn bác cô cùng tận"
7542181910451143431,7538746083271281927,Richdad nguyen,Vi cha già của dân tộc! Đời đời nhớ ơn HỒ CHÍ MINH VĨ ĐẠI🥰🥰,13,1756051075,vi cha già của dân tộc! đời đời nhớ ơn hồ chí minh vĩ đại
7542545891706569480,7538746083271281927,henry cuong,Bác là thánh nhân của dân tộc Việt Nam . 👍,160,1756135819,bác là thánh nhân của dân tộc việt nam .
7550339351072736016,7538746083271281927,huong_nguyen3009,Đời đời nhớ ơn chủ tịch Hồ Chí Minh vĩ đại,9,1757950384,đời đời nhớ ơn chủ tịch hồ chí minh vĩ đại
7539181637923062529,7538746083271281927,Nguyễn Tâm,Hồ Chủ Tịch muôn năm Việt Nam muôn năm 🇻🇳🇻🇳🇻🇳🇻🇳🇻🇳❤️❤️❤️❤️❤️,96,1755352520,hồ chủ tịch muôn năm việt nam muôn năm
7539023601649140498,7538746083271281927,Kim Xuyen,cả thế giới đều ngưỡng mộ Bác 🥰,36,1755315730,cả thế giới đều ngưỡng mộ bác
7545120601838125831,7538746083271281927,Hawng Thoor,nghe búp sen xanh mà nước mắt như mưa,407,1756735291,nghe búp sen xanh mà nước mắt như mưa
7542299045562843911,7538746083271281927,Quỳn Quỳn,Người là Thánh mà ông trời cử xuống cứu nước cứu dân nhân❤️,67,1756078357,người là thánh mà ông trời cử xuống cứu nước cứu dân nhân
7545784252379267857,7538746083271281927,Hoa Vải  KIM SANG,Mỗi lần xem clip về Bác là nước mắt cứ rưng rưng.,10,1756889822,mỗi lần xem clip về bác là nước mắt cứ rưng rưng.
7542537914888012545,7538746083271281927,Hiệp khách,nge mà nước mắt không ngừng rơi .🥺🥺cảm ơn Bác Hồ kính yêu,19,1756133969,nge mà nước mắt không ngừng rơi .cảm ơn bác hồ kính yêu
7539137923917775634,7538746083271281927,Trần Quang Kiều,bác Hồ muôn năm người cha kính yêu của dân tộc,9,1755342341,bác hồ muôn năm người cha kính yêu của dân tộc
7540676609515291409,7538746083271281927,Giang Nghiem,"nghe kính phục bác quá, dành cả cuộc đời vì dân tộc",14,1755700593,"nghe kính phục bác quá, dành cả cuộc đời vì dân tộc"
