comment_id,video_id,username,comment_text,digg_count,create_time,clean_text
7327327999614993154,7326709132352900354,☘️Minh Huyền☘️,"Mình vừa xem đoạn clip hậu trường, phải công nhận bạn này làm rất giống như đang chạy, thêm nhạc hay nữa. Quá tuyệt 👍",1,1706026518,"mình vừa xem đoạn clip hậu trường, phải công nhận bạn này làm rất giống như đang chạy, thêm nhạc hay nữa. quá tuyệt"
7327172424582595336,7326709132352900354,july dương,cái ông chạy tưng tưng ngoài mưa phải ko,2,1705990283,cái ông chạy tưng tưng ngoài mưa phải ko
7326820069617861383,7326709132352900354,Nguyễn Quốc,Có ai xin tên bài hát với,2,1705908243,có ai xin tên bài hát với
7326900233798484737,7326709132352900354,ĐườngVănGiang👁️‍🗨️,Xem hậu trường r,2,1705926920,xem hậu trường r
7326875191635428097,7326709132352900354,tài 0 đợi xỉu,tua ngược 😌👍,3,1705921089,tua ngược
7327074414154433288,7326709132352900354,B.H❤️,Mượt thế nhờ,0,1705967485,mượt thế nhờ
7326918933856387848,7326709132352900354,모𝐍𝐚𝐦𝐐𝐮ố𝐜0505,"mới koi clip hậu trường chỉ có 1 chân là nhất lên chân còn lại chỉ nhón gót,tay chân đều hay thật😁",0,1705931264,"mới koi clip hậu trường chỉ có 1 chân là nhất lên chân còn lại chỉ nhón gót,tay chân đều hay thật"
7327056287987286785,7326709132352900354,K.O.I ☃️,trừ lương camaraman này ngen,0,1705963288,trừ lương camaraman này ngen
7326982856244364034,7326709132352900354,Đam mê DIY,này nhìn giống lag 🙂,0,1705946166,này nhìn giống lag
7326963058986124039,7326709132352900354,Linh gia dụng 93,Ping 9999,0,1705941537,ping 9999
7326961089001849602,7326709132352900354,Ở Đây Có Niềm Dzui,Giỏi thật,0,1705941090,giỏi thật
7326985093271143175,7326709132352900354,🇻🇳NAM CAO MOTOR🏁,nó chạy như trong Mơ tôi chạy . chạy hoài ko tới 🤣🤣,0,1705946667,nó chạy như trong mơ tôi chạy . chạy hoài ko tới
7327083227716797202,7326709132352900354,Tập Chơi Game,"trend 1 khứa chạy thật, 1 khứa chạy giả 🤣🤣",0,1705969534,"trend 1 khứa chạy thật, 1 khứa chạy giả"
7539208784582230815,7326709132352900354,msmuffet,Complete control! Amazing 👏 😊,0,1755358845,complete control! amazing
7326942489515410177,7326709132352900354,杨姐司机-Dương Thúy Nga,"chạy 1 chân
chân kia nhún Theo thôi Tui xem hậu trường rồi",0,1705936751,chạy 1 chân chân kia nhún theo thôi tui xem hậu trường rồi
7327636243692372738,7326709132352900354,Kiều Đoài,đỉnh thật,0,1706098289,đỉnh thật
7326935224296702727,7326709132352900354,Mạnh Nguyễn,Lại còn slowmotion 😬,0,1705935050,lại còn slowmotion
7349143977621766913,7326709132352900354,Phùng Cường,Chạy nhanh quá á,0,1711105944,chạy nhanh quá á
7326946469649613570,7326709132352900354,Nguyễn Út96,chân thật quá,0,1705937678,chân thật quá
7337616667553530625,7326709132352900354,LoveKaKa,Đứng lên cái máy chạy chứ gì 😂😂😂,0,1708422028,đứng lên cái máy chạy chứ gì
7533151718482985746,7326709132352900354,xiteendau,chạy tới tương lai mà chạy mãi chẳng tới,0,1753948573,chạy tới tương lai mà chạy mãi chẳng tới
7326939969799521029,7326709132352900354,Vũ Thanh Hùng87,Quá đẳng cấp 👍,0,1705936159,quá đẳng cấp
7326966738209112834,7326709132352900354,Nguyễn Thị Tú Quỳnh,"Đây là cách chạy trong mơ của tui, y chang😆",0,1705942405,"đây là cách chạy trong mơ của tui, y chang"
7327526963726844692,7326709132352900354,Tuấn Messi,chạy mệt k vậy,0,1706072961,chạy mệt k vậy
7327298807880188673,7326709132352900354,P.Thịnh,vừa xem hậu trường bên trên,0,1706019718,vừa xem hậu trường bên trên
7439946701056557832,7326709132352900354,😾nguyễn Huy😸,một chân ổng để im với nhúng một chân chạy giả á,0,1732247588,một chân ổng để im với nhúng một chân chạy giả á
7327050775660659457,7326709132352900354,Thanh Bình,có hậu trường ai cần tag ko,0,1705961997,có hậu trường ai cần tag ko
7326948931278979842,7326709132352900354,A chú Đà Lạt trường chay,nghệ hen,0,1705938262,nghệ hen
7327954760551809794,7326709132352900354,+Hà 宁宁+,Quả nick😁😁😁,0,1706172451,quả nick
7327085902744273671,7326709132352900354,Lily Cổ Trang VĩnhLong,chỗ cần quay thì k quay,0,1705970167,chỗ cần quay thì k quay
7326931384554488594,7326709132352900354,Gà Tre 93,bên trung cong an đi bộ đi tuần nhỉ,0,1705934159,bên trung cong an đi bộ đi tuần nhỉ
7327577856068911873,7326709132352900354,VA Tuấn,Lại hót trend,0,1706084692,lại hót trend
7326933141141111553,7326709132352900354,PHU KIỆN ĐIỆN THOẠI 96,"Công nhận ổng hay, toàn ra trend không luôn",0,1705934570,"công nhận ổng hay, toàn ra trend không luôn"
7326803375856304917,7326709132352900354,Anh cù lần,"1 chân nhón lên hạ xuống, chân còn lại làm động tác chạy thôi,tui xem clip gốc rồi",0,1705904547,"1 chân nhón lên hạ xuống, chân còn lại làm động tác chạy thôi,tui xem clip gốc rồi"
7326908834440725255,7326709132352900354,ta150600,Có ai giải thích cho mình tại sao lại chạy nv đc k ạ mình kb thật😅,0,1705928907,có ai giải thích cho mình tại sao lại chạy nv đc k ạ mình kb thật
7326935140110123777,7326709132352900354,KimChi(◕ᴗ◕✿),xem video này tui đã biết trước kq òi nhìn thấy có 1 bên chân nhất lên thoii à,0,1705935048,xem video này tui đã biết trước kq òi nhìn thấy có 1 bên chân nhất lên thoii à
7326987149923517186,7326709132352900354,thích uống Americano,t chỉ xin link mua áo blazer đó🥰,0,1705947167,t chỉ xin link mua áo blazer đó
7326934057760473862,7326709132352900354,Doquan Doan,cao thủ,0,1705934785,cao thủ
7326931582123475730,7326709132352900354,Johnny Lộc,Cái này trước có ông a võ boxing có làm rồi thì phải 😁 cũng lâu r,0,1705934206,cái này trước có ông a võ boxing có làm rồi thì phải cũng lâu r
7327661395150455554,7326709132352900354,𝐓ʏ́ 𝐍𝐡ỏ,nhìn cứ tưởng ông minh cường đi lạc qua đây chứ🤧,0,1706104137,nhìn cứ tưởng ông minh cường đi lạc qua đây chứ
7326933127946732306,7326709132352900354,Thịn Thịn,Thêm một trend khó,0,1705934566,thêm một trend khó
7347556163120399112,7326709132352900354,tình,độc lạ đẹp,0,1710736240,độc lạ đẹp
7347081752761123585,7326709132352900354,Minh13,Đỉnh quá,0,1710625815,đỉnh quá
7327086294978708244,7326709132352900354,TrungThu Quán,nhớ khứa áo xanh 😮‍💨😮‍💨😮‍💨😮‍💨😮‍💨😮‍💨,0,1705970785,nhớ khứa áo xanh
7327688404652294920,7327635949616254210,Lucyyy,Mình cực thích ăn lòng. Nhưng mình sợ giun sán nên hạn chế ăn ý 😅,1980,1706110417,mình cực thích ăn lòng. nhưng mình sợ giun sán nên hạn chế ăn ý
7327983297261552392,7327635949616254210,DzuNguyen,mình ăn đc lòng nhưng mình lại thích nhìn bạn đeo kính chuppy cầm miếng lòng ăn,1090,1706179077,mình ăn đc lòng nhưng mình lại thích nhìn bạn đeo kính chuppy cầm miếng lòng ăn
7328008178138317586,7327635949616254210,Bố cu Tin,"ko biêt mn ntn. nhưng riêng t mà lòng tiết kiểu đặc tiết, lèo tèo tí gia vị ntn thì 1 điểm về chỗ,lòng p có rau dăm,húng,hành,đỗ tương rang, cuống họn",501,1706184873,"ko biêt mn ntn. nhưng riêng t mà lòng tiết kiểu đặc tiết, lèo tèo tí gia vị ntn thì 1 điểm về chỗ,lòng p có rau dăm,húng,hành,đỗ tương rang, cuống họn"
7327747731131581191,7327635949616254210,Leo đi show (MC Leo),"Lòng đêm rất thi thoảng mới ăn thôi mng nhé, vì lòng nhiều protein, đạm ý, nên ăn đêm ko tiêu dc gây ảnh hưởng hệ tiêu hoá, nhất là ăn sau 10h tối. Có ăn thì ăn sớm nhậu tốt hơn",120,1706124238,"lòng đêm rất thi thoảng mới ăn thôi mng nhé, vì lòng nhiều protein, đạm ý, nên ăn đêm ko tiêu dc gây ảnh hưởng hệ tiêu hoá, nhất là ăn sau 10h tối. có ăn thì ăn sớm nhậu tốt hơn"
7328441759264899847,7327635949616254210,Bông Bé Bỏng,tui đu 2 ng hơn 500k nhé. chứ. k quá giá sv đâu nha,47,1706285821,tui đu 2 ng hơn 500k nhé. chứ. k quá giá sv đâu nha
7327641005242008338,7327635949616254210,Trần Hoàng,Nhìn quả rồi cắn ngập mồm thấy uy tín rồi😂,756,1706099382,nhìn quả rồi cắn ngập mồm thấy uy tín rồi
7327961238532080392,7327635949616254210,Chiếc Ảnh Cũ 📸,"Ai bị mỡ trong máu hạn chế ăn nội tạng như lòng nha, em khám bs bảo vậy 😅 bớt ts nữa 😂",53,1706173942,"ai bị mỡ trong máu hạn chế ăn nội tạng như lòng nha, em khám bs bảo vậy bớt ts nữa"
7338397914785891074,7327635949616254210,😶‍🌫️Linĥ🐷,Dồi kia mình nhìn không ngon toàn thấy tiết không . Mình ăn 2 lần 1 quán trên Thái Nguyên ngon k quên đc luôn.6h sáng ra hết chỗ ngồi,17,1708603929,dồi kia mình nhìn không ngon toàn thấy tiết không . mình ăn 2 lần 1 quán trên thái nguyên ngon k quên đc luôn.6h sáng ra hết chỗ ngồi
7329505287331644162,7327635949616254210,Vi thị thu thuý bánh bèo,Lòng nhân có mỗi tiết vs mỡ nhìn đã ngấy rồi😂,25,1706533445,lòng nhân có mỗi tiết vs mỡ nhìn đã ngấy rồi
7336951255375872775,7327635949616254210,Thái vũ,Tóm lại họ trả bn để rivew vậy 🤣🤣,122,1708267090,tóm lại họ trả bn để rivew vậy
7327673173443937026,7327635949616254210,napjjk0297,"Mở muộn nên cái giờ ối dồi ôi thèm ăn mà vẫn được đáp ứng, nice từ chủ đến nhân viên, đồ thì ngon, giá vừa túi tiền nữa. Mình và anh xã mình đều mê 🥰",29,1706106883,"mở muộn nên cái giờ ối dồi ôi thèm ăn mà vẫn được đáp ứng, nice từ chủ đến nhân viên, đồ thì ngon, giá vừa túi tiền nữa. mình và anh xã mình đều mê"
7327663225351865089,7327635949616254210,trongnghia1310000,mình cực thích ăn lòng nhưng khu mình ở thì chả có ai bán:(( miền tây ngta ít ăn lòng hay s í,142,1706104563,mình cực thích ăn lòng nhưng khu mình ở thì chả có ai bán:(( miền tây ngta ít ăn lòng hay s í
7327674696086012673,7327635949616254210,Matrioshka,"Nhìn cái dồi mướt như thạch cũng rất muốn đc đi ăn thử, nhưng vẫn phải có mỡ và rau, chứ dồi cứ bóp nát ra rồi luộc thì ko thích lắm, ăn cứ bã bã",47,1706107239,"nhìn cái dồi mướt như thạch cũng rất muốn đc đi ăn thử, nhưng vẫn phải có mỡ và rau, chứ dồi cứ bóp nát ra rồi luộc thì ko thích lắm, ăn cứ bã bã"
7342507159219864338,7327635949616254210,Trịnh Huy Hoàn240984,Số 6 Ngõ 125 Nguyễn Ngọc Vũ👍 Quán Lòng Mình Ăn Quá Nhon Luôn❤️,9,1709560677,số 6 ngõ 125 nguyễn ngọc vũ quán lòng mình ăn quá nhon luôn
7337545492245005058,7327635949616254210,Pablo Aimar,Thiếu sương sông.hành lá.mỡ lá.rau ngổ.băm vào.đó là vị ngon nhất của lòng,21,1708405463,thiếu sương sông.hành lá.mỡ lá.rau ngổ.băm vào.đó là vị ngon nhất của lòng
7327683962171212552,7327635949616254210,Gắt_😡😡😡,"Trời thì lạnh thể xác thì ở trong chăn còn tâm hồn thì bánh mỳ chảo, mỳ cay, cháo lòng…..😭😭😭😭",28,1706109382,"trời thì lạnh thể xác thì ở trong chăn còn tâm hồn thì bánh mỳ chảo, mỳ cay, cháo lòng.."
7327687391160828673,7327635949616254210,Uybeo,"10h30 tối ,nằm đắp chăn xem video 😁",6,1706110185,"10h30 tối ,nằm đắp chăn xem video"
7329522713247613704,7327635949616254210,Vũ Phóng (Chè Tô 230),"Ăn ở lòng Chát đc 1 nửa chỗ này, 3 thằng ăn hết hơn 1tr 😂",6,1706537498,"ăn ở lòng chát đc 1 nửa chỗ này, 3 thằng ăn hết hơn 1tr"
7327688185483838209,7327635949616254210,Vân Vân,nghiện lòng nhưng colesteron cao😂,5,1706110381,nghiện lòng nhưng colesteron cao
7339502711464198919,7327635949616254210,tung.n2t,hết nc chấm luôn,1,1708861153,hết nc chấm luôn
7327690329031852802,7327635949616254210,Nguyễn Lực,quán này tr ở 1194 láng.quán ngon thật sự,52,1706110870,quán này tr ở 1194 láng.quán ngon thật sự
7327689911023256326,7327635949616254210,Hoàng Thùy Dương,Thích cái lòng già tiết nhiều như kia ghê. Tui nghĩ đến nc ngọt khi tui cắn luôn r á😂,13,1706110767,thích cái lòng già tiết nhiều như kia ghê. tui nghĩ đến nc ngọt khi tui cắn luôn r á
7338414046904894215,7327635949616254210,Mạnh Tùng,mình thích ăn lòng nhiều tiết như này vì nó mềm,5,1708607672,mình thích ăn lòng nhiều tiết như này vì nó mềm
7327697505319699218,7327635949616254210,Bầy bi sác đu đu 🇻🇳,SG có quán như vậy ko ạ 🥺 thèm online,14,1706112541,sg có quán như vậy ko ạ thèm online
7327702505957081857,7327635949616254210,Cường,Lòng quán 66A triều khúc bao ngon,19,1706113714,lòng quán 66a triều khúc bao ngon
7337425291243012865,7327635949616254210,Kẻ Cô Độc,pha bỏ miếng lòng vào miệng mà để huy quần bông thấy thì toang😁,6,1708377492,pha bỏ miếng lòng vào miệng mà để huy quần bông thấy thì toang
7327659079839646482,7327635949616254210,Meow,quán này rcm siu ngon ạ 🥹,11,1706103587,quán này rcm siu ngon ạ
7327691851308598018,7327635949616254210,Cửu Tam,gần 700 thì giá ok nhỉ,23,1706111225,gần 700 thì giá ok nhỉ
7327639497968698119,7327635949616254210,⚔️ Đ𝐚̣𝐢 𝐬𝐮̛ 𝐇𝐮𝐲𝐧𝐡 ⚔️,quán ở đâu đây b,11,1706099031,quán ở đâu đây b
7357301860955390727,7327635949616254210,Tính gà chọi (21 lục yên),Hết nước chấm,1,1713005338,hết nước chấm
7339607503342928641,7327635949616254210,Thông,Thiệt chứ H này 1h30 sáng đói bụng lướt tới cái clip này nằm nuốt nước bọt ực ực 😢😢😢,3,1708885566,thiệt chứ h này 1h30 sáng đói bụng lướt tới cái clip này nằm nuốt nước bọt ực ực
7357144218072498961,7327635949616254210,Mộc San,cho xin địa chỉ quán với bé ơi,1,1712968651,cho xin địa chỉ quán với bé ơi
7359106551442916103,7327635949616254210,Hải HL,"Ăn theo rv đây , tầm 200 1 người cả đồ uống mà mở đêm thì thế là ổn rồi",1,1713425523,"ăn theo rv đây , tầm 200 1 người cả đồ uống mà mở đêm thì thế là ổn rồi"
7356994509823247125,7327635949616254210,GIAM CAN CUNG PHUONG,Chủ quán xinh thế,1,1712933812,chủ quán xinh thế
7339858245206819586,7327635949616254210,Nguyễn,khiếp cầm cả cái khúc ruột gặm híc híc,2,1708943936,khiếp cầm cả cái khúc ruột gặm híc híc
7339878226757468936,7327635949616254210,T.D.TOAI,À hoá ra ăn mở buổi tối vì tầm này rồi nhặng đi ngủ hết rồi ko á mùi mắn tôm quá hấp dẫn:))). 😅,2,1708948577,à hoá ra ăn mở buổi tối vì tầm này rồi nhặng đi ngủ hết rồi ko á mùi mắn tôm quá hấp dẫn:))).
7339919443973718785,7327635949616254210,Trần Trung Kiên,long sao rua,1,1708958184,long sao rua
7339512334001996562,7327635949616254210,boom,Làm mét lòng 😂😂😂😂,1,1708863389,làm mét lòng
7339899506232951554,7327635949616254210,Diệu Cát,Mình xin thua,1,1708953545,mình xin thua
7339515066628604679,7327635949616254210,🥥,đang đói mà xem cái này 😂😂,1,1708864024,đang đói mà xem cái này
7339515830948070162,7327635949616254210,"Mình là Tuyến, Ông Bố Bỉm Sữa",Mình cũng ghiền nhưng gút không cho phép ăn nhiều 😂,1,1708864201,mình cũng ghiền nhưng gút không cho phép ăn nhiều
7339857685422441218,7327635949616254210,Phượng Đặng,Quán ở đâu vậy em,1,1708943806,quán ở đâu vậy em
7339754524020491010,7327635949616254210,traibnphni,có ship ko ạ,1,1708919799,có ship ko ạ
7339505354340369160,7327635949616254210,Nam Lang Thang 🥦🥦🥰,Địa chỉ ở đâu ạ,1,1708861763,địa chỉ ở đâu ạ
7339929014075278088,7327635949616254210,Meeee,Mk thích ăn những sợ ăn phải lòng làm Ko sạch,1,1708960403,mk thích ăn những sợ ăn phải lòng làm ko sạch
7343215933722739474,7327635949616254210,Mẹ Tôm Tép,Tui thèm quá trời .Vào nam mấy năm không được ăn lòng kiểu bắc rồi nhớ hương vị đấy quá,1,1709725701,tui thèm quá trời .vào nam mấy năm không được ăn lòng kiểu bắc rồi nhớ hương vị đấy quá
7339891792294445825,7327635949616254210,Tiểuu Huyềnn🇻🇳🇹🇼,Chỉ ăn lòng dồi tiết thôi😂 chứ lòng có dồi rau vs nhân ko ăn đc,1,1708951743,chỉ ăn lòng dồi tiết thôi chứ lòng có dồi rau vs nhân ko ăn đc
7339563388038939393,7327635949616254210,野比のび太-,Bạn về ở với mk hợp lý 😂😂,1,1708875283,bạn về ở với mk hợp lý
7339523367505036039,7327635949616254210,Khởi Nghiệp F&B,Mê cái cách bạn đeo kính cầm và ngậm cắn đoạn lòng,1,1708865958,mê cái cách bạn đeo kính cầm và ngậm cắn đoạn lòng
7339917597859480327,7327635949616254210,𓇼 ⋆｡˚ Bun ᶻ 𝗓 𐰁 .ᐟ,Quán có mắm tôm k bạn nhờ?,2,1708957747,quán có mắm tôm k bạn nhờ?
7357037091539518215,7327635949616254210,TRANG Bong,Thôi nói thật trải nghiệm của mình ăn theo rv đây. Lòng quán đưa lên vẫn còn có miếng cắn lạnh vì đe tủ. K dc nóng hôi hổi đâu,2,1712943693,thôi nói thật trải nghiệm của mình ăn theo rv đây. lòng quán đưa lên vẫn còn có miếng cắn lạnh vì đe tủ. k dc nóng hôi hổi đâu
7339870236660122386,7327635949616254210,user280990940,Cháo lòng bắc.ngon lắm.cháo màu cánh gián.dồi thêm 1xị rượu nếp.là ok,1,1708946724,cháo lòng bắc.ngon lắm.cháo màu cánh gián.dồi thêm 1xị rượu nếp.là ok
7342866489323815687,7327635949616254210,Nostalgia 💙,ko hiểu sao chỉ ngoài bắc mới có quán lòng còn trong trung hay nam ko có toàn phải tự làm 😅,1,1709644336,ko hiểu sao chỉ ngoài bắc mới có quán lòng còn trong trung hay nam ko có toàn phải tự làm
7342522737271866132,7327635949616254210,Khanh duy,quán ở đâu vậy bạn,1,1709564374,quán ở đâu vậy bạn
7341809585005101842,7327635949616254210,phương Linh👾,ngon hết nước chấm... và phải ăn nóng😊,0,1709401199,ngon hết nước chấm... và phải ăn nóng
7341824599845569281,7327635949616254210,Mây ☁️,Phải qua đây ăn ms đc😭😭,0,1709401766,phải qua đây ăn ms đc
7342264991855723271,7327635949616254210,phụ nữ thời hiện đại,Ăn lòng sáng uống rượu mới ngon,0,1709504330,ăn lòng sáng uống rượu mới ngon
7341743840095519489,7327635949616254210,Lion,Xem mà nuốt nước bọt ừng ực,0,1709382963,xem mà nuốt nước bọt ừng ực
7350327146433725186,7327635949616254210,N.N.T,Thành dồi mà dày là ko ngon oy,0,1711381420,thành dồi mà dày là ko ngon oy
7357760708069950225,7327635949616254210,Bapkidshop,Rẻ thế nhỉ 😅,0,1713112179,rẻ thế nhỉ
7342493358239515410,7327635949616254210,naml864,quá tuyệt vời lòng lợn tiết canh tuyệt vời,0,1709557462,quá tuyệt vời lòng lợn tiết canh tuyệt vời
7342817270970712834,7327635949616254210,Lynshop2503,Có bán tối ko ạ,0,1709632890,có bán tối ko ạ
7340642082259256072,7327635949616254210,nguyễn Hiền,xin địa chỉ quán,0,1709126432,xin địa chỉ quán
7342482126300955394,7327635949616254210,i sờ nguyên,mất kiểm soát tuyến nước miếng 🥰,0,1709554859,mất kiểm soát tuyến nước miếng
7357991695059075841,7327635949616254210,thích trồng cây 93,Thích dồi mà nghĩ chuyện lên size thì thôi bỏ qua kkk,0,1713165954,thích dồi mà nghĩ chuyện lên size thì thôi bỏ qua kkk
7360244535300080391,7327635949616254210,vuonrausanthuongdk,Ko lòng vòng,0,1713690483,ko lòng vòng
7342484798165271303,7327635949616254210,Lặng,mk cũng thích ăn lòng nhưng mà k ăn nổi thịt mỡ trong lòng🥺,0,1709555473,mk cũng thích ăn lòng nhưng mà k ăn nổi thịt mỡ trong lòng
7342143720966849281,7327635949616254210,Tường thuật Game,"Ăn nguyên cây luôn, nể thật sự",0,1709476066,"ăn nguyên cây luôn, nể thật sự"
7342497792780911368,7327635949616254210,જ⁀➴ς๏ภg_tยคภ_69♡,Lòng trắng b nhỉ .,0,1709558495,lòng trắng b nhỉ .
7356841549667369745,7327635949616254210,Minh Tú,hêt hồn .,0,1712898165,hêt hồn .
7355017695928173313,7327635949616254210,Trường liên 2012,E đã thấy sán trong lòng chưa. Đảm bảo e thấy nó e bỏ luôn,0,1712473519,e đã thấy sán trong lòng chưa. đảm bảo e thấy nó e bỏ luôn
7343168009110733573,7327635949616254210,lng.vn.tun56,Mk ăn bữa 30k,0,1709714556,mk ăn bữa 30k
7342274606222344967,7327635949616254210,Yến nè✌🏻🤡,Đời khổ nhất gặp đúng gu mà k ăn dk t thèm mà bị bệnh kiêng k ăn dk😩,0,1709506547,đời khổ nhất gặp đúng gu mà k ăn dk t thèm mà bị bệnh kiêng k ăn dk
7359615975350649618,7327635949616254210,Linh mini mart,11h30 đêm vũ trụ gửi đến tôi vd này,0,1713544134,11h30 đêm vũ trụ gửi đến tôi vd này
7342824789331067649,7327635949616254210,Tôi Ơi Có Ổn Không!!!,Có bán tối không ạ,0,1709634635,có bán tối không ạ
7342914032561505026,7327635949616254210,Nhà Có Em Bé,"Mình cũng thích ăn lắm, thèm",0,1709655418,"mình cũng thích ăn lắm, thèm"
7342464242182931207,7327635949616254210,Hà Quyên,"mình cũng thích, rất rất thích ăn và cuối cùng mình bị gout rồi 😵‍💫😵‍💫😵‍💫",0,1709550687,"mình cũng thích, rất rất thích ăn và cuối cùng mình bị gout rồi"
7342366895204942600,7327635949616254210,Thanh tran,Sài gòn ko có đâu,0,1709528020,sài gòn ko có đâu
7357288747161404168,7327635949616254210,Đưc minh,quán lòng đêm ở đâu đấy,0,1713002283,quán lòng đêm ở đâu đấy
7357552475971715847,7327635949616254210,meoaoma,Địa chỉ ở đâu e ?,0,1713063690,địa chỉ ở đâu e ?
7340251471697019666,7327635949616254210,Sắc Màu Cuộc Sống,Rẻ hơn lòng chát,0,1709035484,rẻ hơn lòng chát
7342471555056501512,7327635949616254210,Phương,Nhìn thèm qá.,0,1709552388,nhìn thèm qá.
7342477650004591367,7327635949616254210,Cương Trần,Ăn cả mét😂,0,1709553804,ăn cả mét
7342850285608305409,7327635949616254210,👑KING_Romantic🪽,làm sao có thể ăn hết đk vậy😳😳,0,1709640579,làm sao có thể ăn hết đk vậy
7339529856403538696,7327635949616254210,nhatnhoa,"mình cũng thích nữa, ở Tân An Long An chỗ nào bán nhỉ?",0,1708867470,"mình cũng thích nữa, ở tân an long an chỗ nào bán nhỉ?"
7341760049415291655,7327635949616254210,Ngô Tỉnh,Cho mình xin đc,0,1709386726,cho mình xin đc
7357225305306399496,7327635949616254210,nhìn là yêu đấy.🥰,chỗ tôi ban có 70k 1 kg .mua về ca nhà ăn không hết,0,1712987512,chỗ tôi ban có 70k 1 kg .mua về ca nhà ăn không hết
7339572381655106306,7327635949616254210,khuongnguyen_nvk,Nhức nách,0,1708877388,nhức nách
7356400039897563920,7327635949616254210,JIMMEAL STORE2807,Nhìn hấp dẫn quá ạ,0,1712795380,nhìn hấp dẫn quá ạ
7357097041045488400,7327635949616254210,Hoàng Chung,"Thèm ăn lòng mà bị gan nhiễm mỡ , phải kiêng cay thế chứ nị :(",0,1712957699,"thèm ăn lòng mà bị gan nhiễm mỡ , phải kiêng cay thế chứ nị :("
7329519667557991176,7329473663445601554,Xoai_660,"Ủa sao giốg lá tía tô vậy 🥺 , hay tên khác nó là lá kim",171,1706536789,"ủa sao giốg lá tía tô vậy , hay tên khác nó là lá kim"
7329498121594438402,7329473663445601554,ka chu 💫,lá kim 🤣 đứa nào cứ bảo lá lốt 😀,70,1706531780,lá kim đứa nào cứ bảo lá lốt
7329532598085796615,7329473663445601554,username198371038,"Lá kim là rong biển ăn liền, kia là lá vừng hay lá mè :))",24,1706539801,"lá kim là rong biển ăn liền, kia là lá vừng hay lá mè :))"
7329466207819203335,7329473663445601554,_h.   🐝,xin giá Hd ơi 😂,5,1706526659,xin giá hd ơi
7329480511083938578,7329473663445601554,tính,phải tương đậu của Hàn mới hơn,5,1706527675,phải tương đậu của hàn mới hơn
7329522227456033554,7329473663445601554,bduongww,lá đấy có mùi vị gì vậy anh??,2,1706537389,lá đấy có mùi vị gì vậy anh??
7329477020332131079,7329473663445601554,dyoa2v8e7n1z,sớm nè anh🥰,4,1706526862,sớm nè anh
7329762163953779463,7329473663445601554,㊝ＢＡＯＯムＬＯＮＧＧ모😜,đc dùng thịt bốn chỉ ko anh,2,1706593255,đc dùng thịt bốn chỉ ko anh
7340302157327237906,7329473663445601554,Lê Hùng🇻🇳🇰🇷,Cái này là áp chảo 😹,2,1709047282,cái này là áp chảo
7329475215070446343,7329473663445601554,Rau thích ăn mèo bel,Đg đói mà lướt thấy💀,3,1706526442,đg đói mà lướt thấy
