comment_id,video_id,username,comment_text,digg_count,create_time,clean_text
7485235995865088776,7484250739519360263,số phân开开心心,nó ở trên đồi núi nắng nó ra phơi rồi hai vợ chồng nó quấn nhau chứ có gì mà lạ đây găp nhiều rồi nhé .,0,1742792331,nó ở trên đồi núi nắng nó ra phơi rồi hai vợ chồng nó quấn nhau chứ có gì mà lạ đây găp nhiều rồi nhé .
7486270997089600277,7484250739519360263,Chuche,Có tọc,0,1743033334,có tọc
7485360587284103943,7484250739519360263,Phạm luyến,xa xui,0,1742821339,xa xui
7484495591822525202,7484250739519360263,Được nhiên,2 con đang yêu nhau,0,1742619954,2 con đang yêu nhau
7485242916588733191,7484250739519360263,chupchup,nó cắn là chết lúc này nọc rắn cực độc,0,1742793946,nó cắn là chết lúc này nọc rắn cực độc
7559429177947489032,7484254231696772370,thamm04,Xịn vậy bà,0,1760066771,xịn vậy bà
7551247539921257224,7484254231696772370,Tiệm Nail Sau Nhà,Xinh quá ne,0,1758161838,xinh quá ne
7484300834382512904,7484254231696772370,theo lẽ phải,da mộc bị đẹp á,11,1742574596,da mộc bị đẹp á
7484824753900487432,7484254231696772370,thutuyets,M xin link áo nha,3,1742696587,m xin link áo nha
7484257296336323344,7484254231696772370,Mẹ ko cho để tóc dài 🥲,Xinh quá chuỵ ưi,1,1742564454,xinh quá chuỵ ưi
7484255895392813842,7484254231696772370,Ngọc ở Trung Quốc,Lên clip dạy mở góc mắt đi bà,0,1742564129,lên clip dạy mở góc mắt đi bà
7524598656709886728,7484254231696772370,linhniz_🎀🇻🇳,mặt mộc xinh vậy,1,1751957158,mặt mộc xinh vậy
7504562340017832722,7484254231696772370,Ngoc Kieu,làm roi mà khong có bồ để gửi🤡,0,1747292094,làm roi mà khong có bồ để gửi
7524266484123484949,7484254231696772370,Tuyên Hoàng,🥰ðẹp ghe,0,1751879820,ẹp ghe
7508732395588944648,7484254231696772370,Jinju,biến hình khét lẹt v bà,0,1748263002,biến hình khét lẹt v bà
7484654644737262354,7484254231696772370,Như Như,Mình xin info áo với ng đẹp 🥺,2,1742656972,mình xin info áo với ng đẹp
7505372390684246802,7484254231696772370,Đinh Tuyết Mai-463,❤️❤️❤️❤️❤️❤️❤️Đẹp quá nhiều ạ,0,1747480696,đẹp quá nhiều ạ
7484506314733142802,7484254231696772370,ngoc oanhh 💕🐇,xin inf màu chân mày ạaaaa,1,1742622451,xin inf màu chân mày ạaaaa
7489665604111319809,7484254231696772370,OKAY MAKE UP TWO,Xinh quá nàng ơiiii,0,1743823691,xinh quá nàng ơiiii
7489752413478454023,7484254231696772370,bellatruongcute,cho xinh màu môi,1,1743843888,cho xinh màu môi
7510963042692776722,7484254231696772370,hannaa nèee💞💥,có bồ đâu mà gửi,0,1748782367,có bồ đâu mà gửi
7509663565578502919,7484254231696772370,hà kẹo,Bà này không makeup cũng xinh,0,1748479809,bà này không makeup cũng xinh
7484580396497617672,7484254231696772370,Hà Linh,Xin in4 lens ng đẹp oii😭,1,1742639693,xin in4 lens ng đẹp oii
7504295164715598599,7484254231696772370,Yuumi,ê bà quay cam trước hay cam sau z,1,1747229886,ê bà quay cam trước hay cam sau z
7516418386521899784,7484254231696772370,｡:ﾟphw.ahn~ෆ~☆,sao mà đẹp zữ v chị,0,1750052537,sao mà đẹp zữ v chị
7496547512183538439,7484254231696772370,Tớ👈,nhìn như gái hàn luôn😳,0,1745425998,nhìn như gái hàn luôn
7487267700746797831,7484254231696772370,Tiệm bé mèo,Tha thiết xin link áo 😭,0,1743265371,tha thiết xin link áo
7484421374662968072,7484254231696772370,xoài chấm muối,sáng ra đã thấy người đẹp 🥱,0,1742602677,sáng ra đã thấy người đẹp
7486526610188583698,7484254231696772370,Quýt🍊,sao vẽ lông mày đỉnh zay xin tips,0,1743092827,sao vẽ lông mày đỉnh zay xin tips
7487142943385568008,7484254231696772370,Nga ☘️,Cho e hỏi má hônhgf gi ạ,0,1743236336,cho e hỏi má hônhgf gi ạ
7484606184261124872,7484254231696772370,thít michiliti,hong có bồ thì gửi ai ạ=)),0,1742645701,hong có bồ thì gửi ai ạ=))
7484862772120355592,7484254231696772370,𝓣𝓱𝓸𝓻𝓪 𐙚 ⋆˚.⋆,Mở mắt đúng cách 🫶🏻,0,1742705435,mở mắt đúng cách
7484262376628339457,7484254231696772370,99% bị đồn là les,in4 son ạ,0,1742565646,in4 son ạ
7502795278627128072,7484254231696772370,nhựahuyhoavietnhat,😳😁🥰tt nhé bạn 😃,0,1746880671,tt nhé bạn
7484907731292439304,7484254231696772370,NamiJournal,Lens mắt màu gì xinh vậy ạ,0,1742715902,lens mắt màu gì xinh vậy ạ
7484832425858089729,7484254231696772370,kati🧸,quay roi mà kh có bồ để gửi😔,0,1742698399,quay roi mà kh có bồ để gửi
7485247872544785159,7484254231696772370,Cô bé sâu răng🦷,sao nàng che khuyết điểm môi với lên màu môi đẹp dạ,0,1742795097,sao nàng che khuyết điểm môi với lên màu môi đẹp dạ
7486786067049513746,7484254231696772370,Ái Vân(수연),xinh xĩu😊,0,1743153243,xinh xĩu
7485343707743617810,7484254231696772370,Liuliu,Sao mấy bà make đỉnh dị,0,1742817407,sao mấy bà make đỉnh dị
7486910908183347969,7484254231696772370,My Vũ,Cho e xin in4 lens vứi ạ🥺,0,1743182300,cho e xin in4 lens vứi ạ
7487836635851162384,7484254231696772370,ChanChan Cosmetics,Xinh dị shop ui,0,1743397854,xinh dị shop ui
7500090315010310967,7484254231696772370,nào cosplay thì đổi tên,ko có bồ gửi cho bn thân đc hem,0,1746250917,ko có bồ gửi cho bn thân đc hem
7514917565862740744,7484254231696772370,Minsu 2004,Xinh quá chị oi 🥰,0,1749703105,xinh quá chị oi
7544281083576632071,7484254231696772370,Ngoan.Xinh.Êu,da mộc siêu đã un,0,1756539827,da mộc siêu đã un
7487430003970376449,7484254231696772370,myhah ✿,Chị ơi lens màu j v ạ,0,1743303173,chị ơi lens màu j v ạ
7485664347743847188,7485612643672165639,luanhi.ngtantu_0108,sát ck là như nào z,177,1742892075,sát ck là như nào z
7485747094751527697,7485612643672165639,Phlinh💫,Khổ vì tình😭,225,1742911350,khổ vì tình
7485717852173370130,7485612643672165639,MaiGioann,Ba phải là sao ta,205,1742904532,ba phải là sao ta
7485679598912979720,7485612643672165639,muaxuan2005,3 phải : phải hp/ phải giàu / phải có nhiều sức khỏe,119,1742895625,3 phải : phải hp/ phải giàu / phải có nhiều sức khỏe
7485977348078568209,7485612643672165639,Lê Trần Đức Thành ↙️↘️,trộm vía ko có cái nào,43,1742964979,trộm vía ko có cái nào
7560593296507601672,7485612643672165639,ᥫ᭡ṿợ~ʏêȗᥫ᭡,mỗi video 1 kiểu r tin ai,0,1760337810,mỗi video 1 kiểu r tin ai
7485722240433931026,7485612643672165639,Th🤍🐥,9 nè được cái giỏi tiêu tiền,8,1742905549,9 nè được cái giỏi tiêu tiền
7485772930535326472,7485612643672165639,💤,thế trái cằm thì sao:),7,1742917344,thế trái cằm thì sao:)
7485735375383511824,7485612643672165639,Mèo Bé 🤍,7.Ê đúng nha t yêu thg nào cũng khóc vì nó mấy lần 😭,10,1742908603,7.ê đúng nha t yêu thg nào cũng khóc vì nó mấy lần
7534538832898622226,7485612643672165639,💔,lấy ck giàu 😝,1,1754271542,lấy ck giàu
7485777816945197840,7485612643672165639,秋,5 nhiều tiền đâu hong thấy :))),8,1742918498,5 nhiều tiền đâu hong thấy :)))
7511234689379484432,7485612643672165639,kc.,"1,5",1,1748845622,"1,5"
7485762953683501832,7485612643672165639,☆°tn_dh°☆,số 1 nhg mẹ cho đi xóa mất tiu rồi hối hận ghê 😭😢😿,7,1742915024,số 1 nhg mẹ cho đi xóa mất tiu rồi hối hận ghê
7485656277536899858,7485612643672165639,Phương Thảo,Lấy ck giàu thật k ta 🤣,15,1742890190,lấy ck giàu thật k ta
7511069041189405447,7485612643672165639,Ngoc Tuyen,"1,2,6=))",1,1748807048,"1,2,6=))"
7496520566247097095,7485612643672165639,dầu hào maggi,"tui 5,6🥰🥰🥰",1,1745419722,"tui 5,6"
7486695568489415425,7485612643672165639,🦢,Dưới mắt bên trái gần giữa mũi thì sao ạ,1,1743132192,dưới mắt bên trái gần giữa mũi thì sao ạ
7504931709226992404,7485612643672165639,Linh 👩🏿‍🦰,Số 8 thay vì tinh tế có thể là kinh tế đc ko 🤣,1,1747378093,số 8 thay vì tinh tế có thể là kinh tế đc ko
7510583388148679431,7485612643672165639,Yun Chanthira,Nhiều tiền chưa thấy chỉ thấy tẩy 2lần rồi,1,1748693973,nhiều tiền chưa thấy chỉ thấy tẩy 2lần rồi
7511016180791116562,7485612643672165639,Thư nè,khổ vì tình nhiều tiền lấy chồng giàu =))),1,1748794739,khổ vì tình nhiều tiền lấy chồng giàu =)))
7511228442152518417,7485612643672165639,chulibi🐝,trái cằm là s,1,1748844165,trái cằm là s
7505304453852218119,7485612643672165639,Dự báo thời tiết 24/7,số 7 nên xóa ko ạ mik sợ ns mọc lại r để lại sẹo nữa,1,1747464882,số 7 nên xóa ko ạ mik sợ ns mọc lại r để lại sẹo nữa
7500210182926336775,7485612643672165639,Ngũ ngôn tứ tuyệt 𐤀,trái cằm thì sao,1,1746278780,trái cằm thì sao
7487632231541506824,7485612643672165639,Mẫn Châu,tui nằm trong mắt luôn,1,1743350247,tui nằm trong mắt luôn
7487050449716200200,7485612643672165639,edowagaconancute,lấy chồng giàu 😏,5,1743214793,lấy chồng giàu
7490068222260544272,7485612643672165639,baby iuu  💢❣👾☠🕸,6:)),1,1743917430,6:))
7488292473338577671,7485612643672165639,Hana Nek,Sao thấy kêu ở cánh mũi là mất lộc mà,1,1743503974,sao thấy kêu ở cánh mũi là mất lộc mà
7486718406318768914,7485612643672165639,""":(",1 và 7,1,1743137479,1 và 7
7487165103197373192,7485612643672165639,Bỏ Quên,2 nhưng ko 3 phải nhá.,1,1743241490,2 nhưng ko 3 phải nhá.
7530200882740019986,7485612643672165639,2th10🐣,Cái 6 bên trái thì sao 🤔,1,1753261526,cái 6 bên trái thì sao
7487573375344460551,7485612643672165639,♡lười♡,Đã khổ vì tình còn lấy Ck giàu..,1,1743336558,đã khổ vì tình còn lấy ck giàu..
7490161855148393224,7485612643672165639,gấu trúc🐼,tui số 4 nghĩa là j,1,1743939220,tui số 4 nghĩa là j
7487665137617568530,7485612643672165639,sữaa.,t ba phải hồi nào 😭,1,1743357908,t ba phải hồi nào
7486754555884225288,7485612643672165639,Bị sikibidi nhập,"1,6 re nha👍🏻",1,1743145901,"1,6 re nha"
7486777940761084679,7485612643672165639,@kieucute09,trên gò má trái thì sao,1,1743151351,trên gò má trái thì sao
7490492511611421458,7485612643672165639,Xoài chua🥭🥭,ê t có 2 nốt trên má lận là tính sát chồngx2 à,4,1744016211,ê t có 2 nốt trên má lận là tính sát chồngx2 à
7487060195672425223,7485612643672165639,Hết mê phim Trung đổi tên,"lấy chồng giàu,phúc khí🥰🥰🥰",1,1743217064,"lấy chồng giàu,phúc khí"
7496718019679601416,7485612643672165639,(;★CR7★;),"2,4,5,6🤣",1,1745465696,"2,4,5,6"
7487156044940264210,7485612643672165639,Mie.ngozz🎀,sát chồng là gì dợ,1,1743239385,sát chồng là gì dợ
7490503747211297543,7485612643672165639,ℂ𝕙𝕖𝕟𝕪𝕚𝕙𝕖𝕟𝕘ヅ,phúc khí là j mn tui ko hiểu,0,1744018823,phúc khí là j mn tui ko hiểu
7487442759223296784,7485612643672165639,ng_tuyet𐙚⋆.˚,số 2 nên xoá k ta,0,1743306154,số 2 nên xoá k ta
7487227952405431061,7485612643672165639,anhthucute🌷🌷,5 nhe,0,1743256117,5 nhe
7487408355217900296,7485612643672165639,Lilyofthevalley,Thế 5 vs 6 là vì sát ck mà có nhiều tiền à :))),0,1743298133,thế 5 vs 6 là vì sát ck mà có nhiều tiền à :)))
7487468752167322384,7485612643672165639,ᯓᡣ𐭩 mè mé đê!😝,tinh tế,0,1743312185,tinh tế
7491295801017893640,7485612643672165639,suniii😜,Lấy chồng giầu,0,1744203238,lấy chồng giầu
7493930935877649170,7485612643672165639,Nhỏ ơi,tui ở cánh mũi nta kêu xóa đi,0,1744816776,tui ở cánh mũi nta kêu xóa đi
7486759767433937672,7485612643672165639,...,dưới cằm thì sao ạ,0,1743147127,dưới cằm thì sao ạ
7486873545684697864,7485612643672165639,hôi 🙏 🗽⃢⃢🗿,k có thì s ạ,0,1743173606,k có thì s ạ
7487455990536700680,7485612643672165639,Nhi Ngao ngơ,chắc phải đi xóa r:))),0,1743309220,chắc phải đi xóa r:)))
7490227088164487954,7485612643672165639,liêu 😘,mik có ba nút rùi 235,0,1743954409,mik có ba nút rùi 235
7487119626511483649,7485612643672165639,ᴛʜᴀᴏɴɢᴜʏᴇɴᡣ𐭩𐙚,4 nè,0,1743230924,4 nè
7486754463690015509,7485612643672165639,mẫu đơn,tôi số 1.hai vc khổ kkkk🥰,0,1743145887,tôi số 1.hai vc khổ kkkk
7486728703469306631,7485612643672165639,Kem bautique,Khổ vì tình xóa 3 lần k hết😩,0,1743139877,khổ vì tình xóa 3 lần k hết
7487045639834993426,7485612643672165639,ok mà,kh có thì s ạa,0,1743213672,kh có thì s ạa
7487061785458164488,7485612643672165639,💤,ủa v trái cằm thì nn ạ?,0,1743217442,ủa v trái cằm thì nn ạ?
7487292002612495122,7485612643672165639,Jadoo 🐣,4 / 6/ 7 kkkk,0,1743271045,4 / 6/ 7 kkkk
7487135305482158855,7485612643672165639,👤,T s7 nhm cũng có 1 cái ở cằm nhm bên trái =)) nhm khổ vì tình thật,0,1743234554,t s7 nhm cũng có 1 cái ở cằm nhm bên trái =)) nhm khổ vì tình thật
7487265879249240839,7485612643672165639,khanhh nqocc💤💤,t có bị chỗ bên trái sóng mũi với 2 mí mắt:))),0,1743264952,t có bị chỗ bên trái sóng mũi với 2 mí mắt:)))
7490194814056301319,7485612643672165639,Phuong.thao1772,số 2 Ba phải là sao,0,1743946893,số 2 ba phải là sao
7487232733980246791,7485612643672165639,hhhhhhhhh,tao thấy 6,0,1743257233,tao thấy 6
7493425860709040904,7485612643672165639,2hawn,mai này lấy chồng giàu 🥵,0,1744699182,mai này lấy chồng giàu
7487298936341922568,7485612643672165639,tVyyy,tui có cái s2 nhưng tui k thích nó tí nào,0,1743272664,tui có cái s2 nhưng tui k thích nó tí nào
7489681447210976018,7485612643672165639,"Hờ Nga, ko cơn Ny,  😁😎",1 4 8☺️😅,0,1743827374,1 4 8
7487401168827187976,7485612643672165639,vi.,3 nè,0,1743296460,3 nè
7487538679084188424,7485612643672165639,hoanqvyy,sát chồng là gì??,0,1743328467,sát chồng là gì??
7486890887978140423,7485612643672165639,Lúa,1.2,0,1743177639,1.2
7490462389810643728,7485612643672165639,Dương Dương,số 1 mà lấy ck giàu mà là giàu tình cảm 🤣,0,1744009215,số 1 mà lấy ck giàu mà là giàu tình cảm
7487219211624039175,7485612643672165639,최승현  💤,"trên trán,trên mày",0,1743254090,"trên trán,trên mày"
7486889182254924551,7485612643672165639,Anti thế giới :)))),1.3,0,1743177240,1.3
7486845465071649544,7485612643672165639,⛅,"t thích cái thứ 6 á, nhìn ngầu ngầu đẹp gái",0,1743167069,"t thích cái thứ 6 á, nhìn ngầu ngầu đẹp gái"
7487211588924310273,7485612643672165639,Girl xì xì phố 💅💩💩,chắc mình t 9:)))),0,1743252312,chắc mình t 9:))))
7487256765207560977,7485612643672165639,",....🌊",4.6,0,1743262842,4.6
7491254917852594962,7485612643672165639,Matcha😋,1 mà s tuii lấy ck nghèo còn vũ phu nữa chứ😞,0,1744193716,1 mà s tuii lấy ck nghèo còn vũ phu nữa chứ
7487478918577554192,7485612643672165639,༘˚⋆ᴢᴍᴊ.ʏᴜᴀɴ ^ྀི,Ê t thảo mai chỗ nào 🤯,0,1743314562,ê t thảo mai chỗ nào
7487234880704955154,7485612643672165639,Thiên kim,tao số 7,0,1743257732,tao số 7
7487304114951799570,7485612643672165639,Di🐷,Lấy chồng giàu thiệt k kk,0,1743273859,lấy chồng giàu thiệt k kk
7487384230307201800,7485612643672165639,dog🐶🌷,số 9 có phải tài giỏi không chứ tớ không tài giỏi 🍀,0,1743292522,số 9 có phải tài giỏi không chứ tớ không tài giỏi
7487252507408777992,7485612643672165639,muon 44^^,lấy ck giàu:)),0,1743261832,lấy ck giàu:))
7490602071335879444,7485612643672165639,Không còn gì để chối,1 và 6 lấy ck giàu r nó cht mình hốt bạc 🥰,0,1744041715,1 và 6 lấy ck giàu r nó cht mình hốt bạc
7487519596272222997,7485612643672165639,🐸,Số 5 mà chx chộ tiền mô🙂,0,1743324030,số 5 mà chx chộ tiền mô
7491309475552330512,7485612643672165639,Ngáo 💝🎀,mik số 1,0,1744206426,mik số 1
7487367035249525511,7485612643672165639,xấu gái²⁰⁰⁵,số 7 y chang,0,1743288515,số 7 y chang
7487481960945222408,7485612643672165639,ʚ༝༚༝༚Շℛầท_Շɦị_ทջọ☪_αทɦɞ݁ ˖Ი𐑼⋆,"6,8",0,1743315258,"6,8"
7490200714025075474,7485612643672165639,Ngọc bình @,"Canh mũi ,tren mũi mà xóa mất tiêu",0,1743948274,"canh mũi ,tren mũi mà xóa mất tiêu"
7487569634399748872,7485612643672165639,xt,khổ vì tình :)),0,1743335673,khổ vì tình :))
7487132657298719495,7485612643672165639,𝟐𝟒𝐡 𝐦𝐢𝐬𝐬 𝐇 🙈,đuôi mắt thì sao🙂,0,1743233933,đuôi mắt thì sao
7486913732699603720,7485612643672165639,T,giữa trán thì sao nhỉ🥰,0,1743182963,giữa trán thì sao nhỉ
7487569318688801554,7485612643672165639,Quỳnh Chii🤞🤙,"6,7,8",0,1743335602,"6,7,8"
7486862806966043410,7485612643672165639,Miiu Nguyễn 1998,1 nghèo rớt mồng tơi😂,0,1743171103,1 nghèo rớt mồng tơi
7517600030661640968,7485710216521174279,huonglanday,Cả nhà ơi lựa size theo số đo eo ngang rún sau đó muốn cạp trễ thì lấy size rộng hơn còn khum thì thoii ạ. Tui cao m63 48kg eo 63 mặc S vừa khít eo còn trong clip tui mặc M cạp trễ đó ạ,11,1750327664,cả nhà ơi lựa size theo số đo eo ngang rún sau đó muốn cạp trễ thì lấy size rộng hơn còn khum thì thoii ạ. tui cao m63 48kg eo 63 mặc s vừa khít eo còn trong clip tui mặc m cạp trễ đó ạ
7531801742493762320,7485710216521174279,❤️‍🩹,m54 45kg mặc size gì á shop,1,1753634254,m54 45kg mặc size gì á shop
7553521934764933895,7485710216521174279,baorphuonw,m57 mac quet dat k a,0,1758691381,m57 mac quet dat k a
7503920348262368021,7485710216521174279,☃️,Màu dì v ạ,2,1747142615,màu dì v ạ
7535113861025383186,7485710216521174279,💢mthuw💤,"m50 45kg,eo 67cm sz nào ạ",0,1754405417,"m50 45kg,eo 67cm sz nào ạ"
7535716352075334420,7485710216521174279,av~,Ik học nên mua xanh classic hay xanh nhạt wash ạ,0,1754545700,ik học nên mua xanh classic hay xanh nhạt wash ạ
7491664080077521672,7485710216521174279,Qingyun 🌸,phân vân bycamcam với calem,4,1744288987,phân vân bycamcam với calem
7493403394369045266,7485710216521174279,glazedingrace🍀,Chị mặc size jv ạ,1,1744693958,chị mặc size jv ạ
7493082564513530642,7485710216521174279,😳,"tớ pass quần jean bycamcam bản pr 140 🐟 thui tớ có xanh nhạt,đen wash với đen nha",1,1744619249,"tớ pass quần jean bycamcam bản pr 140 thui tớ có xanh nhạt,đen wash với đen nha"
7496693520863707912,7485710216521174279,cứt thằn lằn,Màu này với xanh nhạt màu nào dễ phối vs xinh hơn ạ (đb là phối vs xanh navy ý ạ 😭),1,1745459998,màu này với xanh nhạt màu nào dễ phối vs xinh hơn ạ (đb là phối vs xanh navy ý ạ )
7522140826337805072,7485710216521174279,iw.bngc_47,m50 mặc đc ko ạ,0,1751384904,m50 mặc đc ko ạ
7519432209665934100,7485710216521174279,🪼,Pass rẻ mn oii,0,1750754250,pass rẻ mn oii
7526580121910854408,7485710216521174279,maingoccc><,"mn ơi màu classic ở ngoài có giống như này kh ạa,cùng tone màu vs áo khoác khum ạ sợ mua về khác màu quá😭",1,1752418499,"mn ơi màu classic ở ngoài có giống như này kh ạa,cùng tone màu vs áo khoác khum ạ sợ mua về khác màu quá"
7507743915148509972,7485710216521174279,?,Muốn cạp trễ eo 64 chọn size nào ạ..,1,1748032866,muốn cạp trễ eo 64 chọn size nào ạ..
7521698220663128853,7485710216521174279,Ngọc Vũ,vải dày ko ạ,0,1751281849,vải dày ko ạ
7500911475662701330,7485710216521174279,bu.,Đây là bản thường à chị🥰,3,1746442060,đây là bản thường à chị
7500560697991004946,7485710216521174279,qynzang,quần trong vid là size gì ạ,1,1746360386,quần trong vid là size gì ạ
7491560745894953736,7485710216521174279,lovely wife ★,Bản này là bản gi v ạ,1,1744264932,bản này là bản gi v ạ
7486379904852116244,7485710216521174279,lee.,C mặc sz gì v ạ,1,1743058682,c mặc sz gì v ạ
7490479396127048466,7485710216521174279,Martin’s favourite,Này là màu gì thế ạ,1,1744013154,này là màu gì thế ạ
7500043469445514002,7485710216521174279,୨ৎ,đồ cam đẹp mà rẻ v,0,1746239971,đồ cam đẹp mà rẻ v
7549785854790517522,7485710216521174279,nghị luận xã hội,1m63 47kg sz gì ạ eo 64,0,1757821508,1m63 47kg sz gì ạ eo 64
7523068896249938696,7485710216521174279,lạnh lùng ít ói,mình xin in4 áo khoác jean của cậu đc k ạ,0,1751600980,mình xin in4 áo khoác jean của cậu đc k ạ
7530682367108285191,7485710216521174279,tít.,m50 44 kg size gì ạ,0,1753373629,m50 44 kg size gì ạ
7491562961983783688,7485710216521174279,ngoc linh,mặc ổn k dị…,0,1744265442,mặc ổn k dị
7540475457407714055,7485710216521174279,T ghét lí,m65 55kg eo 70 mặc size gì ạ,0,1755653772,m65 55kg eo 70 mặc size gì ạ
7507156625230529287,7485710216521174279,LuLu 💭,E xin in4 áo khoác với ạ,0,1747896115,e xin in4 áo khoác với ạ
7497111876128768775,7485710216521174279,Ynhi Ho,xin in4 áo ngoài với ạ,0,1745557397,xin in4 áo ngoài với ạ
7491997401219023624,7485710216521174279,chiếc khăn gió ấm,1m65 60kg mặc size nào ạ,0,1744366597,1m65 60kg mặc size nào ạ
7502640165690475272,7485710216521174279,hngoc,m5 vừa k ạ😞,0,1746844565,m5 vừa k ạ
7502103487804130049,7485710216521174279,️,e xin inf áo khoác voi,0,1746719607,e xin inf áo khoác voi
7538879314851988231,7485710216521174279,Uyên nhi🎀,Cho e xin link áo khoác ngoài với ạ,0,1755282133,cho e xin link áo khoác ngoài với ạ
7509081484013011730,7485710216521174279,Tình Nguyễn,Màu ở ngoài có xám xám bạc bạc nha trong clip của bạn ko,1,1748344283,màu ở ngoài có xám xám bạc bạc nha trong clip của bạn ko
7490094514612470536,7485710216521174279,ebe hay dỗii,mình pass xanh classic premium sz S 150,1,1743923547,mình pass xanh classic premium sz s 150
7492668969020424967,7485710216521174279,🌻hngliu_1912🐼🐼🌲💐,quần trong vd bị xù lông đko ạ,0,1744522960,quần trong vd bị xù lông đko ạ
7486143286332949255,7485965945857527047,đông đọc thân,+1 máy cô đơn,68,1743003574,+1 máy cô đơn
7554628287445287696,7485965945857527047,!,để t,0,1758948977,để t
7541431188700857096,7485965945857527047,‧₊ ᵎᵎ 🍒ɱע.Ո૭૦८⋅ ˚✮,3 tô cơm chó,0,1755876284,3 tô cơm chó
7486477518438925077,7485965945857527047,Mơ zô tri 💤,để em với anh,6,1743081389,để em với anh
7513957131847893768,7485965945857527047,Ngọc báo thủ Tiền Giang 🍡🍮🍙,lêu lêu đồ ko có người yêu,1,1749479481,lêu lêu đồ ko có người yêu
7498580585310585608,7485965945857527047,HG 💗,+1 ăn cơm cẩu,1,1745899362,+1 ăn cơm cẩu
7511990305303446280,7485965945857527047,....,bị phát cơm chó 🤣,0,1749021804,bị phát cơm chó
7496717592842470151,7485965945857527047,cute love 1e,bổ túc,1,1745465600,bổ túc
7486086257582015240,7485965945857527047,Anh béeee🥷🏻,Cay lắm,1,1742990295,cay lắm
7486148434690016020,7485965945857527047,vk anh-)),ngày nào trên lớp chả v 😁,2,1743004775,ngày nào trên lớp chả v
7485974224868410120,7485965945857527047,suy 💤,em yến đâu 😂,2,1742964208,em yến đâu
7510614563089761031,7485965945857527047,Oanh(Nghĩa),nhìn mãi cũng ngán chứ,0,1748701233,nhìn mãi cũng ngán chứ
7486108648662729493,7485965945857527047,BÉ lùn,thiệt luôn giống nek bị phát cơm chó quà 😳,2,1742995511,thiệt luôn giống nek bị phát cơm chó quà
7486346141673374471,7485965945857527047,ⓑⓞⒻⒻⓥⓝ,trời trời nghê vậy 😂😂,1,1743050812,trời trời nghê vậy
7486260295729922834,7485965945857527047,......thiep......,thời hs là vậy đó 😅,1,1743030858,thời hs là vậy đó
7495762744940856072,7485965945857527047,con mẹ mày,tôi hiểu cảm giác này mà,2,1745243280,tôi hiểu cảm giác này mà
7486259225384436487,7485965945857527047,07/07♛,đến lúc ct sẽ hiểu 🤣🤣,1,1743030584,đến lúc ct sẽ hiểu
7499357795155346184,7485965945857527047,ngoại lệ của emm,+1 máy nói đúng còn to 😌,1,1746080313,+1 máy nói đúng còn to
7513592967694451473,7485965945857527047,Kay Kay,không có NY Kay à,0,1749394871,không có ny kay à
7486105886575936264,7485965945857527047,cậu bé cô đơn ☺️,lúc đó nó cayyyyyyy🗿,0,1742994869,lúc đó nó cayyyyyyy
7486386057522610952,7485965945857527047,20:10,Hộ mik mấy vd vs ạ,0,1743060112,hộ mik mấy vd vs ạ
7486469910806414088,7485965945857527047,౨ৎ,chị tao phát cho nhiug vào h bị mời phụ rùi đình chỉ tùm lung lum 🥺,0,1743079621,chị tao phát cho nhiug vào h bị mời phụ rùi đình chỉ tùm lung lum
7486466665681896213,7485965945857527047,EM TỆ LẮM 🖤,cơm chó nhiều nhỉ 😅😆,0,1743078867,cơm chó nhiều nhỉ
7501462512714760981,7485965945857527047,Mèo🤯,tội z,0,1746570375,tội z
7486387199711626002,7485965945857527047,bánh Đa 💞,đi học để đánh nhau🤣🤣,0,1743060375,đi học để đánh nhau
