comment_id,video_id,username,comment_text,digg_count,create_time,clean_text
7528786010764870407,7528773260138401042,Đặng Thái An,có cảnh báo cơn bão mà còn cho tàu ra biển??????? trách nhiệm???,2,1752932099,có cảnh báo cơn bão mà còn cho tàu ra biển??????? trách nhiệm???
7528795490924036882,7528773260138401042,Minh Lý 6886,Khách gan thật hay không xem tin thời tiết hả ??,2,1752934309,khách gan thật hay không xem tin thời tiết hả ??
7528794154379264786,7528773260138401042,Dũng Vũ,"Chở 52 người chắc không sao, chở 53 người chắc nặng quá nên bị quá tải",3,1752933995,"chở 52 người chắc không sao, chở 53 người chắc nặng quá nên bị quá tải"
7528802382835663624,7528773260138401042,Trùng Dương,Bão mà ra biển chơi ah,1,1752935911,bão mà ra biển chơi ah
7528775239255130887,7528773260138401042,Chucly Mai,sao bảo mà thi thích du lịch vậy trời.,3,1752929593,sao bảo mà thi thích du lịch vậy trời.
7528789570806612737,7528773260138401042,Nguyễn Thống,cái nghèo đã cứu ta 1 mạng,1,1752932934,cái nghèo đã cứu ta 1 mạng
7528814111443485447,7528773260138401042,Chang Nhun,Lúc nữa chắc lên 58,1,1752938640,lúc nữa chắc lên 58
7528785040039691026,7528773260138401042,Nguyễn Đào 1976,có bão vẫn du lịch chịu luôn,1,1752931874,có bão vẫn du lịch chịu luôn
7528802885124424455,7528773260138401042,Quang Nhật,Số 53 nguy hiểm🧐,1,1752936026,số 53 nguy hiểm
7528803841115357970,7528773260138401042,Huỳnh Trung,Bão nv cũng đi thì chịu rồi,1,1752936249,bão nv cũng đi thì chịu rồi
7528774909545562902,7528773260138401042,Ngân Hiền Hậu,Bão gió còn ra biển,4,1752929525,bão gió còn ra biển
7528783698343658256,7528773260138401042,Nguyễn Hoài Thơm,không biết nói gì ngoài chữ quá thương tâm,1,1752931563,không biết nói gì ngoài chữ quá thương tâm
7528807646879613704,7528773260138401042,lethoa.1990,Trời bão mà đi du lịc ra đây chi trời,1,1752937134,trời bão mà đi du lịc ra đây chi trời
7528795225461490440,7528773260138401042,@thắng barca,Rồi tỉnh hạ long,1,1752934243,rồi tỉnh hạ long
7528781394211554068,7528773260138401042,Rô béo 79,"ai ký lệnh chi tầu xuất bên cung mệt à. Khu Vịnh này giông lốc rất khốc liệt, gió cứ rít cuộn theo các đảo",1,1752931030,"ai ký lệnh chi tầu xuất bên cung mệt à. khu vịnh này giông lốc rất khốc liệt, gió cứ rít cuộn theo các đảo"
7528774900556382984,7528773260138401042,QuaNhi,Tàu chở khách,1,1752929511,tàu chở khách
7528786803849380628,7528773260138401042,2hip,Rút kinh nghiệm lần sau nhé,1,1752932292,rút kinh nghiệm lần sau nhé
7528775175233438472,7528773260138401042,Trần Thúy,Đau lòng quá. Mong mn bình an,1,1752929578,đau lòng quá. mong mn bình an
7528796078554415879,7528773260138401042,___Cô Út🍒___,Cầu mong tất cả đều bình an..😔,1,1752934445,cầu mong tất cả đều bình an..
7528812374099772168,7528773260138401042,út cute,lúc thì bảo 48 người lúc thì bảo 53 người chẳng biết nghe ai,1,1752938236,lúc thì bảo 48 người lúc thì bảo 53 người chẳng biết nghe ai
7528786430332748552,7528773260138401042,Tinh Lionel212,49 53 thua,0,1752932197,49 53 thua
7528790392902714120,7528773260138401042,THÚY NGA .CẨM PHẢ,chiều nay mưa giông kéo vè hl mà .khổ quá đi,0,1752933120,chiều nay mưa giông kéo vè hl mà .khổ quá đi
7528959038814454546,7528773260138401042,🍀 Diệu tâm bình 🍀❤️,thương tâm bão giông đến nhanh quá 🙏🙏🙏🙏🙏,0,1752972390,thương tâm bão giông đến nhanh quá
7528783901222208263,7528773260138401042,Thu Hoang,còn 40 người đi đâu rồi,0,1752931608,còn 40 người đi đâu rồi
7528790239650824978,7528773260138401042,Luân Seo Lơ ✅,ức quá ức mà,0,1752933086,ức quá ức mà
7528795416030380807,7528773260138401042,chauthanhphong063,tin bão có báo mà ta,0,1752934288,tin bão có báo mà ta
7528790282247652114,7528773260138401042,NguyenphươngTuyền94,Bjk bao di nua,0,1752933091,bjk bao di nua
7528819430995002129,7528773260138401042,quá khứ buồn,có kiểm tra trước khi đi chưa có báo cáo kg.ròi ai là người nhận tt báo cáo đó hay là mấy ông khi xảy ra ròi đỗ thưa,0,1752939882,có kiểm tra trước khi đi chưa có báo cáo kg.ròi ai là người nhận tt báo cáo đó hay là mấy ông khi xảy ra ròi đỗ thưa
7528797811477021458,7528773260138401042,PhươngPhamBG🏗️,Ở bắc giang sáng đi lm quên k sạc quạt tích điện sợ mưa nó mất điện 12h gọi về nhờ mẹ sạc hộ vì biết chiều có mưa. Nể phục mấy ng này . Dù gì cũng chia buồn 🥺,0,1752934846,ở bắc giang sáng đi lm quên k sạc quạt tích điện sợ mưa nó mất điện 12h gọi về nhờ mẹ sạc hộ vì biết chiều có mưa. nể phục mấy ng này . dù gì cũng chia buồn
7528940949607547656,7528773260138401042,VuThanhng,Du lịch bất chấp,0,1752968183,du lịch bất chấp
7528837756115944213,7528773260138401042,Duy Thanh Trần,tôi..thằng cty su lịch nó kêu ko sao nê đi,0,1752944155,tôi..thằng cty su lịch nó kêu ko sao nê đi
7528802391123903253,7528773260138401042,Lam,Đi chơi vậy sợ,0,1752935917,đi chơi vậy sợ
7528851239279559432,7528773260138401042,Cường N.P,thảm hoạ🙏🙏🙏.. nên rà soát lại tất cả các loại tàu thuyền trở khách du lịch để ko còn tình trạng này ko xảy ra thêm 1 lần nào nữa quá đau thương 🙏🙏🙏,0,1752947285,thảm hoạ.. nên rà soát lại tất cả các loại tàu thuyền trở khách du lịch để ko còn tình trạng này ko xảy ra thêm 1 lần nào nữa quá đau thương
7528785456340304656,7528773260138401042,KEN,53. 😥,0,1752931972,53.
7528816711114736400,7528773260138401042,꧁༒ʈɧảσ•ʈâɤ༒꧂,49-53 thật buồn,0,1752939248,49-53 thật buồn
7528799543350838034,7528773260138401042,Long White🌖,Tại nạn do công ty du lịch biết có bão vẫn đưa khách ra,0,1752935251,tại nạn do công ty du lịch biết có bão vẫn đưa khách ra
7528804788571570952,7528773260138401042,Ngọc Hà,số 53 thường không mai. 3 5 7 toàn số k mai,0,1752936472,số 53 thường không mai. 3 5 7 toàn số k mai
7528801739920376596,7528773260138401042,trangmi310,Lại số 53,0,1752935766,lại số 53
7528797471297536786,7528773260138401042,Đức hậu đậu,"k hiểu sao ng có đầu óc có t mà vẫn chạy ra đó đc, no hỉu",0,1752934766,"k hiểu sao ng có đầu óc có t mà vẫn chạy ra đó đc, no hỉu"
7528803715920659208,7528773260138401042,caryn3725,Mưa mưa ma du lịch?,0,1752936224,mưa mưa ma du lịch?
7528788851167871762,7528773260138401042,Hiểu Huỳnh,nghe nói hôm nay bão vào mà,0,1752932758,nghe nói hôm nay bão vào mà
7528830492306850567,7528773260138401042,ĐỖ THANH TOÀN,Tới nữa 😳,0,1752942460,tới nữa
7528788791487415048,7528773260138401042,Về hưu trồng rau nuôi cá...Sấu,quá tan thương 😢,0,1752932747,quá tan thương
7528787718073238280,7528773260138401042,Hung Nguyễn Thị,quả này tìm kiếm cũng lâu và chật vật đấy,0,1752932497,quả này tìm kiếm cũng lâu và chật vật đấy
7528788775385105159,7528773260138401042,Quyên kim,đi du lich toi sơ đi tàu lâm,0,1752932740,đi du lich toi sơ đi tàu lâm
7528792150412575506,7528773260138401042,Tân Tung Tăng,còn 40ng èo ôi. a di đà Phật,0,1752933532,còn 40ng èo ôi. a di đà phật
7529031277883622165,7528773260138401042,minh khang,chắc tại tàu không chạy bằng điện,0,1752989214,chắc tại tàu không chạy bằng điện
7528815890735104784,7528773260138401042,ĐỖ LINH,Co du báo rồi thế ra bien lam gi hả,0,1752939061,co du báo rồi thế ra bien lam gi hả
7528822612627063570,7528773260138401042,HẰNG PHƯƠNG,Trời thương tâm quá. Mong mn bình an,0,1752940625,trời thương tâm quá. mong mn bình an
7528844310327362311,7528773260138401042,Lưu Trung Sơn,Ng có tiền hay nhỉ ... 😅 . Chắc không xem thời sự bao giờ ....,0,1752945673,ng có tiền hay nhỉ ... . chắc không xem thời sự bao giờ ....
7528801474945434376,7528773260138401042,Phạm Thái,Nam mô a di phat Phật,0,1752935698,nam mô a di phat phật
7554091288212374279,7529177322889530631,*Tok*,១M+#ភ្នែក!,1,1758823945,m+#!
7529379500444091144,7529374001374792976,Nguyễn hoàng Yến 99.9FM,Mấy việc tốt như này cần lan toả nhiều hơn,28,1753070283,mấy việc tốt như này cần lan toả nhiều hơn
7545096395527914248,7529374001374792976,mình minh,😉🥰❤️nhà cô này có phúc lớn ❤️❤️nên lgap lại người có trái tim nhân hậu ạ ❤️,1,1756729655,nhà cô này có phúc lớn nên lgap lại người có trái tim nhân hậu ạ
7529380588995003144,7529374001374792976,Lý gia khuê,"😭😭😭😭😭😭😭
cúi đầu biết ơn anh",3,1753070538,cúi đầu biết ơn anh
7529402285690356498,7529374001374792976,雪花,Thay mặt gia đình cảm ơn hành động của a🥰,1,1753075590,thay mặt gia đình cảm ơn hành động của a
7529398627073344263,7529374001374792976,Phùng Thị Triển,tình người rất tuyệt vời cộng động chia sẻ lan tỏa lên nhé,2,1753074735,tình người rất tuyệt vời cộng động chia sẻ lan tỏa lên nhé
7529382334127407890,7529374001374792976,Binh chi linh,Chúc anh và gia đình luôn mạnh khỏe và hạnh phúc,5,1753070939,chúc anh và gia đình luôn mạnh khỏe và hạnh phúc
7529394944750994194,7529374001374792976,trịnh bích xì teen 1977,những người con Việt Nam tuyệt vời thật ấm lòng ❤️❤️❤️❤️❤️❤️❤️,2,1753073875,những người con việt nam tuyệt vời thật ấm lòng
7529453559771857672,7529374001374792976,user841663618650,Em tốt quá,1,1753087524,em tốt quá
7529403554634777351,7529374001374792976,Hồng Lĩnh,thắm đượm tình đồng bào,2,1753075890,thắm đượm tình đồng bào
7529403830623322888,7529374001374792976,free 1000,cây đổ nguy hiểm quá,2,1753075946,cây đổ nguy hiểm quá
7529721143478764296,7529374001374792976,thuyngamcbuithing,chúc em nhiều sức khỏe bình an hạnh phúc đến với gia đình em làm nhiều việc tốt nhé,0,1753149827,chúc em nhiều sức khỏe bình an hạnh phúc đến với gia đình em làm nhiều việc tốt nhé
7529393574419677960,7529374001374792976,Hoa hồng,người tốt vạn dặm bình an,2,1753073571,người tốt vạn dặm bình an
7529563439963423496,7529374001374792976,ĐÌNH THƠM,người tốt thì sẽ gặp được nhiều điều tốt với mình❤❤❤❤❤❤❤❤❤❤,0,1753113113,người tốt thì sẽ gặp được nhiều điều tốt với mình
7529398955677139733,7529374001374792976,xuân thủ,Việt Nam tôi đó.,0,1753074823,việt nam tôi đó.
7529443449386124049,7529374001374792976,User111222209,"Cảm ơn nhiều lắm Bạn trai tốt bụng, chúc bạn thật nhiều sức khỏe vạn sự bình an",0,1753085178,"cảm ơn nhiều lắm bạn trai tốt bụng, chúc bạn thật nhiều sức khỏe vạn sự bình an"
7529407191695786769,7529374001374792976,Lê thảo thương ♥️♥️♥️,tấm lòng nhân ái,0,1753076735,tấm lòng nhân ái
7529395342211728145,7529374001374792976,nguyễn thí Hằng,tuyệt vời thật âm lòng,0,1753073971,tuyệt vời thật âm lòng
7529398860780765968,7529374001374792976,Lê Hằng,cảm ơn tấm lòng tốt,0,1753074797,cảm ơn tấm lòng tốt
7529403714420441873,7529374001374792976,Hồng Lĩnh,cảm ơn chú hiệp nhiều nhé,0,1753075926,cảm ơn chú hiệp nhiều nhé
7529399681111081746,7529374001374792976,Phạm Thị Luyện Phạm Thị Luyện,Khen thưởng kịp thời,0,1753074982,khen thưởng kịp thời
7529443715011789576,7529374001374792976,bình  yên,cảm ơn bạn hiệp đã có tâm cứu nạn rất biết ơn bạn du mình chỉ là người lướt mạng gặp,0,1753085407,cảm ơn bạn hiệp đã có tâm cứu nạn rất biết ơn bạn du mình chỉ là người lướt mạng gặp
7529406683068826375,7529374001374792976,Huy Bin 2005,quá tuyệt vời. những việc làm như vậy cần loan tỏa 👏👏👏,0,1753076611,quá tuyệt vời. những việc làm như vậy cần loan tỏa
7529393082938327816,7529374001374792976,vanhoa,cảm ơn anh hiệp sĩ....,0,1753073447,cảm ơn anh hiệp sĩ....
7529455455224644360,7529374001374792976,Hường Nguyễn Thị,"cảm ơn bạn hiệp đã có tấm lòng vàng đã không quản ngại mưa bão để cứu người bị nạn . Tôi cũng chỉ là người lướt mạng nhưng rất khâm phục.
❤️❤️❤️❤️❤️❤️❤️",0,1753087965,cảm ơn bạn hiệp đã có tấm lòng vàng đã không quản ngại mưa bão để cứu người bị nạn . tôi cũng chỉ là người lướt mạng nhưng rất khâm phục.
7529505348023452424,7529374001374792976,Thảo Nguyễn,Anh hùng vn,0,1753099581,anh hùng vn
7529394467904733953,7529374001374792976,Trịnh thị mơ,Cảm ơn bạn chúc bạn nhiều sức khỏe,0,1753073769,cảm ơn bạn chúc bạn nhiều sức khỏe
7529425661264560903,7529374001374792976,Nguyễn Lan,Thật là tuyệt vời,0,1753081203,thật là tuyệt vời
7529398023619003154,7529374001374792976,Tuyet@,chúc cháu an nhiên 1 đời,0,1753074598,chúc cháu an nhiên 1 đời
7529399481961300743,7529374001374792976,Phạm Thị Luyện Phạm Thị Luyện,Tuyệt quá !,0,1753074935,tuyệt quá !
7529480795846820615,7529374001374792976,@Nguyễn Thị Quang 47,việc làm nghĩa hiệp của anh thật tuyệt vời chúc anh sức khỏe và hạnh phúc,0,1753094045,việc làm nghĩa hiệp của anh thật tuyệt vời chúc anh sức khỏe và hạnh phúc
7529401787431650056,7529374001374792976,thanh minh,"quá tuyệt vời,các a",0,1753075659,"quá tuyệt vời,các a"
7529402677575353096,7529374001374792976,Cách Pham,cần lắm những tsams lòng njsan ái,0,1753075676,cần lắm những tsams lòng njsan ái
7529404054142141204,7529374001374792976,Toan Phạm,Cháu rất có tâm thật tuyệt vời,0,1753076003,cháu rất có tâm thật tuyệt vời
7529419669745713936,7529374001374792976,Phan mạnh tuấn,Tự hào khi là người con của đất nước việt nam muôn năm,0,1753079641,tự hào khi là người con của đất nước việt nam muôn năm
7529452797458268936,7529374001374792976,Hoàng Long Belero,Tuổi trẻ Tình thương và ý thức trách nhiệm rất cao. Rất đáng học tâlj và nhân bản.. cảm ơn bạ Hiệp nhiều. 🥰🥰🥰🥰🥰🥰,0,1753087348,tuổi trẻ tình thương và ý thức trách nhiệm rất cao. rất đáng học tâlj và nhân bản.. cảm ơn bạ hiệp nhiều.
7529419921241080597,7529374001374792976,Thúy,quá tốt bụng và tuyệt vời anh ơi chúc gia đình anh gặp nhiều may mắn,0,1753079704,quá tốt bụng và tuyệt vời anh ơi chúc gia đình anh gặp nhiều may mắn
7529495975849706248,7529374001374792976,Mai Hương,anh ấy thật tuyệt vời,0,1753097399,anh ấy thật tuyệt vời
7529460216066376456,7529374001374792976,lehoa2507,Quá tuyệt vời Anh.👍👍🥰🥰🥰🥰🥰🥰.,0,1753089077,quá tuyệt vời anh..
7529413375279252242,7529374001374792976,Vương Hoàng Yến,bà này phúc lớn quá mới gặp đc các bạn này,0,1753078174,bà này phúc lớn quá mới gặp đc các bạn này
7529396432690217744,7529374001374792976,Cường,ok rất tốt,0,1753074236,ok rất tốt
7529829294559052551,7529374001374792976,Ngọc Ánh,cầu chúc cho gia đình e chai được nhiều suất khoẻ,0,1753175007,cầu chúc cho gia đình e chai được nhiều suất khoẻ
7529482309785027335,7529374001374792976,Văn phòng phẩm AK,Phật gia hộ cho người có tâm tốt nam mô a Di Đà Phật,0,1753094221,phật gia hộ cho người có tâm tốt nam mô a di đà phật
7529399905895711509,7529374001374792976,Ba' s1tg,Cảm ơn bạn trai quá tuyệt vời,0,1753075037,cảm ơn bạn trai quá tuyệt vời
7529438476963726101,7529374001374792976,thế Thanh,khi hoạn nạn mới biết được tình yêu của dân tộc Việt Nam ❤️❤️❤️,0,1753084024,khi hoạn nạn mới biết được tình yêu của dân tộc việt nam
7529402519769301780,7529374001374792976,diemhuong12,người tốt giúp người thì ko cần si nghĩ miễn cứu đc người là giúp thôi cam ơn người tốt ❤️,0,1753075647,người tốt giúp người thì ko cần si nghĩ miễn cứu đc người là giúp thôi cam ơn người tốt
7529437839240119058,7529374001374792976,Vũ Thu🌻❤️,Tự Hào việt nam chúc em muôn điều tốt đẹp 🥰🥰🥰🥰🥰🥰🥰👍👍👍👍👍👍,0,1753083866,tự hào việt nam chúc em muôn điều tốt đẹp
7529471648526271248,7529374001374792976,ĐinhVân,Tuyệt vời qúa em,0,1753091740,tuyệt vời qúa em
7529433584798745352,7529374001374792976,Trịnh Thuý182,Tuyệt vời quá chúc cháu khỏe mạnh hạnh phúc bình an,0,1753082877,tuyệt vời quá chúc cháu khỏe mạnh hạnh phúc bình an
7529469378590196481,7529374001374792976,Ngọc Lệ,em trai có tầm long thương người tốt bụng,0,1753091215,em trai có tầm long thương người tốt bụng
7529388809227272978,7529374001374792976,Tuyết Hồng,biết ơn e trai nhiều lam,0,1753072947,biết ơn e trai nhiều lam
7529392701632971528,7529374001374792976,Thành hiền,một hành động đẹp của em trai.chi chúc em trai nhiều sức khỏe ❤️🌹,0,1753073356,một hành động đẹp của em trai.chi chúc em trai nhiều sức khỏe
7529405055666946824,7529374001374792976,na tam xa,"Tuyệt vời lắm, cảm ơn bạn công Đức vô lượng,❤️❤️❤️",0,1753076232,"tuyệt vời lắm, cảm ơn bạn công đức vô lượng,"
7529488578389263111,7529374001374792976,🌺Vũ y Bình 6868🌺,Công Đức vô lượng chức bạn gd nhiều Sk 🥰👍,0,1753095677,công đức vô lượng chức bạn gd nhiều sk
7529721982301111048,7529374001374792976,namngu70268189379,"Cảm ơn Anh giúp đỡ chị gặp bão. Chúc Anh sức khoẻ, Anh sẽ gặp lành vì ở hiền !",0,1753150025,"cảm ơn anh giúp đỡ chị gặp bão. chúc anh sức khoẻ, anh sẽ gặp lành vì ở hiền !"
7529392549266457361,7529374001374792976,linh cá khô 1 nắng,biết ơn bạn nhiều 🥰,0,1753073323,biết ơn bạn nhiều
7529495600905028373,7529374001374792976,bé lùn,a hùng vn🥰,0,1753097322,a hùng vn
7529416925094707976,7529374001374792976,Nguyet Vo,làm phước gặp phúc 🥰🥰🥰,0,1753078996,làm phước gặp phúc
7529416159156011794,7529374001374792976,luyenphan 1973,quá tuyệt vời quá phúc hậu em trai.❤💓💞💕🧡💛💚💙💜💯💢💥,0,1753078991,qua tuyêt vơi qua phuc hâu em trai.
7529416514727297808,7529374001374792976,MÙA XUÂN,10 điểm cho bạn.,0,1753078904,10 điểm cho bạn.
7529410428238775060,7529374001374792976,XÍ MŲÔI,hành động 2 anh em quá tuyệt vời,0,1753077489,hành động 2 anh em quá tuyệt vời
7529453685769929480,7529423982018317584,Đăng Xa Lộ,"Cho mấy người trình độ ko có lại thiếu trách nhiệm thi công thì nguy hiểm, tất cả yếu tố đó đều tính trước dc để tránh",88,1753087558,"cho mấy người trình độ ko có lại thiếu trách nhiệm thi công thì nguy hiểm, tất cả yếu tố đó đều tính trước dc để tránh"
7529499473690592008,7529423982018317584,Mạnh Đức store $,cột rò điện người dân đã trình báo nhưng vẫn không có phương án xử lý cho đến khi sự việc xảy ra quá đau lòng😥😥😥,46,1753098217,cột rò điện người dân đã trình báo nhưng vẫn không có phương án xử lý cho đến khi sự việc xảy ra quá đau lòng
7529444262170755848,7529423982018317584,Hải Cường,bị điện rựt phải để nằm dưới đất một lúc đừng bế lên ngay thì mới cứu được,95,1753085361,bị điện rựt phải để nằm dưới đất một lúc đừng bế lên ngay thì mới cứu được
7529468532670251783,7529423982018317584,Kiến thức +1,"m thấy ở nước ngoài cột điện ở gần dân cư đều có bọc lớp nhựa tầm 2m ở dưới cột điện tránh nhiễm điện, ở ta có nhiều trường hợp bị điện giật như thế này chưa khắc phục dc",10,1753091011,"m thấy ở nước ngoài cột điện ở gần dân cư đều có bọc lớp nhựa tầm 2m ở dưới cột điện tránh nhiễm điện, ở ta có nhiều trường hợp bị điện giật như thế này chưa khắc phục dc"
7529469266052842261,7529423982018317584,phamnhutthi,giờ tao con sợ VN làm cột đèn cột điện bằng sắt,9,1753091186,giờ tao con sợ vn làm cột đèn cột điện bằng sắt
7529463649141932807,7529423982018317584,kỹ nghệ sắt tấn phát,rồi ai sẽ chịu trách nhiệm vụ việc này vậy ta,7,1753089883,rồi ai sẽ chịu trách nhiệm vụ việc này vậy ta
7529457212793930504,7529423982018317584,Lanh Lanh Review,"nguy hiểm quá, thương bé",4,1753088387,"nguy hiểm quá, thương bé"
7529464793834685192,7529423982018317584,Tran Thu,Thương con a di đà phật,3,1753090144,thương con a di đà phật
7529658742453011208,7529423982018317584,thườngthôi🤫,nếu có lắp át chông giật thi an toàn,1,1753135313,nếu có lắp át chông giật thi an toàn
7529562847156880136,7529423982018317584,Lạc rang 🥜,Quê tôi cũng thấy toàn làm bằng cột sắt mà lại toàn quấn dây điện vô . Nhìn bất lực thật sự,2,1753112970,quê tôi cũng thấy toàn làm bằng cột sắt mà lại toàn quấn dây điện vô . nhìn bất lực thật sự
7529510495863669521,7529423982018317584,Hoàng Chương,này cột phần dưới nên làm bằng bê tông hoặc bọc nhựa hay chất cách điện thì sẽ an toàn hơn chút chứ giờ đầy cột toàn bằng sắt hơi ghê,1,1753100784,này cột phần dưới nên làm bằng bê tông hoặc bọc nhựa hay chất cách điện thì sẽ an toàn hơn chút chứ giờ đầy cột toàn bằng sắt hơi ghê
7529468835012477704,7529423982018317584,Minh phúc,"chèn ơi, thương quá",1,1753091081,"chèn ơi, thương quá"
7529694380249498375,7529423982018317584,hồng sơn 191066,đừng bao giờ sờ vào cột đèn sắt kể cả trời nắng,1,1753143840,đừng bao giờ sờ vào cột đèn sắt kể cả trời nắng
7529530451351716616,7529423982018317584,nga_1.9.9.2,🥺🥺 trời. Tội bé quá,1,1753105427,trời. tội bé quá
7529562071126541074,7529423982018317584,0k 5 sao,chỉ biết bắt phạt đèn xanh đèn đỏ là tài,1,1753112786,chỉ biết bắt phạt đèn xanh đèn đỏ là tài
7529630031812576008,7529423982018317584,⚜️༄ Mr.Đen  ࿐⚜️          ༽,Cột điện nào bằng sắt cũng nhiễm mát. Chỉ có sơn tĩnh điện thì mới an toàn cho người dân được,1,1753128621,cột điện nào bằng sắt cũng nhiễm mát. chỉ có sơn tĩnh điện thì mới an toàn cho người dân được
7529501476989715207,7529423982018317584,khoatroc1,T thấy mấy cột điện dân tự làm nguy hiểm vãi. Ở tao toàn vậy. Chỉ cần lực ma sát chà đi chà lại tgian dây nào cột nào cũng hở điện.,2,1753098681,t thấy mấy cột điện dân tự làm nguy hiểm vãi. ở tao toàn vậy. chỉ cần lực ma sát chà đi chà lại tgian dây nào cột nào cũng hở điện.
7529553416256815889,7529423982018317584,mai,điện nhà giờ có bán cầu dao chống giật mà k sài vậy,1,1753110776,điện nhà giờ có bán cầu dao chống giật mà k sài vậy
7529913544608842503,7529423982018317584,Huyền Mạnh Mẽ 🇻🇳 🇰🇷,Điện giờ nguy hiểm quá gặp bảo còn nguy hiểm nhìu hơn,1,1753194623,điện giờ nguy hiểm quá gặp bảo còn nguy hiểm nhìu hơn
7529491377593320193,7529423982018317584,Giaa Phúu🌧,ddi ddaau cx vaayj k bao h t dungj vao cais j maf cos satws,1,1753096338,ddi ddaau cx vaayj k bao h t dungj vao cais j maf cos satws
7529540003786998545,7529423982018317584,Luna Hiếu,"A DI ĐÀ PHẬT..
A DI ĐÀ PHẬT..
NAM MÔ BỒ TÁT QUÁN THẾ ÂM 🥺🥺..tội quá, mong con được siêu thoát 🙏",1,1753107656,"a di đà phật.. a di đà phật.. nam mô bồ tát quán thế âm ..tội quá, mong con được siêu thoát"
7529509622584492808,7529423982018317584,Đức Anh Tủ Điện,sự quan trọng của dây tiếp địa. nhưng lại rất hay bị bỏ qua,1,1753100577,sự quan trọng của dây tiếp địa. nhưng lại rất hay bị bỏ qua
7529426383166358290,7529423982018317584,Dụng Cụ Của Mọi Gia Đình,chia buồn với gia đình 🙏🙏🙏,1,1753081200,chia buồn với gia đình
7529481554718229256,7529423982018317584,Nguyễn Công,cột đèn này không có tiếp địa à,1,1753094052,cột đèn này không có tiếp địa à
