comment_id,video_id,username,comment_text,digg_count,create_time,clean_text
7556981158397133585,7479247693173263634,၄၃𝙱ă𝚗𝚐𝚏𝚏౨ৎ,tui môi đầy đặng cũng cũng,0,1759496802,tui môi đầy đặng cũng cũng
7481228197255742226,7479247693173263634,iem cun?,team môi tây,0,1741859200,team môi tây
7481318832347644690,7479247693173263634,Gauxinhiu🍭,Môi dày thì sao ah??,0,1741880291,môi dày thì sao ah??
7481434929595941650,7479247693173263634,Sara Meiuyoo🎀,"Cách sdeer giúp bạn có môi cười
thứ nhất : bạn hãy cười nhiều điều này sẽ khiến môi bạn cong lên mỗi khi cười thử xem nhé",0,1741907333,cách sdeer giúp bạn có môi cười thứ nhất : bạn hãy cười nhiều điều này sẽ khiến môi bạn cong lên mỗi khi cười thử xem nhé
7480941909927346962,7479247693173263634,kitw,ê t môi tây:)),0,1741792533,ê t môi tây:))
7552049824356074258,7479247693173263634,NOBI NÔBITA 💫,Moi tôi mới cưoi ạ,0,1758348633,moi tôi mới cưoi ạ
7481248916463682322,7479247693173263634,hienthu,có ai môi trái tim ko🙃,0,1741864028,có ai môi trái tim ko
7562462564345594631,7479247693173263634,hhhhhhhhhhh,môi qru,0,1760773033,môi qru
7481169118336516871,7479247693173263634,ko tìm thấy tài khoản  🖤,môi đầy dặn nha,0,1741845445,môi đầy dặn nha
7481527571088491282,7479247693173263634,❤️☘️Thư Nhi❤️💕,Môi đầy đặn hay môi cười phân biệt k đc môi mình 😂😂😂,0,1741928896,môi đầy đặn hay môi cười phân biệt k đc môi mình
7508731658834264839,7479247693173263634,chuốii labubu,có ai môi chữ M giống mik ko,0,1748262831,có ai môi chữ m giống mik ko
7481180335386231559,7479247693173263634,⋅˚Hana୨୧ ˚ ⋅,môi cười á👍,0,1741848059,môi cười á
7481543216484778770,7479247693173263634,miss           ¿,Cần ng tim vd ms nhất,0,1741932541,cần ng tim vd ms nhất
7481307133793092360,7479247693173263634,HÀ LÀ CHÀ 😱,môi tây nha,0,1741877573,môi tây nha
7481301505037239056,7479247693173263634,pi💗,8/10,0,1741876262,8/10
7481643593624044296,7479247693173263634,Tuong Giang 🩷,Môi trái tymm,0,1741955908,môi trái tymm
7537694514430640914,7479247693173263634,+1 máy lụy cổ trang TQ,môi tây vs môi quyến rũ giống nhau vậy,0,1755006271,môi tây vs môi quyến rũ giống nhau vậy
7481317439470240520,7479247693173263634,17th10,Môi đây đặn,0,1741879974,môi đây đặn
7481298173168976658,7479247693173263634,....?!,cánh hoa,0,1741875478,cánh hoa
7481324282229572373,7479247693173263634,Phạm tiểu thư,tôi môi cười,0,1741881562,tôi môi cười
7487433067293491976,7479247693173263634,Thuyanh 2k17,Môi cười 1000/1000000,0,1743303880,môi cười 1000/1000000
7481184170212115217,7479247693173263634,°Sơn tổng°☀️,tui môi mỏng,0,1741848947,tui môi mỏng
7480905096378467073,7479247693173263634,我愛佢,Môi cánh hoa nhé:)),0,1741783963,môi cánh hoa nhé:))
7490214180743840528,7479247693173263634,khotinh.,m cuoi vs chữ m đẹp dữ tr😭,0,1743951414,m cuoi vs chữ m đẹp dữ tr
7563526242075460370,7479247693173263634,Ngọc🌟🌟🌹🌹,đôi cánh hoa nha❤,0,1761020689,đôi cánh hoa nha
7481232780924879632,7479247693173263634,Lazy,môi tổng hợp,0,1741860262,môi tổng hợp
7479768119683334920,7479764801384680722,mèo,xúc xích ponnie 88% thịt😂,197,1741519238,xúc xích ponnie 88% thịt
7480485425862673160,7479764801384680722,GKS,luộc luôn cho nhanh chứ như này chả khác j còn tốn gas,1,1741686254,luộc luôn cho nhanh chứ như này chả khác j còn tốn gas
7479768737694221063,7479764801384680722,nguynlhngthnh,nó là luộc pk,2,1741519392,nó là luộc pk
7479765911534027538,7479764801384680722,bin?!,anh flop kìa,1,1741518730,anh flop kìa
7479787470813414151,7479764801384680722,๓ย☬ภ๏☬l๏שє,nói luộc men đi còn rán nx,16,1741523741,nói luộc men đi còn rán nx
7479791031465362183,7479764801384680722,Tờ Hờ Khờ 😜,"ăn xúc xích luộc❌
ăn lẩu ✅",90,1741524580,ăn xúc xích luộc ăn lẩu
7479765767446954760,7479764801384680722,TienTran,cái này là luộc chứ kphai chiên nhé,77,1741518692,cái này là luộc chứ kphai chiên nhé
7479765401960121104,7479764801384680722,Depzaiii¿,Mong anh reppppppp,4,1741518614,mong anh reppppppp
7479781481260598034,7479764801384680722,không tìm thấy tài khoản,"xem mukbang❌
nghe nhạc✅",4,1741522357,xem mukbang nghe nhạc
7479820267868603156,7479764801384680722,Hanh Sun,Người Nhật ăn lành mạnh là chém đấy ạ 😂😂😂 toàn chiên rán thui 😅😅😅,1,1741531380,người nhật ăn lành mạnh là chém đấy ạ toàn chiên rán thui
7479785350375162632,7479764801384680722,H.Linh😀,luộc,1,1741523251,luộc
7481671851824775943,7479764801384680722,NĐPhg🗿,luộc mà anh🤡🤡,1,1741962484,luộc mà anh
7479789846560817927,7479764801384680722,Dyn mọt sách 📚,vậy hả,1,1741524304,vậy hả
7479766301122151176,7479764801384680722,𝙉𝙊𝘽𝙄𝙏𝘼 𝙂𝘼𝙉 𝟲 𝙈𝙐𝙄,Ò thì ra là vậy🗿,1,1741518821,ò thì ra là vậy
7479863655509689104,7479764801384680722,ђ๒ภђ,Cho vào lo chiên k dầu cho nhanh ngon mê,1,1741541480,cho vào lo chiên k dầu cho nhanh ngon mê
7490103029779579655,7479764801384680722,Thành,chiên nhập nước à,1,1743925527,chiên nhập nước à
7484183948803146503,7479764801384680722,Trần Kiều,"xúc xích này ngon lắm, nhà mình toàn mua của hãng này ko a",1,1742547397,"xúc xích này ngon lắm, nhà mình toàn mua của hãng này ko a"
7480110652195930888,7479764801384680722,Cater,"🙄 luộc thì kêu đi, còn chiên ạ",1,1741598988,"luộc thì kêu đi, còn chiên ạ"
7480127932753576711,7479764801384680722,mình buồn^^,17% còn lại là j thế ah,0,1741603015,17% còn lại là j thế ah
7479785879244145415,7479764801384680722,Minh Hiệp,Em làm nhà hàng toàn đem ra rán dầu,0,1741523378,em làm nhà hàng toàn đem ra rán dầu
7479768161471906566,7479764801384680722,ღ꧁𓆩❤︎𓆪꧂ღ,cho hỏi chiên bằng nc lọc thì khác j luộc ạ,0,1741519281,cho hỏi chiên bằng nc lọc thì khác j luộc ạ
7479800274967102228,7479764801384680722,hoài nam,thịt 83% thế 17% còn lại là hóa chất 👌,0,1741526727,thịt 83% thế 17% còn lại là hóa chất
7489779919019361042,7479764801384680722,#quangson!➴,chiên bằng nước lọc thì hết cả bình gas,0,1743850291,chiên bằng nước lọc thì hết cả bình gas
7482760159593562898,7479764801384680722,umm,"如果你读了这篇评论，你的父母100年后会非常健康。要激活此诅咒，您需要将其复制并粘贴到另外五个视频中
Hãy dịch đi nhé,không hối hận đâuu🥰",0,1742215876,"100 hãy dịch đi nhé,không hối hận đâuu"
7509796600493425426,7479764801384680722,:)),Ở nhà em chiên lạp xưỡng cả nhà đều chiên bằng nl thôi,0,1748510786,ở nhà em chiên lạp xưỡng cả nhà đều chiên bằng nl thôi
7479765611251385106,7479764801384680722,общий?,hí anh,0,1741518659,hí anh
7479803106667250440,7479764801384680722,HHsky,lúc đầu tưởng fans ổng,0,1741527384,lúc đầu tưởng fans ổng
7479768437720908560,7479764801384680722,Thanh chả cá😏👹,Sớmmmmm,0,1741519310,sớmmmmm
7480113781432353558,7479764801384680722,Mai Hoa,Nghe câu người nhật toàn ăn kiểu lành mạnh nó cứ cấn cấn,0,1741599730,nghe câu người nhật toàn ăn kiểu lành mạnh nó cứ cấn cấn
7480361318823887634,7479764801384680722,Chill chill,"Nhật đi siêu thị đồ ăn sẵn đa phần toàn chiên, xúc xích cx lần đầu nghe chiên băng nước lọc. Ở nhật 8 năm chưa gặp bh🤣",0,1741657368,"nhật đi siêu thị đồ ăn sẵn đa phần toàn chiên, xúc xích cx lần đầu nghe chiên băng nước lọc. ở nhật 8 năm chưa gặp bh"
7524818792875721480,7479764801384680722,FIvesaKen,chiên nước lọc á🥰,0,1752008417,chiên nước lọc á
7487588377258296072,7479764801384680722,ĐẶC CẦU TULEN,thua ponnie 88%😂,0,1743340040,thua ponnie 88%
7487973574997934865,7479764801384680722,Hank,phải gọi luộc chứ nhỉ?,0,1743429728,phải gọi luộc chứ nhỉ?
7480858592992838418,7479764801384680722,lúc tệ lúc không 🤓,"ê bth tui cũng chiên nước á, cho đỡ dầu mỡ",0,1741773135,"ê bth tui cũng chiên nước á, cho đỡ dầu mỡ"
7554981862365790983,7479764801384680722,Bò bt bay mà,Bắt:)?,0,1759031301,bắt:)?
7479780933684904712,7479764801384680722,HZZ,55k rẻ thế,0,1741522221,55k rẻ thế
7480144525102465810,7479764801384680722,MUSIC men ❤️‍🔥🎶🎵,stay with me,0,1741606880,stay with me
7489690922449011473,7479764801384680722,Pi Lai,ê t thấy giống luộc hơn .,0,1743829574,ê t thấy giống luộc hơn .
7479866764009440008,7479764801384680722,thuylinh996,Tim hộ vd nick phungngockhanhlinh01 với ạ,0,1741542209,tim hộ vd nick phungngockhanhlinh01 với ạ
7479821602168947463,7479764801384680722,6 6 7 7,chấm điểm nhật kí 🤣,0,1741531696,chấm điểm nhật kí
7479788010834379527,7479764801384680722,Phan Bội Chill,luộc à?,0,1741523866,luộc à?
7495373843025822471,7479764801384680722,Hồng Minh,luộc mà chứ chiên rán gì,0,1745152735,luộc mà chứ chiên rán gì
7492005509501076231,7479764801384680722,Bells,ở miền tây chiên bằng nc dừa nc lọc bth mà,0,1744368484,ở miền tây chiên bằng nc dừa nc lọc bth mà
7480089507505668871,7479764801384680722,Ming Tâm đêy 🤷‍♀️🚩,Lạp xưởng cg thế lun nhe cứng mềm chiên bằng nc lọc tất bao ngon,0,1741594067,lạp xưởng cg thế lun nhe cứng mềm chiên bằng nc lọc tất bao ngon
7480559845659493138,7479764801384680722,Spyz агент😪,Em rùi nè,0,1741703582,em rùi nè
7480473273258296082,7479764801384680722,ᴅɪᴏ_ʙʀᴀɴᴅᴏ☆,"""Chiên"" & ""Rán"" 🤡🤡🤡",0,1741683431,"""chiên"" & ""rán"""
7480039663273984789,7479764801384680722,Hoàng Longg👣,luộc mà,0,1741582465,luộc mà
7499009813385872146,7479764801384680722,sờ ki bị đi,rán❎️luộc✅️,0,1745999300,ránluộc
7485310950335021831,7479764801384680722,ko có tên,xúc xích luộc,0,1742809787,xúc xích luộc
7480164075617174290,7479764801384680722,qhuyy_,Xúc xích Ponie 88% thịt cơ-)),0,1741611433,xúc xích ponie 88% thịt cơ-))
7480517600741573394,7479764801384680722,Huy Duong,chiên thử r nó cũng giòn ra phết đấy,0,1741693738,chiên thử r nó cũng giòn ra phết đấy
7535374812212265746,7479764801384680722,🖇️⋆baongoc౨ৎ,xích xích chiên bằng nước lọc giòn cực á,0,1754466179,xích xích chiên bằng nước lọc giòn cực á
7484510172309816082,7479764801384680722,PhanTom,ko chiên nước lọc thì mik dùng nc dừa,0,1742623342,ko chiên nước lọc thì mik dùng nc dừa
7481717545646048017,7479764801384680722,Thằng đàn bà,Luộc ạ,0,1741973132,luộc ạ
7481238448138879762,7479764801384680722,ly thích ngủ,nhật mà ăn lành mạnh lạy chúa tôi . đồ ăn thì ngọt dầu mỡ ngập trời 😢 . xúc xích nhật ko ngon ăn ngán muốn chơzt,0,1741861583,nhật mà ăn lành mạnh lạy chúa tôi . đồ ăn thì ngọt dầu mỡ ngập trời . xúc xích nhật ko ngon ăn ngán muốn chơzt
7487589007056995089,7479764801384680722,...,Luộc à:),0,1743340182,luộc à:)
7480310097777459986,7479764801384680722,THINHTTS19🇻🇳35🇯🇵,Anh sai rồi nhật bản toàn đồ chiên rán thôi 🤣,0,1741645453,anh sai rồi nhật bản toàn đồ chiên rán thôi
7480158301126673172,7479764801384680722,Nào đẹp gái thì tao đổi tên 🐣,"T chiên nước lọc mà , đỡ ngấy",0,1741610090,"t chiên nước lọc mà , đỡ ngấy"
7480106655330878225,7479764801384680722,Đồ xinh ở đây🎀,Ở nhật làm gì có 🧐,0,1741598065,ở nhật làm gì có
7479765729853670164,7479764801384680722,Qhuychapbi,"tim để gia đình khỏe mạnh, hạnh phúc",0,1741518687,"tim để gia đình khỏe mạnh, hạnh phúc"
7479803533572473617,7479764801384680722,🤡,Rẻ ha. Bigc có kh nhỉ,0,1741527485,rẻ ha. bigc có kh nhỉ
7480026411298718482,7479764801384680722,bị tử kỉ 💿,Xúc xích th,0,1741579378,xúc xích th
7495352425332114194,7479764801384680722,1257,chứ có ép buộc phải ăn nước lọc đâu chiên dầu bình thường,0,1745147741,chứ có ép buộc phải ăn nước lọc đâu chiên dầu bình thường
7479811817423143687,7479764801384680722,Tú,Khác j luộc,0,1741529409,khác j luộc
7479815732625457927,7479764801384680722,Trangvo1010,xúc xích cx có nhiều loại chiên = nc lọc là do nó có mỡ nhiều như lạp xưởng nếu đem chiên dầu sẽ bị ngán ( mn ko thấy cục xúc xích a hải đăng cầm có mỡ ở ngoài à 🙂,0,1741530321,xúc xích cx có nhiều loại chiên = nc lọc là do nó có mỡ nhiều như lạp xưởng nếu đem chiên dầu sẽ bị ngán ( mn ko thấy cục xúc xích a hải đăng cầm có mỡ ở ngoài à
7479948316588573447,7479764801384680722,🎀୨ৎ. ❀.ᥫ᭡.𐙚,Xx luộc chứ chiên j,0,1741561209,xx luộc chứ chiên j
7479765426009162504,7479764801384680722,Ẩn dụ ^^,sớm nè,0,1741518612,sớm nè
7521403263565415176,7479764801384680722,文阮草原 (Wén Ruǎn Cǎo Yuán),Bán ở đâu vậy ạ,0,1751213169,bán ở đâu vậy ạ
7479791993679381255,7479764801384680722,ngô tuấn hưng,nó có khác gì luộc đâu,0,1741524798,nó có khác gì luộc đâu
7479788434660262674,7479764801384680722,Tung tung tung sahur,Cái này là luộc chứ 😅,0,1741523965,cái này là luộc chứ
7479801016058610439,7479764801384680722,Đồng Văn,Xúc xích dán nc ❌xúc xích nấu✅,0,1741526898,xúc xích dán nc xúc xích nấu
7479823191352083207,7479764801384680722,DLS,Xúc xích nhìn ngol mà ko dc ăn😋,0,1741532059,xúc xích nhìn ngol mà ko dc ăn
7479815896992531218,7479764801384680722,OKBro🐉,"Loại này ăn ok , mặn",0,1741530363,"loại này ăn ok , mặn"
7479765769242215175,7479764801384680722,toanvo7420,xúc xích ponie 88% thịt mà:>,0,1741518694,xúc xích ponie 88% thịt mà:>
7479986382465155858,7479764801384680722,Numberrrrrrrr1,giá ?,0,1741570081,giá ?
7479777465839682311,7479764801384680722,Hà,Anh luộc mà?,0,1741521422,anh luộc mà?
7480033813747516178,7479764801384680722,Dirak^^ômloss,bonnie 88% cơ mà,0,1741581109,bonnie 88% cơ mà
7480056186936967954,7479764801384680722,CHANE⚓️,sao ở nhật mà t chưa thấy baoh,0,1741586319,sao ở nhật mà t chưa thấy baoh
7480065442155299600,7479764801384680722,gia huy,này là luộc chứ chiên nước lọc ở đâu 😋,0,1741588480,này là luộc chứ chiên nước lọc ở đâu
7480103536270017296,7479764801384680722,Lion.zwb🎬,Đây là xúc xích luộc mà 🐸🚬,0,1741597334,đây là xúc xích luộc mà
7480114960413999889,7479764801384680722,Duy Nam,Hẳn là ng nhật lành mạnh,0,1741599998,hẳn là ng nhật lành mạnh
7480132952832639751,7479764801384680722,Tiktok,lạp xưởng cũng rán bằng nước lọc mà,0,1741604182,lạp xưởng cũng rán bằng nước lọc mà
7480162602629153543,7479764801384680722,Văn Hiếu,"Xúc xích luộc ❎
Xúc xích chiên nước ✅
:))",0,1741611091,xúc xích luộc xúc xích chiên nước :))
7480183664434873106,7479764801384680722,Mạnh,thế là rán hay luộc,0,1741615989,thế là rán hay luộc
7480422012126446353,7479764801384680722,pнυonganн,t kinh khủng hơn cơ t bỏ vào bình siêu tốc:),0,1741671495,t kinh khủng hơn cơ t bỏ vào bình siêu tốc:)
7479768169826140946,7479764801384680722,Nguyen,20🦋 1kfl tik tok🥰🥰,0,1741519248,20 1kfl tik tok
7479817685288846087,7479802141662596370,TTH,Vô coi bằng chatGpT cho lẹ,2,1741530783,vô coi bằng chatgpt cho lẹ
7479811262408803080,7479802141662596370,Tiên Sinh Kể Chuyện,Đúng nhận sai cãi,2,1741529290,đúng nhận sai cãi
7480187883472470827,7479802141662596370,Leo🐀,Có phí nha cả nhà,0,1741616994,có phí nha cả nhà
7480108961925956370,7479802141662596370,Shop. Mẹ.Mít,Bất ngờ nha,0,1741598605,bất ngờ nha
7479812636579693320,7479802141662596370,Hồng Thắm,đÚNG thiệt nha mấy ní,1,1741529603,đúng thiệt nha mấy ní
7479809014898508552,7479802141662596370,Oyster is me,"Ê, app này hỏi 5 câu đầu đúng hết, sợ thế 😳",1,1741528761,"ê, app này hỏi 5 câu đầu đúng hết, sợ thế"
7480109328038478599,7479802141662596370,thuytramxinh3,"Tui xem tử vi thấy đúng rồi đó nha, kiểu này các thầy bói lại mất nghề",0,1741598690,"tui xem tử vi thấy đúng rồi đó nha, kiểu này các thầy bói lại mất nghề"
7479805444970840840,7479802141662596370,520 STORE VN,Để t tải về thử xong quay lại cmt,1,1741527926,để t tải về thử xong quay lại cmt
7479810484487029512,7479802141662596370,Học Tiếng Anh 10s,Các thầy mất nghề ngang rồi😂😂😂,1,1741529105,các thầy mất nghề ngang rồi
7479804340687373063,7479802141662596370,Hai ngón chí tôn 🔮,ở đời nếu biết trước mọi chuyện thì còn j thú vị và đáng sống nữa,2,1741527675,ở đời nếu biết trước mọi chuyện thì còn j thú vị và đáng sống nữa
7480011524565025553,7479802141662596370,Thợ Săn,mê tính quá bn oi,1,1741575917,mê tính quá bn oi
7480129766704579336,7479802141662596370,Gia Linh Phát,Mất tý ph.í đỡ phải xếp hàng,0,1741603437,mất tý ph.í đỡ phải xếp hàng
7480051161262867216,7480022905380687112,🍬𝐊ẹ𝐨 𝐓𝐰𝐢𝐱💗  ˃ 𖥦 ˂,Like cái ... Chiều mai trúng số 🥰,1731,1741585151,like cái ... chiều mai trúng số
7480124719480931090,7480022905380687112,Мужской бог 💙,Xưa coi Thành Ý Võ giờ coi Tủn cùi bắp ❤️❤️,209,1741602268,xưa coi thành ý võ giờ coi tủn cùi bắp
7480149980402959112,7480022905380687112,PKQT 21h 22/10🆚️Miu Tỷ🇻🇳,ý tưởng hay thật,23,1741608154,ý tưởng hay thật
7480119595631133448,7480022905380687112,Sam 💞,thuý liễu gần nhà tui nè m.n nói thật á😳,35,1741601078,thuý liễu gần nhà tui nè m.n nói thật á
7480176029207888647,7480022905380687112,🧏🏻‍♀️ Mèo Béo Dễ Thương ❤️🐈,T thấy tk Tũn này oki chứ LTK t thấy trả có j hay 😆 chắc mỗi t 1 kiẻu kk,7,1741614216,t thấy tk tũn này oki chứ ltk t thấy trả có j hay chắc mỗi t 1 kiẻu kk
7480048805188518664,7480022905380687112,.HN,nhà thiết kế miền tây,22,1741584601,nhà thiết kế miền tây
7480093320569176850,7480022905380687112,ƁŦ亗𝘚𝘜𝘕⁀ᶦᵈᵒᶫ,làm idol toptop cx khó lắm chứ,9,1741594959,làm idol toptop cx khó lắm chứ
7480155571598181127,7480022905380687112,Nguyễn Thanh Tiến Đạt🤡,đặc biệt 97 này ko bỏ con,23,1741609448,đặc biệt 97 này ko bỏ con
7480141220917101328,7480022905380687112,bbboy✈️,t thấy hay hơn LTK nhiều luôn,129,1741606107,t thấy hay hơn ltk nhiều luôn
7484130973128409864,7480022905380687112,An-An,Hay hơn ltk nhiều,4,1742535059,hay hơn ltk nhiều
7489835937943569173,7480022905380687112,Nhi Pham,mỗi lần đi học về ăn cơm là phải coi tủn cùi bắp không coi là không được huhu☺️,5,1743863340,mỗi lần đi học về ăn cơm là phải coi tủn cùi bắp không coi là không được huhu
7480050279573832455,7480022905380687112,buonngu24/7,ai mà hay coi fb thường xuyên là phải biết đến tủn ra đường hỏi là ai cũng biet🥰,8,1741584938,ai mà hay coi fb thường xuyên là phải biết đến tủn ra đường hỏi là ai cũng biet
7481145404559147783,7480022905380687112,Trần Lâm,hây hơn lê tuấn khang,5,1741839925,hây hơn lê tuấn khang
7482268486464799495,7480022905380687112,Lucas Huế,Ko biet sao nữa. Xem tủn là vui liền,4,1742101413,ko biet sao nữa. xem tủn là vui liền
7480580389262934805,7480022905380687112,miss a 24h~,ko xui mai tim cả ngày,8,1741708364,ko xui mai tim cả ngày
7480934150007948050,7480022905380687112,Nôbita,thích xém tũn hơn le tuân khang,3,1741790729,thích xém tũn hơn le tuân khang
7489081086040081160,7480022905380687112,Cẩm Huệ,"Mình cũng hay xem của e ấy hơn, ltk coi Ko hiểu mấy",3,1743687580,"mình cũng hay xem của e ấy hơn, ltk coi ko hiểu mấy"
7480859118924808967,7480022905380687112,SAKURA OFF VĨNH VIỄN......,tui tên Nguyễn Chí Thiện 😍,2,1741773258,tui tên nguyễn chí thiện
7480112572404187905,7480022905380687112,bún ZY,ông này cái gì cx nghĩ ra đk lun á😁,5,1741599449,ông này cái gì cx nghĩ ra đk lun á
7513177848539300616,7480022905380687112,Hồng Yến Nguyễn Thị,🥰🥰Tủn cùi bắp rất sáng tạo nghệ thuật và chịu đầu tư ! Hay lắm em !,0,1749298038,tủn cùi bắp rất sáng tạo nghệ thuật và chịu đầu tư ! hay lắm em !
7484220375452042005,7480022905380687112,Nguyễn Châu,Sao thích so sánh quá mỗi người có 1 thế mạnh riêng 😳,2,1742555868,sao thích so sánh quá mỗi người có 1 thế mạnh riêng
7482417197756744455,7480022905380687112,phuonghuong@y,Tủn ra vi deo thực tế nhất,2,1742136030,tủn ra vi deo thực tế nhất
7481134388341097234,7480022905380687112,jein🌻,lướt xuống thấy lun,2,1741837353,lướt xuống thấy lun
7487754023685964551,7480022905380687112,Lương Minh Huệ,xem cuốn lắm ngày nào cũng xem,2,1743378628,xem cuốn lắm ngày nào cũng xem
7481300007137559303,7480022905380687112,Tuấn Phạm,Nội dung mới sáng tạo tốt OK,2,1741875909,nội dung mới sáng tạo tốt ok
7481456493428196116,7480022905380687112,lương Thị Lý (độc thân vui vẻ,siêu đỉnh luôn,2,1741912369,siêu đỉnh luôn
7483144294468190984,7480022905380687112,Ước được xinh 💃🏼,Ngày nào k team Tủn k chịu dk🤣🤣,2,1742305313,ngày nào k team tủn k chịu dk
7486383699064603393,7480022905380687112,trangKay0🎶29A6868🇻🇳🇻🇳🇻🇳,Tôi rất thích b này xem thấy rất vui ❤️,2,1743059564,tôi rất thích b này xem thấy rất vui
7486115241035137810,7480022905380687112,hạnh,cô rất thích xem còn diễn,2,1742997044,cô rất thích xem còn diễn
7490177062737953556,7480022905380687112,Minh tú 1987,Cười chết lun á,2,1743942759,cười chết lun á
7481272137186624274,7480022905380687112,shadow garden,bằng tủi với ai đó tên là j97,2,1741869422,bằng tủi với ai đó tên là j97
7481258803087491847,7480022905380687112,shin béo chăm chỉ,hay thật,2,1741866322,hay thật
7483877618032460551,7480022905380687112,Triều Đại Nhà Nguyễn,ổng mà có thêm dàn edit xịn với những camera men xịn nữa thì ổng đạt nhà sáng tạo nội dung luôn quá❤❤❤,2,1742476064,ổng mà có thêm dàn edit xịn với những camera men xịn nữa thì ổng đạt nhà sáng tạo nội dung luôn quá
7509103099098022663,7480022905380687112,Khưu Lương Minh Danh,5.7M hơn thg 10 mấy M nào đó lâu lâu ra clip rồi nhờ drama với khiết đan mới nổi mà tụi nó tôn sùng 😂,1,1748349526,5.7m hơn thg 10 mấy m nào đó lâu lâu ra clip rồi nhờ drama với khiết đan mới nổi mà tụi nó tôn sùng
7481302700568265480,7480022905380687112,Tuấn anh,xem tủn hay hơn thằng Tuấn khang tỉ lần?,4,1741876537,xem tủn hay hơn thằng tuấn khang tỉ lần?
7480946280039432968,7480022905380687112,𝘿𝙖̂𝙪𝙪玉兔🌸,coi Liễu là quất mấy tô côm liên tục cuốn quãii,2,1741793550,coi liễu là quất mấy tô côm liên tục cuốn quãii
7480907324812526343,7480022905380687112,Nguyễn thu thủy,e thích xem a tủn hơn.,2,1741784481,e thích xem a tủn hơn.
7482209591909253909,7480022905380687112,Lặng ♥️♥️(🍄 nấm),ăn cơm tui phải coi tủn mới chịu ngeng k xem ăn cơm k ngon,1,1742087694,ăn cơm tui phải coi tủn mới chịu ngeng k xem ăn cơm k ngon
7480958154298999572,7480022905380687112,ᥫ᭡.ĐỨ☪_ҨųÝ.,Tui rất thích xem bạn này,2,1741796315,tui rất thích xem bạn này
7481319306681664276,7480022905380687112,Bé Nhiii,Xem video ông có ý nghĩa hơn,1,1741880404,xem video ông có ý nghĩa hơn
7484945479089357569,7480022905380687112,ANH MƯỜI BA,tui tên Chí Thiện,2,1742724700,tui tên chí thiện
7490144457783575304,7480022905380687112,⊱𝙇𝙤𝙫𝙚 𝙊𝙗𝙨𝙚𝙨𝙨𝙞𝙤𝙣⊰,trc có j97 giờ có t97,1,1743935169,trc có j97 giờ có t97
7489994624958743314,7480022905380687112,Tú❤️,phim ma tui thích xem nhất hơn mấy khác,1,1743900290,phim ma tui thích xem nhất hơn mấy khác
7490051418730349319,7480022905380687112,ⴼⓊ₦ⓖ Trầm TínЋ 2K1o,chả xem bao h,1,1743913520,chả xem bao h
7489455697924784917,7480022905380687112,GiGi⭐,thích tũn😁,1,1743774810,thích tũn
7489966650914849544,7480022905380687112,Quỳnh Hương,"tuyệt vời quá , rất thích xem mà ko chán , giỏi lắm luôn 💖🌹🌹🌹🌹🌹",1,1743893819,"tuyệt vời quá , rất thích xem mà ko chán , giỏi lắm luôn"
7490081294887944968,7480022905380687112,2k văn giang,e mình Nguyễn Thanh chí thiện,1,1743920472,e mình nguyễn thanh chí thiện
