comment_id,video_id,username,comment_text,digg_count,create_time,clean_text
7489421509602624264,7489265961791393042,Khang phát 🪷🪷,"Thương quá , bị v lo chết l",0,1743766843,"thương quá , bị v lo chết l"
7489294416877749000,7489265961791393042,Chiều Hoàng,"Quản giáo,trinh sát nắm tình hình kém quá",1,1743737258,"quản giáo,trinh sát nắm tình hình kém quá"
7489309137329079060,7489265961791393042,Hiếuuuuu,Tù tội khổ lắm,1,1743740691,tù tội khổ lắm
7518672977140761362,7489265961791393042,anhtenphu¿•¿,thanh lâm gắt the ma van trốn dc,0,1750577477,thanh lâm gắt the ma van trốn dc
7489362118341395208,7489265961791393042,changdory,người ta chửi mắng mẹ mình vài câu cái là sẳn sàng vi phạm pháp luật để tỏ lòng hiếu thuận với cha mẹ....(các trẩu cho hay),0,1743753016,người ta chửi mắng mẹ mình vài câu cái là sẳn sàng vi phạm pháp luật để tỏ lòng hiếu thuận với cha mẹ....(các trẩu cho hay)
7489450984195703570,7489265961791393042,thanhtai06060,G nhiều lí do đi tù lắm chứ đâu phải đi tù là người xấu ko đâu,0,1743773710,g nhiều lí do đi tù lắm chứ đâu phải đi tù là người xấu ko đâu
7489449084811985682,7489265961791393042,Hoàng Giang♥️♥️,lại thêm 3 năm đau điếng người,0,1743773265,lại thêm 3 năm đau điếng người
7489271428437672712,7489267848586530056,namtrung4811,Cứ người nhà nước vi phạm là đau bụng với bị trôm mất mũ bảo hiểm.,123,1743731904,cứ người nhà nước vi phạm là đau bụng với bị trôm mất mũ bảo hiểm.
7489289463982736146,7489267848586530056,Minh Minh,"Tài xế biển xanh kêu là ông, gặp biển số trắng là đối tượng ngay 😂",428,1743736099,"tài xế biển xanh kêu là ông, gặp biển số trắng là đối tượng ngay"
7489286483884655378,7489267848586530056,🎋🪴Sơn Hạ thu đông❄️🇻🇳,Cán bộ học luật mà phạm luật phạt gấp đôi so với thường dân thì mới đáng phục,14,1743735417,cán bộ học luật mà phạm luật phạt gấp đôi so với thường dân thì mới đáng phục
7489371296401556242,7489267848586530056,ANH BOY,Hợp lý phết😆😆😆😆😆,14,1743755153,hợp lý phết
7489268924095398674,7489267848586530056,Nghĩa 18t,Người nhà muốn nói gì chả đc🤭,490,1743731334,người nhà muốn nói gì chả đc
7489275271805240082,7489267848586530056,Kube22121980,"Giải thích này không chấp nhận được, gì bây giờ quán cafe vào uống ly Cafe vẫn đi vê sinh được, hay tram xăng dầu vẫn cho đi vê sinh OK ,",4,1743732812,"giải thích này không chấp nhận được, gì bây giờ quán cafe vào uống ly cafe vẫn đi vê sinh được, hay tram xăng dầu vẫn cho đi vê sinh ok ,"
7489297054251320072,7489267848586530056,Hữu Duyên,gặp dân thì khỏi giải thích 🤭,66,1743737871,gặp dân thì khỏi giải thích
7489325280826311442,7489267848586530056,Tôi người Thái Bình!!!,lý do cực kỳ thuyết phục luôn!🤣🤣🤣,5,1743744437,lý do cực kỳ thuyết phục luôn!
7489277229336970002,7489267848586530056,phongcanglong,xe biển xanh thì dấu tên sao ko công khai,291,1743733259,xe biển xanh thì dấu tên sao ko công khai
7489287054875427592,7489267848586530056,batuoc,😂dân đen đau bụng là mệt ráng mà nhịn về tới nhà,7,1743735542,dân đen đau bụng là mệt ráng mà nhịn về tới nhà
7489316814708622097,7489267848586530056,Người vận chuyển,lý do quá thuyết phục😂,6,1743742477,lý do quá thuyết phục
7489332745522168594,7489267848586530056,Quang Nguyễn,m đùa t à 😂😂,3,1743746181,m đùa t à
7489293687320134408,7489267848586530056,doilacatbuilata25,lấy lí do hài nhỉ 😂😂😂😂😂😂,73,1743737085,lấy lí do hài nhỉ
7489269034850370311,7489267848586530056,Cường Khoẻ Mỗi Ngày,Dừ cam chạy bằng cơm nhiều quá,8,1743731364,dừ cam chạy bằng cơm nhiều quá
7489269074997314311,7489267848586530056,Nghiale_0902,"😂😂😂Lý luận ,, chỉnh chu ????",7,1743731363,"lý luận ,, chỉnh chu ????"
7489271616053986056,7489267848586530056,minhnguyen,Lý do hợp lý nộp phạt,0,1743731964,lý do hợp lý nộp phạt
7490086908321252104,7489267848586530056,AutoZone-Phụ Kiện Ô Tô,Đau à không tha nhé,1,1743921769,đau à không tha nhé
7489400894908515073,7489267848586530056,Dũng Ka,Lý do đó thì ai vượt cũng nói được mà,2,1743762046,lý do đó thì ai vượt cũng nói được mà
7489597759957123860,7489267848586530056,Phi Phi Ong Rừng,đau bụng mất toi 10 củ,1,1743807919,đau bụng mất toi 10 củ
7489272549001200402,7489267848586530056,Ôg Chú 9x,mấy a biển xanh gê lắm,2,1743732172,mấy a biển xanh gê lắm
7489501184405242632,7489267848586530056,Rô bp,Nhà nước bấy giờ mất lòng tin với dân rồi,1,1743785402,nhà nước bấy giờ mất lòng tin với dân rồi
7489287138237235976,7489267848586530056,minhnguyen132200,Biển đỏ cx thế thôi,1,1743735562,biển đỏ cx thế thôi
7489430802167644936,7489267848586530056,Tran Huyen,ủa tưởng đèn đỏ rẽ phải đc đi mà,3,1743769013,ủa tưởng đèn đỏ rẽ phải đc đi mà
7489340990228398849,7489267848586530056,LK,Không có ngoại lệ,1,1743748107,không có ngoại lệ
7508939202161558290,7489267848586530056,Htu vui vẻ 🍃,"Hôm thứ 7 thấy 1 chiếc biển xanh cung vượt đèn đỏ. Lúc đầu đen đỏ còn thấy dừng , lúc sau còn 2 mấy giây đèn đỏ cái thấy chạy luôn",0,1748311166,"hôm thứ 7 thấy 1 chiếc biển xanh cung vượt đèn đỏ. lúc đầu đen đỏ còn thấy dừng , lúc sau còn 2 mấy giây đèn đỏ cái thấy chạy luôn"
7489350621536928520,7489267848586530056,nguoinhaque,cứ nói là phạt nặng mà họ không hề sợ,0,1743750341,cứ nói là phạt nặng mà họ không hề sợ
7503559996195111687,7489267848586530056,Cậu ba 🐥,có chuyện cái là có lý do hết à,0,1747058716,có chuyện cái là có lý do hết à
7490094908523496210,7489267848586530056,Đinh Hoàng Điệp 1987,"ủa bị phạt hả , tính áp dụng mà thôi bỏ ý định đó😂😂",0,1743923628,"ủa bị phạt hả , tính áp dụng mà thôi bỏ ý định đó"
7489617817370444551,7489267848586530056,tuantrinhminh2024,Tiêu chuẩn kép!👍,0,1743812563,tiêu chuẩn kép!
7489298426477052680,7489267848586530056,Bảo cali là chặn.,Ai cũng đau bụng như ông thì chúng tôi biết xử lý như thế nào😂,0,1743738199,ai cũng đau bụng như ông thì chúng tôi biết xử lý như thế nào
7489362357815182098,7489267848586530056,hoàng Sơn,vượt đèn đỏ rồi nói đau bụng chắc nhiều lần rồi,0,1743753068,vượt đèn đỏ rồi nói đau bụng chắc nhiều lần rồi
7489361303188243207,7489267848586530056,Tôi người Thái Bình!!!,khó thế mà bác cũng nghĩ ra được!😂😂😂,0,1743752838,khó thế mà bác cũng nghĩ ra được!
7489276171147690770,7489267848586530056,Tiệp Dolce 💋,thế bị đau bụng đi vs mà dừng làn khẩn cấp thì sao ad,0,1743733013,thế bị đau bụng đi vs mà dừng làn khẩn cấp thì sao ad
7489364140693160722,7489267848586530056,Trai Nghèo Củ Chi,"Đau bụng đi cầu thì ghé vào cây xăng còn đau về cái khác đi bệnh viện,",0,1743753494,"đau bụng đi cầu thì ghé vào cây xăng còn đau về cái khác đi bệnh viện,"
7489292939493114642,7489267848586530056,Bụng Mỡ ❤️,Vượt đèn đỏ mà bị trừ có 4₫ ☹️☹️,0,1743736916,vượt đèn đỏ mà bị trừ có 4
7489312976840377089,7489267848586530056,Hien Sang,quay video rồi đành phạt thôi ... chứ họ muốn đâu 😂,0,1743741586,quay video rồi đành phạt thôi ... chứ họ muốn đâu
7489339125814166279,7489267848586530056,Hải Nguyễn(62k1)độc thân,đủ lý do😂😂😂,0,1743747666,đủ lý do
7489332115138495250,7489267848586530056,Về Đây Anh Lo,Đau bụng mà tốn 20 củ quá đắt,0,1743746028,đau bụng mà tốn 20 củ quá đắt
7489337132209963783,7489267848586530056,Tictok0828,Hôn trước tôi đau bụng vào nhà nghỉ một tiếng mà vợ đuổi tôi ra khỏi nhà.,0,1743747200,hôn trước tôi đau bụng vào nhà nghỉ một tiếng mà vợ đuổi tôi ra khỏi nhà.
7489670828859720456,7489267848586530056,Hùng Nguyễn,Ghé quán cà phê hay quán ăn là tiết kiệm được cả chục triệu rồi 🤣,0,1743824894,ghé quán cà phê hay quán ăn là tiết kiệm được cả chục triệu rồi
7489702721886536456,7489267848586530056,user7865251171197,Vn luon có lý do chính đang 😂😂😂,0,1743832327,vn luon có lý do chính đang
7489549775941419777,7489267848586530056,kusoc,lý do..thua,0,1743796757,lý do..thua
7489358412292702983,7489267848586530056,thích đủ thứ 79,nhiều lí do lắm,0,1743752156,nhiều lí do lắm
7503113285400642322,7489267848586530056,đinh trương,dân vs cán bộ nó khác nhau lắm vn ạ,0,1746954715,dân vs cán bộ nó khác nhau lắm vn ạ
7489358395294040839,7489267848586530056,🫂❤️❤️🫂,Sao k ghé quán,0,1743752160,sao k ghé quán
7489604835832365832,7489267848586530056,Duc vien 09199,lại có lí do mới r 😂😂😂,0,1743809566,lại có lí do mới r
7489275817639461650,7489267848586530056,Nam87 Nami HL✅,"👏👏👏hoan hô, ý thức biển xanh rồi lý với do",0,1743732934,"hoan hô, ý thức biển xanh rồi lý với do"
7489291519803851536,7489267848586530056,phongtrnh16,Cứ sao đỗ lỗi,0,1743736581,cứ sao đỗ lỗi
7512461779017499410,7489267848586530056,Nguyễn Công2804,Thôi thôi 😂😂😂,0,1749131316,thôi thôi
7489300060615967496,7489267848586530056,Thai Bui,Lý do hợp lý,0,1743738572,lý do hợp lý
7489305410303656722,7489267848586530056,Ti Ti Mom,"Chẳng lẽ lại bảo, tại sếp bảo cứ vượt đi không phạt đâu mà sợ 🤣🤣🤣",0,1743739818,"chẳng lẽ lại bảo, tại sếp bảo cứ vượt đi không phạt đâu mà sợ"
7489423868274328338,7489267848586530056,NhẫnThiênPhúc1993,nói gì nói phạt hay k thì cái a gửi video là dc 5t rồi đó 😁😁😂,0,1743767399,nói gì nói phạt hay k thì cái a gửi video là dc 5t rồi đó
7489316105342829330,7489267848586530056,Phong ở 63,Cũng có kênh tick xanh nói bị đau lưng nữa,0,1743742312,cũng có kênh tick xanh nói bị đau lưng nữa
7489275799264101138,7489267848586530056,Hùng võ,Tao tin 100% nha😏😏😏😏😏,0,1743732933,tao tin 100% nha
7507958971736621842,7489267848586530056,Bùi  Hóa,không xử phạt luôn 😅,0,1748082929,không xử phạt luôn
7489272343476175634,7489267848586530056,Moon MC,😅 lên chức thì không thấy đau bụng,0,1743732123,lên chức thì không thấy đau bụng
7489322961896522503,7489267848586530056,TẠP HÓA ONLINE Ghen Z,😅 vtv này càng ngày càng mặn,0,1743743899,vtv này càng ngày càng mặn
7489630904043602695,7489267848586530056,Hoàng tử ếch,Họ vẫn nộp phạt bình thường chứ có chối tội đâu.,0,1743815613,họ vẫn nộp phạt bình thường chứ có chối tội đâu.
7489498257401807624,7489267848586530056,BigM,mấy tk biển xanh nó chạy như bay nhìn còn sợ hơn xe cont,0,1743784719,mấy tk biển xanh nó chạy như bay nhìn còn sợ hơn xe cont
7489387543445652242,7489267848586530056,Honey 1206,toàn trò đùa,0,1743758938,toàn trò đùa
7489333942513451794,7489267848586530056,An Lê,cali trong này nhiều thật..,0,1743746455,cali trong này nhiều thật..
7489380840624046866,7489267848586530056,Minn💋❤️,ê cười chết luôn á 😆😆😆,0,1743757373,ê cười chết luôn á
7489308854259335944,7489267848586530056,Hoài Nam,Quá nà hợp lý 😃😃😃,0,1743740619,quá nà hợp lý
7489395574941188871,7489267848586530056,Phan Tấn Doanh,Lý do rất thuyết phục...😂😂😂,0,1743760803,lý do rất thuyết phục...
7489277186404549383,7489267848586530056,Huỳnh 0 Híp,Ôi dời ôi,0,1743733260,ôi dời ôi
7489274235115717384,7489267848586530056,khịa vui thôi đừng giận,hợp lý đó chứ . t yêu cầu nên đưa vào luật . được ưu tiên,0,1743732565,hợp lý đó chứ . t yêu cầu nên đưa vào luật . được ưu tiên
7489279784464401160,7489267848586530056,củ cải,Kiểu nào cũng nói được 😅,0,1743733852,kiểu nào cũng nói được
7490562724234347271,7489267848586530056,ánh huyền baby 2015,giờ đỗ thửa đau bụng nghe sao sao,0,1744032553,giờ đỗ thửa đau bụng nghe sao sao
7489344518605865735,7489267848586530056,út cà mau,ủa quẹo phải mà sao phạt ta,0,1743748918,ủa quẹo phải mà sao phạt ta
7489404585308832520,7489267848586530056,찬반하이 Hải hay hát,rẽ phải dc mà,0,1743762902,rẽ phải dc mà
7489285376206537479,7489267848586530056,Dũng Rồng,lý do hài quá.,0,1743735157,lý do hài quá.
7489403748792419080,7489267848586530056,lee anh nuôi,dân co kêu dau bụng duoc ko,0,1743762706,dân co kêu dau bụng duoc ko
7489670016443843335,7489267848586530056,chuphivlogs,"Thương chú quá, nhưng chú đừng ỷ biển số xah",0,1743824706,"thương chú quá, nhưng chú đừng ỷ biển số xah"
7502592589389005586,7489267848586530056,Siêu Cấp Mồm Điêu 🐣,sao không nói bị Tào Tháo đuổi lý do hơn,0,1746833488,sao không nói bị tào tháo đuổi lý do hơn
7489280538923074325,7489267848586530056,Thầy Nam Trừ Tà 🫠,sao k thấy kỷ luật ???,0,1743734027,sao k thấy kỷ luật ???
7489846454767223559,7489267848586530056,Fernn 🪴,"biển đỏ biển xanh chạy ngoài đường như xe ưu tiên, chèn hết người này tới ngk, có lạ gì đâu",0,1743865782,"biển đỏ biển xanh chạy ngoài đường như xe ưu tiên, chèn hết người này tới ngk, có lạ gì đâu"
7489359835935998728,7489267848586530056,callbaybi,Có ai tin k,0,1743752490,có ai tin k
7489285483312186120,7489267848586530056,ဗီူᑭᕼươᑎǤᑕòᎥ˚🦋,Lý do cái giề,0,1743735188,lý do cái giề
7489706519995630343,7489267848586530056,Người đến sau 6886,"Một lý do quá con nít,",0,1743833202,"một lý do quá con nít,"
7489302629476025108,7489267848586530056,Michael,"Ông ơi là ông, vào quán cf ngay lề đường, làm ly cf và xin đi nhờ nhà vs, quạt mát nc ngon, 25k giờ thành 20 củ luôn 🤨",0,1743739175,"ông ơi là ông, vào quán cf ngay lề đường, làm ly cf và xin đi nhờ nhà vs, quạt mát nc ngon, 25k giờ thành 20 củ luôn"
7489758136178983687,7489267848586530056,Cỏ Ba Lá ☘️☘️☘️,lý do to hơn sự thật,0,1743845226,lý do to hơn sự thật
7489316802061714194,7489267848586530056,Não cá vàng,Video này chưa đủ để làm bằng chứng 😳,0,1743742463,video này chưa đủ để làm bằng chứng
7491325060469572360,7489267848586530056,TuiKhôngKìCục,ủa lúc xe đem chạy vô còn xe máy cũng rẽ vào sao k kiếm xe kia luôn nhể,0,1744210047,ủa lúc xe đem chạy vô còn xe máy cũng rẽ vào sao k kiếm xe kia luôn nhể
7489447613398958868,7489267848586530056,ltvinh,"Vô gặp công an bảo là: ""20 củ, nói ít thôi""😂😂",0,1743772921,"vô gặp công an bảo là: ""20 củ, nói ít thôi"""
7489272335225668360,7489267848586530056,Ngọc Linh,hợp đồng còn cỡ này,0,1743732119,hợp đồng còn cỡ này
7489304232127202055,7489267848586530056,Minh Chiến,tin vịt. sao k nói rõ tên đi úp mở lại lên phường bây giờ 😂,0,1743739537,tin vịt. sao k nói rõ tên đi úp mở lại lên phường bây giờ
7489430114599961352,7489267848586530056,❤Dũng❤,lý do cũng ok đó😂,0,1743768849,lý do cũng ok đó
7489686497294484232,7489267848586530056,gonni256,luôn có lý do...!😂,0,1743828542,luôn có lý do...!
7489427961331237633,7489267848586530056,Lê Lực,phạt hành chính. biện minh đau bụng,0,1743768354,phạt hành chính. biện minh đau bụng
7489624048001352456,7489267848586530056,thaisalem479,dân ngta chết người cũng phải dừng đèn đỏ.,0,1743814023,dân ngta chết người cũng phải dừng đèn đỏ.
7506444409014207239,7489267848586530056,Hoàng Sài thành,mình cũng đau bụng 😂,0,1747730295,mình cũng đau bụng
7489453516659458824,7489267848586530056,24Th3,Phí đi wc là 19 củ,0,1743774295,phí đi wc là 19 củ
7489316885143290631,7489267848586530056,Sunny Ngọc Tuấn,😂🤣 có mỗi cán bộ tin,0,1743742489,có mỗi cán bộ tin
7490151843302195976,7489300733129510151,Cẩm Tú đâyyy nè,ý là nội dung mình viết bằng chat GPT đúng ko,190,1743936887,ý là nội dung mình viết bằng chat gpt đúng ko
7490105056098304775,7489300733129510151,Toan Minh,cơm tấm 150k thì mua 4 hộp Hồng Calmet ăn cho đã.,20,1743926002,cơm tấm 150k thì mua 4 hộp hồng calmet ăn cho đã.
7490101880375821074,7489300733129510151,The Punisher86,"Bánh mì nó phải đỉnh như thế , ăn mới đã cái nư 🤩",41,1743925256,"bánh mì nó phải đỉnh như thế , ăn mới đã cái nư"
7508107468870861575,7489300733129510151,Minh Thưu,Cơm tấm sài gòn vk ck tui ăn nhiều r mà rcm cho mng quán cơm tấm cô thuý bên thủ đức siu ngon. Vk ck tui đi chơi về tối hay ghé ăn mặc dù ngược đường,0,1748117505,cơm tấm sài gòn vk ck tui ăn nhiều r mà rcm cho mng quán cơm tấm cô thuý bên thủ đức siu ngon. vk ck tui đi chơi về tối hay ghé ăn mặc dù ngược đường
7490016476231172871,7489300733129510151,Đinh Thi,Ăn 1 lần bánh mì Huynh Hoa và cũng là duy nhất. Ớn,72,1743905383,ăn 1 lần bánh mì huynh hoa và cũng là duy nhất. ớn
7490331149622412039,7489300733129510151,Quan Dang6800,Nhìn cái bà nướng sườn cơm tấm ba ghiền mặc đồ cái hết muốn ăn,2,1743978665,nhìn cái bà nướng sườn cơm tấm ba ghiền mặc đồ cái hết muốn ăn
7489876945376707335,7489300733129510151,nguyenhuong2803,Mà nó ngán quá ăn có nữa ổ ngán ăn k nổi luôn áz,11,1743872892,mà nó ngán quá ăn có nữa ổ ngán ăn k nổi luôn áz
7507341339475837714,7489300733129510151,♏,bánh mì hh thì 1 ổ 2ng ăn oki với tui thì n nhạt!t thích bánh mì có sốt xíu mại đậm đà hay cá nục kho mía hơn. cơm 3 ghiền khá ngon nhưng hơi ngọt!sủi cảo htq ngon😌 cơm 3há ngon!,0,1747939128,bánh mì hh thì 1 ổ 2ng ăn oki với tui thì n nhạt!t thích bánh mì có sốt xíu mại đậm đà hay cá nục kho mía hơn. cơm 3 ghiền khá ngon nhưng hơi ngọt!sủi cảo htq ngon cơm 3há ngon!
7510661687269507857,7489300733129510151,Henry Lưu,Bánh mì Huỳnh Hoa có ship Cần Thơ k ạ,1,1748712208,bánh mì huỳnh hoa có ship cần thơ k ạ
7490172175724053256,7489300733129510151,Quinn,"Mình mới mua 73k /ổ , ăn không tới nữa ổ nữa mà ngán không ăn nổi 😂",3,1743941626,"mình mới mua 73k /ổ , ăn không tới nữa ổ nữa mà ngán không ăn nổi"
7509875379453707015,7489300733129510151,Shusu,Chắc do t nghèo á bây nên cảm thấy ăn bánh mì thịt khìa pate hay bánh mì heo quay 10k 1 ổ là ngon nhất á.chứ nhìn thấy nhiều pate quá cũng hơi ngán à,0,1748529124,chắc do t nghèo á bây nên cảm thấy ăn bánh mì thịt khìa pate hay bánh mì heo quay 10k 1 ổ là ngon nhất á.chứ nhìn thấy nhiều pate quá cũng hơi ngán à
7505269407393317639,7489300733129510151,Độc Bước,Bỏ bơ đi ăn đỡ ngấy ngay,0,1747456720,bỏ bơ đi ăn đỡ ngấy ngay
7507971623359726343,7489300733129510151,Thuỷ Thu,Tôi ăn bánh mì HH ko thấy ngon..,0,1748085874,tôi ăn bánh mì hh ko thấy ngon..
7508058419108446984,7489300733129510151,Bánh Bao Xá Xíu,trà đào dầm đợi 1 tiếng )),0,1748106082,trà đào dầm đợi 1 tiếng ))
7504625930745545489,7489300733129510151,Đông Hà Review cửa,"Ăn cơm ghiền quá nhiều và quá mắc, ăn 1 lần ko dám quay lại",0,1747306902,"ăn cơm ghiền quá nhiều và quá mắc, ăn 1 lần ko dám quay lại"
7491283961130550023,7489300733129510151,Huỳnhđô,"ê ở quê quán cơm tấm ruột của t ăn 7,8 năm nay có 25k thôi còn free trà đá nữa, 150k là t ăn đc 1 tuần r 😅😅",1,1744200479,"ê ở quê quán cơm tấm ruột của t ăn 7,8 năm nay có 25k thôi còn free trà đá nữa, 150k là t ăn đc 1 tuần r"
7505821810979095297,7489300733129510151,Đỗ Phương,b canh 50k ng phi khanh cũng bt nhưng do khu q1 đắt đỏ và ít hàng nên ok tại đó😏,0,1747585337,b canh 50k ng phi khanh cũng bt nhưng do khu q1 đắt đỏ và ít hàng nên ok tại đó
7510705378612675335,7489300733129510151,<Thiên Vũ Tu La Kiếm Thần>,Tui là team ăn cả ổ vẫn ko ngán 😂😂,0,1748722384,tui là team ăn cả ổ vẫn ko ngán
7515403561913336592,7489300733129510151,Ngoc Phung,😂coi khỏi kéo qua ăn hết tô mì cay kkkk🤪,1,1749816258,coi khỏi kéo qua ăn hết tô mì cay kkkk
7490587179406132023,7489300733129510151,Thu Nguyen,Từ lúc được Michilen 3 ghiền hết ngon luôn,1,1744038272,từ lúc được michilen 3 ghiền hết ngon luôn
7507349255163986695,7489300733129510151,Hoàng Sơn,ai tóm tắt hộ ik:)),0,1747940976,ai tóm tắt hộ ik:))
7490046243796861714,7489300733129510151,atỷ,"Review có tâm chút nek, có vị này vị kia chứ ko phải mấy review kia toàn khen làm như chuẩn lắm á (chắc có chia cổ phần 😁)",0,1743912301,"review có tâm chút nek, có vị này vị kia chứ ko phải mấy review kia toàn khen làm như chuẩn lắm á (chắc có chia cổ phần )"
7490501978151469832,7489300733129510151,zang.6666,K ăn được 1/3 cái bánh mì huynh hoa 🥲 vì quá ngán,0,1744018418,k ăn được 1/3 cái bánh mì huynh hoa vì quá ngán
7494311184293430024,7489300733129510151,Kỉ Niệm Xưa,tinh ra đĩa com 150k đo. mình đi ăn đĩa 30k và mua thêm 120k thịt trứng chả bì thì đc nhiều như đĩa đo ko nhỉ hay nhiều hon,0,1744905312,tinh ra đĩa com 150k đo. mình đi ăn đĩa 30k và mua thêm 120k thịt trứng chả bì thì đc nhiều như đĩa đo ko nhỉ hay nhiều hon
7490675517847405320,7489300733129510151,URBANJEANS,Cảm ơn chợ lớn😂,0,1744058830,cảm ơn chợ lớn
7491245920718357264,7489300733129510151,Thoa top 1,Ai nói gì nói t vẫn thích bánh mì Huynh Hoa,0,1744191632,ai nói gì nói t vẫn thích bánh mì huynh hoa
7491245250528232199,7489300733129510151,Nguyễn Tấn Khanggg,nay lên 78k hay 73k r anh ơi,0,1744191472,nay lên 78k hay 73k r anh ơi
7506008441937691408,7489300733129510151,LivinPMH,toàn mấy quán ngon k nha,0,1747628800,toàn mấy quán ngon k nha
7490515132800844551,7489300733129510151,Kha Nguyễn,Huynh Hoa lên 72k rồi mà 😃,0,1744021475,huynh hoa lên 72k rồi mà
7534329169078944534,7489300733129510151,Mi,Uầy list này chất lượng á để lưu lại đi ăn dần,0,1754222725,uầy list này chất lượng á để lưu lại đi ăn dần
7495831353859801877,7489300733129510151,Anh²,"Ê mê bánh mì Huynh Hoa dữ á, bữa h chưa ăn 🤤",0,1745259262,"ê mê bánh mì huynh hoa dữ á, bữa h chưa ăn"
7490313000994882311,7489300733129510151,Tien Ich Sach va Xanh SG,BM ruột thịt nguội chế biến nhiều quá không biết có gia vị gì trong đó,0,1743974434,bm ruột thịt nguội chế biến nhiều quá không biết có gia vị gì trong đó
7494514861184140050,7489300733129510151,KatKat,"ở chợ Tân Định có bánh canh phồng tôm ngon lắm bạn, quán nằm phía sau lưng bệnh viện quận 1 à",0,1744952733,"ở chợ tân định có bánh canh phồng tôm ngon lắm bạn, quán nằm phía sau lưng bệnh viện quận 1 à"
7503232408570594056,7489300733129510151,Ngọc Trinh,bánh mì nhìn ngon mà mình hk ăn pate bơ đc 😳,0,1746982449,bánh mì nhìn ngon mà mình hk ăn pate bơ đc
7490922223587869447,7489300733129510151,Danghaivinhthao,Rr lo,0,1744116255,rr lo
7490916313696174855,7489300733129510151,INVOKER,điều gì ngán hơn 1 ổ bánh mì bình thường. đó là 1 ổ bánh mì nhiều topping.hơn.,0,1744114883,điều gì ngán hơn 1 ổ bánh mì bình thường. đó là 1 ổ bánh mì nhiều topping.hơn.
7492589836851774225,7489300733129510151,Oanh Lê,Ngon nhất là bánh tráng trộn,0,1744504535,ngon nhất là bánh tráng trộn
7506194679717888786,7489300733129510151,Steve Phan,Dân SG chính gốc mà chưa bao giờ muốn ăn bm HH. Nó chỉ thu hút dân nhập cư và khách du lịch thôi,0,1747672151,dân sg chính gốc mà chưa bao giờ muốn ăn bm hh. nó chỉ thu hút dân nhập cư và khách du lịch thôi
7490299101117088513,7489300733129510151,MÌ TRỘN CHÚ HOÀN,"Sao lại nhắc tên siro Trinh chi vậy, không hay đâu...",0,1743971189,"sao lại nhắc tên siro trinh chi vậy, không hay đâu..."
7511025217592410898,7489300733129510151,Đoàn,m.n chịu sếp hàng chờ ghê nhỉ . mình thì chịu rồi 😅😅😅,0,1748796847,m.n chịu sếp hàng chờ ghê nhỉ . mình thì chịu rồi
