comment_id,video_id,username,comment_text,digg_count,create_time,clean_text
7539811214956757761,7539777942935653633,Nội Thất Lạc Gia Furniture,"Miền ngoài rồi , chỉ có miền ngoài thôi 😂",0,1755499106,"miền ngoài rồi , chỉ có miền ngoài thôi"
7539825260884460289,7539777942935653633,xem cho vui,"có giải phân cách, thì xe có ngược chiều k?",0,1755502380,"có giải phân cách, thì xe có ngược chiều k?"
7540158643201000214,7539777942935653633,blockminecraftno      🌾,Nó con cháu cán bộ là cái chắc,0,1755580029,nó con cháu cán bộ là cái chắc
7539798799561278216,7539777942935653633,Lí Xiào,chắc chưa nạp 4G bữa giờ,0,1755496215,chắc chưa nạp 4g bữa giờ
7539831860203094792,7539777942935653633,TRANG DẠY Ê TÔ🚗,Có phần 2 ko hóng quá,0,1755503916,có phần 2 ko hóng quá
7539802782091985684,7539777942935653633,Mạnh Tùng,Tình huống thật quen thuộc,0,1755497148,tình huống thật quen thuộc
7539810444087182088,7539777942935653633,Đình Tân,ko có 300tr tao ko mở mắt😂😂,0,1755498929,ko có 300tr tao ko mở mắt
7539793184689160976,7539777942935653633,Tuấn Anh,phen này bán xe xịn rút đơn 😂,0,1755494912,phen này bán xe xịn rút đơn
7539795963533165319,7539777942935653633,Văn Tiến,Lên ca em hối hận vì lúc đấy em mất kiểm soát 😂😂😂😂,0,1755495555,lên ca em hối hận vì lúc đấy em mất kiểm soát
7539801483459674887,7539777942935653633,Conduongdautu-Toanventaichinh,xuân này nên ko rõ 🥺,0,1755496843,xuân này nên ko rõ
7539791267456516885,7539777942935653633,iu,Hóng phần 2 ở trên phường 😌,0,1755494465,hóng phần 2 ở trên phường
7539791088555557633,7539777942935653633,.thanh.tú1988,Thấy đeo cái giỏ đăng trước là biết,0,1755494419,thấy đeo cái giỏ đăng trước là biết
7539932728205083399,7539777942935653633,✩‧₊˚🎐Mai⋆.˚˚୨୧⋆.˚,Chỗ cũ nhà T 😅😅,0,1755527394,chỗ cũ nhà t
7539806020337124114,7539777942935653633,𝑡𝑖𝑒̂̉𝑢 𝑡𝑜̂̉ 𝑡𝑜̂𝑛𝑔,Kịch bản chắc bác tài cũng thuộc rồi k cần tôi phải nhắc lại đâu nhỉ 😂,0,1755497895,kịch bản chắc bác tài cũng thuộc rồi k cần tôi phải nhắc lại đâu nhỉ
7539814540474024720,7539777942935653633,Anh Còi,từ lái thuê lên làm chủ ô tô ròi,0,1755499883,từ lái thuê lên làm chủ ô tô ròi
7539790100470006535,7539777942935653633,Anh bạn à,thần tài đến thần tài đến😍😍😍,0,1755494191,thần tài đến thần tài đến
7539789207028581141,7539777942935653633,van ly,chuan bi lên phường,0,1755493982,chuan bi lên phường
7539789691521106696,7539777942935653633,tinhquechoa37,có p2 cho tôi xem với,0,1755494094,có p2 cho tôi xem với
7539790000616260360,7539777942935653633,Lan Anh,Lại có tiền nữa,0,1755494164,lại có tiền nữa
7539819270503596807,7539777942935653633,Thay đổi từ đây,Ko đụng đc đâu,0,1755500982,ko đụng đc đâu
7539961347275342613,7539777942935653633,Thỏ Phê Cỏ(^◔ᴥ◔^),hành khách cũng muốn có 300tr 🐧,0,1755534059,hành khách cũng muốn có 300tr
7539794777408881429,7539777942935653633,nguyenthanhhai000,Chưa thấy lên phường,0,1755495279,chưa thấy lên phường
7539799171696837396,7539777942935653633,🌲 No2 🌲,thôi cũng ko có gì to tát cả 500 củ đc rồi 😁,0,1755496301,thôi cũng ko có gì to tát cả 500 củ đc rồi
7539790102223913735,7539777942935653633,♥ Dế Mèn ♥,khởi tố chưa😂😂😂😂,0,1755494192,khởi tố chưa
7540682786929132296,7539777942935653633,Mê tập gym,"Tài xế kiểu: tiền đến,tiền đến",0,1755702034,"tài xế kiểu: tiền đến,tiền đến"
7539791267522298642,7539777942935653633,Chí Mê câu,Chiều nay là có phần 2 👍,0,1755494460,chiều nay là có phần 2
7539789602291893009,7539777942935653633,Long,Nó lên phường chưa nhỉ,0,1755494076,nó lên phường chưa nhỉ
7539806387100041992,7539777942935653633,user59267583694532,thôi lại anh hùng rơm rồi lại mất vài chục củ,0,1755497983,thôi lại anh hùng rơm rồi lại mất vài chục củ
7539807660998263570,7539777942935653633,Minh Trung,mấy thằng này thích nổi trên mạng xã hội,0,1755498279,mấy thằng này thích nổi trên mạng xã hội
7539802174957454098,7539777942935653633,Sống dai như đĩa,lại thêm 1 thằng đi tìm bố,0,1755497001,lại thêm 1 thằng đi tìm bố
7539814241202258696,7539777942935653633,garaanhhong,lại có thang gia nhập giuventut,0,1755499812,lại có thang gia nhập giuventut
7539802627846357778,7539777942935653633,Vũ Gia,hóng lên phường 😂,0,1755497111,hóng lên phường
7539799162784826119,7539777942935653633,Nguu mới tap t 🥱,"sao bảo namkiki văn minh lắm mà, hóa ra cũng đi tìm bố à 😔",0,1755496303,"sao bảo namkiki văn minh lắm mà, hóa ra cũng đi tìm bố à"
7539786113326990098,7539777942935653633,Gia Cát Cùa,Hóng clip lên phường,0,1755493261,hóng clip lên phường
7539883454331290375,7539841976942841105,chơn lý,"không phải nói chứ cũng biết là vì miếng cơm manh áo, nhưng mà mấy cha xiet cá cũng ác lắm, ban ngày không đi đâu ở chỗ tôi nè biết người ta xiet chuộc cũng vô luôn",18,1755515922,"không phải nói chứ cũng biết là vì miếng cơm manh áo, nhưng mà mấy cha xiet cá cũng ác lắm, ban ngày không đi đâu ở chỗ tôi nè biết người ta xiet chuộc cũng vô luôn"
7539858631308444417,7539841976942841105,⠀ ⠀ ⠀ ⠀ ⠀᠌cậu ba,trời ơi đến năm 2024 vẫn dùng cách này để bắt chuột 😌,28,1755510146,trời ơi đến năm 2024 vẫn dùng cách này để bắt chuột
7540947661617382151,7539841976942841105,杜玉蘭,ở miền tây rãi của người ta như của nó muốn đi là đi còn rãi nó không ai đi qua được đâu ao cá người ta nó vô bất,0,1755763811,ở miền tây rãi của người ta như của nó muốn đi là đi còn rãi nó không ai đi qua được đâu ao cá người ta nó vô bất
7540081303775150855,7539841976942841105,Nguyễn Linh,"treo đèn cảnh báo,cặm cây rào mấy cái đầu bờ. mà còn sợ ngta lội vô ngồi tại cục xiệt để canh",0,1755562011,"treo đèn cảnh báo,cặm cây rào mấy cái đầu bờ. mà còn sợ ngta lội vô ngồi tại cục xiệt để canh"
7539850211322577671,7539841976942841105,Bs Trường toq,Đi tù đấy,2,1755508183,đi tù đấy
7540461779685491463,7539841976942841105,🆔😘 Anh muốn bên em 😘💝,chỗ tui họ câu vô điện gia đình có cp chống giật có gì nó tự bật lên,1,1755650591,chỗ tui họ câu vô điện gia đình có cp chống giật có gì nó tự bật lên
7539915699357418247,7539841976942841105,Quốc Huy,sao ko để đèn cảnh báo 🚨,6,1755523432,sao ko để đèn cảnh báo
7540028380700246800,7539841976942841105,bonsai Lý Lâm 88,"nhỏ mình đi trông nước vào ruộng cũng bị điện giật do 1 nhà dùng điện để bẫy chuột, may mình cố gắng bò lên khỏi ruộng được",0,1755549685,"nhỏ mình đi trông nước vào ruộng cũng bị điện giật do 1 nhà dùng điện để bẫy chuột, may mình cố gắng bò lên khỏi ruộng được"
7540301953101431553,7539841976942841105,Thanh ʇʇʇʇ̛̣nɥN,đèn cảnh báo đâu,0,1755613363,đèn cảnh báo đâu
7539871043868918544,7539841976942841105,Hoàng Nam,lại là cường😅,0,1755513038,lại là cường
7539945166339031826,7539841976942841105,Tôi iu bé Thah Ha🤩❤️,67👍,0,1755530292,67
7540461386691035921,7539841976942841105,VẺ NÌ,gần chỗ tui nè,0,1755650504,gần chỗ tui nè
7540531156291273480,7539841976942841105,Ngọc Linh😋,xem nhật ký tớ follow hết 😢,0,1755666729,xem nhật ký tớ follow hết
7540864050348442384,7539841976942841105,thanhhero,chế chỗ tôi nè😅,0,1755744241,chế chỗ tôi nè
7539891142756090631,7539841976942841105,tđ,Châu đốc cũng có 1 vụ,2,1755517716,châu đốc cũng có 1 vụ
7539898787339911944,7539841976942841105,trong nhan 62,@Huỳnh T.Khang @✅Nguyễn Hoàng Phước Thịnh ✅ @Hà NumBer One @vnhiều62🎣🎣 @Thu Thu,0,1755519495,hoàng phước thịnh
7540114520413340424,7539841976942841105,𝙆.𝙉𝙜𝙤𝙘><,@ׁׅ᥎ׁׅꪱׁׁׁׅׅׅ̣tׁׅ ᝯׁ֒ᨵׁׅׅ݊ꪀ @ngò rí @🫧⃝𖤐 Ari💙💙 🪽 @rrrrrrrrrr biết dụ này chưa,1,1755569723,ari
7539867938300658439,7539841976942841105,ྀིྀི໒꒱Cườngજ⁀➴ ♡,Cũng sợ mấy thằng đó thiệt thấy đỏ đèn hết mà cũng cố đi vô siệt cho bằng đc😏,3,1755512309,cũng sợ mấy thằng đó thiệt thấy đỏ đèn hết mà cũng cố đi vô siệt cho bằng đc
7539872879799780097,7539841976942841105,Giang Nguyen,cho ở 30 năm là vừa,2,1755513467,cho ở 30 năm là vừa
7539889000346321672,7539841976942841105,Nguyễn Minh NgỌc,49 chưa qua 53 đã tới 🤔🤔🤔,1,1755517214,49 chưa qua 53 đã tới
7539862228917469960,7539841976942841105,daolehuuphat,thế các bộ trưởng đã nghĩ ra cách gì diệt chuột chưa🗿🗿,1,1755510982,thế các bộ trưởng đã nghĩ ra cách gì diệt chuột chưa
7539857017579832082,7539841976942841105,Long Cắt Tóc,53 đã tới,1,1755509771,53 đã tới
7539941151706841874,7539841976942841105,Huỳnh Thanh,8năm khổ thân quá,0,1755529359,8năm khổ thân quá
7539945331204326151,7539841976942841105,Huyền Trân😅,mn ơi mik ở x.châu phong nek 😮,0,1755530333,mn ơi mik ở x.châu phong nek
7540110707204817672,7539841976942841105,lê lành,quê tui ruộng ai nấy bắt à,0,1755568840,quê tui ruộng ai nấy bắt à
7539950279435256594,7539841976942841105,sung 84,chuột 50kg,0,1755531485,chuột 50kg
7540243097171739400,7539841976942841105,🟦\/🟦ⁱⁿʰ☪𝖍ᴀ̂𝖚,đã có nhiều cái chết vì bẫy chuột mà vẫn còn nhiều nơi sử dụng,0,1755599660,đã có nhiều cái chết vì bẫy chuột mà vẫn còn nhiều nơi sử dụng
7540477174991258389,7539841976942841105,mây.trắng1986,phạt.mạnh.tay.lên cảnh báo hoài cũng có người ra.đi.,0,1755654169,phạt.mạnh.tay.lên cảnh báo hoài cũng có người ra.đi.
7539878329991594770,7539841976942841105,ngân châu tv,"biết như vậy mà vẫn làm,",0,1755514732,"biết như vậy mà vẫn làm,"
7540301052970894088,7539841976942841105,ken long xuyên,Ông xiệt chuột xiệt ông xiệt cá ông xiệt chuột đi tù😂,0,1755613155,ông xiệt chuột xiệt ông xiệt cá ông xiệt chuột đi tù
7540490877274800913,7539841976942841105,Phờ Ong Phong,"Vo ý, chứ cố ý gì. 😏",0,1755657355,"vo ý, chứ cố ý gì."
7540646832641344264,7539841976942841105,út uy tín 82,"chỗ tôi xã Phú Thành a ,T N, đồng tháp , còn xiệc chuộc",0,1755693661,"chỗ tôi xã phú thành a ,t n, đồng tháp , còn xiệc chuộc"
7539934890851156754,7539841976942841105,Huỳnh Thu Liễu🍀🍀🍀,có cảnh báo rất nhiều mà kg biết,0,1755527898,có cảnh báo rất nhiều mà kg biết
7539882248066368263,7539841976942841105,cô đơn,"chuột nó ăn 9 giờ trỏ lại, có diệt chuột bằng điện thì ở đó giữ, rồi tháo về",0,1755515643,"chuột nó ăn 9 giờ trỏ lại, có diệt chuột bằng điện thì ở đó giữ, rồi tháo về"
7539902544219931413,7539841976942841105,Nổi buồn ko tên,nữa...bị hoài ko sợ mà....,0,1755520369,nữa...bị hoài ko sợ mà....
7539900404634010375,7539841976942841105,thủy,mà em hỏi nè ở an giang lúc này nước nổi rồi mà,0,1755519869,mà em hỏi nè ở an giang lúc này nước nổi rồi mà
7539897422308115208,7539841976942841105,user57128083399,bấy như thế ít ra phải gắn biển cảnh báo vào chứ🥺,0,1755519178,bấy như thế ít ra phải gắn biển cảnh báo vào chứ
7539892648376075016,7539841976942841105,vietnguyen6263,😇😇😇😭😭😭 nguy hiếm thật,0,1755518065,nguy hiếm thật
7539888123893220118,7539841976942841105,𝐊𝐚𝐢 🪅,xiệt chuột này rất nguy hiểm điện cao áp,0,1755517023,xiệt chuột này rất nguy hiểm điện cao áp
7539883076693852946,7539841976942841105,Trương Võ,bị hoài mà ko sợ,0,1755515840,bị hoài mà ko sợ
7540585399213064967,7539841976942841105,Tuấn bắt Tử. k5,chổ tôi một năm k biết bao nhiêu người mất như cũng phải làm k làm chuột cắn k còn một cây,0,1755679363,chổ tôi một năm k biết bao nhiêu người mất như cũng phải làm k làm chuột cắn k còn một cây
7539932922472563463,7539841976942841105,LQ...thái...bắt ông vò vẽ,ko có đèn báo sao mà vào đó xiệc vậy,0,1755527441,ko có đèn báo sao mà vào đó xiệc vậy
7540499023200928520,7539841976942841105,Do Le1423,lỗi do con chuột hợp tác xã nên mua chuột đồng sống với giá 1tr ₫ồng 1kg em sẽ bỏ cty về phối hợp với ae xóm bắt hết chuộc ngoài đồng giao nộp 👍,0,1755659250,lỗi do con chuột hợp tác xã nên mua chuột đồng sống với giá 1tr ồng 1kg em sẽ bỏ cty về phối hợp với ae xóm bắt hết chuộc ngoài đồng giao nộp
7539878384446210824,7539841976942841105,ngân châu tv,cần sử lí mạnh mẽ,0,1755514743,cần sử lí mạnh mẽ
7539850546129158919,7539841976942841105,ngoctanpham179,sao ko rút kinh nghiệm nhỉ,0,1755508266,sao ko rút kinh nghiệm nhỉ
7545982687460508472,7539963401196408082,Gloria,pequeña brillante🥰,6,1756936023,pequea brillante
7542900555472487175,7539963401196408082,Sùng Mí Sử,thứ mà đắt hơn cả vàng bạc chính là đây chứ đâu,124,1756218396,thứ mà đắt hơn cả vàng bạc chính là đây chứ đâu
7540264092109521682,7539963401196408082,Tomi_hongkong,gaya dan goyangan yang asyiikk dan keren 👍👍👍🌹🌹🌹,16,1755604550,gaya dan goyangan yang asyiikk dan keren
7542086096366568208,7539963401196408082,Pam loan,Yêu lắm cơ,17,1756028772,yêu lắm cơ
7540575021238158085,7539963401196408082,svetlana,"Звёздочка ,Красотулечеа ,Любимовка ,Супер!!!💯🔥🔥🔥",20,1755676966,", , ,!!!"
7544195554319844101,7539963401196408082,franciscochaga542,"Nossa que talento,prinseza linda maravilhosa 👏👏👏😂😂😂",6,1756519929,"nossa que talento,prinseza linda maravilhosa"
7541034241167295250,7539963401196408082,Bhimgole327,wow beauti ful 👌👌👌👌👌,6,1755783864,wow beauti ful
7542258279700169479,7539963401196408082,@Karola coronado,divina bendiciones🙏😇,6,1756068862,divina bendiciones
7540383849308013319,7539963401196408082,user6041398214761,Oh so cute,28,1755632445,oh so cute
7541064450259452694,7539963401196408082,Salvatore,BRAVISSIMA E BELLISSIMA 🌹🌹🌹,7,1755790902,bravissima e bellissima
7544216382104945415,7539963401196408082,Zem,Wowww.. cute sumayaw 🥰,9,1756524764,wowww.. cute sumayaw
7541041709455590166,7539963401196408082,humour jp,j'imagine dans 5 ans,9,1755785605,j'imagine dans 5 ans
7542891974114837255,7539963401196408082,박은영,완전 아기 아이돌입니다!^^,8,1756216397,!^^
7540473405834019592,7539963401196408082,Tere Osorno,HERMOSA! ASIÁTICA❤️💯,5,1755653283,hermosa! asiática
7542685866410509064,7539963401196408082,☎️ANH TRƯỜNG ☎️,❤️mơ ước của nhiều người... trong đó có tôi 🌹,37,1756168420,mơ ước của nhiều người... trong đó có tôi
7540431173803082517,7539963401196408082,sinh180,ôi trời dễ thương quá ước gì có một cô cháu gái như vậy,39,1755643467,ôi trời dễ thương quá ước gì có một cô cháu gái như vậy
7540960557794034450,7539963401196408082,Bhagawati shahi,wowow🥰👍👍👍👍,7,1755766709,wowow
7542084700479767304,7539963401196408082,bích thảo,cưng quá con gái,5,1756028440,cưng quá con gái
7545963393947026184,7539963401196408082,user3493654180879,janaaaa 😘,5,1756931815,janaaaa
7544126984839136008,7539963401196408082,Tony Nguyen,gioi qua vay,12,1756504233,gioi qua vay
7540391245727695637,7539963401196408082,Razu Khan,So beautifully nic vedio,9,1755634165,so beautifully nic vedio
7540461065499853586,7539963401196408082,thầy su ye,con gái của anh dễ thương nhảy đẹp quá,22,1755650420,con gái của anh dễ thương nhảy đẹp quá
7540450963792364296,7539963401196408082,user9387333295382,mong có con gái liền. dị mới là nhải chớ,11,1755648080,mong có con gái liền. dị mới là nhải chớ
7543575685945770770,7539963401196408082,zakirhossain750,good dancing,13,1756375591,good dancing
7541402910204134166,7539963401196408082,Erni Cabrera,"That's really cute, really cool.",5,1755869709,"that's really cute, really cool."
7541039095567909655,7539963401196408082,vioricaurian,"wow, wow ce copil dulce și talentat la dans!💯❤️❤️❤️❤️🥰🥰🥰🥰👍👍👍👍",17,1755785002,"wow, wow ce copil dulce i talentat la dans!"
7540508392957592376,7539963401196408082,carmentorres2127,tan pequeña y es una bailarina🥰🥰🥰🥰🥰🥰,21,1755661454,tan pequea y es una bailarina
7541021063981531906,7539963401196408082,Mimika-αγάπη,she will be a good actress when she'll grow up,36,1755780802,she will be a good actress when she'll grow up
7540916881092313863,7539963401196408082,user2536925067769,🥰you are so Cute & adorable kid🥰😍😍😍😍😍😘,6,1755756536,you are so cute & adorable kid
7540961824801604360,7539963401196408082,Teo Januhan Señal,wowww so cutie very nice,11,1755767005,wowww so cutie very nice
7540517743109735175,7539963401196408082,user7117553226657,Very Love🥰🥰🥰🥰🥰,24,1755663608,very love
7540964463676523282,7539963401196408082,user4618321313266,very fine... thanks !,8,1755767617,very fine... thanks !
7540917524126040850,7539963401196408082,Ali,sweet adorable doll 🥰🥰👏👏👏🥰🥰🥰🥰,5,1755756690,sweet adorable doll
7540532587648697106,7539963401196408082,Đinh phương,Con gái nhà người ta,9,1755667066,con gái nhà người ta
7540456960639910672,7539963401196408082,Edsum Olyamus,I love ur move baby girl.,8,1755649472,i love ur move baby girl.
7542116596497220370,7539963401196408082,🌈Thao Nguyên💥,Đời k đẻ con gái k nể🤔🤔🤔,6,1756035868,đời k đẻ con gái k nể
7541042957697942279,7539963401196408082,Lalu Kwt,Good good super happy ☺️☺️☺️☺️☺️,9,1755786019,good good super happy
7540546179797517063,7539963401196408082,userpon7w8a0an,Cưng quá động tác uyển chuyển tuyệt pé iu🥰🥰🥰😘😘😘,6,1755670226,cưng quá động tác uyển chuyển tuyệt pé iu
7540909608803435265,7539963401196408082,SHAHZAD KHAN,good dance,6,1755754850,good dance
7541834009219728136,7539963401196408082,Md Shorif,excellent. im Bhangladeshi,5,1755970072,excellent. im bhangladeshi
7543052163742122770,7539963401196408082,pumpui 😘❤️,"So cute, my daughter.❤️🥰",5,1756253719,"so cute, my daughter."
7544231580962194197,7539963401196408082,Vũ Đình Khương,sao mà dễ thương quá con gái ơi,6,1756528303,sao mà dễ thương quá con gái ơi
7540826677103821588,7539963401196408082,Elsa Barbecho,nice baby dance,6,1755735547,nice baby dance
7545288388431266616,7539963401196408082,lisMata,🥰🥰🥰🥰hermosa bailarina,10,1756774370,hermosa bailarina
7540528138817536776,7539963401196408082,Hoàng Nhu Mỳ,cưng trưa ne,43,1755666030,cưng trưa ne
7540767714143863570,7540117521551068423,Miguel Andrades,Ada Wong Young 🥰,38,1755721817,ada wong young
7540898033358799634,7540117521551068423,luisenrique,🔥🔥🔥🔥SHINRA TENSEI 🔥🔥🔥🔥,7,1755752152,shinra tensei
7540696386833351437,7540117521551068423,Shadow Blade,Asian ladies starting to eat American food! lol 👍🏼😍,36,1755705215,asian ladies starting to eat american food! lol
7540750195743851295,7540117521551068423,jtorres1995714,Camera 🎥 operator knew the assignment,6,1755717740,camera operator knew the assignment
7540690194208310036,7540117521551068423,rashu_mudhimu,Made in China.,12,1755703759,made in china.
7540813214062969613,7540117521551068423,Heinzeng,That's one Fine woman,7,1755732407,that's one fine woman
7540673651176866568,7540117521551068423,Roberto J Yepez,Caramba como han mejorado las orientales,10,1755699908,caramba como han mejorado las orientales
7540492978839913221,7540117521551068423,Brañes Tomas Robinson Jaime,apuesto que no lleva tatuajes 😅,7,1755657860,apuesto que no lleva tatuajes
7540300266157343494,7540117521551068423,alexfalcon6285,"Hermosa y elegante no hay que mostrar para verse estupenda, como se muestran algunas",83,1755612983,"hermosa y elegante no hay que mostrar para verse estupenda, como se muestran algunas"
7540758238305977093,7540117521551068423,Jhoangel Millán,"si no esta operada ni nada, ya gano",6,1755719610,"si no esta operada ni nada, ya gano"
7540575138678752006,7540117521551068423,dyn5vlqf9nsxДима,КРАСОТКА КАКАЯ!!!!!!!,7,1755676994,!!!!!!!
7540306016781959943,7540117521551068423,joml,Beauty Made woman,10,1755614308,beauty made woman
7540468940737463048,7540117521551068423,CURSORC36,"No me importa que vende!
Se lo compro!",5,1755652247,no me importa que vende! se lo compro!
7540445762561508113,7540117521551068423,💪🎱💵🌽THOMMY💪🌽🦈,team marino😎......💪,12,1755646866,team marino......
7540294678013412104,7540117521551068423,user186786,manhwa build 😍,8,1755611668,manhwa build
7540245823168103184,7540117521551068423,Ko ko,my type my type😁😁🥰,6,1755600302,my type my type
7540594562508047126,7540117521551068423,Manfred Butkiewicz,Ooooo my God it's beautiful 💖 beautiful...beauti.beautiful.beautiful🌹💋,6,1755681499,ooooo my god it's beautiful beautiful...beauti.beautiful.beautiful
7540607780793811728,7540117521551068423,user13155306552,ko thấy ai bl nhỉ😅😅😅,13,1755684568,ko thấy ai bl nhỉ
7540180752529507079,7540117521551068423,Tuấn Chạy Thận CS,quá tuyệt luôn ạ,7,1755585143,quá tuyệt luôn ạ
7542238843661206273,7540117521551068423,Ranzez G. gael,Un ejemplar Poko existente❤️,2,1756064341,un ejemplar poko existente
7542939246517732102,7540117521551068423,danielmarcelo3843,Musa🥰💘,1,1756227411,musa
7542099708875064071,7540117521551068423,🍓Suzie🍓,Ui v3 ❤️❤️❤️❤️❤️,1,1756031938,ui v3
7541319040054199046,7540117521551068423,Mario Lopes,como se llama?,3,1755850190,como se llama?
7541624882364482309,7540117521551068423,Raven,power 🔥👍,1,1755921411,power
7544703506042127126,7540117521551068423,twotierkier,Mommy?,1,1756638184,mommy?
7542165943108436759,7540117521551068423,Thơ Nguyễn inFinity 1985,thả ❤️cái may mắn cả năm🥰🥰,1,1756047361,thả cái may mắn cả năm
7543918777315296007,7540117521551068423,NTDANH💵,tim hộ mình vd😅,1,1756455593,tim hộ mình vd
7541869208771625750,7540117521551068423,Jaybird,my gosh 👏👏👏👏👏,1,1755978273,my gosh
7543353859193078535,7540117521551068423,Gấu MyLinh,chưa hiểu gì,1,1756323949,chưa hiểu gì
7542710967516513042,7540117521551068423,soái ca đẹp trai,quá đẳng cấp năm roi,1,1756174256,quá đẳng cấp năm roi
7542214279015252754,7540117521551068423,Thuy Le Nguyen,Sao hay dị quá,1,1756058615,sao hay dị quá
7543483142503695117,7540117521551068423,Mr. Michael Beal,Good looking 👌 💯 💪 👏 👍,2,1756354071,good looking
7542615802986824453,7540117521551068423,Sergiño,gym girl ada,1,1756152295,gym girl ada
7542671723503338247,7540117521551068423,MinhDat,úi trời !,1,1756165133,úi trời !
7541188314855981854,7540117521551068423,marcusgreen56,Her Genetics are through the roof! 😍,4,1755819770,her genetics are through the roof!
7541268973482345224,7540117521551068423,Lil Ry,she's so healthy and beautiful .,4,1755838732,she's so healthy and beautiful .
7541300828432401174,7540117521551068423,costi87miru,Of e câtă eleganță felicitări 🤗🤗🤗,2,1755845951,of e câtă elegană felicitări
7541298307445162774,7540117521551068423,Данчо Димчев,krasiva prkasna seksi,2,1755845359,krasiva prkasna seksi
7542335239034078008,7540117521551068423,D7ytjkjre,Si lo reconozco,1,1756086787,si lo reconozco
7540971890036474646,7540117521551068423,angeloamendola@70,Bella 🥰🥰💯💯,2,1755769355,bella
7541743810130395934,7540117521551068423,Alex Fernando,hermosa princesa 😍😍😘😍😘,1,1755949128,hermosa princesa
7541448980711031570,7540117521551068423,★★★★★★,terbaik lah 👍👍👍👍🥰,1,1755880424,terbaik lah
7540938784461734678,7540117521551068423,Affroun Akim,Bonjour 👋,2,1755761651,bonjour
7541785659477197573,7540117521551068423,luisca,ajá! y cuál es la idea de esto??,3,1755958821,ajá! y cuál es la idea de esto??
7540914624410206998,7540117521551068423,Ramin Ara,(っ'-')╮=͟͟͞͞💌,2,1755756033,('-')=
7540695056550839047,7540117521551068423,Niko Mailoa,hello.gils,2,1755704888,hello.gils
7540695376442311432,7540117521551068423,Niko Mailoa,all. sweets. you. gils,2,1755704964,all. sweets. you. gils
7543536809487450898,7540117521551068423,hiếu,xin code,2,1756366539,xin code
7540989561913541432,7540117521551068423,wilsonbarbosa250,bom dia bjos 😘😘,2,1755773752,bom dia bjos
7540788391043465991,7540117521551068423,Heka Energy,hola hermosa 🥰🥰🥰🥰🥰,2,1755726634,hola hermosa
7540751833225298710,7540117521551068423,antonio.montoya,si o no marino?,2,1755718111,si o no marino?
