comment_id,video_id,username,comment_text,digg_count,create_time,clean_text
7551369222241911569,7551358551822847239,ngang như cua,Nết nằm võng y chang t lun 😌,549,1758190167,nết nằm võng y chang t lun
7552545529952994055,7551358551822847239,mèo con🐾,ta đã từng 😍,7,1758464043,ta đã từng
7551985483732501255,7551358551822847239,⋅˚₊‧ ଳ⋆.࿔*:･ᴅʜ౨ৎ🐢🐰,Đoán là mới học tiết toán vs văn xong 😁,9,1758333654,đoán là mới học tiết toán vs văn xong
7552807960650547985,7551358551822847239,✮phương ✮,Cô ấy đã trải qua những gì,77,1758525150,cô ấy đã trải qua những gì
7551647309730939666,7551358551822847239,⋆. 𐙚 ˚𝓰𝓪𝓸 ᨶ႒ᩚ⋆.˚🦋༘⋆,Bạn đằng sau là biểu hình của t khi học 4t anh🙃🙃,92,1758254911,bạn đằng sau là biểu hình của t khi học 4t anh
7551478961667113735,7551358551822847239,nào mua xe điện đổi tên 😋,để ý bả nhảy ❌ để ý bà ngoài sao ✅,40,1758215713,để ý bả nhảy để ý bà ngoài sao
7551375437076644625,7551358551822847239,‧₊˚🖇️✩₊˚girl ff ⊹♡,Còn để ý đằng sau cô 😇,59,1758191612,còn để ý đằng sau cô
7551383535454995207,7551358551822847239,Nguyễn Phương Thuý🥵,nhìn trẻ như u30,7,1758193495,nhìn trẻ như u30
7551393356643844880,7551358551822847239,Thienn Trangg:>,s con cô giống con giữ v🤭,43,1758195784,s con cô giống con giữ v
7552379740574155528,7551358551822847239,Tènnnn,Con hc bài mẹ quay tóp tóp,5,1758425442,con hc bài mẹ quay tóp tóp
7552428063708971783,7551358551822847239,sát boy lạnh lùng:),"để ý cô nhảy❌
để ý người nằm ở võng✔",5,1758436857,để ý cô nhảy để ý người nằm ở võng
7551775625225782037,7551358551822847239,NGÂN hàng,Ai hại bà đằng sau zị🙂,75,1758284786,ai hại bà đằng sau zị
7551462821604377362,7551358551822847239,Em bé Cá 🐟🐳🐠,Xem nhảy ❌ nhìn 👀 bn đằng sau nằm võng ✅,5,1758211957,xem nhảy nhìn bn đằng sau nằm võng
7551472102013354770,7551358551822847239,có cảnh vs bố k?,hình ảnh của t sau khi học 9 tiết về là ở đằng sau^^,5,1758214117,hình ảnh của t sau khi học 9 tiết về là ở đằng sau^^
7551436875031233288,7551358551822847239,´꒳`ƙ♄áภ♄_ly♡,Chào sếp🙋🏻‍♀,5,1758205914,chào sếp
7553286798321320711,7551358551822847239,KAMADO NEZUKO🎍,"để ý bả nhảy🚫
để ý bà nằm võng✅",1,1758636636,để ý bả nhảy để ý bà nằm võng
7551651764291273488,7551358551822847239,Péliên💝,Ngắm hoa lệ rơi 😆,0,1758255952,ngắm hoa lệ rơi
7551366199600677639,7551358551822847239,𝐇𝐨à𝐧𝐠 𝐍𝐠ọ𝐜 𝐭â𝐦 𝐍𝐡𝐢,hình ảnh t hc ở phía sau,5,1758189465,hình ảnh t hc ở phía sau
7551442155647648520,7551358551822847239,₊˚⊹ 𝕟ắ𝕡 𝕟ồ𝕚 đ𝕚 𝕝ạ𝕔 ⊹˚₊,ủa cúc tịnh y về Việt r à 🥰,34,1758207143,ủa cúc tịnh y về việt r à
7552411795681133330,7551358551822847239,Đào Tuấn -vp,Để í bà nhảy❌,11,1758432908,để í bà nhảy
7553895818786620168,7551358551822847239,Không tìm thấy tài khoản,Mẹ thì nhảy . Con thì bất lực 🤣,3,1758778438,mẹ thì nhảy . con thì bất lực
7555756896369066773,7551358551822847239,T.A cute,chị ngồi đằng sau chắc học mệt mỏi quá à,1,1759211750,chị ngồi đằng sau chắc học mệt mỏi quá à
7562204723773014791,7551358551822847239,PTD 💔,nhỏ kia chc vừa hc xong 2 tiết toán 😳,1,1760713001,nhỏ kia chc vừa hc xong 2 tiết toán
7551661387556307720,7551358551822847239,🔥suu💢,cô ơi dép cô đâu dợ để con xách cho😅,3,1758258191,cô ơi dép cô đâu dợ để con xách cho
7551410890274800402,7551358551822847239,tổng tài hít le,cô ơi con cô ngất r kìa💀,4,1758199867,cô ơi con cô ngất r kìa
7551773307042398984,7551358551822847239,hoaithuong🤸‍♀️,xin lỗi cô nhma bạn đằng sau chiếm hết sì bót lai roi🥰,3,1758284247,xin lỗi cô nhma bạn đằng sau chiếm hết sì bót lai roi
7552937401305432850,7551358551822847239,gấu thuiis🫧,Cô ơi cho con xin link quần ạ,1,1758555284,cô ơi cho con xin link quần ạ
7551671463602946823,7551358551822847239,tào lao bí đao,Bạn đằng sau là biểu hình của t khi học 2t toán 🙃🙃,2,1758260534,bạn đằng sau là biểu hình của t khi học 2t toán
7551564526727168785,7551358551822847239,vk ah T 😝,chắc ms hc xng 2 văn 2 toán nek,3,1758235648,chắc ms hc xng 2 văn 2 toán nek
7551670572494160641,7551358551822847239,sầu riêng,kiểu này chắc học 3 tiết văn,3,1758260588,kiểu này chắc học 3 tiết văn
7551370026235839249,7551358551822847239,k.,sớm cô ơi-)),1,1758190353,sớm cô ơi-))
7553150806670607112,7551358551822847239,con lợn 🐷,nhìn cô này giống cô giáo tôi quá,1,1758604974,nhìn cô này giống cô giáo tôi quá
7553226601968042759,7551358551822847239,hả hả hả hả????,"để ý bả nhảy ❎
để ý đứa nằm võng ✅",1,1758622620,để ý bả nhảy để ý đứa nằm võng
7552478665143485202,7551358551822847239,👑pianoᯓ★👑,"để ý bả nhảy ×
để ý bả đằng sau✓",4,1758448481,để ý bả nhảy để ý bả đằng sau
7551775094940746504,7551358551822847239,Mai Lan 🍀,Con học mãi kh thuộc mẹ nhảy tt😂,2,1758284664,con học mãi kh thuộc mẹ nhảy tt
7551438298327040784,7551358551822847239,Im mồm đừng sủa,con cô đang sau à 🤣,1,1758206447,con cô đang sau à
7551675599724200725,7551358551822847239,Cô gái buồn,Chị kia học áp lực em cũng vậy cô ơi áp lực anh văn 🥰,1,1758261500,chị kia học áp lực em cũng vậy cô ơi áp lực anh văn
7551713496841929480,7551358551822847239,nghọi em là vợ anh là chồng,đang nằm,1,1758270319,đang nằm
7551385948459877127,7551358551822847239,bécute,sao cj kia nam keu gi di??,1,1758194063,sao cj kia nam keu gi di??
7551773811877544722,7551358551822847239,hé lô các boạn,xl cô con nhìn lộn chị đằng sau là nam😬,1,1758284365,xl cô con nhìn lộn chị đằng sau là nam
7551359987735347975,7551358551822847239,người lùn nhất thí giới 🐍,sớm cô uii,1,1758188012,sớm cô uii
7551461754464568081,7551358551822847239,suri và na nek,cái bà phía sau chiếm hết Sì bốt lai,1,1758211895,cái bà phía sau chiếm hết sì bốt lai
7551425757214622484,7551358551822847239,...!🖤,Tui là cái nết y hệt bà đằng sau😂,1,1758203325,tui là cái nết y hệt bà đằng sau
7551688911099151112,7551358551822847239,Thảo Vy,cô sì tin vậy 😁,1,1758264600,cô sì tin vậy
7551969421384925970,7551358551822847239,Tui yêu ban,Chị Nhìn vay chát Tre lám hay Em doán Chị 30 🥰🥰🥰,1,1758329912,chị nhìn vay chát tre lám hay em doán chị 30
7551815601687446273,7551358551822847239,💭TRƯƠNG TỔNG😴,tướng nằm khi tôi học bài...,1,1758294324,tướng nằm khi tôi học bài...
7551777116367799047,7551358551822847239,𝙩𝙝𝙪́𝙮 𝙫𝙮𝙮🌷,cô nhảy đẹp lắm lun á,1,1758285131,cô nhảy đẹp lắm lun á
7551701186081391367,7551358551822847239,୨ৎri୨ৎ🍭,để ý bả nhảy no để ý bà đằng sau,1,1758267457,để ý bả nhảy no để ý bà đằng sau
7551555722116530951,7551358551822847239,zoi tổng 293 🐘🐋,cô dẻo hơn con luôn á,3,1758233609,cô dẻo hơn con luôn á
7551977490127831828,7551358551822847239,trần thị ngọc,bạn đằng sau chắc làm ba tiết toán mới như thế,1,1758331982,bạn đằng sau chắc làm ba tiết toán mới như thế
7551359974548177672,7551358551822847239,Nh.,Sớm rồi nì,1,1758188008,sớm rồi nì
7551716564483965703,7551358551822847239,Đang chs đừng gọi,bn đằng sau vừa học xong 3 tiết văn,1,1758271034,bn đằng sau vừa học xong 3 tiết văn
7551444287872664340,7551358551822847239,keo 503😉,khi t hc xong tiết thế chất kiểu:🥰,1,1758207642,khi t hc xong tiết thế chất kiểu:
7551418862269924114,7551358551822847239,👤,bn đằng sau giống t khi học xong 3 tiết văn🥰,1,1758201722,bn đằng sau giống t khi học xong 3 tiết văn
7551359616186712839,7551358551822847239,bánh 🄳onut 🍩,sớm!,1,1758187926,sớm!
7551358871224091393,7551358551822847239,e cua~,sớm nhat,1,1758187759,sớm nhat
7551808763063550728,7551358551822847239,A.Ngoc✨,đoán vội bn đằng sau vừa hc xog 2 tiết toán😭,1,1758292503,đoán vội bn đằng sau vừa hc xog 2 tiết toán
7551421556413891336,7551358551822847239,Peter ok,🥰 ớ,1,1758202347,ớ
7551436880857137928,7551358551822847239,🍨kem🍦,đẹp quá cô ơi,1,1758205915,đẹp quá cô ơi
7551367411720979208,7551358551822847239,em chào sếp ạ!🫡.,ai mà đẹp vậy ta,1,1758189749,ai mà đẹp vậy ta
7553222876758000391,7551358551822847239,🍀4A🍀,chú ý người đang nhảy ❌,0,1758621750,chú ý người đang nhảy
7552471588814570258,7551358551822847239,8h truồng bò,để ý nhảy 💃 hay để ý người đằng sau,0,1758446827,để ý nhảy hay để ý người đằng sau
7552465337871713044,7551358551822847239,Xuân Trúc,Để í cô này nhảy ❌,0,1758445375,để í cô này nhảy
7551663590018990865,7551358551822847239,🫂👥,cô nhảy phát nào tự ái phái đó😅😳,0,1758258711,cô nhảy phát nào tự ái phái đó
7551667377734533908,7551358551822847239,ngọc ánh (chu che)🌹🎀,Con xin vía nhảy đẹp ạ🤭,0,1758259584,con xin vía nhảy đẹp ạ
7552898505058190098,7551358551822847239,𝙩.,bà nằm võng nhìn thấy cưng qua à,0,1758546228,bà nằm võng nhìn thấy cưng qua à
7552040471267672850,7551358551822847239,Kg,"T là bà ở sau , sau khi học xong 3tiết hoá",0,1758346451,"t là bà ở sau , sau khi học xong 3tiết hoá"
7552036384438174472,7551358551822847239,Hồng Thà🦋,cổ xinh,0,1758345497,cổ xinh
7551785946523140882,7551358551822847239,Hôm nay móc gì 🧶,+ một hình ảnh tôi lúc bé,0,1758287192,+ một hình ảnh tôi lúc bé
7554997106487771925,7551358551822847239,Lớp 7b,Chắc chỉ áp lực học tập thôi,0,1759034850,chắc chỉ áp lực học tập thôi
7553636987845608199,7551358551822847239,huyền Trang nie🎀,đoán cô ấy đã học 4 tiết anh văn,0,1758718168,đoán cô ấy đã học 4 tiết anh văn
7551817997238403848,7551358551822847239,kiwi🥝,u50 mà nhảy cuốn thí,0,1758294650,u50 mà nhảy cuốn thí
7551794202318996231,7551358551822847239,coccac,bà kia lm gi v cô,0,1758289110,bà kia lm gi v cô
7552403372483265298,7551358551822847239,vịt cute 68,khúc tát ghép hả,0,1758430945,khúc tát ghép hả
7552041182835639048,7551358551822847239,bánhquy💗💗🤪🍥,cô ơi bạn đằng sau lm zì v ạ,0,1758346617,cô ơi bạn đằng sau lm zì v ạ
7551745590008120071,7551358551822847239,🥑Adu e Bơ🥑,cô ko nói ko ai nhìn đâu,0,1758277795,cô ko nói ko ai nhìn đâu
7551777731009217288,7551358551822847239,27th7 🪷,ý là mình lớn rồi á 🗿,0,1758285276,ý là mình lớn rồi á
7552703082922558226,7551405933868436754,Cậu út Nam 86b1,Xem Bùi phương nga cái tự nhiên Tik Tok cho thấy video bạn này lun😅,145,1758500749,xem bùi phương nga cái tự nhiên tik tok cho thấy video bạn này lun
7551467459313058580,7551405933868436754,"44,55kg",Đúng là HHVN khác bọt thật ợ,2560,1758213036,đúng là hhvn khác bọt thật ợ
7551666924763464456,7551405933868436754,FanhCake,Cũng là HHVN- cũng là nhảy bài này mà sao HHVN 2018 nhảy khác HHVN 2025 quá hà 🤣🤣🤣,858,1758259483,cũng là hhvn- cũng là nhảy bài này mà sao hhvn 2018 nhảy khác hhvn 2025 quá hà
7551596920310481680,7551405933868436754,Phan Tú Khuê,ko tin cổ nhảy được tag Tiểu Vy vào đây ngay😂,81,1758243190,ko tin cổ nhảy được tag tiểu vy vào đây ngay
7551431111449297665,7551405933868436754,Đỗ Cẩm Ly,haha nhảy giỏi nèe,602,1758204572,haha nhảy giỏi nèe
7551657530432193287,7551405933868436754,hoanghoang____,Lần đầu tiên t thấy có cô hoa hậu Oke nhất từ trước tới giờ,52,1758257291,lần đầu tiên t thấy có cô hoa hậu oke nhất từ trước tới giờ
7551469249480491794,7551405933868436754,chỉ là Bé Heo thôi,Đẹp cỡ này mới xứng hoa hậu nè,27,1758213455,đẹp cỡ này mới xứng hoa hậu nè
7551458937075024660,7551405933868436754,Dương Hoàng Hải,C quậy hả c Linh🤪,177,1758211052,c quậy hả c linh
7551980234996974344,7551405933868436754,🍒🍒🍒,"Cổ đẹp sang , HHVN có khác ko có điểm gì để chê luôn á",19,1758332430,"cổ đẹp sang , hhvn có khác ko có điểm gì để chê luôn á"
7551483222111470343,7551405933868436754,Đinh Hoàng Linh Đan,Xem nãy giờ 10 lần ròi đó,24,1758216705,xem nãy giờ 10 lần ròi đó
7552117158866109201,7551405933868436754,Thiênn Bình,Lâu giờ mới thấy HH đẹp vậy,143,1758364319,lâu giờ mới thấy hh đẹp vậy
7551407500060656402,7551405933868436754,Tiểu Anh Anh 🫧,Bả kiếm đâu cái áo giống mẹ tui quá à,60,1758199078,bả kiếm đâu cái áo giống mẹ tui quá à
7551617791040946951,7551405933868436754,Cô Em ADMIN,quá xinh quá hài lòng về hoa hậu này🥰❤,5,1758248040,quá xinh quá hài lòng về hoa hậu này
7551637749607891730,7551405933868436754,Lotus,Con bé hợp MI thật sự.,5,1758252687,con bé hợp mi thật sự.
7551574510542275345,7551405933868436754,nieowi,Má nào search HTl ở trường nhảy hiphop zạy tr 😅,5,1758237968,má nào search htl ở trường nhảy hiphop zạy tr
7551550992580363015,7551405933868436754,Xatto_,bị cuốn thệt á chớ,6,1758232493,bị cuốn thệt á chớ
7551460996985438994,7551405933868436754,𝐓𝐡𝐮̛ 𝐓𝐡@𝐧𝐡? 𝐓𝐡𝐨̛𝐢𝐢,"Cho bã xuất khẩu qt đi, quá trời roi, tự hào gái 78 vậy ad",951,1758211531,"cho bã xuất khẩu qt đi, quá trời roi, tự hào gái 78 vậy ad"
7551580666119947026,7551405933868436754,Đào Quang Nhật,nhan sắc này sao k thi miss universe cx chiến hay MW . MI cx OK nhỉ nhìn OK thật,118,1758239409,nhan sắc này sao k thi miss universe cx chiến hay mw . mi cx ok nhỉ nhìn ok thật
7551463799129031432,7551405933868436754,Nguyễn Hoàng Mỹ Vân,Đúng em tui ròii👯‍♀,13,1758212185,đúng em tui ròii
7552413152559448849,7551405933868436754,minh tâm,ngại dùm tỉu vy,5,1758433225,ngại dùm tỉu vy
7551751792418669330,7551405933868436754,thanh,Chị này đẹp hơn cái bà mới đăng quang miss grand.,49,1758279236,chị nay đep hơn cai ba mơi đăng quang miss grand.
7552026049220461320,7551405933868436754,phụ liệu phụ kiện hoa hanmade,"bé này nhảy có nhịp nhìn cuốn cuốn, kiểu như từng học nhảy có kỹ năng á, chứ k phải nhảy đại đại",58,1758343093,"bé này nhảy có nhịp nhìn cuốn cuốn, kiểu như từng học nhảy có kỹ năng á, chứ k phải nhảy đại đại"
7551418743222829832,7551405933868436754,Trần Trang,Cưng hết sẩy con bà bảy ❤,15,1758201695,cưng hết sẩy con bà bảy
7551411664425026305,7551405933868436754,Bí Ngô,Lạ quá hổng có quen 😂,7,1758200047,lạ quá hổng có quen
7551455347460162312,7551405933868436754,𝐓𝐡𝐮̛ 𝐓𝐡@𝐧𝐡? 𝐓𝐡𝐨̛𝐢𝐢,"Này mới gọi là Linh đag thể hiện đúng chính con người mình, nang động và gioi❤",5,1758210219,"này mới gọi là linh đag thể hiện đúng chính con người mình, nang động và gioi"
7552038639484797712,7551405933868436754,LT 🤍,Úp ht sources nhảy lên lun đi c,5,1758346027,úp ht sources nhảy lên lun đi c
7551437099606704914,7551405933868436754,ndkdb,coi cổ nhảy hiphop ở UFM nên thấy clip này cũng bth 😂😂,45,1758205965,coi cổ nhảy hiphop ở ufm nên thấy clip này cũng bth
7551852750917763847,7551405933868436754,liaby.h,Huhu c này với c HH MCO hao hao luôn,5,1758302742,huhu c này với c hh mco hao hao luôn
7551427976640283410,7551405933868436754,NGUYEN VAN MAI Makeup,Dẻo dữ dạ con kakka🥰🥰,5,1758203844,dẻo dữ dạ con kakka
7551431523141845781,7551405933868436754,embecuti,ý là em thấy đâu có đẹp đâu á chị ơi🥺🥺mà em coi hơn 70 lần em ngồi cười tuýt mắt nảy h ak chị🥰,11,1758204670,ý là em thấy đâu có đẹp đâu á chị ơimà em coi hơn 70 lần em ngồi cười tuýt mắt nảy h ak chị
7551447780633182992,7551405933868436754,Bs Mạnh yhct,xinh như hoa hậu luôn,10,1758208461,xinh như hoa hậu luôn
7552128032145687317,7551405933868436754,shuan,lover,3,1758366841,lover
7552127950378025748,7551405933868436754,shuan,nguoi dep viet nam,3,1758366822,nguoi dep viet nam
7552537127284884240,7551405933868436754,🐰Bé Hiếu 🐰,Ả xinh 🥰,1,1758462087,ả xinh
7552127904499794696,7551405933868436754,shuan,hoa hau the gioi,2,1758366808,hoa hau the gioi
7560516602870579976,7551405933868436754,Vựa khô mực Nhật Tuyết,Set Nay của brand nào ạ,0,1760319960,set nay của brand nào ạ
7552091685946606357,7551405933868436754,Đào Văn Minh,Yêu quó🥰,2,1758358374,yêu quó
7552198809947095826,7551405933868436754,🏸,mình cùng họ Hà chào nhau cái nhỉ 😁,2,1758383316,mình cùng họ hà chào nhau cái nhỉ
7552465970418336519,7551405933868436754,Homes Tuyên,cuốn thật,2,1758445519,cuốn thật
7552056230506054421,7551405933868436754,Linh văn 1990,Chào hoa hậu,2,1758350126,chào hoa hậu
7551861422248133394,7551405933868436754,Bellabella💋,xịn xịn 😘,2,1758304767,xịn xịn
7552100455586480903,7551405933868436754,laniamyby72,nhảy được đó,2,1758360416,nhảy được đó
7551869366431138568,7551405933868436754,🌷An An Rì Viu🌷,cổ xinhhh,2,1758306613,cổ xinhhh
7552163863174365970,7551405933868436754,Võ Thị  kim thư,Hoa Hậu Sinh Quá,2,1758375261,hoa hậu sinh quá
7552438905855132424,7551405933868436754,Hoàng Thư,Hoa hậu Hà Trúc Linh có khác,2,1758439222,hoa hậu hà trúc linh có khác
7551988300166497042,7551405933868436754,Nguyễn Duy Hảo,xinh gái nhảy đẹp em ơi 🥰🥰🥰,3,1758334307,xinh gái nhảy đẹp em ơi
7552333644968608530,7551405933868436754,Trọng Đào,HH xinh thật,3,1758414721,hh xinh thật
7552498340652385032,7551405933868436754,Shyhaysuy,bà càng ngày càng đẹp luôn á!!!,1,1758453057,bà càng ngày càng đẹp luôn á!!!
7551831368344388373,7551405933868436754,Hương Lan,sang,2,1758297766,sang
7552236140113085191,7551405933868436754,Lũ 14,Yêu em qyas,2,1758392011,yêu em qyas
7552148479759008530,7551405933868436754,Kẻ huỷ diệt loài bò 🐮,Ủa c này hoa hậu hả. Sao đẹp vậy. Mới thấy lần đầu luôn😳🥰,2,1758371599,ủa c này hoa hậu hả. sao đẹp vậy. mới thấy lần đầu luôn
7552471782625608466,7551405933868436754,Nga,"Chánh cung nhìn nó vẫn khácccccc , sang xịn minh quá🥰🥰🥰",2,1758446875,"chánh cung nhìn nó vẫn khácccccc , sang xịn minh quá"
7552012368592716564,7551405933868436754,Mẹ Bảo Khuy 11/03/22 🥰,Đẹp quá bé ơii,2,1758339911,đẹp quá bé ơii
7552444313663111943,7551405933868436754,Nguyên Lâm,HHVN Chánh cung quá đẹp . Nhân trắc học quá đẹp . ❤️❤,3,1758440480,hhvn chánh cung quá đẹp . nhân trắc học quá đẹp .
7551849467746976530,7551405933868436754,La Thành,khớp từng beat một luôn ýyyy,3,1758301980,khớp từng beat một luôn ýyyy
7551939869104620306,7551405933868436754,pt.kie,Tự hào Gái 78 🥰,3,1758323049,tự hào gái 78
7551754917901189906,7551405933868436754,"@Seven Quới....""VN """,❤❤❤ka..Chanh..🥰🥰🥰😜😜😜,2,1758279968,ka..chanh..
7552359658738303752,7551405933868436754,Thanh Thanh,sao đẹp dữ vậy trời🥰,2,1758420774,sao đẹp dữ vậy trời
7551664933504320264,7551405933868436754,Bé Xuka❤️,Bả đẹp,2,1758259017,bả đẹp
7552149821303259911,7551405933868436754,user9739148095007,Xinh quá em❤❤❤,2,1758371912,xinh quá em
7552002235417854728,7551405933868436754,THUÝ ( 小翠 )🌻🌻,Đẹp qué,2,1758337548,đẹp qué
7552073143155098386,7551405933868436754,Hương Hương,C tham gia vs gđ nhà a Hải pk ạ,2,1758354058,c tham gia vs gđ nhà a hải pk ạ
7551606732452135701,7551405933868436754,Annie đến đâyyy🎀,cưnggg,2,1758245466,cưnggg
7552524744622326546,7551405933868436754,Bơ Shops,Bả càng ngày càng đẹp đó. Vẫn là chọn Hoa chuẩn,1,1758459202,bả càng ngày càng đẹp đó. vẫn là chọn hoa chuẩn
7552561889491075853,7551405933868436754,THẦY MINH BCR,đúng là thợ thầy có khác,1,1758467860,đúng là thợ thầy có khác
7552753118325277460,7551405933868436754,Bởi Vì Đam Mê 🤓,siu phẩm 🥰,1,1758512377,siu phẩm
7552060563264094993,7551405933868436754,Mơn Nỳ,Hoa hậu đẹp nhất tui thấy. Giờ tui mới khen được 1 mình chị này❤,3,1758351134,hoa hậu đẹp nhất tui thấy. giờ tui mới khen được 1 mình chị này
7552044840692925202,7551405933868436754,Chanhneee,HHVN có khác .,3,1758347471,hhvn có khác .
7552377940186596113,7551405933868436754,Chị Gấu xin chào,"Bé HH xinh quá, nhưng ko thấy hoạt động nhiều",2,1758425031,"bé hh xinh quá, nhưng ko thấy hoạt động nhiều"
7552089090130035463,7551405933868436754,Huy Nguyen,"Đẹp đó, nhưng cô k phải của tôi😏",2,1758357771,"đẹp đó, nhưng cô k phải của tôi"
7551997325780353813,7551405933868436754,Trần Ngát,Mê cái dáng nhảy xem cuốn quá😍,2,1758336410,mê cái dáng nhảy xem cuốn quá
7551747209055863569,7551405933868436754,han Tran,"chánh cung có khác, ko như quốc gia gì kia đó ăn theo tên.",2,1758278180,"chánh cung có khác, ko như quốc gia gì kia đó ăn theo tên."
7552219336472789776,7551405933868436754,MH76,nói nhỏ nghe ... xinh quá 😂,2,1758388098,nói nhỏ nghe ... xinh quá
7552054590373724946,7551405933868436754,HaiYen🍓,Eo ơi xinh quá,2,1758349742,eo ơi xinh quá
7552032511338185479,7551405933868436754,Thuỷ Bii,Xinh dữ,2,1758344597,xinh dữ
7552056042554393362,7551405933868436754,Huyền Anh 🧚🏻‍♀️,Í là không ai xem 1 lần cả ý chị,4,1758350076,í là không ai xem 1 lần cả ý chị
7552011899278852885,7551405933868436754,RinVT,bảo sao nhìn bả sang vô đọc cmt mới biết HHVN😳,3,1758339800,bảo sao nhìn bả sang vô đọc cmt mới biết hhvn
7551867803130643208,7551405933868436754,rửa mông bên bờ sông,e ở đây 2 tiếng r chị,3,1758306252,e ở đây 2 tiếng r chị
7551960626046763784,7551405933868436754,Hoài Bảo bolero ✅,HHVN nó phải vậy chứ đẹp sang ❤,3,1758327863,hhvn nó phải vậy chứ đẹp sang
7551652084971700999,7551650207604198673,Mili Độ,Quá tuyệt vời. Những hành động như vậy đáng được lan rộng. 😍😍😍,11,1758256027,quá tuyệt vời. những hành động như vậy đáng được lan rộng.
7551743326975001362,7551650207604198673,DŨNG TRỌC 75,Lan tỏa yêu thương biểu dương cho những hành động đẹp,1,1758277264,lan tỏa yêu thương biểu dương cho những hành động đẹp
7551657123786015495,7551650207604198673,haobganh,Cái ông nhảy nhảy nhìn hài,0,1758257197,cái ông nhảy nhảy nhìn hài
7551677171589350145,7551650207604198673,Tân Tỵ🐍,Không có vụ cháy j thì lại bảo trộm cắp,1,1758261861,không có vụ cháy j thì lại bảo trộm cắp
7552365831171293960,7551650207604198673,benzama,đóng tiền mạng để xem những hành động như này,0,1758422205,đóng tiền mạng để xem những hành động như này
7551778561306116882,7551650207604198673,Tungken1981,ko có mấy đứa hậu quả nghiêm trọng chủ quán phải thưởng cho mấy đứa mới được.,0,1758285472,ko có mấy đứa hậu quả nghiêm trọng chủ quán phải thưởng cho mấy đứa mới được.
7551742141140189973,7551650207604198673,nguyenngocthuan031988,Đáng đc tuyên dương.,0,1758276989,đáng đc tuyên dương.
7551654654007165704,7551652773650042128,Nguyễn Nhung120311,"Tưởng nhân viên nên bắt nạt, ai ngờ con chủ quán.",1059,1758256619,"tưởng nhân viên nên bắt nạt, ai ngờ con chủ quán."
7551703712231719696,7551652773650042128,Ngoan Dandy Dandy,"Tổng tài mở cty vốn 3 tỷ, còn đây là cái đồng hồ mẹ bạn nhân viên đeo 🤣🤣🤣",623,1758268057,"tổng tài mở cty vốn 3 tỷ, còn đây là cái đồng hồ mẹ bạn nhân viên đeo"
7551655078622528264,7551652773650042128,nguyễn hoàng thế đức,"bản chất par.kyy là không đổi, xin lỗi cho có 🤣🤣🤣",127,1758256722,"bản chất par.kyy là không đổi, xin lỗi cho có"
7551659623661667079,7551652773650042128,Duy lang bạt,Theo như logic trong fim là sau đó tổng tài quay lại và mua luôn quán cf 😳,97,1758257776,theo như logic trong fim là sau đó tổng tài quay lại và mua luôn quán cf
