comment_id,video_id,username,comment_text,digg_count,create_time,clean_text
7479440355432956692,7478650065301671176,Phạm Thế Uy,bảo 15 suất kia là quán khuyến mãi nên đem ra trước =]],0,1741442923,bảo 15 suất kia là quán khuyến mãi nên đem ra trước =]]
7499364391692714770,7478650065301671176,tâm,nhìn mặt giống ôg luật sư nào đó:))),0,1746081855,nhìn mặt giống ôg luật sư nào đó:)))
7480150061549241106,7478650065301671176,Trung Bộp,Bảo sao t mua có phần 25k mà về đến nay 2 ngày chưa ngủ dc,0,1741608168,bảo sao t mua có phần 25k mà về đến nay 2 ngày chưa ngủ dc
7508054639642182408,7478650065301671176,dka_@,"thêm thôi, bột uyên ương mà nặng thì t xin thua",0,1748105204,"thêm thôi, bột uyên ương mà nặng thì t xin thua"
7479393043456623361,7478650065301671176,Yuki_H,là sao?,0,1741431911,là sao?
7479316639378178817,7478650065301671176,Đã đổi tên :))),Âhha,0,1741414126,âhha
7479470612203209480,7478650065301671176,Reiji 🌊,vào kiếm bột uyên ương mà nó lạ lắm...,0,1741449975,vào kiếm bột uyên ương mà nó lạ lắm...
7479623211891720967,7478650065301671176,Manganese💗,Ê t tìm bột uyên ương ra cgi í,0,1741485514,ê t tìm bột uyên ương ra cgi í
7479423790352024328,7478650065301671176,CHILL GUYS🇻🇳,Ko rep mai xui cả ngày,0,1741439068,ko rep mai xui cả ngày
7498723079473218320,7478650065301671176,🔥Châu Tiền Đình 🔥,trộn chung cả 2 luôn,0,1745932532,trộn chung cả 2 luôn
7479042611270583041,7478650065301671176,QingYi.x.XiaoBai,"tại sao lại có bột ""uyên ương""ở trg bếp mà còn 1 hũ to nữa🤨🤨",0,1741350320,"tại sao lại có bột ""uyên ương""ở trg bếp mà còn 1 hũ to nữa"
7500237984302662408,7478650065301671176,Phạm Dung 98,k sao đâu cứ ngọt là OK 😂😂,0,1746285248,k sao đâu cứ ngọt là ok
7480135451988001552,7478650065301671176,Lycchi,Tự nhiên ăn khoai về thấy khỏe hẳn ra 🤡🤡🤡,0,1741604766,tự nhiên ăn khoai về thấy khỏe hẳn ra
7480802388045185810,7478650065301671176,Con bạn vợ thầy gái cơ quan🐧,thôi ksao còn 5 phần nx=)),0,1741760056,thôi ksao còn 5 phần nx=))
7479598656078185234,7478650065301671176,Ngọc Ly,rồi mắc gì để bột đó trong bếp chi zậy cha,0,1741479788,rồi mắc gì để bột đó trong bếp chi zậy cha
7479337111565796104,7478650065301671176,bao4th7,Là bột j vậy,0,1741418887,là bột j vậy
7478882619173683975,7478650065301671176,sang dark,cho hỏi...khách anh đi đâu hết rồi,0,1741313085,cho hỏi...khách anh đi đâu hết rồi
7478922190869840647,7478650065301671176,Thin khungg🧸🇻🇳,khách quen ấy màa,0,1741322291,khách quen ấy màa
7478703754154558215,7478650065301671176,Mlokery,+1 bestseller 😂,0,1741271418,+1 bestseller
7479763007263949576,7478650065301671176,Kun,Xuân dược à 🤣,0,1741518056,xuân dược à
7478703586692891409,7478650065301671176,UwU,nhìn mặt chất quá =)),0,1741271382,nhìn mặt chất quá =))
7490163077833900807,7478650065301671176,Long,r h kh s r,0,1743939502,r h kh s r
7499417102371259143,7478650065301671176,🧚🏻‍♀️,t kím bột uyên ương nó ra động sét là s bay😇,0,1746094131,t kím bột uyên ương nó ra động sét là s bay
7478939011744285448,7478650065301671176,Tian Nguyễn,thế ô này chắc p mở thêm cả nghỉ cạnh quán gà🤣,0,1741326208,thế ô này chắc p mở thêm cả nghỉ cạnh quán gà
7479368430413251344,7479088876036951312,bơ,chắc t vẽ cả mặt 🥰,2844,1741426182,chắc t vẽ cả mặt
7479320306931270420,7479088876036951312,LAVA CHOCOLATE,chj mua miếng dán mụn hình ngôi sao ý,5704,1741414972,chj mua miếng dán mụn hình ngôi sao ý
7489787456788284178,7479088876036951312,nhims,Ê thấy bả bị nói cạo lông mặt nhiều quá cx tội,897,1743852051,ê thấy bả bị nói cạo lông mặt nhiều quá cx tội
7479437601968177927,7479088876036951312,Sứa mộng mơ🪼,"Da này là thiếu ẩm á nàng nên:
1. Đắp thêm mặt nạ 2-3/tuần hoặc đắp mask cấp ẩm trước khi make
2. Xem lại các bước dưỡng ẩm trước make đủ chưa hay do nền (ckđ) quá khô / khô nhanh k hợp với da
3. Coi lại phấn phủ xem có bị dày k",146,1741442280,da này là thiếu ẩm á nàng nên: 1. đắp thêm mặt nạ 2-3/tuần hoặc đắp mask cấp ẩm trước khi make 2. xem lại các bước dưỡng ẩm trước make đủ chưa hay do nền (ckđ) quá khô / khô nhanh k hợp với da 3. coi lại phấn phủ xem có bị dày k
7479098105326879508,7479088876036951312,th_nguyenn_..,ê đẹp thật 😍,164,1741363240,ê đẹp thật
7479295797185463041,7479088876036951312,ı̣ɥɔɥꓕ,Tim 999🤩,5,1741409280,tim 999
7479401290188473106,7479088876036951312,hmy,cj ơi cái nền kìa nó bị mốt nền hả 😭😭😭,94,1741433828,cj ơi cái nền kìa nó bị mốt nền hả
7479654662481216273,7479088876036951312,Changiune,shao vid nào màu son của bả cx xink hết vậy bây 😭😭😭,10,1741492822,shao vid nào màu son của bả cx xink hết vậy bây
7479282701984793361,7479088876036951312,ic3.hrt,Tim thứ 688🥰,27,1741406225,tim thứ 688
7480902713032409863,7479088876036951312,🫂🤍,ựa t là nạn nhân của cạo lông mặt🥰,148,1741783412,ựa t là nạn nhân của cạo lông mặt
7499448037007098640,7479088876036951312,👉🖕👈,bị mốc nền hả ta 🥰,7,1746101336,bị mốc nền hả ta
7487450249339437842,7479088876036951312,☆bống☆,Ê mốc nền hoài nha😭😭😭,280,1743307877,ê mốc nền hoài nha
7479258211444376327,7479088876036951312,✨Sarah🦄🦋,xinh thiệt😁,2,1741400528,xinh thiệt
7479303229747151617,7479088876036951312,Bảo Uyên,mặt t cũng hay lên mấy cái mụn kiểu v đau lứm bây ơi có muốn bị v đâu,9,1741410994,mặt t cũng hay lên mấy cái mụn kiểu v đau lứm bây ơi có muốn bị v đâu
7499540916866630408,7479088876036951312,phương linh❤️‍🔥,trộm vía màu son xinh xỉu😝,3,1746122970,trộm vía màu son xinh xỉu
7479298464426705682,7479088876036951312,Iov u.,Tim thứ 1071😉,4,1741409892,tim thứ 1071
7481960961932526344,7479088876036951312,T thấy hay mà 🥲,Ê sao t thấy nó ko đẹp mà làm cho mụn nó nổi hơi í😂😂,2,1742029812,ê sao t thấy nó ko đẹp mà làm cho mụn nó nổi hơi í
7479435711121605383,7479088876036951312,أديتيا جاي,😭 lông mặt chứ mốc đâu ra mà 1 số bà cứ nói v,6,1741441843,lông mặt chứ mốc đâu ra mà 1 số bà cứ nói v
7490068326652723975,7479088876036951312,no_name👾,Một hồi cái mặt hồng lè😂,2,1743917447,một hồi cái mặt hồng lè
7479632719916712720,7479088876036951312,14.,màu son như mauwwkinhwwnguyet v,1,1741487711,màu son như mauwwkinhwwnguyet v
7516109935857124114,7479088876036951312,_ 𝙍𝙤_,Bôi 10tấn bột lên mặt hả bn🥰,1,1749980723,bôi 10tấn bột lên mặt hả bn
7483498289435771666,7479088876036951312,a4ba'💗,tiếc cho gương mặt xinh đẹp này,1,1742387742,tiếc cho gương mặt xinh đẹp này
7499011877219140353,7479088876036951312,chánnn,vẽ thế chắc mặt t kín,2,1745999800,vẽ thế chắc mặt t kín
7484958373420434197,7479088876036951312,♑︎𝑩𝒆́ 𝑪𝒉𝒊ᵏᵃʷᵃ🥨,móc nền kìa bà,1,1742727698,móc nền kìa bà
7480422591720489735,7479088876036951312,Con người da ngâm,Màu son đệp dữ,2,1741671628,màu son đệp dữ
7480036787056018183,7479088876036951312,Thien Nhannn,T tưởng bả chét máu🥰🥰🥰,1,1741581799,t tưởng bả chét máu
7492001646407516935,7479088876036951312,˚｡⋆ TOI MỆT R ⋆˚,Càng đc chú ý nhiều hơn 😌,2,1744367578,càng đc chú ý nhiều hơn
7515646903502701330,7479088876036951312,chẳng biết gì cả,ước j tôi có thể lạc quan như sốp😌,4,1749872914,ước j tôi có thể lạc quan như sốp
7480499382438265607,7479088876036951312,Ngoc Le Tong Hoang,này đã nhạy cảm gùi ... tẩy trang kỹ nha 🥰,1,1741689501,này đã nhạy cảm gùi ... tẩy trang kỹ nha
7479290004680033040,7479088876036951312,#nthh.,tim thu 837,3,1741407930,tim thu 837
7484135445849670408,7479088876036951312,Đà𝒏 𝒆𝒎 𝑪ô 𝙃ải 😆,hazz chị bị mốc nền k,1,1742536091,hazz chị bị mốc nền k
7479284313985794832,7479088876036951312,vạnh ơ,"trời oii, xin vía môi đẹp 😘",2,1741406597,"trời oii, xin vía môi đẹp"
7479303388044804865,7479088876036951312,ᵗᵐʸˣⁱⁿᵏᵏᵏ,bl số 102,1,1741411037,bl số 102
7479306054485984007,7479088876036951312,P.,Tim 1.232🎀,1,1741411664,tim 1.232
7479297900196528897,7479088876036951312,Lê GMinh,tim thứ 1504,1,1741409757,tim thứ 1504
7479303726008648466,7479088876036951312,nhuquynh,Chị này hay bị mốc nền ghê,1,1741411111,chị này hay bị mốc nền ghê
7480113631524700949,7479088876036951312,Lam Lùn🍫,mụn z mà kêu nhiều tới t chắc là khủng bố mụn quá🥰,1,1741599693,mụn z mà kêu nhiều tới t chắc là khủng bố mụn quá
7480848420064822024,7479088876036951312,The Dreams,màu son j v ạ,1,1741770765,màu son j v ạ
7501621911458579218,7479088876036951312,𝟙𝟡𝟡𝟜,"Nào đẹp gọi t nha bây, t đi ngủ á",1,1746607472,"nào đẹp gọi t nha bây, t đi ngủ á"
7515657395630113544,7479088876036951312,𝐚𝐧𝐡 𝐭𝐡𝐨,cái nền xấu quá,1,1749875359,cái nền xấu quá
7502815883442946823,7479088876036951312,ở đây có ebe mọc răng,ê mốc nền mà tao thấy cái nền trắng xoá,1,1746885462,ê mốc nền mà tao thấy cái nền trắng xoá
7491210393655542546,7479088876036951312,Ng Hân 🪾,"Đừng cạo lông mặt nha mn ơi , tui xưa mặt láng o luôn , k thâm mụn , nghe lời mxh đi cạo , tuy makeup k mốc nền , mới đầu nó láng d á , nhma da nó k đc bảo vệ nó nổi mụn ẩn á mấy bro ơi",1,1744183355,"đừng cạo lông mặt nha mn ơi , tui xưa mặt láng o luôn , k thâm mụn , nghe lời mxh đi cạo , tuy makeup k mốc nền , mới đầu nó láng d á , nhma da nó k đc bảo vệ nó nổi mụn ẩn á mấy bro ơi"
7480542337635058453,7479088876036951312,Bánh Donut ><,xinh nhe,1,1741699499,xinh nhe
7492787665638048528,7479088876036951312,Ngờ ân là con nào?!,ê đc cái môi đẹp nha 😍,2,1744550589,ê đc cái môi đẹp nha
7479400327637680904,7479088876036951312,KieuKHANH,mấy má ơi cái ng ta muốn quảng bá tới là son mà sao mấy má cứ soi hết cái này tới cái kia v tr,1,1741433609,mấy má ơi cái ng ta muốn quảng bá tới là son mà sao mấy má cứ soi hết cái này tới cái kia v tr
7479335586961736456,7479088876036951312,Tiên tung tung sà hua jetjet,tim thứ 10k,2,1741418537,tim thứ 10k
7480699782357926677,7479088876036951312,౨ৎϳɛɲɲɨɛ🎀,Sao hok tô bên trong♥️v chị,1,1741736175,sao hok tô bên trongv chị
7479375690949804805,7479088876036951312,i eat kids,nền này hơi mốc á nàng ơi. không phải lông mặt đâu. nhìn vẫn bở bở với không đều ấy. nàng chú ý dưỡng ẩm nha 😭😭😭,1,1741427888,nền này hơi mốc á nàng ơi. không phải lông mặt đâu. nhìn vẫn bở bở với không đều ấy. nàng chú ý dưỡng ẩm nha
7499348615204340496,7479088876036951312,Bich Ngoc🍚🍚,"t đang đọc mangatoon thì tk em họ t lén xem ,nó tưởng t có Ny nên bảo cả nhà t giờ 1 là t giải thích nhưng bị phát hiện đọc mangatoon,2 là t để yên cho mn hỏi ""tk đấy là tk nào"":)))",1,1746078196,"t đang đọc mangatoon thì tk em họ t lén xem ,nó tưởng t có ny nên bảo cả nhà t giờ 1 là t giải thích nhưng bị phát hiện đọc mangatoon,2 là t để yên cho mn hỏi ""tk đấy là tk nào"":)))"
7480361389723796242,7479088876036951312,Bena_benho,Tui bị mụn viêm cx nhiều mà tui đánh nền vx mướt vx che đc hết vết đỏ mặc dù vx gồ ghề nhg k lộ đỏ và bông tróc như chị này,1,1741657382,tui bị mụn viêm cx nhiều mà tui đánh nền vx mướt vx che đc hết vết đỏ mặc dù vx gồ ghề nhg k lộ đỏ và bông tróc như chị này
7512099267835757313,7479088876036951312,🌊⋆｡𖦹 °.miffychann🎀🍰⋆❀˖°🫧,Cái này là mốc nền hay lông mặt ạ?(ko biết nên hỏi),3,1749046921,cái này là mốc nền hay lông mặt ạ?(ko biết nên hỏi)
7516118275924640519,7479088876036951312,Băng Tâm,có v thôi đó mà t coi gần hết video trong trang bả:),1,1749982665,có v thôi đó mà t coi gần hết video trong trang bả:)
7490108120515330823,7479088876036951312,nhat linhᥫᩣ,Nền sao vậy shop?🐧,2,1743926717,nền sao vậy shop?
7497885807119303432,7479088876036951312,Dinhnhi,Cạo lông mặt nhiều không tốt đâu tại dễ nổi mụn nếu không chăm sóc kĩ với lại lông mặt còn bảo vệ da nữa,1,1745737593,cạo lông mặt nhiều không tốt đâu tại dễ nổi mụn nếu không chăm sóc kĩ với lại lông mặt còn bảo vệ da nữa
7486624764321153813,7479088876036951312,AD,Sao Cj cứ liếm môi thế,3,1743115694,sao cj cứ liếm môi thế
7479487729472422674,7479088876036951312,Tăng được lên 43kg thì đổi tên,"Nền này có hai vấn đề một là bị thiếu ẩm hai là dặm chưa chắc tay nên nền không ăn vào da mà bị bờ ở trên bề mặt nè. Bà dặm nền chặt tay và phủ phấn thật nhẹ tay, dưỡng ẩm kỹ trước khi đánh nền",2,1741453966,"nền này có hai vấn đề một là bị thiếu ẩm hai là dặm chưa chắc tay nên nền không ăn vào da mà bị bờ ở trên bề mặt nè. bà dặm nền chặt tay và phủ phấn thật nhẹ tay, dưỡng ẩm kỹ trước khi đánh nền"
7479289133649036039,7479088876036951312,xih yeu.𐙚,tim thứ 819😵‍💫,1,1741407727,tim thứ 819
7499393853372400391,7479088876036951312,DUYEN,Ê t hay bị mốc nền v á. Làm sao hết dan,1,1746088710,ê t hay bị mốc nền v á. làm sao hết dan
7480199383080338184,7479088876036951312,h.nhi💤,đẹp cái nỗi j😭,1,1741619653,đẹp cái nỗi j
7479258952153514770,7479088876036951312,8𝘩🀄️𝘊𝘩𝘪𝘤𝘢𝘨𝘰🎶,Ngtim524,1,1741400692,ngtim524
7479696520032781064,7479088876036951312,Linglingg >.<,ước bả show mặt 🤡🤡,4,1741502570,ước bả show mặt
7492274436244226823,7479088876036951312,trái banhh 🏸,mốc nền 😇,2,1744431104,mốc nền
7480531429358863122,7479088876036951312,Ác wỷ phi phai 😏,màu son mà 2022 t thích,1,1741696963,màu son mà 2022 t thích
7479622474809508624,7479088876036951312,bao giờ hết ế thì đổi tên,mụn ngay giữa trán làm v đc k ạ 🥰🥰,1,1741485336,mụn ngay giữa trán làm v đc k ạ
7479291919151923986,7479088876036951312,Mom slayy🫦,cao long la dep r,2,1741408368,cao long la dep r
7479294590438638344,7479088876036951312,T🍁,Son gì d chị,1,1741408999,son gì d chị
7479291973431247632,7479088876036951312,ShiNa 🌷,xin vía môi nhom,1,1741408385,xin vía môi nhom
7479718641845535504,7479088876036951312,Anhin lite,màu son dữ dằn vậy chài,0,1741507726,màu son dữ dằn vậy chài
7500126573468173064,7479088876036951312,hoanglan2014,Son giống máu quá,0,1746259313,son giống máu quá
7483522678441657106,7479088876036951312,Do Kang Woo,ngt chứg mih ctính mà mấy bà😇,0,1742393420,ngt chứg mih ctính mà mấy bà
7490580103271023367,7479088876036951312,ngoc_anhh 𐙚,Mốc nền hay sao á,0,1744036602,mốc nền hay sao á
7480047106721645317,7479088876036951312,Lann´꒳`,"cần chuyên gia đánh giá về cái nền này là mốc hay do da, chứ thấy trang cãi nhiều quá ạ",0,1741584249,"cần chuyên gia đánh giá về cái nền này là mốc hay do da, chứ thấy trang cãi nhiều quá ạ"
7480047975493026568,7479088876036951312,.,mốc nền r hay sao ý,0,1741584403,mốc nền r hay sao ý
7501703066750075655,7479088876036951312,Búp bê chem chép kuteo🥰✨,Xinhh🥰,0,1746626369,xinhh
7482411013023793975,7479088876036951312,💍ndiep cờ xanh mạnh nhất tg✨,đc 12 ngay roi,0,1742134594,đc 12 ngay roi
7488348541988127509,7479088876036951312,Lithium🧪🧫,chị phải vẽ hình ngôi sao mới đẹp :))),0,1743517022,chị phải vẽ hình ngôi sao mới đẹp :)))
7499127338115384071,7479088876036951312,Ngô Ánh,"6, quá 😂",0,1746026658,"6, quá"
7480050820199023368,7479088876036951312,bu bù bú,chị dùng son gì v a,0,1741585062,chị dùng son gì v a
7500639209733227285,7479088876036951312,thuanh,sao khi nào bả cx bị mốc nền vậy 😅,0,1746378669,sao khi nào bả cx bị mốc nền vậy
7482706124652200722,7479088876036951312,phương linh🎀,ria mép nhiều quá,0,1742203299,ria mép nhiều quá
7479719043878372103,7479088876036951312,С А Г D E W★,bả còn ít mụn hơn tui tui nguyên cái mặt chỗ nào cũng mụn ko thừa 1 chỗ,0,1741507828,bả còn ít mụn hơn tui tui nguyên cái mặt chỗ nào cũng mụn ko thừa 1 chỗ
7479473622068429575,7479088876036951312,vũ scg,chj này nhìu màu sơn đẹp ghê ă😳😳😳,0,1741450670,chj này nhìu màu sơn đẹp ghê ă
7484132847696724756,7479088876036951312,M.I.N.H-C.H.A.U,Em cũng nhiều mụn ở trán 😂,0,1742535489,em cũng nhiều mụn ở trán
7479441570505458440,7479088876036951312,Nữ phụ độc ác 🫦😈,🪒 lông đi là nhan sắc lên tầm cao mới luôn ak ng đẹp oi❤️,0,1741443204,lông đi là nhan sắc lên tầm cao mới luôn ak ng đẹp oi
7508639194421478151,7479088876036951312,đu_boylove><,tìm kiếm sơn môi cho môi thâm,0,1748241308,tìm kiếm sơn môi cho môi thâm
7497532233737028360,7479088876036951312,gb,đừng lè lưỡi cắn môi dc k 🤗...,0,1745655275,đừng lè lưỡi cắn môi dc k ...
7481239781273207569,7479088876036951312,Bôngxih🪐🪐🫧,Èo nhìn cái nền..,0,1741861896,èo nhìn cái nền..
7479362231857578759,7479088876036951312,Bắp cày 🐝và quýt🍊,móc nền nha bà,0,1741424746,móc nền nha bà
7481236596868809479,7479088876036951312,˖ ֹ੭୧Cherry🍒⊹ ࣪ ⑅,"chị mua cái miếng dán mụn ii, xinhh cutee lắm á",0,1741861148,"chị mua cái miếng dán mụn ii, xinhh cutee lắm á"
7498722819980477191,7479088876036951312,Hoàng Mai ♏️,Cj bộ nhìu phấn quá làm gia kích ứng thì nó nổi mụn đó ạ cj mua thuốc về chấm ik ạ,0,1745932474,cj bộ nhìu phấn quá làm gia kích ứng thì nó nổi mụn đó ạ cj mua thuốc về chấm ik ạ
7479724249344426760,7479088876036951312,ok,k dth nổi💔,0,1741509028,k dth nổi
7492794955418026759,7479088876036951312,𝙙𝙖𝙣𝙘𝙝𝙞 ᥫ᭡,ko phải mụn thôi đâu mà nền còn bị mốc nx,0,1744552285,ko phải mụn thôi đâu mà nền còn bị mốc nx
7502835134489903890,7479088876036951312,tmyy,nền bị trượt nha,0,1746889952,nền bị trượt nha
7498997851235615505,7479088876036951312,౨ৎ𝐍𝐡𝐢́𝐦,phấn mốc kìa chị,0,1745996529,phấn mốc kìa chị
7499376047429206802,7479088876036951312,................,nền bị mốc cj ơi đánh nền cho đẹp ik,0,1746084573,nền bị mốc cj ơi đánh nền cho đẹp ik
7479679388427928351,7479088876036951312,camchatvinhvien😭,Môi giống June v,0,1741498593,môi giống june v
7484635320332731154,7479088876036951312,Ngọc thuỷ 🍁,cho em xin màu son với ạ😻,0,1742652469,cho em xin màu son với ạ
7479305621877244679,7479247693173263634,𝟗𝐭𝐡𝟗🌷,có ai môi dày ko,488,1741411556,có ai môi dày ko
7560311186719720199,7479247693173263634,🍪kẹo chocopie౨ৎ💢,môi gì vậy ạ.??,3,1760272128,môi gì vậy ạ.??
7562442224132358920,7479247693173263634,𝜗𝜚˚⋆herbie𐙚: ⋆˚𝜗𝜚˚⋆,môi cười,1,1760768302,môi cười
7479281386668540680,7479247693173263634,Bim Beauty 🌷,Các bạn chụp màn hình sau đó dùng filter “ Green Screen Eyes and Mouth” để kiểm tra nha 🌷,545,1741405920,các bạn chụp màn hình sau đó dùng filter green screen eyes and mouth để kiểm tra nha
7479294534766379796,7479247693173263634,Tô tiểu thư,Team môi quyến rũ,111,1741408975,team môi quyến rũ
7479310464113427207,7479247693173263634,Ai hỏi?,t môi dày + hô =môi chề☺️,13,1741412690,t môi dày + hô =môi chề
7479319849904308999,7479247693173263634,dumb.4luv,Môi chữ M💔,51,1741414879,môi chữ m
7479330631928333072,7479247693173263634,cái bô biết đi 🥰🥰🥰,môi tây🥰😁😁,5,1741417386,môi tây
7479302056017216274,7479247693173263634,m8 thì đổi tên~👙🥰,môi thẳng😭,8,1741410731,môi thẳng
7479247280895017746,7479247693173263634,nguyễn thị tuyền,mình là môi tây á,24,1741415414,mình là môi tây á
7479282022877528850,7479247693173263634,🐸Giang_iu_My🐸,mình môi đầy đặn,50,1741406067,mình môi đầy đặn
7480122605044155143,7479247693173263634,trai tim bang 📄,Mỗi t môi tròn nhỏ hỏ bây,35,1741601774,mỗi t môi tròn nhỏ hỏ bây
7479682957122437906,7479247693173263634,Elm su,Môi cánh hoa:),6,1741499417,môi cánh hoa:)
7479804879793373968,7479247693173263634,Sùng a chuối 🍌,Công Ken môi j v mn🥰,6,1741527804,công ken môi j v mn
7479420419159687943,7479247693173263634,BMy cũng thích hát mà🧸,môi cười nha,6,1741438285,môi cười nha
7479379668187054869,7479247693173263634,𐙚ྀ𝐘𝐮𝐧𝐢𝐞𝐌𝐚𝐬𝐭𝐞𝐫𝐃♬🫧,Môi bán nguyệt ạ,5,1741428800,môi bán nguyệt ạ
7481540809649963794,7479247693173263634,cọng lông mi Seunghuyn🙏,môi công ken môi j 😳,2,1741931976,môi công ken môi j
7480902029340181255,7479247693173263634,xinh iu thì đổi tên 💞,môi chữ M nhé,0,1741783250,môi chữ m nhé
7479283716595532562,7479247693173263634,Niki,K biết môi gì,7,1741406465,k biết môi gì
7480192977987011349,7479247693173263634,N.Uyên,Team môi cánh hoa đâu,5,1741618160,team môi cánh hoa đâu
7489747691204657927,7479247693173263634,CôThưkí💖🍒,có ai môi cười hăm,1,1743842793,có ai môi cười hăm
7482251137392591624,7479247693173263634,.no_3nd.,Mng vô video to nhan hộ tớ vs ah to môi chữ M hay môi thẳng hay môi cánh hoa hay môi bán Nguyệt v ạ,1,1742097366,mng vô video to nhan hộ tớ vs ah to môi chữ m hay môi thẳng hay môi cánh hoa hay môi bán nguyệt v ạ
7481490407756890888,7479247693173263634,Hậu Võ Thị563,t môi thuyền úp 😁,1,1741920263,t môi thuyền úp
7481299275232068370,7479247693173263634,ෆ𝙇𝙞𝙣𝙝𝙇𝙞𝙣𝙝✧,môi tay dơ tay,1,1741875744,môi tay dơ tay
7482411865177260808,7479247693173263634,nấm cực độc,mình chịu,1,1742134788,mình chịu
7480933652202013456,7479247693173263634,Buoon…!,mik môi cười,1,1741790607,mik môi cười
7480850961394696968,7479247693173263634,em tệ lắm đk ^^...,t cx hok bt t môi j nx :)),1,1741788522,t cx hok bt t môi j nx :))
7481634552835687176,7479247693173263634,🌷Teo.Đứcnắng🐚💝,riêng t mỏ nhọn 🥰,1,1741953808,riêng t mỏ nhọn
7486306327285007111,7479247693173263634,Nguyễn Đình Phương,môi cánh hoa nha,1,1743041548,môi cánh hoa nha
7559968593962828562,7479247693173263634,Sigma girl,Môi j đây🤔,1,1760192359,môi j đây
7558139299972186887,7479247693173263634,*Tên Hân *🤡🤪,môi phúc chu,1,1759766544,môi phúc chu
7549559510026601234,7479247693173263634,“N”🇻🇳,T là j v,1,1757768807,t là j v
7529037091922625287,7479247693173263634,phngtrinh,mấy bà cho tuiii hỏi hỏi môi tui là gì vậy,2,1752990557,mấy bà cho tuiii hỏi hỏi môi tui là gì vậy
7551804734015226632,7479247693173263634,Nhuey Nhuye,môi này là môi nào ạ,1,1758291567,môi này là môi nào ạ
7481149548741067521,7479247693173263634,🪷Cappypara🪷,1000/10,0,1741840897,1000/10
7481539879554990868,7479247693173263634,minh ngoc,Môi trái timm thì saoo ạ??,0,1741931764,môi trái timm thì saoo ạ??
7481574510743782151,7479247693173263634,@củ khoai nướng 🤤😋,team môi cười,0,1741939824,team môi cười
7481266289231971090,7479247693173263634,DingChengXin,hai mép môi của t quay xuống má ơi,0,1741868061,hai mép môi của t quay xuống má ơi
7481503438732772117,7479247693173263634,౨ৎSunnyxBaby౨ৎ,môi quyến rũ mắt phượng,0,1741923284,môi quyến rũ mắt phượng
7481666170966360839,7479247693173263634,.,môi cách hoa nek mấy ní,0,1741961159,môi cách hoa nek mấy ní
7481586192703718145,7479247693173263634,bée Thỏ🐇🐇🐇,môi cười a,0,1741942551,môi cười a
7481644867606856455,7479247693173263634,Thanh Thanh,moi cánh hoa,0,1741956209,moi cánh hoa
7480949500497724178,7479247693173263634,*,môi mình môi gì ai xem giúp mih voi a,0,1741794300,môi mình môi gì ai xem giúp mih voi a
7481272182754132754,7479247693173263634,kim đào,môi cánh hoa 🍀,0,1741869434,môi cánh hoa
7563516073410151176,7479247693173263634,💔,môi này là môi j dạ,0,1761018327,môi này là môi j dạ
7486336359214924552,7479247693173263634,toantran2532,moi chu M co ai moi nay ko,0,1743048542,moi chu m co ai moi nay ko
7481204161880802066,7479247693173263634,iuu><,Cos ai môi cười không,0,1741853605,cos ai môi cười không
