comment_id,video_id,username,comment_text,digg_count,create_time,clean_text
7299466424837407490,7297532839489178885,Ánh Nguyệt,anh này nói tiếng việt nghe rõ ghê á,0,1699543054,anh này nói tiếng việt nghe rõ ghê á
7298288704287621890,7297532839489178885,10cm nữa m7,anh ơi về Ang Giang đi ak,0,1699265277,anh ơi về ang giang đi ak
7298673716589445893,7297532839489178885,𝕸𝖎𝖓𝖍 𝕹𝖍ậ𝖙🔥,Anh đang du lịch ở tỉnh nào vậy ạ🥰,0,1699354919,anh đang du lịch ở tỉnh nào vậy ạ
7340211685913117447,7297532839489178885,phạm quốc huy,bạn người nước nào vậy,0,1709026220,bạn người nước nào vậy
7424254733047972615,7297532839489178885,Bắc Cực .☠️,"mì tôm đi
😆",0,1728600375,mì tôm đi
7298283825187848967,7297532839489178885,𝙂𝙞𝙖•𝙆𝙝𝙖𝙣𝙝,ăn hảo hảo đi a,0,1699267269,ăn hảo hảo đi a
7298294637164430081,7297532839489178885,Long LT🎭,repp em với anh ơi 🥰,0,1699266659,repp em với anh ơi
7298297500870722306,7297532839489178885,Anh Thục,anh ra Hà Nội đi ạ 😊,0,1699267319,anh ra hà nội đi ạ
7316367169544389406,7297532839489178885,Oliver Parker,the epitome of cuteness.,0,1703474494,the epitome of cuteness.
7298678082407219970,7297532839489178885,Vợ,Sài gòn chỗ nào z?,0,1699355935,sài gòn chỗ nào z?
7298297732061758210,7297532839489178885,Su_Meo🩵:3,woa:3,0,1699267380,woa:3
7298325149332505345,7297532839489178885,mèo khùng🐱,anh về hà nội chơi đi vui lắm ạ🤭,0,1699273751,anh về hà nội chơi đi vui lắm ạ
7298670695851049746,7297532839489178885,️,Trường em học :),0,1699354206,trường em học :)
7304918572698272517,7304823138171292974,LoikaAlima,"hidup lagi capek""nya lihat beginian yakin ngakak 😂😂😂😂",215,1700808924,"hidup lagi capek""nya lihat beginian yakin ngakak"
7304854031293334290,7304823138171292974,hoangminh 739,sao em không đội mũ bảo hiểm vậy ? em có làm thủ tục đổi số định danh chưa ? coi chừng bị đo nồng độ cồn đó em ơi .. hihi 😂😂😂😂😂😂,76,1700793889,sao em không đội mũ bảo hiểm vậy ? em có làm thủ tục đổi số định danh chưa ? coi chừng bị đo nồng độ cồn đó em ơi .. hihi
7304869691339145989,7304823138171292974,oma raja,😂😂😂awas jgn di gas ya,15,1700797532,awas jgn di gas ya
7304891324222898949,7304823138171292974,dinar,itu kalo di gas pol langsung ngebul aseapnya kuning,221,1700802577,itu kalo di gas pol langsung ngebul aseapnya kuning
7327021220448469793,7304823138171292974,ralphdederscheck1,Gute Idee für unterwegs 😂😂🥰,1,1705955089,gute idee fr unterwegs
7304834954130244358,7304823138171292974,Rahman cel,jual dimana ini alat,18,1700794084,jual dimana ini alat
7325773311333548805,7304823138171292974,อารมย์สีเทา,เบ่งตามคันเร่ง...อ่ะ...จู๊ดดดดด,1,1705664536,......
7327673204721582855,7304823138171292974,Nim Chimpsky,Lol,0,1706106881,lol
7327559281833640722,7304823138171292974,RombheNallavan,what country is this?,0,1706080358,what country is this?
7336415116004655915,7304823138171292974,jameslee339,What’s for it?,0,1708142264,whats for it?
7382507116240864005,7304823138171292974,Un_@nk,"🤪,,,",0,1718873902,",,,"
7325419691835835141,7304823138171292974,🦄 Z,5555555,0,1705582194,5555555
7327759535085732641,7304823138171292974,monisia_08,może i to jest śmieszne ale ja to chcę,0,1706126987,moe i to jest mieszne ale ja to chc
7331686330521633541,7304823138171292974,ji min tuynh,mất diện tích 🤭,0,1707041268,mất diện tích
7307720912009495327,7307003658741353761,David Coolwater,what's the joke here 😂,25,1701461390,what's the joke here
7307923472263971590,7307003658741353761,Andini Natasya801,ampun dah 🤣🤣🤣,18,1701511475,ampun dah
7307237565449716486,7307003658741353761,ReNo MARPAUNG,ada apa dengan rambut pirang ya 😳🤔,50,1701348838,ada apa dengan rambut pirang ya
7307733297244291846,7307003658741353761,𝒶𝓇𝒾𝒻 𝓈ℯ𝓉𝒾𝒶𝓌𝒶𝓃,🤔🤔🤔🤔🤔🤔🤔🤔🤔🤔 ada kejadian apa gaiiis,51,1701467608,ada kejadian apa gaiiis
7307976553475539717,7307003658741353761,Abdim.,"Emang dimana2 rambut pirang slalu jd sorotan ia,😆🙏🙏",25,1701520902,"emang dimana2 rambut pirang slalu jd sorotan ia,"
7307931139933815558,7307003658741353761,TOPAN,"🤣🤣🤣yg punya merasa,,☺️☺️☺️",22,1701510327,"yg punya merasa,,"
7307295592061354757,7307003658741353761,Nipa,rambutnya dah pirang😂😂,16,1701362360,rambutnya dah pirang
7307184873717465862,7307003658741353761,penikmatkopihitam,perasaan rambut gue gak kayak gitu..😁😁,40,1701337287,perasaan rambut gue gak kayak gitu..
7307943056472425222,7307003658741353761,Acok Oi,kita memang beda negara bg tapi kita 1pemikiran.😂😂,23,1701513109,kita memang beda negara bg tapi kita 1pemikiran.
7307931874856239878,7307003658741353761,🇮🇩  CALON SUAMI 🇮🇩,musuh datang ini 😁😁😁😁😁,6,1701510507,musuh datang ini
7318809260343034629,7307003658741353761,putra kis,emang nya knpah kok 🤣,0,1704043092,emang nya knpah kok
7321372791562502918,7307003658741353761,@Aton.esia,😅😅....😂....,1,1704639957,........
7323734752538788616,7307003658741353761,ngốc,cười chắc chết😂😂,1,1705189899,cười chắc chết
7322737109613183746,7307003658741353761,userfsufokl1rz,lại DC xem chủ em này rồi buồn cười luôn nhé,1,1704957623,lại dc xem chủ em này rồi buồn cười luôn nhé
7319559267051651842,7307003658741353761,pemburu hati 😊😊,"I'm understand what is ?? man try to msg, a girl, 😂😂😂",4,1704217717,"i'm understand what is ?? man try to msg, a girl,"
7322527534737589010,7307003658741353761,Kim Tươi,ô mua hàng ai cũng né bộ chỉ hủy là sauta,1,1704908815,ô mua hàng ai cũng né bộ chỉ hủy là sauta
7319337778482725634,7307003658741353761,พ่อเลมอล,หัวจนเจ็บท้องคับ😂😂😂😂😂😂😂😂😂😂55555555⅝555,2,1704166155,55555555555
7321296756607271698,7307003658741353761,Cô Đơn Mình Tôi,quát á,1,1704622247,quát á
7321978270932878088,7307003658741353761,"น้ำ""แพง🧸💙",5555😁😁😁😁😁😁,1,1704780932,5555
7321921071388410626,7307003658741353761,NGUYỄN MẠNH HIẾU Decor,T đã dịch được cô gái nói j qua khẩu hình. Hỏi thăm mẹ a khách 😂😂😂,1,1704767632,t đã dịch được cô gái nói j qua khẩu hình. hỏi thăm mẹ a khách
7319505208844108562,7307003658741353761,אדריאן,balik2 tengok..tapi masih belum faham .🤣,1,1704205118,balik2 tengok..tapi masih belum faham .
7320073562223461125,7307003658741353761,Maximus Biru,munkin sama,1,1704337461,munkin sama
7319512723133432578,7307003658741353761,Ⓜ️V➡️Trưởng 2️⃣3️⃣,🤣🤣 quá hài luôn,1,1704206878,quá hài luôn
7318945039924282117,7307003658741353761,adi,expresinya itu yg bikin ngakak 😁😁,1,1704074709,expresinya itu yg bikin ngakak
7480816912310928148,7307003658741353761,Đào Công Châu,Quá vui lắm luôn nè 🌹💖💖💖💖💖💖💖💖💖💖,0,1741763434,quá vui lắm luôn nè
7323666387464209170,7307003658741353761,Ashik World's,🙈🙈 Bangladesh 🇧🇩,0,1705173976,bangladesh
7323724428293817094,7307003658741353761,7310,nadie escribe en español para tirar caja un rato 🤣🤣🤣🤣,0,1705187494,nadie escribe en espaol para tirar caja un rato
7419728201013003028,7307003658741353761,Kho thanh lý tây ninh,Tui thích video nay,0,1727540097,tui thích video nay
7319344597427127045,7307003658741353761,Macan Kalimantan,😂😂😂 rambut pirang ..,0,1704167741,rambut pirang ..
7318956079164457733,7307003658741353761,Agung Prabowo,😁😁😁nggone bakule,0,1704081342,nggone bakule
7319054748496495365,7307003658741353761,abiazka,maksute opo iku..??? 😂,0,1704100248,maksute opo iku..???
7307065359587836674,7307061469294759176,achouv ◝◡◜,Đứa nào cười t kh qua bóng chuyền !!,641,1701308770,đứa nào cười t kh qua bóng chuyền !!
7307480127842845441,7307061469294759176,Haley1711💜🐰,"Đá cầu, bóng chuyền, bóng rổ, td nhịp điệu, cầu lông, chạy sức bền, võ cổ truyền, đẩy tạ :))) t qua được hết. Riêng có bộ môn nhảy xà là t ko qua 😃",182,1701405324,"đá cầu, bóng chuyền, bóng rổ, td nhịp điệu, cầu lông, chạy sức bền, võ cổ truyền, đẩy tạ :))) t qua được hết. riêng có bộ môn nhảy xà là t ko qua"
7307125133326516993,7307061469294759176,Nguyễn HồngAnh,Nhả vía thi 2 lần được 5đ vừa đủ qua môn🙂,161,1701322668,nhả vía thi 2 lần được 5đ vừa đủ qua môn
7307324740439458561,7307061469294759176,Linh Phạm,"nhả vía 9₫, tổng kết 9,7 A+ nhé=))",20,1701369159,"nhả vía 9, tổng kết 9,7 a+ nhé=))"
7307087809473561345,7307061469294759176,Hathienneeee 🫢,Nhả vía thi bóng chiền 9đ 😗,32,1701313983,nhả vía thi bóng chiền 9đ
7307158610998608648,7307061469294759176,Paint mê cầu lông🏸,"=))Bạn này lớp nào đoáa, mình cũng học bóng chuyền",14,1701330454,"=))bạn này lớp nào đoáa, mình cũng học bóng chuyền"
7307287580344337153,7307061469294759176,정말 잘생,=)))))),1,1701360490,=))))))
7307214172378415873,7307061469294759176,Đậu HSK 5 thì đổi tên,nhả vía thi lại cầu lông 3 lần cho mn =)),8,1701343403,nhả vía thi lại cầu lông 3 lần cho mn =))
7307174539737072402,7307061469294759176,đẹp gái yêu gái đẹp 💋,"vừa thi giữa kì đc 10 =)))
may con nhỏ ném bóng có hcv tỉnh nên nó ném chuẩn dễ đệm chứ thầy căn bảo lớp khác k biết ném điểm thấp 💀",12,1701334168,vừa thi giữa kì đc 10 =))) may con nhỏ ném bóng có hcv tỉnh nên nó ném chuẩn dễ đệm chứ thầy căn bảo lớp khác k biết ném điểm thấp
7307307342956970759,7307061469294759176,Gara Ô Tô Minh Huy 🔧🚘,"T học cầu lông cô Điểm toàn trốn lên ktx nằm có lần bị bắt doạ cấm thi mà vẫn dc thi cuối kì t phải dc 4,5 quả mới qua lúc kiểm tra phất vu vơ 4đ 🤡",1,1701365093,"t học cầu lông cô điểm toàn trốn lên ktx nằm có lần bị bắt doạ cấm thi mà vẫn dc thi cuối kì t phải dc 4,5 quả mới qua lúc kiểm tra phất vu vơ 4đ"
7307311210671702785,7307061469294759176,𝓟𝓱𝓾̛𝓸̛𝓷𝓰 𝓝𝓱𝓾𝓷𝓰 🤍,Nhớ mãi đánh được 3 điểm nhưng cô Điểm nghe lộn 5 điểm 🥲 thế là thoát,4,1701366002,nhớ mãi đánh được 3 điểm nhưng cô điểm nghe lộn 5 điểm thế là thoát
7310199732248314631,7307061469294759176,Trường Đỗ,"các chị không biết chơi còn đỡ, em chơi lâu r xong bỏ gần 1 năm giờ chơi lại còn hơn thế cơ, nhớ cách phát mà phát không qua nổi 1 quả 😆",1,1702038521,"các chị không biết chơi còn đỡ, em chơi lâu r xong bỏ gần 1 năm giờ chơi lại còn hơn thế cơ, nhớ cách phát mà phát không qua nổi 1 quả"
7307283784659370759,7307061469294759176,iamvitamindforu,t cần qua môn huhuu,1,1701359606,t cần qua môn huhuu
7307258631199490824,7307061469294759176,Nói Thì Tài Lắm,Thi môn bóng chuyền này thế nào là đạt ạ,0,1701353742,thi môn bóng chuyền này thế nào là đạt ạ
7307350504798094087,7307061469294759176,H DucLong,A+ :)))),1,1701375144,a+ :))))
7308186016128942849,7307061469294759176,Chunn🐠,bóng chuyền thầy hạnh cũng đỡ áp lực😔,1,1701569695,bóng chuyền thầy hạnh cũng đỡ áp lực
7307699032734221058,7307061469294759176,thảo.,ủa học cùng lớp bóng chuyền nè,1,1701456311,ủa học cùng lớp bóng chuyền nè
7307405077731361544,7307061469294759176,Mít,1 phát bay thẳng qua lưới,1,1701387877,1 phát bay thẳng qua lưới
7307806071833559815,7307061469294759176,Anti đậu đen pho e vờ🙃,môn gì chưa thấy trượt chỉ thấy gdtc là thấy trượt 😵,1,1701481225,môn gì chưa thấy trượt chỉ thấy gdtc là thấy trượt
7307440392718385928,7307061469294759176,Thành Đông,Trường này lấy bao điểm thế bn,1,1701396078,trường này lấy bao điểm thế bn
7307320659448939265,7307061469294759176,hoaqdinh,quên tha đầu lơ,0,1701381220,quên tha đầu lơ
7307258938067403528,7307061469294759176,Riren_meo,Trường t thi bóng chuyền hơi bốc nhầm phải quả méo thì đúng trượt luôn :)),0,1701353812,trường t thi bóng chuyền hơi bốc nhầm phải quả méo thì đúng trượt luôn :))
7307678124434211586,7307061469294759176,Hóng hớt,"Nhả vía đạt td:))cầu lông bóng rổ bóng chuyền bóng đá, bt chs mỗi thứ 1 ít và ổn nhé. Thi đấu hkpđ trường nx nè😁",0,1701451424,"nhả vía đạt td:))cầu lông bóng rổ bóng chuyền bóng đá, bt chs mỗi thứ 1 ít và ổn nhé. thi đấu hkpđ trường nx nè"
7307262057907323650,7307061469294759176,Hina,bóng chuyền da đừng đánh như thế kiểu nó dễ bị đau tay lắm 🙄🙄,0,1701354540,bóng chuyền da đừng đánh như thế kiểu nó dễ bị đau tay lắm
7307262356694106887,7307061469294759176,popcorn,quen quá😭😭😭😭,0,1701354612,quen quá
7307315669555741458,7307061469294759176,_HDLan_🤍,"Trường tôi , một quả nx quyết định 0₫ hay 500k :))))",0,1701367025,"trường tôi , một quả nx quyết định 0 hay 500k :))))"
7307841407275664129,7307061469294759176,Loc Dep Trai,Tính ra mình giỏi riêng bộ môn thể chất này mình toàn điểm 10,0,1701489442,tính ra mình giỏi riêng bộ môn thể chất này mình toàn điểm 10
7307700320544031489,7307061469294759176,प्यारी महिला,ủa t thấy phát dễ mà ta,0,1701456600,ủa t thấy phát dễ mà ta
7307700509535126274,7307061469294759176,Vi Nguyet Hang🐻,Tôi là A 😁,0,1701456648,tôi là a
7307429673842246407,7307061469294759176,Mỹ nữ nuôi heo,"t không rớt bóng chuyền, t rớt cầu lông 🙂",0,1701393574,"t không rớt bóng chuyền, t rớt cầu lông"
7307449984998359815,7307061469294759176,H.ahnn,ms thì xong luoonn😂,0,1701398301,ms thì xong luoonn
7307260352645956360,7307061469294759176,..,ước được 1 lần vào cái sân như thế này hoặc sân trong phòng th,0,1701354139,ước được 1 lần vào cái sân như thế này hoặc sân trong phòng th
7309419299306160898,7307061469294759176,Phương Nam 🫘,Vừa hqua thi 10đ thầy Trung:)),0,1701856819,vừa hqua thi 10đ thầy trung:))
7307270076150792962,7307061469294759176,cái vì vị??,nhả vía phát được 4 quả cho ae,0,1701356411,nhả vía phát được 4 quả cho ae
7307320535549100807,7307061469294759176,𝙋𝙝𝙖𝙣 𝙇𝙖𝙣 𝘼𝙣𝙝,nhả vía trượt bóng chuyền ạ🙂,0,1701368163,nhả vía trượt bóng chuyền ạ
7325803184231711496,7307061469294759176,cam 🍊,😌 nhìn mấy chị choi bóng chuyền còn giỏi hơn em nữa ik,0,1705671481,nhìn mấy chị choi bóng chuyền còn giỏi hơn em nữa ik
7307708275394069249,7307061469294759176,HoangAnh,môn nào t chơi đều đều hạng 2..,0,1701458463,môn nào t chơi đều đều hạng 2..
7307614669651559170,7307061469294759176,TÚ,Học lại học lại 2tr học lại nè,0,1701436640,học lại học lại 2tr học lại nè
7307353953657832193,7307061469294759176,Chazyyy,"Pass bóng chuyền, pass bơi nhưng học lại đá cầu 😭",0,1701375983,"pass bóng chuyền, pass bơi nhưng học lại đá cầu"
7330433591924507400,7307061469294759176,_gumimimimimimi,T chỉ ko qua đc chạy bền và nhảy xà thôi 😞💔,0,1706749587,t chỉ ko qua đc chạy bền và nhảy xà thôi
7310993511821935367,7307061469294759176,🧸TuấnAnh - 수박🇻🇳🍉,Ngoài bóng rổ ra😀 thì qua hết,0,1702223339,ngoài bóng rổ ra thì qua hết
7307940975597568770,7307061469294759176,Văn Đào,2 triệu học lại 😂😂😂,0,1701512617,2 triệu học lại
7307634370621031170,7307061469294759176,❤️Alice✨❤️,:)những con người bt chs bóng chuyền ngồi nhìn be like :,0,1701441227,:)những con người bt chs bóng chuyền ngồi nhìn be like :
7307478367120409346,7307061469294759176,tpa,10đ thể chất nhả vía kiki,0,1701404921,10đ thể chất nhả vía kiki
7307887616781779713,7307061469294759176,thor iu,vả bóng:)),0,1701500195,vả bóng:))
7320248622826013441,7307061469294759176,justmanhh,😌 im fine quền chá nà,0,1704378222,im fine quền chá nà
7307903791000421138,7307061469294759176,英nahhnee,haizz,0,1701503958,haizz
7307531167561417479,7307061469294759176,800 toeic thì đổi tên,tý thì tạch cái môn này,0,1701417207,tý thì tạch cái môn này
7307505187903013633,7307061469294759176,Duy Ly,tưởng c3 các e học qua hết r mà nhể,0,1701411155,tưởng c3 các e học qua hết r mà nhể
7307601865037382402,7307061469294759176,...,ủa sao đánh bóng dễ mà ta😶,0,1701433662,ủa sao đánh bóng dễ mà ta
7310770436399629064,7307061469294759176,Hoàng Đào,bôi lơ vào,0,1702171406,bôi lơ vào
7307591403445863186,7307061469294759176,kuaaaa,ước chỗ mình có sân bóng như này 😔,0,1701431225,ước chỗ mình có sân bóng như này
7307329601104036615,7307061469294759176,jwelleb,ăn may được 8đ bóng chuyền cũng vui 😇,0,1701370274,ăn may được 8đ bóng chuyền cũng vui
7307330009697141512,7307061469294759176,Ru,nhận thi hộ bóng chuyền ạ =)))) bóng da bóng hơi chơi hết,0,1701370375,nhận thi hộ bóng chuyền ạ =)))) bóng da bóng hơi chơi hết
7307262686605312770,7307061469294759176,50kg thì đổi tên😗,Nhả vía bóng chuyền học lần thứ 3 mới qua. Ai nhận thì nhận🤣,0,1701354692,nhả vía bóng chuyền học lần thứ 3 mới qua. ai nhận thì nhận
7307429311752569607,7307061469294759176,thanhthí🍀,"lúc t tập phát 40 lần qua lưới 2 trái, lúc thi phát 5 trái qua 5, yên tâm tới thi bản năng sinh tồn trỗi dậy à 😅😅",0,1701393497,"lúc t tập phát 40 lần qua lưới 2 trái, lúc thi phát 5 trái qua 5, yên tâm tới thi bản năng sinh tồn trỗi dậy à"
7307421803830608648,7307061469294759176,Phương Phương,"đợt mk tập, bét lắm cx có thế này đou 🥹",0,1701391747,"đợt mk tập, bét lắm cx có thế này đou"
7307429355600757505,7307061469294759176,❄,nhả vía cô dễ nâng vừa đủ đậu hihi,0,1701393541,nhả vía cô dễ nâng vừa đủ đậu hihi
7308273629282697985,7307061469294759176,Toàn va phải hl** 😔,nhả vía đánh 4/5 quả qua lưới,0,1701590068,nhả vía đánh 4/5 quả qua lưới
7307354579866796818,7307061469294759176,ĐThe🍋,Ê cho hỏi là môn này cứ đánh bóng qua lưới là đạt hả mn 😅mình học thể chất 1 chạy mà muốn lết,0,1701376104,ê cho hỏi là môn này cứ đánh bóng qua lưới là đạt hả mn mình học thể chất 1 chạy mà muốn lết
7307280453735809793,7307061469294759176,tuyetmuahe259,đây là hình ảnh của tôi vào sáng mai :))) lạy trời cho qua môn thể chất,0,1701358831,đây là hình ảnh của tôi vào sáng mai :))) lạy trời cho qua môn thể chất
7307495723614929665,7307061469294759176,Welther,Lúc phát đừng thảy lên bạn ơi cứ cầm trên tay r phát th,0,1701408947,lúc phát đừng thảy lên bạn ơi cứ cầm trên tay r phát th
7307447333008409362,7307061469294759176,_MyLinh_🥀,Nhả vía phát bóng cao tay hay thấp tay đều đc 9đ nha,0,1701397693,nhả vía phát bóng cao tay hay thấp tay đều đc 9đ nha
7307445483424678657,7307061469294759176,Quế Anhhh nè 💗,Má ơi cười điên. Tự nhiên thấy chạy cũng dễ thương 🥲,0,1701397276,má ơi cười điên. tự nhiên thấy chạy cũng dễ thương
7307636371086099208,7307061469294759176,lethangws,Tính ra phát tay thấp này rất dễ luôn á mấy đứa em tôi ở nhà tôi có quả bóng hay chơi mình xong nó cũng khoái bảo cho thử nó phát quả đầu tiên tốt cực,0,1701441694,tính ra phát tay thấp này rất dễ luôn á mấy đứa em tôi ở nhà tôi có quả bóng hay chơi mình xong nó cũng khoái bảo cho thử nó phát quả đầu tiên tốt cực
7310613900026168065,7307061469294759176,Kim Hajin shop,K15 vẫn đang học thể chất nè.Nhả vía học thể chất 7 lần cho em nhé🥰,0,1702134965,k15 vẫn đang học thể chất nè.nhả vía học thể chất 7 lần cho em nhé
7307258892211733266,7307061469294759176,💮,2tr học lại,0,1701353804,2tr học lại
7307859685188879106,7307061469294759176,🐻‍❄️,Khó z cũng làm dc 😂😂😂,0,1701493705,khó z cũng làm dc
7307655833251808002,7307061469294759176,tdung,🤣nhả vía qua tất thể chất ở PKA nhé,0,1701446233,nhả vía qua tất thể chất ở pka nhé
7307511334479364866,7307061469294759176,Mai Huyen Trang,Thi trượt 2 lần tới lần ba thiếu 1đ nữa mới qua 😞,0,1701412588,thi trượt 2 lần tới lần ba thiếu 1đ nữa mới qua
7307551284835386114,7307061469294759176,ts,ms đki xong nhaaa,0,1701421891,ms đki xong nhaaa
7307488595211666177,7307061469294759176,longbui3788,Triều Tiên,0,1701407297,triều tiên
7307909888343802631,7307061469294759176,Notifier,Trường xịn học bóng xịn,0,1701505377,trường xịn học bóng xịn
7307909204492403464,7307061469294759176,cyan,tiên học lại à,0,1701505223,tiên học lại à
7307263321186730759,7307061469294759176,Thích ăn gà rán 🍗,T đi thi phải thắp hương các cụ đó bay may sao mà đủ qua môn không thì móm,0,1701354835,t đi thi phải thắp hương các cụ đó bay may sao mà đủ qua môn không thì móm
7307938751588614913,7307061469294759176,ăn thịt người lùn👹,phát hụt hay z :)),0,1701512099,phát hụt hay z :))
7311448629636694786,7307061469294759176,IMJUN,nhả vía A+ cho nè🥰,0,1702329335,nhả vía a+ cho nè
7308035661185303297,7307061469294759176,Chiiiiiiii,học thầy Căn vẫn sợ trượt=)) may thầy cho thi lại :))),0,1701534673,học thầy căn vẫn sợ trượt=)) may thầy cho thi lại :)))
7307596920318182151,7307061469294759176,1𝓷𝓰ᥫ᭡,bt làm động tác khác nhưng riêng phát bóng là tay gãy,0,1701432509,bt làm động tác khác nhưng riêng phát bóng là tay gãy
7307613219711320839,7307061469294759176,tuimyneba,Phát là phần dễ nhất gòi đó chị oi,0,1701436305,phát là phần dễ nhất gòi đó chị oi
7307279716561650433,7307061469294759176,Duongsuy,ước gì trường mình có môn này,0,1701358663,ước gì trường mình có môn này
7307857607178453761,7307061469294759176,kén ăn nhất nhà🤨,phát ntn dễ mà chỉ đỡ bóng là khoai thôi,0,1701493205,phát ntn dễ mà chỉ đỡ bóng là khoai thôi
7307343322510557960,7307061469294759176,không có bông tuyết nào...,ms thi xong😂 yên tâm ngon giấc hẳn😌😌,0,1701373483,ms thi xong yên tâm ngon giấc hẳn
7308032317044917010,7307061469294759176,Bảo Vật Tay💪,đưa t phát ez😂😂,0,1701533883,đưa t phát ez
7308007433392603906,7307061469294759176,Minato,nhả vía thi 2 môn đều vừa khít đủ điểm,0,1701528090,nhả vía thi 2 môn đều vừa khít đủ điểm
7307263756835914498,7307061469294759176,Ẹc,sao có thể đánh trượt đc hay v nhỉ😂😂,0,1701354941,sao có thể đánh trượt đc hay v nhỉ
7310900733627990791,7307061469294759176,dieu linh🌧️,bóng chuyền dễ mà=))),0,1702201735,bóng chuyền dễ mà=)))
7307377170191434498,7307061469294759176,Min Chu👀,nhả vía thi bóng chuyền 9đ 🤧,0,1701381394,nhả vía thi bóng chuyền 9đ
7307692505478710023,7307061469294759176,bọng mắt của Joshuji💞👀,ban đầu hơi đau tay tí nma đánh thích,0,1701454782,ban đầu hơi đau tay tí nma đánh thích
7307320566523298567,7307061469294759176,Min Thưư,đợt thi này 2₫ -.-,0,1701368169,đợt thi này 2 -.-
7307324427967415048,7307061469294759176,Vịt baby,Nhả vía 9 nè 😂,0,1701369072,nhả vía 9 nè
7307335485772088065,7307061469294759176,.,Nhả vía 8₫ thi đúng 1 phát,0,1701371664,nhả vía 8 thi đúng 1 phát
7307500318739743495,7307061469294759176,iam_bna💫,Tui 10đ rùiii🥰,0,1701410018,tui 10đ rùiii
7307726993331127047,7307061469294759176,én,học thầy Căn phát bóng hok qua là ra bật cóc ngược 1 vòng sân ☺️,0,1701462812,học thầy căn phát bóng hok qua là ra bật cóc ngược 1 vòng sân
7308013555122193153,7307061469294759176,🪷Ngộ Tuệ Nhã🪷,Tao con trai đây mà làm còn ko dc thế là thể dục ko đạt 😂,0,1701529517,tao con trai đây mà làm còn ko dc thế là thể dục ko đạt
7307600463779906311,7307589498878102792,Pattranite😾,Lần đầu tiên trái thanh long có trong nồi chiên,1348,1701433333,lần đầu tiên trái thanh long có trong nồi chiên
7307590253036094210,7307589498878102792,mh,"mình ăn cái này thật hôi hôi sao á, kbt có ai thấy giống hogg??",110,1701430965,"mình ăn cái này thật hôi hôi sao á, kbt có ai thấy giống hogg??"
