comment_id,video_id,username,comment_text,digg_count,create_time,clean_text
7505776249592857351,7488988284744436999,ú na ú nửn,"Tim để học sinh xuất sắc
　 　　　
1 giờ 　 trả lời　 　 　 　 　 　 ♥️9999.9B
　　　　　　　　　
　—xem 999 câu trả lời",175,1747574729,tim để học sinh xuất sắc 1 giờ trả lời 9999.9b xem 999 câu trả lời
7488991934390076168,7488988284744436999,TTF┊ᰔᩚ༺ LẶNG༺,Xin lỗi tôi đã cười 🤣🤣🤣🤣🤣🤣🤣🤣,42,1743666835,xin lỗi tôi đã cười
7489042132951761681,7488988284744436999,Nhi Trần,"ngực nơi chứa sữa cho con đi làm ntn...đã sinh con không làm, làm không sinh",98,1743678524,"ngực nơi chứa sữa cho con đi làm ntn...đã sinh con không làm, làm không sinh"
7506427882639442695,7488988284744436999,flora_huongthao,Sao ai cũng bảo nâng an toàn k vỡ mà nhỉ nhìn như này thì ai dám làm nữa đâu,17,1747726452,sao ai cũng bảo nâng an toàn k vỡ mà nhỉ nhìn như này thì ai dám làm nữa đâu
7489029072062186260,7488988284744436999,Vũ Luân 68E1,ông ck cũng mạnh tay à 🤣🤣🤣,10,1743675484,ông ck cũng mạnh tay à
7488990146223620880,7488988284744436999,tủM,Tôi cũng đến chịu 😂😂,17,1743666412,tôi cũng đến chịu
7488993143657349906,7488988284744436999,QUỐC HÙNG,xin lỗi vì tôi nghi anh hàng xóm lâu ngày mới gặp 🤣🤣🤣🤣🤣,3,1743667110,xin lỗi vì tôi nghi anh hàng xóm lâu ngày mới gặp
7488997927801832199,7488988284744436999,phong thủy đổi vận,đẹp an toàn thôi...đẹp tự nhiên là tốt nhất,10,1743668221,đẹp an toàn thôi...đẹp tự nhiên là tốt nhất
7489055420528837383,7488988284744436999,Nhung Đỗ,vẫn còn thay túi mới 🤣,10,1743681611,vẫn còn thay túi mới
7489076214293381906,7488988284744436999,Xu.,này do th chồng rồi🤣,8,1743686445,này do th chồng rồi
7489004743345210133,7488988284744436999,Baby Pumpkin 🐈🐈,Cỡ tiết dịch túi là do đó là túi nc biển,6,1743669812,cỡ tiết dịch túi là do đó là túi nc biển
7488998304396690194,7488988284744436999,giangg1707,Bởi vậy ck t kiu nào nghĩ sanh mới cho nâng còn sanh là không cho nâng,6,1743668316,bởi vậy ck t kiu nào nghĩ sanh mới cho nâng còn sanh là không cho nâng
7508353326343013128,7488988284744436999,ʙᴀᴏ кʜᴀɴɢ ᴍᴏᴏʟɪᴛ,tim để may mắn 🍀☄,3,1748174744,tim để may mắn
7506105209078711048,7488988284744436999,☆M.Thư☆,"tim họ sinh sx
❤️9999.99B",4,1747651327,tim họ sinh sx 9999.99b
7508795549425713927,7488988284744436999,Hoàn kim cơ giáp,Tìm may mắn cả năm,1,1748277707,tìm may mắn cả năm
7505672550413484820,7488988284744436999,Văn Minh,——xem 1000000000 câu trả lời,1,1747550589,xem 1000000000 câu trả lời
7522007721518056199,7488988284744436999,Tú Ly,Túi bây h lm sao mà vỡ đc nhỉ mình cũng mới lm xong,3,1751353909,túi bây h lm sao mà vỡ đc nhỉ mình cũng mới lm xong
7506852017412637448,7488988284744436999,Bùi Thuận 🐔,"tim ko để bị chỉ😂😂😂.
❤️999.999.999B",2,1747825203,tim ko để bị chỉ. 999.999.999b
7505737032611513095,7488988284744436999,Thảo My yêu màu hồng!!,ê đang ăn lun á,1,1747565598,ê đang ăn lun á
7506892116648362760,7488988284744436999,Em ko trêu 😊,tim để đc điểm cao,1,1747834533,tim để đc điểm cao
7496900467597001490,7488988284744436999,Quắc Phét🗿,ai hộ video đầu với❤️,3,1745508179,ai hộ video đầu với
7489120404457718548,7488988284744436999,Moon mụp mẹp,thắc mắc bấy lâu đã đx giải đáp😂,1,1743696739,thắc mắc bấy lâu đã đx giải đáp
7489103859144983304,7488988284744436999,Nhi Nhi 💛,K thương nổi trường hợp này,1,1743692891,k thương nổi trường hợp này
7508768891011629832,7488988284744436999,K Min Minn 🥦,gì vậy tr 🙂,0,1748271497,gì vậy tr
7489021236010582802,7488988284744436999,Đời nó nhạt 🤣🤣🤣,k thay thì nó bèo nhèo,0,1743673646,k thay thì nó bèo nhèo
7508405354389291783,7488988284744436999,Cụt Mỡ 😂,"tui muốn đi treo sa trễ, nhưng nhìn cắt bớt may lại thấy đau quá",0,1748186856,"tui muốn đi treo sa trễ, nhưng nhìn cắt bớt may lại thấy đau quá"
7507026155015275282,7488988284744436999,heo lùn 😘😘,ôi trời ơi chả bù cho mình 😂😂 nghe sợ thế 😂,0,1747865759,ôi trời ơi chả bù cho mình nghe sợ thế
7518367545154618130,7488988284744436999,Luân Đi A50❤️‍🩹,Chung quy lại là tự nhiên là tốt nhất,0,1750506360,chung quy lại là tự nhiên là tốt nhất
7498989183434212104,7488988284744436999,👉🏻 PBC 🫶🏻,@𝓚𝓲𝓶 𝓗𝓮𝓪𝓰𝓲𝓷 💗: Cần ng chấm điểm nhật ký 😭,0,1745994500,: cần ng chấm điểm nhật ký
7504286525234234129,7488988284744436999,Trang♡,uuuuuuu,0,1747227879,uuuuuuu
7498385533904388885,7488988284744436999,Khanhlinh -122,ông chồng giỏi v 🥰,0,1745853947,ông chồng giỏi v
7507563410034672392,7488988284744436999,longday,S ơi,0,1747990832,s ơi
7504969992056996626,7488988284744436999,💖 GlrL 💖 漂亮的,ô mai gót 💬💬💬💬💬💬💬💬💬💬💬💬💬💬💬💬💬💬💬💬💬💬💬💬💬💬💬💬💬💬💬💬💬💬💬💬💬💬,0,1747387008,ô mai gót
7499410079683216136,7488988284744436999,Chú in,Labor Day,0,1746092485,labor day
7506787346932450055,7488988284744436999,em lig cte.,thay là ch sợ,0,1747810144,thay là ch sợ
7506971452810740487,7488988284744436999,Nội Thất Emerald,có tiền thì đợi ko sinh nữa hãng nâng,0,1747853019,có tiền thì đợi ko sinh nữa hãng nâng
7505562506908222209,7488988284744436999,hehhs930,"tim cả năm mày mắn
❤️9999999.B
-xem 99999câu trả lời",0,1747524983,tim cả năm mày mắn 9999999.b -xem 99999câu trả lời
7510623511452140304,7488988284744436999,Thái sƠn,để tự nhiên là đẹp nhất,0,1748703316,để tự nhiên là đẹp nhất
7506413494893347591,7488988284744436999,Trần Phương,"Tui nâng mấy năm r ko bị gì cả, mn tìm hiểu kĩ trước khi làm nhé",0,1747723102,"tui nâng mấy năm r ko bị gì cả, mn tìm hiểu kĩ trước khi làm nhé"
7510595002713457426,7488988284744436999,Đỗ C3 đổii tênnᡣ𐭩,chắc lực tay ôg chồng pk mạnh lắm,0,1748696675,chắc lực tay ôg chồng pk mạnh lắm
7509484409570116370,7488988284744436999,my heo🧏‍♀️,sö ca nhà oi nên e kg dám làm,0,1748438093,s ca nhà oi nên e kg dám làm
7495400914921751297,7488988284744436999,114,ô vãi lòng,0,1745159032,ô vãi lòng
7505780484174889735,7488988284744436999,Giang,Vẫn còn thay túi mới. Lậy,0,1747575713,vẫn còn thay túi mới. lậy
7506113223205536533,7488988284744436999,Cookkid,3 giờ 　 trả lời,0,1747653186,3 giờ trả lời
7530141231268987656,7488988284744436999,phúc,cho hỏi là mang túi đó mới bị vỡ hay ko có túi cx bị vỡ,0,1753247638,cho hỏi là mang túi đó mới bị vỡ hay ko có túi cx bị vỡ
7521927911278396168,7488988284744436999,ThuyThuy,"M đặt túi bên bác Ng Trọng Hiếu trvia mau lành, k sưng đau. Dc bảo hành nên cx yên tâm",0,1751335331,"m đặt túi bên bác ng trọng hiếu trvia mau lành, k sưng đau. dc bảo hành nên cx yên tâm"
7508035580203123463,7488988284744436999,nợ 25tr!,💀con gái vậy đó,0,1748100980,con gái vậy đó
7504978530771485458,7488988284744436999,@,toán văn English,0,1747388999,toán văn english
7506859600030892807,7488988284744436999,Ngọc Bích,t cx kh ngờ là v😇🙏,0,1747826966,t cx kh ngờ là v
7506506276478993170,7488988284744436999,ba' kh ah?,cái bl có 1 cái mà cả đám nhai lại 🥰🥰🥰😍😍😍😘😘😘,0,1747744699,cái bl có 1 cái mà cả đám nhai lại
7508363171233907474,7488988284744436999,nhã lam,chị mình bị vở,0,1748177035,chị mình bị vở
7495343323886109447,7488988284744436999,Cem Bẫy Bỳ,"Sợ quá,hu hu 😭😭😭",0,1745145630,"sợ quá,hu hu"
7488994349876511508,7488988284744436999,Bánh Apple pie,nâng cho cố vô😹🤣🤣,4,1743667398,nâng cho cố vô
7489006984051966728,7488988284744436999,Hoàng Minh 🌲,@Kiim Chii's,1,1743670339,'s
7489005739761074952,7489003248263695623,Ababáo,tội vậy 😢 tội a xe container 😫,54,1743670049,tội vậy tội a xe container
7489007314104681234,7489003248263695623,VANANH07.01,"6h30 sáng-xe đạp thể thao -đi vào làn ô tô ....thì chắc là thuộc nhóm ""đoàn xe ưu tiên đc phép vượt đèn đỏ"" vào mỗi buổi sáng rồi,đúng -sai gì chưa nói đến nhưng bác tài vất vả rồi",179,1743670405,"6h30 sáng-xe đạp thể thao -đi vào làn ô tô ....thì chắc là thuộc nhóm ""đoàn xe ưu tiên đc phép vượt đèn đỏ"" vào mỗi buổi sáng rồi,đúng -sai gì chưa nói đến nhưng bác tài vất vả rồi"
7489006738197938951,7489003248263695623,Phượng Sài Gòn ¹⁹⁸⁸,"Khổ thân ông cont, tự dưng mắc vạ",14,1743670276,"khổ thân ông cont, tự dưng mắc vạ"
7489006042710639378,7489003248263695623,♾️ THIÊN TÔN,tội anh xe công quá,17,1743670111,tội anh xe công quá
7489054626059567890,7489003248263695623,Cà tím,"xe cont có sao khong, bơi thường thiệt hại tinh thần cho xe cont",10,1743681422,"xe cont có sao khong, bơi thường thiệt hại tinh thần cho xe cont"
7489011653439161108,7489003248263695623,Khắc Tiệp,Cái bánh xe cont có bị gì k?,23,1743671414,cái bánh xe cont có bị gì k?
7489047552491733778,7489003248263695623,Ba Ốc,"Xe đạp thể thao, xin lỗi nha mình ko tiếc 😂",179,1743679776,"xe đạp thể thao, xin lỗi nha mình ko tiếc"
7489004757269660437,7489003248263695623,Hoài Hận,khổ Bác Tài rồi.,7,1743669810,khổ bác tài rồi.
7489024501768127253,7489003248263695623,funny,lời cảnh tĩnh dành cho mấy ông cố bà cố đi xe đạp mà đèn k quan tâm làn đường cũng k quan tâm. giờ quan tâm nhiều vô chứ k ai né kịp đâu,9,1743674416,lời cảnh tĩnh dành cho mấy ông cố bà cố đi xe đạp mà đèn k quan tâm làn đường cũng k quan tâm. giờ quan tâm nhiều vô chứ k ai né kịp đâu
7489010368649413383,7489003248263695623,Nguyễn Đức Phương,Báo người ta không,6,1743671121,báo người ta không
7489010358734340872,7489003248263695623,🌹Bảo yến🌹,Chạy xe đạp mà đi làn đường oto .cạn lời,16,1743671126,chạy xe đạp mà đi làn đường oto .cạn lời
7489006145870627592,7489003248263695623,Vương cậu,Liên tục như thế này thì mới hết xe đạp vào đường cao tốc hay làn ô tô đc,5,1743670144,liên tục như thế này thì mới hết xe đạp vào đường cao tốc hay làn ô tô đc
7489006113762657040,7489003248263695623,Thanh Pham,vì sao người đi đúng cũng phải chịu trách nhiệm là sao nhỉ,117,1743670132,vì sao người đi đúng cũng phải chịu trách nhiệm là sao nhỉ
7489006359346758408,7489003248263695623,Vinh,Chắc nghĩ xe nó né,5,1743670181,chắc nghĩ xe nó né
7489019042101117704,7489003248263695623,ղɕʊɣễղ ƙɦ¡êლ,xe đạp phải đền thiệt hại cho xe công,18,1743673145,xe đạp phải đền thiệt hại cho xe công
7489014331594851079,7489003248263695623,Nobita,tầm tuổi này khó dạy lắm 😅,4,1743672040,tầm tuổi này khó dạy lắm
7489020014067794696,7489003248263695623,tú tặc,chia buồn với tài xe cont,3,1743673365,chia buồn với tài xe cont
7489038040963531538,7489003248263695623,Phong Le,để coi sáng mai tụi nó còn dám vào nữa kg,18,1743677559,để coi sáng mai tụi nó còn dám vào nữa kg
7489004071862289170,7489003248263695623,Là Nó Long,Chán nhỉ,1,1743669655,chán nhỉ
7489004668854485768,7489003248263695623,aaaaaaaaaaaaaaa,mớ này có phải mớ lúc sáng chạy ở điện biên phủ ko nhỉ,13,1743669797,mớ này có phải mớ lúc sáng chạy ở điện biên phủ ko nhỉ
7489012831229575954,7489003248263695623,Tuấn Thai,tội cho tx,4,1743671692,tội cho tx
7489014994517197586,7489003248263695623,nguyenxuan7893,Khỏe đâu chưa thấy mà thấy đi sớm,2,1743672193,khỏe đâu chưa thấy mà thấy đi sớm
7489021235256017682,7489003248263695623,Nguyễn Văn Chung,chia buồn cùng bác tài 🥰🥰🥰,2,1743673648,chia buồn cùng bác tài
7489021253375148818,7489003248263695623,Phi Hải,Sao lại chạy vào làm xe ô tô chi ta,2,1743673651,sao lại chạy vào làm xe ô tô chi ta
7489004542399578888,7489003248263695623,Cường cò27,Xót xe đạp quá 😂😂😂,4,1743669764,xót xe đạp quá
7489009582937850632,7489003248263695623,Hiếu Nguyễn,tôi nói thật nhe t7 cn là có đoàn xe đạp chuyện chạy theo bầy mà còn lại ra ngoài lane xe lớn rất bức xúc . tôi chạy thư báo ở kcn tân phú trung thấy hoài,2,1743670933,tôi nói thật nhe t7 cn là có đoàn xe đạp chuyện chạy theo bầy mà còn lại ra ngoài lane xe lớn rất bức xúc . tôi chạy thư báo ở kcn tân phú trung thấy hoài
7489018012902818578,7489003248263695623,→Tค๓☆Tђế☆‿ 💯,Sáng còn cỡ chục ng chạy xe đạp đoàn đó luôn đứng ở lại mà,4,1743672906,sáng còn cỡ chục ng chạy xe đạp đoàn đó luôn đứng ở lại mà
7489014428655190791,7489003248263695623,Hạo Nam,Tội tài xế xe công,1,1743672066,tội tài xế xe công
7489012568104731399,7489003248263695623,polo nam new,"sáng nào đi làm cũng mấy anh mấy chị kéo nhau nhiều thì chục hơn ít thì 4 5 người toàn vượt đèn đỏ,chạy giữa đường,hàng ngang hàng ba.",1,1743671632,"sáng nào đi làm cũng mấy anh mấy chị kéo nhau nhiều thì chục hơn ít thì 4 5 người toàn vượt đèn đỏ,chạy giữa đường,hàng ngang hàng ba."
7489007794629280529,7489003248263695623,☪ậų_ßé_ų40,"😔😔 còn 1 thương tâm cùng thời điểm ở chân cầu vĩnh bình nữa ad . hông phải xe đạp thể thao , sát lề đường bên phải",1,1743670527,"còn 1 thương tâm cùng thời điểm ở chân cầu vĩnh bình nữa ad . hông phải xe đạp thể thao , sát lề đường bên phải"
7489021437631365905,7489003248263695623,hnv952,này thì tập thể dục này,0,1743673697,này thì tập thể dục này
7489009551786951442,7489003248263695623,Xã Đức thịnh xe hợp đồng,Nên cấm tập thể dục ngoài đường ô tô,0,1743670928,nên cấm tập thể dục ngoài đường ô tô
7489022382445085458,7489003248263695623,Tấn Tài,Luật parky,0,1743673923,luật parky
7489024412567782150,7489003248263695623,李莫愁,đường này là đường của chị 😂😂😂😂😂😂😂😂😂😂,0,1743674421,đường này là đường của chị
7490159784567522056,7489003248263695623,꧁ᬊᬁ lãng ❤️❤️tửᬊ᭄꧂,chạy vào làng ô tô thì thua rồi,0,1743938743,chạy vào làng ô tô thì thua rồi
7489027018542187282,7489003248263695623,trung kín,xe đạp còn vào cả cao tốc nữa mà,0,1743674992,xe đạp còn vào cả cao tốc nữa mà
7489328372414710535,7489003248263695623,Chú Bốn Lù,tội quá.hic,0,1743745165,tội quá.hic
7489057351670268692,7489003248263695623,Hải Tuấn,Đường xe oto mà xe đạp chui vào chi,0,1743682063,đường xe oto mà xe đạp chui vào chi
7489012843783455505,7489003248263695623,phạm Ngọc Long,xe đạp thể thao là hiểu rồi.,0,1743671699,xe đạp thể thao là hiểu rồi.
7489022077882614536,7489003248263695623,châu minh triết 2019,Việt Nam đúng cũng chíc >sai càng chíc..chỉ có ở vn,0,1743673843,việt nam đúng cũng chíc >sai càng chíc..chỉ có ở vn
7489023118309098258,7489003248263695623,hồng bảo,e cũng thấy xe tập thể dục chạy ge qua,0,1743674082,e cũng thấy xe tập thể dục chạy ge qua
7489015642391233296,7489003248263695623,THÀNH TRUNG 🧭⚓🌐,rồi cái bánh xe có sao ko😔😔😔,0,1743672366,rồi cái bánh xe có sao ko
7489015829276803856,7489003248263695623,Muỗi🦟,"Khổ thân anh tài xế. Mất công mất việc, lại còn bị giam xe",0,1743672400,"khổ thân anh tài xế. mất công mất việc, lại còn bị giam xe"
7489011631102395144,7489003248263695623,Hớt Tóc Lê Trọng Vua Ráy Tai,cần sức khỏe chứ k cần mạng🥺,0,1743671420,cần sức khỏe chứ k cần mạng
7489743886727201554,7489003248263695623,chaubp,40f dau ra,0,1743841902,40f dau ra
7489020396081054472,7489003248263695623,civilwar,Thằng chồng chạy mất dép 🥺🥺,0,1743673459,thằng chồng chạy mất dép
7489020152664572679,7489003248263695623,🦚Thế sao🌸,luật vn lạ lắm,0,1743673402,luật vn lạ lắm
7489025651157271303,7489003248263695623,⚡🌟trương mỹ 🌟⚡,thật đau lòng 😭,0,1743674676,thật đau lòng
7489024620097127186,7489003248263695623,-  @TUẤN ANH,những xe thể thao chạy vào làn ô tô ko tiếc😂😂,0,1743674439,những xe thể thao chạy vào làn ô tô ko tiếc
7489750253819527944,7489003248263695623,phạm duy,xe công có sao ko z,0,1743843388,xe công có sao ko z
7489017317478990599,7489003248263695623,•๖ۣۜTɦàηɦ ๖ۣۜPɦú⁀ᶦᵈᵒ,Sáng sớm tập thể dục xe đẹp chạy giữa lộ hàng 3 vượt đèn đỏ ko,0,1743672741,sáng sớm tập thể dục xe đẹp chạy giữa lộ hàng 3 vượt đèn đỏ ko
7489009685938684690,7489003248263695623,Mê Chụp Ảnh 📸,cứ xe to là khổ trước đã.chán lắm cái luật,0,1743670965,cứ xe to là khổ trước đã.chán lắm cái luật
7489019476021756680,7489003248263695623,Quang Pham,báo tx ko,0,1743673238,báo tx ko
7489015508974551815,7489003248263695623,phúc_Joker,rồi luật giải quyết thế nào...nếu xđ lỗi ở người đi xe đạp...khi đó xe cont bị giam mấy ngày tổn thất kinh tế thì ai đền bù...(đừng biện lý do tình gì ở đây...hãy để pl làm cho rõ ràng)😒😒😒,0,1743672323,rồi luật giải quyết thế nào...nếu xđ lỗi ở người đi xe đạp...khi đó xe cont bị giam mấy ngày tổn thất kinh tế thì ai đền bù...(đừng biện lý do tình gì ở đây...hãy để pl làm cho rõ ràng)
7489026398377247508,7489003248263695623,đại diện thời phong kiến,@Kazubu🌪️ nghe k bà thơ,1,1743674855,nghe k bà thơ
7489066518505800469,7489003248263695623,Người vận chuyển,Giao thông k làm căng cái vụ xe đạp này thì còn nhiều chuyện nữa 😂,0,1743684192,giao thông k làm căng cái vụ xe đạp này thì còn nhiều chuyện nữa
7489009570879996680,7489003248263695623,xuân thanh,Đúng rồi sáng xe đạp đi thể thao thường là họ đi vào xe lớn thông thoáng hơn mình gặp hoài,0,1743670936,đúng rồi sáng xe đạp đi thể thao thường là họ đi vào xe lớn thông thoáng hơn mình gặp hoài
7489013639148503826,7489003248263695623,Hoang Nam,"Tui đi làm 5h sáng từ củ chi đi q1 gặp cảnh xe đạp chạy hàng 2,3, khi thì chạy vảo làn ôtô, khi gặp đèn đỏ thì họ la hét cho mọi người tránh đường để vượt đèn đỏ",0,1743671875,"tui đi làm 5h sáng từ củ chi đi q1 gặp cảnh xe đạp chạy hàng 2,3, khi thì chạy vảo làn ôtô, khi gặp đèn đỏ thì họ la hét cho mọi người tránh đường để vượt đèn đỏ"
7489007206428836626,7489003248263695623,Ngọc Hưng Đ Nẵng,"Trách là trách mấy người đi xe đạp,cứ nghĩ đường là của chung nên đi thế nào cũng đc",3,1743670386,"trách là trách mấy người đi xe đạp,cứ nghĩ đường là của chung nên đi thế nào cũng đc"
7489007664398074631,7489003248263695623,Trường Thành đây♈,Vừa lòng t lắm,2,1743670500,vừa lòng t lắm
7489012693567849234,7489003248263695623,Minh Củ Chi,xe đạp thể thao hay chạy vô làn ô tô và vượt đèn chạy hàng hai hàng ba mình bóp kèn quay lại nhìn mình phải né,1,1743671656,xe đạp thể thao hay chạy vô làn ô tô và vượt đèn chạy hàng hai hàng ba mình bóp kèn quay lại nhìn mình phải né
7489006296462344977,7489003248263695623,Minhkiên,T nói có ngày mà,2,1743670184,t nói có ngày mà
7489005684231914261,7489003248263695623,The.End.00,Lỡ đụng vào gia súc thôi mà có gì đâu,2,1743670031,lỡ đụng vào gia súc thôi mà có gì đâu
7489005058244477714,7489003248263695623,Ánh tuyết 8️⃣8️⃣8️⃣8️⃣,thấy nằm dưới bánh xe ám ảnh 😞,2,1743669882,thấy nằm dưới bánh xe ám ảnh
7489008415277187847,7489003248263695623,K,Mấy mịa già ra đường làm như đường nhà nó bữa t ra đường chạy xe thì phải nhìn 2 hướng để băng qua đường vừa nhìn hướng bả xong nhìn sang hướng kia để xem có xe ko để băng qua. Bả la như tưởng mình,1,1743670663,mấy mịa già ra đường làm như đường nhà nó bữa t ra đường chạy xe thì phải nhìn 2 hướng để băng qua đường vừa nhìn hướng bả xong nhìn sang hướng kia để xem có xe ko để băng qua. bả la như tưởng mình
7489004628300497671,7489003248263695623,Nay cúp điện,"t nghĩ ông ck âm mưu git vk nên mới rủ vk chạy chung.
chứ ng bth đâu ng vậy đâu",1,1743669786,t nghĩ ông ck âm mưu git vk nên mới rủ vk chạy chung. chứ ng bth đâu ng vậy đâu
7489022028520817415,7489003248263695623,võ khang,chạy đúng luật phải đền cho người chạy sai luật.....🤣🤣,0,1743673839,chạy đúng luật phải đền cho người chạy sai luật.....
7489013857152369426,7489003248263695623,Bình Nguyễn 37,đi ko cần nhìn trước sau nữa chí phải à... sớm muộn thôi,0,1743671932,đi ko cần nhìn trước sau nữa chí phải à... sớm muộn thôi
7489012749650445063,7489003248263695623,Tuấn Thai,vừa bụng lắm,0,1743671675,vừa bụng lắm
7489269278971233032,7489265961791393042,Hoàng Quang,Tình mẫu tử tôn trọng !,697,1743731418,tình mẫu tử tôn trọng !
7489269688087020295,7489265961791393042,Thắng,Nghĩ Cũng tội..😳,89,1743731505,nghĩ cũng tội..
7489267291345208071,7489265961791393042,кто укусил,đầu nek,2,1743730952,đầu nek
7489314535662666512,7489265961791393042,Cuccucgoicam,Mấy khứa canh trại ăn biên bản. cui nữa khởi tố hình sự luôn đó,14,1743741962,mấy khứa canh trại ăn biên bản. cui nữa khởi tố hình sự luôn đó
7489281968309650184,7489265961791393042,Hiếuk5,"yêu mẹ thì thừa nhưng đâu bt ng làm mẹ bệnh lại là chính mik , tất cả do bản thân thì chịu thôi",149,1743734367,"yêu mẹ thì thừa nhưng đâu bt ng làm mẹ bệnh lại là chính mik , tất cả do bản thân thì chịu thôi"
7489279031374086919,7489265961791393042,FASHION,cho a đó về đi vài ngày cũng đc hoàn cảnh v mà.,5,1743733693,cho a đó về đi vài ngày cũng đc hoàn cảnh v mà.
7489403871888409351,7489265961791393042,Hieu Ha,nó còn hơn vạn lần thằng,0,1743762743,nó còn hơn vạn lần thằng
7520280886891791112,7489265961791393042,Nguyễn Phát,Anh sai luật pháp nhưng anh đúng luật đời,1,1750951847,anh sai luật pháp nhưng anh đúng luật đời
7489452992819921672,7489265961791393042,Vui Là Chính,Đấy giờ mới biết sự tự do nó quý như nào ông anh,0,1743774171,đấy giờ mới biết sự tự do nó quý như nào ông anh
7505359681511162641,7489265961791393042,Buyry Khanh,"tâm lý phạm nhân trong trại các cán bộ rất quan tâm, phạm nhân mà có biểu hiện bất thường mà cán bộ bt đc là sẽ gọi lên làm việc thui.",0,1747477739,"tâm lý phạm nhân trong trại các cán bộ rất quan tâm, phạm nhân mà có biểu hiện bất thường mà cán bộ bt đc là sẽ gọi lên làm việc thui."
7519033008456745736,7489265961791393042,Phạm Minh Tiến,chú Công Lý,0,1750661301,chú công lý
7489437513074213639,7489265961791393042,Hà Cá Rô,ae tỉnh táo lên 🥺,0,1743770566,ae tỉnh táo lên
7489626329216238344,7489265961791393042,quan hệ đối tác trả phí,chốn bị bắt lại + thêm 3 năm😁,0,1743814559,chốn bị bắt lại + thêm 3 năm
7490136839183074056,7489265961791393042,trần hoàng lâm,vợ ly hôn mẹ tai biến ko trốn về sao biết mẹ giờ có ai trông ko sai với xã hội chứ chữ hiếu x10,0,1743933400,vợ ly hôn mẹ tai biến ko trốn về sao biết mẹ giờ có ai trông ko sai với xã hội chứ chữ hiếu x10
7489843772562473745,7489265961791393042,Trịnh Thiên Hổ,pha này k thể nói gì vì mẹ bệnh,0,1743865156,pha này k thể nói gì vì mẹ bệnh
7489463589268931346,7489265961791393042,bún đậu xì dầu,"Giống khá bảnh thôi, thương mẹ nhưng giờ còn đâu, nên là ráng sống cho tốt nhe các ae😁",0,1743776648,"giống khá bảnh thôi, thương mẹ nhưng giờ còn đâu, nên là ráng sống cho tốt nhe các ae"
7489272601525732114,7489265961791393042,Tôi Yêu Việt Nam,Các bạn trẻ nên lấy đó làm Gương,4,1743732175,các bạn trẻ nên lấy đó làm gương
