comment_id,video_id,username,comment_text,digg_count,create_time,clean_text
7496431260660318996,7495774298494209287,Đạt lad,ông thủ môn đổi qua chơi bóng rổ cũng không yên,265,1745398932,ông thủ môn đổi qua chơi bóng rổ cũng không yên
7499070673584866066,7495774298494209287,the abandoned one,"""even at the final moment his will didn't give up and push forward"" ahh libero ✋🤯✋",117,1746013470,"""even at the final moment his will didn't give up and push forward"" ahh libero"
7496017379617407752,7495774298494209287,𝚂𝙷𝙸𝚁𝙾𝙺𝙾,lelaki main voli 🗿,66,1745302564,lelaki main voli
7503002132174930696,7495774298494209287,official fearless.,He just made a history hahah,6,1746928836,he just made a history hahah
7503483086668382977,7495774298494209287,?,bóng đá vậy rồi qua bóng truyền vẫn không thoát🤣,8,1747040813,bóng đá vậy rồi qua bóng truyền vẫn không thoát
7497584904624947986,7495774298494209287,Chichi,kek dendam bet bjir😭,7,1745667529,kek dendam bet bjir
7496064915515786002,7495774298494209287,💤,ông thủ môn số nhọ năm nào=),74,1745313641,ông thủ môn số nhọ năm nào=)
7496129540163633938,7495774298494209287,Nyap payah,"Main bola sepak pun dia kena
main bola tampar pun Dia kena..hais nasib nasib😩",30,1745328677,main bola sepak pun dia kena main bola tampar pun dia kena..hais nasib nasib
7496009764209902344,7495774298494209287,ĐỗXuânTrung,Giống ông nào đó bên bóng đá😂,94,1745300800,giống ông nào đó bên bóng đá
7498949933821117192,7495774298494209287,LuisMzTr,alguien me cambio de server ?,7,1745985371,alguien me cambio de server ?
7496821739528209170,7495774298494209287,ងើបដើរម្តងទៀត😊,pram pram pram 😂,11,1745489843,pram pram pram
7495909131355767559,7495774298494209287,RIMURU,tuh yg main kena kepala mirip pemain kiper pemain bola dlu,44,1745277392,tuh yg main kena kepala mirip pemain kiper pemain bola dlu
7496078870070018837,7495774298494209287,™,Bỏ bóng đá qua bóng truyền cũng không tha 🤣,16,1745316889,bỏ bóng đá qua bóng truyền cũng không tha
7496274672054207250,7495774298494209287,JETT Thích Cầm Spike,nhớ tới anh thủ môn nào ds🤣,55,1745362500,nhớ tới anh thủ môn nào ds
7495804357843026696,7495774298494209287,Jackie,you can speak bisaya bruh?,38,1745252969,you can speak bisaya bruh?
7501661518590378770,7495774298494209287,Vendric/Jeyk,All ASEAN countries stealing originated songs from the Philippines in the big 25🥀💔,11,1746616695,all asean countries stealing originated songs from the philippines in the big 25
7496060528402842376,7495774298494209287,عٍلُِي | a̯͡l̯͡i̯͡,bad luck charm hhhhh🗿💔,31,1745312613,bad luck charm hhhhh
7499729292772786965,7495774298494209287,🥤MEY LOMG🥤 កែរសម្រួល☘️🌿,"even at the final moment his will didn't give up and push forward"" ahh libero ✋🤯✋",5,1746166813,"even at the final moment his will didn't give up and push forward"" ahh libero"
7495778803047351048,7495774298494209287,Luxyon.,nyasar mulu🗿,10,1745247015,nyasar mulu
7496353655252960008,7495774298494209287,alenkimtu,the legend,12,1745380865,the legend
7498245019565851399,7495774298494209287,mfibmf,poor libero😭,6,1745821236,poor libero
7497954564424188692,7495774298494209287,apip je,libero moment🗿🗿🗿,10,1745753602,libero moment
7498597929772008199,7495774298494209287,limli67,seriusan ini turnament voly?,22,1745903401,seriusan ini turnament voly?
7496698992203334418,7495774298494209287,ziq suka loli🗣️,Ruby recall²😋,5,1745461275,ruby recall
7496136246663791368,7495774298494209287,kevin pake v,asli gak sih,14,1745330243,asli gak sih
7496135715044279058,7495774298494209287,Blox world,Oh my gosh hahahaha 😅,5,1745330122,oh my gosh hahahaha
7499853774196228871,7495774298494209287,SAD SONG,Halatang bisaya 😂,6,1746195796,halatang bisaya
7504937656787796743,7495774298494209287,️Romanos 8:18 ✝️,pa más .,1,1747379482,pa más .
7505645372166095634,7495774298494209287,温柏恩,MVP,1,1747544253,mvp
7513968645158306578,7495774298494209287,𝐓𝐔Ҝ𝐔𝐋 𝐒𝐖𝐏☠︎︎,name sound,1,1749482162,name sound
7512465195156243208,7495774298494209287,Đào Ngoc Khánh Khánh,hảo đồng đội 😂😂😂,2,1749132113,hảo đồng đội
7502799094433497874,7495774298494209287,Kẻ tồi,🗣đi ăn trực đây,1,1746881558,đi ăn trực đây
7506713804966216466,7495774298494209287,Rijal jkg,savage 🗿😂😭,1,1747793025,savage
7503907296193118982,7495774298494209287,—͟͟͞͞𖣘,fue maldicion o suerte?,1,1747139605,fue maldicion o suerte?
7503182227941933842,7495774298494209287,gravitykhôngaiănlại,thiêt đâu công 🤣🤣🤣🤣🤣🤣🤣🤣🤣🤣🤣🤣🤣🤣,0,1746970756,thiêt đâu công
7503894918751519506,7495774298494209287,數|•ナイトXツ༒,lucky nya dh max kek nya🗿,0,1747136697,lucky nya dh max kek nya
7504696290359329554,7495774298494209287,Cao Lương,cười đâu bụng cúa,0,1747323283,cười đâu bụng cúa
7510982545795859216,7495774298494209287,.,ông áo xanh gánh hết,0,1748786911,ông áo xanh gánh hết
7524919828495270672,7495774298494209287,mai võ,nằm cũng ko yên,0,1752031934,nằm cũng ko yên
7510162737844339464,7495774298494209287,⚡Fatehhh⚽,top 10 libero moments 💀,0,1748596031,top 10 libero moments
7510187096998232853,7495774298494209287,Chèooo Ônggg !,Nói 0 với diễn🤣,0,1748601707,nói 0 với diễn
7503070230005662471,7495774298494209287,Raf.,asli kah,0,1746944688,asli kah
7512428342433383175,7495774298494209287,✧Epic✧,I love your content please don't get bald,0,1749123535,i love your content please don't get bald
7502686358386639624,7495774298494209287,the Avatar with 49% memory,legit bato o edited?,0,1746855307,legit bato o edited?
7504140735537627922,7495774298494209287,🅼🅰🆂 🅜🅔🅛🅛🅞🅦🇮🇩🇮🇩,menang sih menang tpi kepala gk bisa di ganti🗿,0,1747193930,menang sih menang tpi kepala gk bisa di ganti
7507837097316942600,7495774298494209287,Hiếu đệ free ball🤡👽,libero phải như thế chứ😀,0,1748054556,libero phải như thế chứ
7508252350311367431,7495774298494209287,QueeQe,cara Adit joget gitu gimana?,0,1748151235,cara adit joget gitu gimana?
7504637531150451473,7495774298494209287,bang z,ada dendam pribadi keknya,0,1747309608,ada dendam pribadi keknya
7511318925624378129,7495774298494209287,thích thì nhích,khi bạn có sức hút quá lớn🤣,0,1748865228,khi bạn có sức hút quá lớn
7506483724667650834,7495774298494209287,1+1=?,cái video nhảy lấy đâu v,0,1747739457,cái video nhảy lấy đâu v
7516093923208905492,7495774298494209287,chú mèo đi comment dạo,[ảnh],0,1749976999,[ảnh]
7514237925313446664,7495774298494209287,Hưng may mắn 💯💯,tội thanh niên 😁😁,0,1749544858,tội thanh niên
7502617865049342728,7495774298494209287,rimmu,AND HE SCORES,0,1746839365,and he scores
7506770573482836754,7495774298494209287,️,galing ng mga bisaya,0,1747806241,galing ng mga bisaya
7513400548668080913,7495774298494209287,hốp nak,ê Al hả,0,1749349902,ê al hả
7512675878457197319,7495774298494209287,🐉    🐉,xong trận cái thành người thực vật luôn,0,1749181167,xong trận cái thành người thực vật luôn
7503065132395004692,7495774298494209287,Hậu Nguyễn,tội libero thế,0,1746943497,tội libero thế
7506517149726802706,7495774298494209287,M.,kawawa naman po yung isa nyong ka team mate,0,1747747237,kawawa naman po yung isa nyong ka team mate
7502679988367098640,7495774298494209287,Trần Thái Dương       ︎︎︎︎︎︎,bóng đá sang bóng chuyền 😂😂,0,1746853830,bóng đá sang bóng chuyền
7508519474079171336,7495774298494209287,precious may baby girl,HAHAHAHAHA,0,1748213446,hahahahaha
7495970677440119559,7495960874469838098,Hihihi,11 xe,2,1745291698,11 xe
7516010190010024722,7495960874469838098,Lêu_lêu,Đường cao tốc lào cai chất lượng kém trong khi bây giờ xe con nhiều bạn trẻ đi xe ẩu lắm,0,1749957495,đường cao tốc lào cai chất lượng kém trong khi bây giờ xe con nhiều bạn trẻ đi xe ẩu lắm
7495992323152446216,7495960874469838098,DƯƠNG ĐÌNH NHUNG,lại do đoạn đang sửa chữa những không đc cảnh báo cần thận. dẫn đến nhiều xe bị bất ngờ phải phanh gấp.,2,1745296737,lại do đoạn đang sửa chữa những không đc cảnh báo cần thận. dẫn đến nhiều xe bị bất ngờ phải phanh gấp.
7495975055081767698,7495960874469838098,Xuân Bình 021983,"Hướng Lào Cai về HN đang sửa đường mà,tôi đi qua đấy vẫn phải đi chậm chậm cho nó an toàn",0,1745292718,"hướng lào cai về hn đang sửa đường mà,tôi đi qua đấy vẫn phải đi chậm chậm cho nó an toàn"
7495978460076114696,7495960874469838098,Dòng sông băng,nội bài lào cai tuyến đường từ ngủ,0,1745293516,nội bài lào cai tuyến đường từ ngủ
7495988690604737288,7495960874469838098,huydo0656,hu đường Cao tốc thế mà vẫn bị,0,1745295894,hu đường cao tốc thế mà vẫn bị
7496016150502769426,7495960874469838098,Tran cao,Thấy bảo 12 mà,0,1745302283,thấy bảo 12 mà
7507145934851408648,7495960874469838098,Muôn Dặm Bình An,mặt đường xấu mà xe to cứ thong thả chạy ở làn ưu tiên khiến các phương tiện toàn phải vượt bên phải gây nguy hiểm,0,1747893639,mặt đường xấu mà xe to cứ thong thả chạy ở làn ưu tiên khiến các phương tiện toàn phải vượt bên phải gây nguy hiểm
7496039113721086728,7495982526733847816,Đá cụi,"Thương Ông Bà, lớn tuổi ko được nghỉ ngơi, nuôi con giờ lại nuôi cháu mà xảy ra chuyện như vậy Ông Bà áy náy đau buồn suốt phần đời còn lại",363,1745307626,"thương ông bà, lớn tuổi ko được nghỉ ngơi, nuôi con giờ lại nuôi cháu mà xảy ra chuyện như vậy ông bà áy náy đau buồn suốt phần đời còn lại"
7496001309238592264,7495982526733847816,Mây xanh,"Mấy nay nắng nóng, cẩn thận an toàn thực phẩm nha mấy ní",29,1745298824,"mấy nay nắng nóng, cẩn thận an toàn thực phẩm nha mấy ní"
7496009722635797255,7495982526733847816,👑Kayla Kim Singer👑,"ko bao giờ cho con ăn đồ ăn hàng xóm cho,toàn ko ăn nữa để lâu mới cho thôi",81,1745300794,"ko bao giờ cho con ăn đồ ăn hàng xóm cho,toàn ko ăn nữa để lâu mới cho thôi"
7496022465673773842,7495982526733847816,Hoành Võ,Xã hội hiện tại gần như tất cả các thực phẩm thịt cá rau xanh hoà quả bánh kẹo nước ngọt các loại… đều có chất này chất nọ phụ gia mà đưa ra thị trường kg được kiểm chứng. Rất đáng buồn!,15,1745303754,xã hội hiện tại gần như tất cả các thực phẩm thịt cá rau xanh hoà quả bánh kẹo nước ngọt các loại đều có chất này chất nọ phụ gia mà đưa ra thị trường kg được kiểm chứng. rất đáng buồn!
7496003513630671636,7495982526733847816,Lệ Lơ Ngơ,"Tui cũng bị 1 lần do bánh ngọt, mấy cái bánh bông lan có kem hay chà bông ở trên ăn dễ bị lắm, lần đó tui ăn 1 muỗng thôi mà tưởng sắp đi rồi.",37,1745299343,"tui cũng bị 1 lần do bánh ngọt, mấy cái bánh bông lan có kem hay chà bông ở trên ăn dễ bị lắm, lần đó tui ăn 1 muỗng thôi mà tưởng sắp đi rồi."
7496082005249180432,7495982526733847816,Hoàng Minh Quyên,"Ông bà ngoại là thương cháu nhất , thương cả ông bà và các cháu",19,1745317630,"ông bà ngoại là thương cháu nhất , thương cả ông bà và các cháu"
7496016681685893905,7495982526733847816,đình nguyên,nên cam kết bán thuốc trừ sau thì không bán thứ khác mà nhiều nơi vẩn buôn bán tổng hợp,6,1745302414,nên cam kết bán thuốc trừ sau thì không bán thứ khác mà nhiều nơi vẩn buôn bán tổng hợp
7496006565405754128,7495982526733847816,Hanna Bui ❤️🤍❤️🤍,sao nh gđ khổ quá 😔 mà bố lv hà nội mẹ lại lv ở hp. 2 cô con gái thế này thg đứt ruột gan. Nam mô A di đà phật,8,1745300051,sao nh gđ khổ quá mà bố lv hà nội mẹ lại lv ở hp. 2 cô con gái thế này thg đứt ruột gan. nam mô a di đà phật
7495989082570408722,7495982526733847816,Nguyễn Thu An,ông bà sẽ dằn vặt lắm 🥺,54,1745295981,ông bà sẽ dằn vặt lắm
7495983423527666439,7495982526733847816,Bố của mèo con,trời ơi. tội quá. rồi ông bà sẽ suy sụp theo luôn😳😳😳,191,1745294671,trời ơi. tội quá. rồi ông bà sẽ suy sụp theo luôn
7496000345417990920,7495982526733847816,QuangDuy,"mong pháp luật điều tra làm rõ vụ này, chứ tôi nghi quá...",23,1745298611,"mong pháp luật điều tra làm rõ vụ này, chứ tôi nghi quá..."
7495990051320840977,7495982526733847816,lehar65,😂😂😂 thương các cháu khổ ông bà thương cha mẹ,30,1745296213,thương các cháu khổ ông bà thương cha mẹ
7495990203242251015,7495982526733847816,CatchSoul,Quá thương tâm. Tội nghiệp hai cháu nhỏ!,12,1745296249,quá thương tâm. tội nghiệp hai cháu nhỏ!
7495991696451666706,7495982526733847816,Linh,Ui có khi nào bị ngộ độc gì không🥺 thương quá,17,1745296590,ui có khi nào bị ngộ độc gì không thương quá
7495993879063675656,7495982526733847816,Tóc Quang Tuyết,Thế thì nghi bánh ngọt bị sao rồi,53,1745297109,thế thì nghi bánh ngọt bị sao rồi
7496004509894771464,7495982526733847816,Ka Mi,"Bánh trôi nổi trên thị trường lại hết đát nữa, thương các con.",9,1745299568,"bánh trôi nổi trên thị trường lại hết đát nữa, thương các con."
7495983944028373778,7495982526733847816,Đàm Lê Tuyển,thương 2 con.mong các con an nghỉ...,9,1745294795,thương 2 con.mong các con an nghỉ...
7496006636935676680,7495982526733847816,Thanh Thủy  37☘️🏘️,"nỗi đau này sao bố mẹ, ông bà chịu nổi 😭",5,1745300068,"nỗi đau này sao bố mẹ, ông bà chịu nổi"
7495998321748804370,7495982526733847816,yenminh21,Trời ơi thương đứt ruột 😭😭,1,1745298130,trời ơi thương đứt ruột
7496036942326252305,7495982526733847816,Ngọc Đỗ,"Thương 2 bé nhưng thương ông bà ngoại hơn, đau lòng biết bao giờ quên nỗi đau này",6,1745307127,"thương 2 bé nhưng thương ông bà ngoại hơn, đau lòng biết bao giờ quên nỗi đau này"
7495998335006819079,7495982526733847816,🎀huyên🎀,k bt ông cậu kia có xích mích gi nhà này k,11,1745298128,k bt ông cậu kia có xích mích gi nhà này k
7496042240072745746,7495982526733847816,Ngoc,"Mình nghi do ăn bánh ngọt, vì bánh có nguy cơ dễ hư và cũng dễ bị nhiễm bẩn.",5,1745308361,"mình nghi do ăn bánh ngọt, vì bánh có nguy cơ dễ hư và cũng dễ bị nhiễm bẩn."
7496108924074115847,7495982526733847816,em cún Bư,"khả năng ông bà cho ăn nhầm gì, nhiều khi ông bà hay lượm lặt đồ",5,1745323882,"khả năng ông bà cho ăn nhầm gì, nhiều khi ông bà hay lượm lặt đồ"
7496805022605951762,7495982526733847816,lão nạp,xót quá,1,1745485955,xót quá
7496739952324657928,7495982526733847816,Yêu Lầm,"con mình bị một lần ăn xôi một lần uống trà sữa xong ói sốt cao lì bì người mềm nhũn, ói ngày chục lần , sợ lắm",1,1745470806,"con mình bị một lần ăn xôi một lần uống trà sữa xong ói sốt cao lì bì người mềm nhũn, ói ngày chục lần , sợ lắm"
7496098390131131144,7495982526733847816,꧁༺𝖓𝖌𝖆🕊️𝖕𝖍Ạ𝖒༻꧂,Ông bà day dứt lắm.thương ông bà hết nuôi con gái rồi nuôi cháu ngoại,3,1745321433,ông bà day dứt lắm.thương ông bà hết nuôi con gái rồi nuôi cháu ngoại
7496102132912636679,7495982526733847816,Độc thân vui tính.,thương hai cháu và ông bà ngoại quá 😭,4,1745322299,thương hai cháu và ông bà ngoại quá
7496076767628116752,7495982526733847816,Thịnh Nguyễn,thương 2 cháu,3,1745316400,thương 2 cháu
7496040615789593351,7495982526733847816,Thuý Hồng 77,"Tội 2 cháu quá, thương ông bà ngoại nỗi đau quá lớn",3,1745307981,"tội 2 cháu quá, thương ông bà ngoại nỗi đau quá lớn"
7496035868110308103,7495982526733847816,Mật Ong Bảo Lộc,🙏🙏🙏mô phật.thương quá 😢😢😢,3,1745306875,mô phật.thương quá
7496017277130982151,7495982526733847816,Thủy Nguyễn,"Thương các cháu quá , những người ở lại cũng khổ quá",3,1745302557,"thương các cháu quá , những người ở lại cũng khổ quá"
7496068150531998472,7495982526733847816,Ngọc Hân trị nám số 1 vĩnh Bao,trời ơi thương quá,2,1745314393,trời ơi thương quá
7496133487898215176,7495982526733847816,Túi Xách Ngọc Trai Hạt Cườm,"Trùng hợp dữ.Hôm qua bà kế bên cho con tui hộp bánh, chú nó ăn bị dí, tới xem date thì hết date nửa năm. Bất cẩn là đâu nghĩ cho đồ hết date. Hên là con tui chưa ăn. Nay nói bả thì bả nói date 3 năm. Trong khi hộp ghi rõ date. Không biết sao có những người dị luôn á😪",2,1745329602,"trùng hợp dữ.hôm qua bà kế bên cho con tui hộp bánh, chú nó ăn bị dí, tới xem date thì hết date nửa năm. bất cẩn là đâu nghĩ cho đồ hết date. hên là con tui chưa ăn. nay nói bả thì bả nói date 3 năm. trong khi hộp ghi rõ date. không biết sao có những người dị luôn á"
7496045363730105106,7495982526733847816,bảo xuyến ❤️💯%,quá đau xót thương con quá,2,1745309090,quá đau xót thương con quá
7496121920384680712,7495982526733847816,Nguyen Phuong Loan,Ui sao đau thuongg qua z,1,1745326905,ui sao đau thuongg qua z
7496028551688602386,7495982526733847816,Minh Hằng,đau sót quá 🙏🙏🙏 Nam mô A di đà phật 🙏 xin chia buồn cùng gia đình,2,1745305174,đau sót quá nam mô a di đà phật xin chia buồn cùng gia đình
7496081079805248272,7495982526733847816,Tâm tít,Thương xót quá 😭,1,1745317407,thương xót quá
7496089062660670224,7495982526733847816,Cổng tự động thanh hoá,Tội nhỉ.,1,1745319269,tội nhỉ.
7496101673666183944,7495982526733847816,Ba Cô,thật là đau lòng 😭😭😭,1,1745322200,thật là đau lòng
7496012348445278984,7495982526733847816,nguyen danh,"thực ra xui rủi phải chịu thôi
có nhiều lúc vài người ần chỉ có 1 ngươig dính",2,1745301393,thực ra xui rủi phải chịu thôi có nhiều lúc vài người ần chỉ có 1 ngươig dính
7496105868767068946,7495982526733847816,dung,Thương xót vô cùng. Nam mô a di đà phật,1,1745323170,thương xót vô cùng. nam mô a di đà phật
7496069950600823570,7495982526733847816,Minh thêm,"Cần làm rõ để dân khỏi hoang mang trong thực phẩm ,thương 2 cháu quá",1,1745314810,"cần làm rõ để dân khỏi hoang mang trong thực phẩm ,thương 2 cháu quá"
7496109284946920193,7495982526733847816,@ Duy Edit,do bánh dính thốc chuột,1,1745323965,do bánh dính thốc chuột
7496083552452363024,7495982526733847816,Nguyễn Thị Oanh,Vậy mang tiếng chứ khổ lắm,1,1745317995,vậy mang tiếng chứ khổ lắm
7496137155463512840,7495982526733847816,Huế Đoàn,chắc là do đồ ăn bị thiu,1,1745330451,chắc là do đồ ăn bị thiu
7496113143699276551,7495982526733847816,Lê Hiền 1987,Thương ông bà ng thương 2 cháu nhỏ quá.nui con rồi giờ lại chăm cháu không may sự việc xảy ra như vậy tội ông bà quá đau lòng 😢,1,1745324868,thương ông bà ng thương 2 cháu nhỏ quá.nui con rồi giờ lại chăm cháu không may sự việc xảy ra như vậy tội ông bà quá đau lòng
7496152992510722823,7495982526733847816,Tiểu ất,🙏🙏🙏 mong linh hồn các bé sớm được siêu thoát,1,1745334146,mong linh hồn các bé sớm được siêu thoát
7496054228705968904,7495982526733847816,Mông Lung🤍,Nghe mà đau thắt tim gan,1,1745311152,nghe mà đau thắt tim gan
7496013186513928968,7495982526733847816,Nhung Nhung,Tôi nghiệp quá không ông bà nào muốn vậy nhà ngoại cũng vậy,1,1745301596,tôi nghiệp quá không ông bà nào muốn vậy nhà ngoại cũng vậy
7496022981149360904,7495982526733847816,Ngọc Bang Chủ,vụ này chỗ t,4,1745303877,vụ này chỗ t
7496026584240538376,7495982526733847816,Nguyễn Thành,quá tội nghiệp cho các cháu 😳,1,1745304713,quá tội nghiệp cho các cháu
7496058115378676488,7495982526733847816,khai tâm 💓💓,có khi nào chuối có hàm lượng thuốc trừ sâu vượt ngưỡng cho phép,1,1745312056,có khi nào chuối có hàm lượng thuốc trừ sâu vượt ngưỡng cho phép
7496040580012917522,7495982526733847816,meo meo,"🙏🙏🙏🙏 thương 2 bé, thương ông bà",0,1745307975,"thương 2 bé, thương ông bà"
7496214497033044743,7495982526733847816,Bắc 1987,Tội i vậy trời,0,1745348471,tội i vậy trời
7496038340887888658,7495982526733847816,Abcd,Quá đau sót,0,1745307454,quá đau sót
7496031710217061140,7495982526733847816,An Ninh1988,khổ cho gđ quá,0,1745305906,khổ cho gđ quá
7496037469658792722,7495982526733847816,Hồng Minh,thương tiếc Quá,0,1745307247,thương tiếc quá
7496038485700625173,7495982526733847816,Diễm Huỳnh,Thương hai con quá nam mô a di đà phật 🙏,0,1745307487,thương hai con quá nam mô a di đà phật
7496023633099653896,7495982526733847816,A Phúc A Phúc,bị ngỗ độc trong thức ăn tôi bửa hom bị ngỗ độc trong bánh mì si vích nhưng uon thuốc sỗ nó đở ói quá trời,0,1745304032,bị ngỗ độc trong thức ăn tôi bửa hom bị ngỗ độc trong bánh mì si vích nhưng uon thuốc sỗ nó đở ói quá trời
7496041038675575559,7495982526733847816,Seven hoang,Thuong ❤quá đau lòng cho ông bà,0,1745308073,thuong quá đau lòng cho ông bà
7496107344209855252,7495982526733847816,camtien339,Thương quá. người thân đau thắc tim. mong bm vượt qua nỗi đau này,0,1745323518,thương quá. người thân đau thắc tim. mong bm vượt qua nỗi đau này
7496033893788222215,7495982526733847816,Mói Mặn Thạch Bàn,trời ơi!,0,1745306413,trời ơi!
7496043525763646215,7495982526733847816,Dũng,"Công nuoi nấng sinh thành nuoi dưỡng giờ lại như vậy ,quá đau lòng",0,1745308652,"công nuoi nấng sinh thành nuoi dưỡng giờ lại như vậy ,quá đau lòng"
7496039886600831762,7495982526733847816,Tam Nguyen91405,thương các cháu,0,1745307805,thương các cháu
7496041237632779026,7495982526733847816,"cu shin ,",😭sợ quá đi,0,1745308122,sợ quá đi
7496043941645943559,7495982526733847816,Thu Đoàn,so quá,0,1745308754,so quá
7496036136759509768,7495982526733847816,Hải yến fashion,Khổ gđ quá,0,1745306937,khổ gđ quá
7496035450185499413,7495982526733847816,Lan Hương,chứ bánh ngọt nào,0,1745306776,chứ bánh ngọt nào
7496037798610666247,7495982526733847816,HuongTran@73,"nam mô siêu sinh tịnh độ bồ tát
nam mô a Di Đà Phật",0,1745307329,nam mô siêu sinh tịnh độ bồ tát nam mô a di đà phật
7496033576845460242,7495982526733847816,hoa giấy,xót xa quá.xin chia buồn cùng gf,0,1745306338,xót xa quá.xin chia buồn cùng gf
7496013448552219408,7495992049070656776,lt.,t xem video mà cô gái đeo kính giơ tay ra cầu cứu mà mấy người thấy vẫn đi qua bth đúng lòng người,7,1745301652,t xem video mà cô gái đeo kính giơ tay ra cầu cứu mà mấy người thấy vẫn đi qua bth đúng lòng người
7496004757527446290,7495992049070656776,Nhỏ Đây Nè,mình nghĩ có khả năng là do ghen tuông .,4,1745299640,mình nghĩ có khả năng là do ghen tuông .
7496096188154151697,7495992049070656776,Đạt 4feet,"lòng người cái gì hả mấy thằng anh hùng mạng 🙂 muốn giúp nhưng lỡ giúp nó cho 1 phát thì lại hay , vác nợ vào mình , cứ phán như đúng rồi , trong việc này khó mà nói người đứng nhìn có tội",3,1745320932,"lòng người cái gì hả mấy thằng anh hùng mạng muốn giúp nhưng lỡ giúp nó cho 1 phát thì lại hay , vác nợ vào mình , cứ phán như đúng rồi , trong việc này khó mà nói người đứng nhìn có tội"
7495993319651787527,7495992049070656776,Út Trang 80,Tội quá 🙏🙏 🙏 nam mô Đại Nguyện Địa Tạng Vương Bồ Tát 🙏🙏🙏🙏🙏,2,1745296970,tội quá nam mô đại nguyện địa tạng vương bồ tát
7496072812009390856,7495992049070656776,mailan,Nam mô a di đà phật cầu cho linh hồn 2 người siêu thoát ạ,0,1745315473,nam mô a di đà phật cầu cho linh hồn 2 người siêu thoát ạ
7496209836222579511,7495992049070656776,Pháp Lê,tôi đấy,0,1745347396,tôi đấy
7496313942685762312,7495992049070656776,Hoa mẫu đơn,Lòng người khó đo...😭😭😭😭😭,0,1745371634,lòng người khó đo...
7496000187329544977,7495992049070656776,độ loa song thì đổi tên😋😋,"😆😆cháy xen vin fats hả các toyno, forno, merno, huyno, kiano",0,1745298578,"cháy xen vin fats hả các toyno, forno, merno, huyno, kiano"
