comment_id,video_id,username,comment_text,digg_count,create_time,clean_text
7540274562841428737,7539507359626841362,be iu ♡,t muốn make nhma khai giảng xong vẫn phải học nên k đc make 😭😭😭,1,1755606989,t muốn make nhma khai giảng xong vẫn phải học nên k đc make
7539947956000129813,7539507359626841362,cú có gaiiii,lại tốn rắn,1,1755530943,lại tốn rắn
7539961157462557458,7539507359626841362,🍓Ôm Đùi Hải Yến Bolero🍒,xin cách làm đi ạ😭,1,1755534017,xin cách làm đi ạ
7540174857965077265,7539507359626841362,Ngọc dayyy,tóc kiểu dì thế ạ,1,1755583777,tóc kiểu dì thế ạ
7539761403852374804,7539507359626841362,ram ram,chờ tut tóc 😔,1,1755487512,chờ tut tóc
7540309658079511302,7539519318451588360,BARON AUTO SERVICE,Never give up 😂😂😂😂😂😂,1408,1755615163,never give up
7544303957099676421,7539519318451588360,ola-vibes01,if you are just seeing this video can we be friends 🤣🤣🤣,19,1756545160,if you are just seeing this video can we be friends
7540490554238042888,7539519318451588360,Review Phim Trọn Bộ,ko biết đường quay ngược dt cho dễ làm hả trời,1351,1755657281,ko biết đường quay ngược dt cho dễ làm hả trời
7541012485885788934,7539519318451588360,Original King...Zion,Who's painting who?,3,1755779046,who's painting who?
7540580255556715269,7539519318451588360,gul__aiym,қазақтар мұнда да барма 😂? біз мыңбыз деңіздер😅.,120,1755678173,? .
7540375699371819781,7539519318451588360,dimitrabi8,Dans 100 ans ils feront rien inh 😂😂,113,1755630540,dans 100 ans ils feront rien inh
7540572820618380039,7539519318451588360,Healthy Inside,yang botak malah maskeran 😭😭😭,379,1755676627,yang botak malah maskeran
7540303034547962632,7539519318451588360,David Luong,kem trộn này đừng để nó khô nhé...,5,1755613720,kem trộn này đừng để nó khô nhé...
7540480650282320696,7539519318451588360,🫀 Levi. Y. 🏍️,alguien habla español aquí 🥲,133,1755654982,alguien habla espaol aquí
7540407848543568646,7539519318451588360,junior 45,c'est le métier qui rentre,11,1755638173,c'est le métier qui rentre
7541486003824460549,7539519318451588360,FRÈRE BERTIN,je suis sel qui commente en français ici ?,43,1755889050,je suis sel qui commente en franais ici ?
7545182823268401976,7539519318451588360,urban,When the owner of the house wants cheaper painter 🤣,7,1756750009,when the owner of the house wants cheaper painter
7540280743294173973,7539519318451588360,hino.600,😒😒😒😒tao ko nói nữa,8,1755608424,tao ko nói nữa
7540271434904584968,7539519318451588360,NGUYỄN_ĐỨC_NGỌC,Tôi bảo lật ngược lại cái nhà song bjo khô mình lật lại là được,10,1755606257,tôi bảo lật ngược lại cái nhà song bjo khô mình lật lại là được
7540482949600068359,7539519318451588360,Minh Dũng,Sao ko lật ngược trần nhà lại cho dễ trám,5,1755655507,sao ko lật ngược trần nhà lại cho dễ trám
7540285783040443156,7539519318451588360,Hữu Nhi😆,xong mới trả lương mà cố đi ný 😂,10,1755609599,xong mới trả lương mà cố đi ný
7540273589703246600,7539519318451588360,N X H,tự dưng lại nhớ đến vụ cắt tóc : e có suy nghĩ đến việc bỏ nghề không ? e không : e cãi cha mẹ cũng phải học cắt tóc 😂,14,1755606759,tự dưng lại nhớ đến vụ cắt tóc : e có suy nghĩ đến việc bỏ nghề không ? e không : e cãi cha mẹ cũng phải học cắt tóc
7540301196705497876,7539519318451588360,Lê Quốc Bảo,ông thầu bất lực. tụi mày cố chấp làm tao sẽ cố chấp nhận để trả lương 😂😂😂🤭🤭🤭,6,1755613189,ông thầu bất lực. tụi mày cố chấp làm tao sẽ cố chấp nhận để trả lương
7541109991836222226,7539519318451588360,💔   🍁LØN£R🍁,I’m sure nah only repair them dey do ooo cause if nah them do the full work 😂🤲 wahala for don sup,67,1755801504,im sure nah only repair them dey do ooo cause if nah them do the full work wahala for don sup
7540268340121174791,7539519318451588360,Bà cô u40 😊,Ông cố ơi ông cố 😁,19,1755605541,ông cố ơi ông cố
7540301145764791058,7539519318451588360,Kim Tâm✔,quả xoa mặt là hiểu tay nghề cứng như nào rồi😂,5,1755613175,quả xoa mặt là hiểu tay nghề cứng như nào rồi
7540280779029431047,7539519318451588360,@Dương Ka2107,Ng đến sau cố lấp đầy khoảng trống của người đến trước để lại😂😂,21,1755608431,ng đến sau cố lấp đầy khoảng trống của người đến trước để lại
7540540445676339976,7539519318451588360,sofi123377,biarin aja yg penting dia seneng dari pada rewel,25,1755669003,biarin aja yg penting dia seneng dari pada rewel
7540259421256942344,7539519318451588360,🍒🍒 cherry 🍒🍒,🤣🤣🤣🤣 có ý chí 👏👏👏,5,1755603461,có ý chí
7540407360830374674,7539519318451588360,𝐅_𝐆𝐚𝐧𝐆🇺🇸♾️,Nous les maçon on connaît ça 😫,12,1755637916,nous les maon on connat a
7540443882669982470,7539519318451588360,HARD TO DEFEND HAPPY WOMAN,so clean and serious🤣🤣🤣🤣🤣,28,1755646419,so clean and serious
7540304698466796306,7539519318451588360,꒷꒦︶꒷꒦︶ ๋ ࣭❤️⤞ɧữμ-ηɠɧĩα⬷❤️⭑꒷꒦,Cố quá để giành lấy trái tim e mà ai ngờ .....🥲,5,1755614004,cố quá để giành lấy trái tim e mà ai ngờ .....
7541149426662195974,7539519318451588360,Rasmané Ouangraoua,pourquoi ya pas des commentaires en francais ici,6,1755810691,pourquoi ya pas des commentaires en francais ici
7540275184918872848,7539519318451588360,Hiếu Hạt Dẻ,"ultr tui cười sắp tắt thở rồi ,chu min a......",7,1755607132,"ultr tui cười sắp tắt thở rồi ,chu min a......"
7540525118779572999,7539519318451588360,🅜🅔🅜🅔🐸,apa aku aja yang nyasar kesini🤣🤣,110,1755665326,apa aku aja yang nyasar kesini
7540928471934321426,7539519318451588360,gia Thịnh,ngồi xem hôm qua tới giờ mà mấy ông chưa trét xong.🥺🥺,8,1755759235,ngồi xem hôm qua tới giờ mà mấy ông chưa trét xong.
7541102587362640645,7539519318451588360,ulisesgracia797,minimi y el gato de la escuelita 🤣🤣🤣,13,1755799779,minimi y el gato de la escuelita
7540272174071153415,7539519318451588360,Tiệm Của Ngọc 6924♥️,chuyện có zị thôi mà toy ngồi cừ ên đó mấy bà,9,1755606431,chuyện có zị thôi mà toy ngồi cừ ên đó mấy bà
7540283201975403285,7539519318451588360,Đức Thịnh,Bả Trần hay Bả người thế . Sao t thấy bả người nét thế 😅😅,9,1755609001,bả trần hay bả người thế . sao t thấy bả người nét thế
7541747882446078740,7539519318451588360,🇹🇷👑M͆a͆r͆d͆i͆n͆L͆i͆👑🇹🇷,#Fikret usta,16,1755950020,#fikret usta
7540564388614062855,7539519318451588360,⠀᠌,aku juga nyasar wey🤣,25,1755674468,aku juga nyasar wey
7540532212283179783,7539519318451588360,🍻Cocacola🍻,GK kak.aku jg nyasar 😩,7,1755666975,gk kak.aku jg nyasar
7540319354760987410,7539519318451588360,Hoàngg Khanhh,Chìu báo sếp trét 2 cái lổ 10phân hết 2 bao bột 😂,8,1755617415,chìu báo sếp trét 2 cái lổ 10phân hết 2 bao bột
7540264241674421013,7539519318451588360,❤͢️͢ ͢L͢i͢n͢h͢ ͢❤͢️͢,Cố chấp thật 🤣,8,1755604585,cố chấp thật
7540265396537213704,7539519318451588360,MiNi,T mua 4G chỉ để xem mấy cái này thôi hả chài 🤣🤣🤣,54,1755604850,t mua 4g chỉ để xem mấy cái này thôi hả chài
7540280961410515719,7539519318451588360,Thanh Thuy75@,tiền công 5tr tiền bột 20tr 😂😂😂,11,1755608475,tiền công 5tr tiền bột 20tr
7540326516657308433,7539519318451588360,benhi19pt,😂😂 có vậy thôi mà tôi cười 15 phút,6,1755619087,có vậy thôi mà tôi cười 15 phút
7541348957534044936,7539519318451588360,diahherliani♐,sbnrny sibuk apa mereka,22,1755857139,sbnrny sibuk apa mereka
7541014364426617616,7539519318451588360,orcid icon,gak rugi nih byar pkrja Kya gini,13,1755779237,gak rugi nih byar pkrja kya gini
7540283465214018325,7539519318451588360,ánh nguyễn,tui cười như điên🤣,7,1755609062,tui cười như điên
7540618910741447442,7539519318451588360,Tiểuu nhị..66🎋,"Tháng này tụi mình làm đủ công.,,còn tăng ca hơn 1 trăm tiếng chắc thang này lãnh lương cao à người ae 🙂",15,1755687164,"tháng này tụi mình làm đủ công.,,còn tăng ca hơn 1 trăm tiếng chắc thang này lãnh lương cao à người ae"
7540572828188132114,7539519318451588360,Nordin Mat Awi,ada pekerja macam pasti sy ambil kerja dengan sy puas hati😁,16,1755676433,ada pekerja macam pasti sy ambil kerja dengan sy puas hati
7540339566185792274,7539519318451588360,➻ŧrâռroꜱყ࿐,cố quá thì quá cố😆😆,10,1755622123,cố quá thì quá cố
7541003888019948289,7539519318451588360,Cóbằngláinhưngmàbiếtláixe_6789,Không lấy băng keo lưới để dán cái lỗ đó lại thì có trét bột bê tới Tết năm sau cũng không dính được 🤣,19,1755776800,không lấy băng keo lưới để dán cái lỗ đó lại thì có trét bột bê tới tết năm sau cũng không dính được
7544361180409037591,7539519318451588360,ÉNERGIE,Ils ont facturé 2000€ se chantier 😂😂😂😂😂,2,1756558479,ils ont facturé 2000 se chantier
7540302450713625351,7539519318451588360,ZeroTMT,Làm công ngày mà kaka,3,1755613478,làm công ngày mà kaka
7542202723869967160,7539519318451588360,Kinto Blaze,Eeeiiiiii🤣😂😂🤣😂,3,1756055923,eeeiiiiii
7539746700664062727,7539743566319406353,Lê Hồng Nhung,"Tôi cũng là phụ nữ ,tôi khuyên lấy vk mà uống rượu bia như nc lã ,xăm mình ,tóc xanh vàng ,nói tục thì nên tránh xa...",1948,1755484086,"tôi cũng là phụ nữ ,tôi khuyên lấy vk mà uống rượu bia như nc lã ,xăm mình ,tóc xanh vàng ,nói tục thì nên tránh xa..."
7539789948230255380,7539743566319406353,ANH HÀO _ 38 🇻🇳🇸🇬,Ko ở được với nhau thì ra mỗi người một đường tại sao lại chọn con đường vào tù cho khổ. Cả hai vk ck tuổi đời còn rất trẻ biết bao nhiêu ước mơ hoài bão ở phía trước,9,1755494157,ko ở được với nhau thì ra mỗi người một đường tại sao lại chọn con đường vào tù cho khổ. cả hai vk ck tuổi đời còn rất trẻ biết bao nhiêu ước mơ hoài bão ở phía trước
7539943823385281301,7539743566319406353,🍀Tuấn Chivas🍀💋,"Tôi năm nay 47 tuổi, chưa thấy tình trạng ntn bao giờ, tôi chưa có vk nhưng xem clip, tôi nghĩ chắc ko cần lấy vk",2,1755529979,"tôi năm nay 47 tuổi, chưa thấy tình trạng ntn bao giờ, tôi chưa có vk nhưng xem clip, tôi nghĩ chắc ko cần lấy vk"
7539759999808520967,7539743566319406353,Nhỏ Bán Sữa,đấy. tụi bây chê gái Miền tây nữa đi 😊,212,1755487180,đấy. tụi bây chê gái miền tây nữa đi
7539759042852782856,7539743566319406353,Khánh Ngự,Ngta tên Hà Thị Hạ. Các Bố Lại Đọc Tên Là Hà Thì Chịu Rồi. Nick Fb Là : Hà Thị Hạ xinh lắm Ae vào mà xin Hữu Duyên ;)),121,1755486957,ngta tên hà thị hạ. các bố lại đọc tên là hà thì chịu rồi. nick fb là : hà thị hạ xinh lắm ae vào mà xin hữu duyên ;))
7539746559702598408,7539743566319406353,Quang,"Tự nhiên thấy mình thật may mắn. Chỉ phải đi làm kiếm tiền, chăm con, làm việc nhà thôi. Mệt nhưng còn mạng 😂",178,1755484054,"tự nhiên thấy mình thật may mắn. chỉ phải đi làm kiếm tiền, chăm con, làm việc nhà thôi. mệt nhưng còn mạng"
7539787148536103700,7539743566319406353,Hiếu Còi,"May cho mình từ ngày lấy vợ tự nhiên ít nói hẳn đi.
Xưa kia vốn đã hiền lành
Từ ngày lấy vợ trở thành hiền khô.😂",45,1755493503,may cho mình từ ngày lấy vợ tự nhiên ít nói hẳn đi. xưa kia vốn đã hiền lành từ ngày lấy vợ trở thành hiền khô.
7539747898218627847,7539743566319406353,bảo anh,bởi vậy nửa đời của mình hãy chọn cho kỹ. nếu thấy khó quá thì ở mình cho khỏe . chọn sai là khổ nửa đời còn lại ....,138,1755484370,bởi vậy nửa đời của mình hãy chọn cho kỹ. nếu thấy khó quá thì ở mình cho khỏe . chọn sai là khổ nửa đời còn lại ....
7539753937127277319,7539743566319406353,Tony Nguyễn,K thấy mấy ce xin vía 😂,31,1755485773,k thấy mấy ce xin vía
7539791560550433544,7539743566319406353,Bùi Văn Trường,Chắc thôi mình k lấy vợ nữa🥺,7,1755494535,chắc thôi mình k lấy vợ nữa
7539752882984485639,7539743566319406353,Hải 9 Háng,sao lại là không may ?,7,1755485526,sao lại là không may ?
7539752452511302420,7539743566319406353,Chàng Khờ,ôi sợ qá.😱😱😱😱,12,1755485430,ôi sợ qá.
7539759913532277512,7539743566319406353,TN:))💚,Ko giám lấy vk🥺,30,1755487165,ko giám lấy vk
7539765458212258581,7539743566319406353,Gạo,"Vậy mà ra ngoài kiểu thuỳ mỵ nết na , rất chi là đáng thương lắm , nên cần đc chở che và lòng thương hại từ anh bồ và ci bồ 😁",8,1755488451,"vậy mà ra ngoài kiểu thuỳ mỵ nết na , rất chi là đáng thương lắm , nên cần đc chở che và lòng thương hại từ anh bồ và ci bồ"
7539774208076677895,7539743566319406353,Trần Ánh - Free Fire,t thấy sợ lấy vợ rồi😳,16,1755490492,t thấy sợ lấy vợ rồi
7539783989491204871,7539743566319406353,THIẾU TIỀN,Cuối cùng thì 2 vk ck vẫn đc gặp nhau ở thế giới bên kia,4,1755492766,cuối cùng thì 2 vk ck vẫn đc gặp nhau ở thế giới bên kia
7539796159495996168,7539743566319406353,Hungking Nguyễn,"Ai luyên sanh sầu ưu, ái luyến sanh sợ hãi, ai giải thoát ái luyến không sầu đâu sợ hãi",4,1755495602,"ai luyên sanh sầu ưu, ái luyến sanh sợ hãi, ai giải thoát ái luyến không sầu đâu sợ hãi"
7539768542918918919,7539743566319406353,Cau_Ken_DJ,t nghỉ lấy vk😂😂,0,1755489176,t nghỉ lấy vk
7539756552179188498,7539743566319406353,Thanh tiger4,Mấy con vk lại vào bảo là tức nc thì vỡ nợ. Tin tin tui đi khả năng k có đứa cgai nào vào cmt đâu😅😅,16,1755486383,mấy con vk lại vào bảo là tức nc thì vỡ nợ. tin tin tui đi khả năng k có đứa cgai nào vào cmt đâu
7539801082958349074,7539743566319406353,ThỏNè,cái này chắt kệ nhắm mắt yêu luôn nè😳,3,1755496750,cái này chắt kệ nhắm mắt yêu luôn nè
7539811189816722194,7539743566319406353,🇻🇳💈CƯỜNG CẮT TÓC💈🇻🇳,"t k hiểu bố mẹ ck đứng đó s k lo cho thèn ck,k gọi điện,nhìn ông cha như ng dưng k có 1 động tác lo lắng gì cả. nhìn khá bình tĩnh",3,1755499101,"t k hiểu bố mẹ ck đứng đó s k lo cho thèn ck,k gọi điện,nhìn ông cha như ng dưng k có 1 động tác lo lắng gì cả. nhìn khá bình tĩnh"
7539756830916330258,7539743566319406353,vô tận,yêu em anh sẽ chờ đợi em,3,1755486449,yêu em anh sẽ chờ đợi em
7539800463160689416,7539743566319406353,꧁༺кιêи༒ʈớɩ༒ͼɧơɩ꧂,AI SỢ VỢ THÌ TỰ VIẾT HOA CÒN TAO TRẢ BAO GIỜ SỢ VỢ 😌,1,1755496600,ai sợ vợ thì tự viết hoa còn tao trả bao giờ sợ vợ
7539788495658976001,7539743566319406353,Vui Vẻ,Lại dc đi du lịch,1,1755493824,lại dc đi du lịch
7539768392766440200,7539743566319406353,Hiền Chipi,thời h sao mà ....😳😳😳😳,1,1755489140,thời h sao mà ....
7539787558986679056,7539743566319406353,🇻🇳Trần Nhung GC.ĐT.🇻🇳,chời🙏🙏🙏,0,1755493606,chời
7539885878732079879,7539743566319406353,Huy,Qua vụ việc này t nhận ra bài học. Chỉ có tiền trong túi mình mới không phản bội mình. Còn lại tất cả những thứ khác đều không đáng tin,0,1755516633,qua vụ việc này t nhận ra bài học. chỉ có tiền trong túi mình mới không phản bội mình. còn lại tất cả những thứ khác đều không đáng tin
7539854229416117008,7539743566319406353,Hùng,Ngày 17 hay 16,0,1755509128,ngày 17 hay 16
7539926178619949840,7539743566319406353,Trung thu trăng sáng như gương,"một xã hội văn minh mà lúc nào cũng án mạng xảy ra như cơm bữa,phú thọ có rất nhiều vụ án gai ốc, tâm điểm đáng chú ý...",0,1755526016,"một xã hội văn minh mà lúc nào cũng án mạng xảy ra như cơm bữa,phú thọ có rất nhiều vụ án gai ốc, tâm điểm đáng chú ý..."
7539787510639297287,7539743566319406353,Thanh Le 🇻🇳 🇹🇭,tiktok tên @Em Yêu°,0,1755493588,tiktok tên
7539941864649687815,7539743566319406353,Long Hoang Van,các cuộc liên hoan công ty phải quản lý người số lượng rượu bia quy trách nhiệm các cuộc liên hoan công ty các nhà hàng phải nhìn số lượng người lớn quy định rõ một người uống bao nhiêu không được quá chung quy lại quản lý chặt rượu bia,0,1755529524,các cuộc liên hoan công ty phải quản lý người số lượng rượu bia quy trách nhiệm các cuộc liên hoan công ty các nhà hàng phải nhìn số lượng người lớn quy định rõ một người uống bao nhiêu không được quá chung quy lại quản lý chặt rượu bia
7539772584717124359,7539743566319406353,Kẻ lừa đảo,@qiaofeng.2004: Có một tiền bối từng dặn ta là: Ta chỉ không muốn để ngươi để tâm vào chuyện nữ nhi tình trường vớ vẩn này nữa. Tiểu tử là một người từng trải ta phải khuyên ngươi một câu đầu tư vào tình cảm quá độ chỉ khiến ngươi sa vào đầm lầy càng sâu thôi. Thậm chí có ngày chết không toàn thây cũng không phải không có khả năng.,2,1755490112,: có một tiền bối từng dặn ta là: ta chỉ không muốn để ngươi để tâm vào chuyện nữ nhi tình trường vớ vẩn này nữa. tiểu tử là một người từng trải ta phải khuyên ngươi một câu đầu tư vào tình cảm quá độ chỉ khiến ngươi sa vào đầm lầy càng sâu thôi. thậm chí có ngày chết không toàn thây cũng không phải không có khả năng.
7539759659231331090,7539743566319406353,spa thư giản hóc môn,nguyên nhân do đâu,17,1755487100,nguyên nhân do đâu
7539798285042500359,7539743566319406353,cải trắng bị heo ủi,"tối ngủ t cứ nhìn vk, ko biết vk t có khó chịu ở đâu ko hay là áp lực công việc j ko, t thấy sợ sợ biết đâu người tiếp theo là mình🥶",30,1755496293,"tối ngủ t cứ nhìn vk, ko biết vk t có khó chịu ở đâu ko hay là áp lực công việc j ko, t thấy sợ sợ biết đâu người tiếp theo là mình"
7539791470913258258,7539743566319406353,Xôi Hà Anh 996,Ở đây k nói để bênh ng vk nha! nhưng phải ở trong gđ họ mjk hiểu s ng vk lại cư xử như thế! giờ chỉ khổ nhiều ng thôi 😞😞😞,6,1755494508,ở đây k nói để bênh ng vk nha! nhưng phải ở trong gđ họ mjk hiểu s ng vk lại cư xử như thế! giờ chỉ khổ nhiều ng thôi
7539774629011899144,7539743566319406353,Trần Tùng BV Phổi.,@123 @be ngoc @Trần Tùng BV Phổi 2 @VietNguyen TVC @nguyên Duyên @Nguyễn Thị Hiếu,0,1755490585,ễn thị hiếu
7539786908520907527,7539777942935653633,NHÀ ĐẤT ĐẮC ĐỊA,"Thôi xong, lại chuẩn bị tiền đền thôi. Anh tài xế nhận lương cả năm",271,1755493445,"thôi xong, lại chuẩn bị tiền đền thôi. anh tài xế nhận lương cả năm"
7539779300149740306,7539777942935653633,Đức Trịnh,"Báo công an luôn , cho biết",141,1755491672,"báo công an luôn , cho biết"
7539805442256552725,7539777942935653633,Khánh,"Anh tài này hay coi toptop nè, ra trước cam đứng đúng chuẩn luôn",30,1755497761,"anh tài này hay coi toptop nè, ra trước cam đứng đúng chuẩn luôn"
7539804468424000264,7539777942935653633,𝐍a𝐌 𝐁ắ𝐂,1 lần làm việc bằng làm cả năm😂mãi đỉnh👌,7,1755497537,1 lần làm việc bằng làm cả nămmãi đỉnh
7539781953709425428,7539777942935653633,PaoPao,Chắc chắn miền ngoài 😂😂😂,48,1755492291,chắc chắn miền ngoài
7539805368940561160,7539777942935653633,Phạm Nghĩa,Đang lái thuê tự dưng có xe ra lái riêng,2,1755497743,đang lái thuê tự dưng có xe ra lái riêng
7539785320335065863,7539777942935653633,Người dự bị...🇻🇳✅,cứ đưa video lên công an...xem còn hống hách nữa không.,105,1755493076,cứ đưa video lên công an...xem còn hống hách nữa không.
7539783499726947079,7539777942935653633,Khanh Duy Ta,ko có 300tr ko rút đơn,11,1755492654,ko có 300tr ko rút đơn
7539800298513695504,7539777942935653633,Hải tỷ,lại đi mấy năm rồi,3,1755496567,lại đi mấy năm rồi
7539800359838073607,7539777942935653633,bomson14,k có 1 tỏi k nói ch,2,1755496576,k có 1 tỏi k nói ch
7539788734368678663,7539777942935653633,đông,hình sự rồi con,8,1755493872,hình sự rồi con
7539790106393576209,7539777942935653633,THẾ GIỚI BẾP - HỒNG KIÊN,"Hoa mắt tróng mặt, luôn trong tâm trạng hoảng sợ k đi lm đc kakaka k có 100tr còn lâu mới hết hoa mắt tróng mặt",19,1755494203,"hoa mắt tróng mặt, luôn trong tâm trạng hoảng sợ k đi lm đc kakaka k có 100tr còn lâu mới hết hoa mắt tróng mặt"
7539811526341886738,7539777942935653633,vanmanngo0,rồi thằng áo vàng đứng đó coi phim á,9,1755499177,rồi thằng áo vàng đứng đó coi phim á
7539784437152908050,7539777942935653633,Ngọ Tộc,thằng đó anh lớn sài gòn không ai dám làm gì nó đâu,20,1755492869,thằng đó anh lớn sài gòn không ai dám làm gì nó đâu
7539786778917208854,7539777942935653633,Bố Đây,Nó con cán bộ chắc luôn,0,1755493449,nó con cán bộ chắc luôn
7539812083321078536,7539777942935653633,abcd@@,người đi xe máy ít dùng mxh à😆😆😆,1,1755499309,người đi xe máy ít dùng mxh à
7539813146098647815,7539777942935653633,Tuổi Thơ Dữ Dội,Rồi rồi tới công chuyện🤣,1,1755499556,rồi rồi tới công chuyện
7542062848416088839,7539777942935653633,Kha Le,có chút xâm mình tự tin hẳn,0,1756023353,có chút xâm mình tự tin hẳn
7539804651517838098,7539777942935653633,Đ🇻🇳,lên VTV thì lại lên phường sớm,1,1755497578,lên vtv thì lại lên phường sớm
7539805426452710151,7539777942935653633,Hùng Hỏng Hẳn,Mới cuối tháng 8 mà đã có thưởng tết🤣,1,1755497756,mới cuối tháng 8 mà đã có thưởng tết
7539798853417419527,7539777942935653633,Đức Hoàng,k có 300 củ k mở mắt,2,1755496229,k có 300 củ k mở mắt
7539779961423725319,7539777942935653633,Duẩn Bùi Thái,1 tỷ,2,1755491829,1 tỷ
7539801211417051922,7539777942935653633,Nguyen Tung Mentor,"k có 2 tỷ auto khó thở, nhức đầu, hoảng loạn, ngồi xe lăn, vinmec xác nhận 🥲, chắc e xe máy ít xem toptop",3,1755496779,"k có 2 tỷ auto khó thở, nhức đầu, hoảng loạn, ngồi xe lăn, vinmec xác nhận , chắc e xe máy ít xem toptop"
7539786427947041544,7539777942935653633,Quân Nguyễn,thằng này chắc ít xem tiktok,1,1755493572,thằng này chắc ít xem tiktok
7539795722439672583,7539777942935653633,Hiếu Hơi Hay,nó lên phường chưa a.e,1,1755495496,nó lên phường chưa a.e
7539793587594298120,7539777942935653633,Võ Lê Minh,Ai đúng ai sai có công an giải quyết,1,1755495005,ai đúng ai sai có công an giải quyết
7539797451483693842,7539777942935653633,Vô Danh C1,Hình sự nằm vùng rồi khổ thân lái xe công nghệ,2,1755495904,hình sự nằm vùng rồi khổ thân lái xe công nghệ
7539788386984837896,7539777942935653633,Đi tìm hạnh phúc,thưa cán bộ e tưởng như thế là ngầu và e chỉ muốn thử thách xem công an có dám bắt e k ấy mà hehehe,1,1755493792,thưa cán bộ e tưởng như thế là ngầu và e chỉ muốn thử thách xem công an có dám bắt e k ấy mà hehehe
7539786792750564117,7539777942935653633,lặng thầm,chắc nhanh lên phường uống trà thôi,1,1755493423,chắc nhanh lên phường uống trà thôi
7539787161404572433,7539777942935653633,𝓝𝓰𝓾𝔂ễ𝓷 𝓣𝓻𝓾𝓷𝓰 47c1,Rồi rồi m xong rồi 🤦‍♂️,1,1755493521,rồi rồi m xong rồi
7539791090632803073,7539777942935653633,Không Sợ Đâu,Người nam 🥰,1,1755494429,người nam
7539786486011953941,7539777942935653633,TopTop seller,lại vin méc thôi,1,1755493348,lại vin méc thôi
7539791199722668808,7539777942935653633,teoteote7,xin phần 2 đi 😃😃😃,1,1755494450,xin phần 2 đi
7539826380050989845,7539777942935653633,.....,lại ko coi toptop r!,0,1755502638,lại ko coi toptop r!
7539810778426147592,7539777942935653633,Bùi hùng 599,bế lên phường,0,1755499001,bế lên phường
7539797524321960722,7539777942935653633,Tho Nguyen,Đợi ảnh lên phường thôi😁,0,1755495919,đợi ảnh lên phường thôi
