comment_id,video_id,username,comment_text,digg_count,create_time,clean_text
7331254680692278034,7329473663445601554,rojota joku,y chang thịt khìa,2,1706940761,y chang thịt khìa
7329524349131195157,7329473663445601554,Anh Ba Chà Cú💨,Thịt nướng quấn lá dổi ăn bao cuốn,2,1706537940,thịt nướng quấn lá dổi ăn bao cuốn
7329740802644755218,7329473663445601554,Rudyus TDT,Nó giống vị lá tía tô ko mn,1,1706588288,nó giống vị lá tía tô ko mn
7329866896576185096,7329473663445601554,uran :),ăn ngon như thịt 👍,1,1706617638,ăn ngon như thịt
7329529557333345042,7329473663445601554,Bình Phạm,Tương ớt cay vài è,2,1706539095,tương ớt cay vài è
7329476744268169985,7329473663445601554,Đăng nè,Hello anh,1,1706526813,hello anh
7329503181117358856,7329473663445601554,🇻🇳VănThạch1997🐃🇻🇳,thiếu kim chi rồi,2,1706532956,thiếu kim chi rồi
7398591281024779015,7329473663445601554,binbụngbự,Nhìn giống thịt pikachu,1,1722618773,nhìn giống thịt pikachu
7329488893820404482,7329473663445601554,Nguyễn Phước Thắn172,lá vừng :))),1,1706529640,lá vừng :)))
7329476680824963848,7329473663445601554,nqm🇻🇳,Gớt nước miếng 🤤,1,1706526785,gớt nước miếng
7329755391008490241,7329473663445601554,Kinnnnnn🐸,E có ông thầy dạy toán tên là Khoa ở hà nam thấy khen anh tới tấp ko bt a bt thầy í ko,2,1706591692,e có ông thầy dạy toán tên là khoa ở hà nam thấy khen anh tới tấp ko bt a bt thầy í ko
7329475560785904385,7329473663445601554,Dainn TL,Tự dưng đói ngang 😢,3,1706526537,tự dưng đói ngang
7329475045675205383,7329473663445601554,Hoàng Thị Thùy Dương,Rớt nước miếêng😳,1,1706526490,rớt nước miếêng
7329475288257430273,7329473663445601554,Anh Khoa 🐳,cx sớm nè,1,1706526476,cx sớm nè
7329526264750015240,7329473663445601554,Kim Anh 🤍,Tính ra thịt nướng hàn họ k ướp đâu. Ăn thế mình thấy ngon hơn,1,1706538327,tính ra thịt nướng hàn họ k ướp đâu. ăn thế mình thấy ngon hơn
7329525089816822529,7329473663445601554,Lã Đình Nhật,Chai tương ớt trông đúng ngon,1,1706538065,chai tương ớt trông đúng ngon
7329762670189445896,7329473663445601554,Phong.( Chơi raz),Có nơi ngta gọi là lá tía tô nhật. Hoặc lá nhíp,1,1706593374,có nơi ngta gọi là lá tía tô nhật. hoặc lá nhíp
7329513966417085192,7329473663445601554,xmpp,lá kim êm thích ăn 🤡,3,1706535462,lá kim êm thích ăn
7329893533480600321,7329473663445601554,winn🧚🏿‍♀️,"T chưa đi hàn quốc nhưng t thấy trên phim, mấy video trên mạng thấy thịt nướng HQ để nguyên bản ko ướp gì mà sao về Vn lại thấy sốt nướng thịt HQ vậy",2,1706623846,"t chưa đi hàn quốc nhưng t thấy trên phim, mấy video trên mạng thấy thịt nướng hq để nguyên bản ko ướp gì mà sao về vn lại thấy sốt nướng thịt hq vậy"
7329475835706442498,7329473663445601554,Hải Đăng Review,Tính ra ngon mà rẻ hơn đi ăn bút pke hen,2,1706526606,tính ra ngon mà rẻ hơn đi ăn bút pke hen
7329517344773931778,7329473663445601554,Hồ Bảo Long,Anh ơi cho e xin cái bếp nướng với ạ,1,1706536260,anh ơi cho e xin cái bếp nướng với ạ
7330153389446038280,7329473663445601554,Tiệm Tạp Hoá Nhà Nguyễn,Lạnh này mà có miếng thịt nướng thì miễn chê 🥰🥰🥰,0,1706684346,lạnh này mà có miếng thịt nướng thì miễn chê
7414234395127874322,7329473663445601554,Lý Bảo Thúy,Úi xinh quá,0,1726260980,úi xinh quá
7329785936040411906,7329473663445601554,Pisco🚬,ba chỉ anh mua thịt đó hả,0,1706598812,ba chỉ anh mua thịt đó hả
7329756847844672264,7329473663445601554,.....,lá này nhà t lấy nấu canh ăn ngon lắm,0,1706594108,lá này nhà t lấy nấu canh ăn ngon lắm
7329848354837119746,7329473663445601554,Mỏ t giật giật r đấy,kê nhíp ( lá vừng) nha,0,1706613333,kê nhíp ( lá vừng) nha
7329759061859533570,7329473663445601554,PĐT,nhà em nhiều lắm,0,1706592558,nha em nhiêu lăm
7329871842637775634,7329473663445601554,Quý Nguyễn,[happy],0,1706618790,[happy]
7329827146930062082,7329473663445601554,成安,thêm cải xanh nữa cho nó cay cay,0,1706608396,thêm cải xanh nữa cho nó cay cay
7330148714813866753,7329473663445601554,𝓗𝓪̀ 𝓝𝓱𝓪̂𝓷,Cái nấm này không được lật. Cái nước của nó mới đáng tiền,0,1706683262,cái nấm này không được lật. cái nước của nó mới đáng tiền
7408794547822183176,7329473663445601554,Nguyễn Thủy,nó là lá Vừng nha😀,0,1724994407,nó là lá vừng nha
7329576426650125064,7329473663445601554,Hồng Sơn 28,sao giống lá tía tô trắng vậy,0,1706550011,sao giống lá tía tô trắng vậy
7329605186967454466,7329473663445601554,Gái Đẹp Hay Dỗi,Anhem Lý Nhân :)),0,1706556742,anhem lý nhân :))
7329496104847835912,7329473663445601554,👨‍🍳 Phát AS 💡,chào đkaaa,0,1706531306,chào đkaaa
7329721181254238983,7329473663445601554,Duy Anh Phạm322,Lá kia là dau diếp không phải xà lách,0,1706583720,lá kia là dau diếp không phải xà lách
7329747928090837778,7329473663445601554,Bố mày là NTT ok nhé ?!,mua cái chai tương ớt kia ở đâu v ạ,0,1706589939,mua cái chai tương ớt kia ở đâu v ạ
7329496523795251975,7329473663445601554,Iucanoc,Thịt xào a ơi,0,1706531401,thịt xào a ơi
7329519009556415233,7329473663445601554,TRAEDR STORE,Nhìn giống lá rau kinh giới. Mà hàng quốc toàn ăn lá tía tô mà,0,1706536651,nhìn giống lá rau kinh giới. mà hàng quốc toàn ăn lá tía tô mà
7329809350267929350,7329473663445601554,Anh Ba Vui Vẻ,Nấm đó là nấm gì vậy,0,1706604251,nấm đó là nấm gì vậy
7329660534524429064,7329473663445601554,mùa đông,chô mình gọi đây là lá kinh giới,0,1706569609,chô mình gọi đây là lá kinh giới
7329538652173173522,7329473663445601554,Khanh Vaan,"Ê cái nước sốt ngon thật. Ăn 1 lần nghiền tới giờ, các loại khác không có cửa luôn nhá=))))Ướp thịt làm bún chả cx ngon😋😋",0,1706541210,"ê cái nước sốt ngon thật. ăn 1 lần nghiền tới giờ, các loại khác không có cửa luôn nhá=))))ướp thịt làm bún chả cx ngon"
7384070150352028433,7329473663445601554,🧿nhím con [hân]🍥🧿,Ủa lá tía tô mà anh,0,1719237818,ủa lá tía tô mà anh
7329929763748348679,7329473663445601554,Lê Mknh Hậu,thiếu kim chi 😂,0,1706632276,thiếu kim chi
7330005907479659265,7329473663445601554,BạchThủChi,"Thịt nướng ngon nhất là thịt vai, 3 chỉ ăn vẫn ngấy",0,1706650075,"thịt nướng ngon nhất là thịt vai, 3 chỉ ăn vẫn ngấy"
7329523037702390530,7329473663445601554,Huong Le,quấn lá sung là chuẩn bài😁😁,0,1706537580,quấn lá sung là chuẩn bài
7329590244167402248,7329473663445601554,ᴷᴵᴹ ᴸᴼᴳ💚,xin link mua nồi nướng này b ơi,0,1706553227,xin link mua nồi nướng này b ơi
7329590434158134024,7329473663445601554,🦢 arabbit shop°｡⋆♡,lá vừng,0,1706553282,lá vừng
7329562708826571522,7329473663445601554,Tuanngoc180399,Vừa gặp hôm trước ăn ở hảo la xong,0,1706546826,vừa gặp hôm trước ăn ở hảo la xong
7329625808732652290,7329473663445601554,B A B Y S T O R M,Lá nhíp,0,1706561552,lá nhíp
7329533562918781704,7329473663445601554,Huệ mét năm tư,Ng hàn gọi lá nhíp,0,1706540028,ng hàn gọi lá nhíp
7373246039765517074,7329473663445601554,use,đang đói,0,1716717663,đang đói
7329543508271825666,7329473663445601554,Marbel,"Này là Kê nhíp của Hàn Quốc mà. Ăn kèm thịt nướng ngon, nhưng không phải ai ăn cũng được",0,1706542353,"này là kê nhíp của hàn quốc mà. ăn kèm thịt nướng ngon, nhưng không phải ai ăn cũng được"
7536202069447951124,7329473663445601554,feryom5,đợi mãi khúc ăn cái nấm mà chất thấy =)),0,1754658782,đợi mãi khúc ăn cái nấm mà chất thấy =))
7329568856539382546,7329473663445601554,P.Thảo 🍇🪻☘️,nấm mỡ nhóe 🤗,0,1706548247,nấm mỡ nhóe
7472370223648654100,7329473663445601554,Vy Thuy,chổ tôi là là lá tía tô,0,1739796784,chổ tôi là là lá tía tô
7336896498029167362,7329473663445601554,LUFFY TẬP REVIEW,Thèm ghê nha 😂,0,1708254360,thèm ghê nha
7349109563095794440,7331360082644503841,shreya,i think i gyat something in my eye 😭🙏,86,1711097916,i think i gyat something in my eye
7352405005195854622,7331360082644503841,isac,this might be king kong,5,1711865213,this might be king kong
7349195036142174982,7331360082644503841,liyaa.,temen gw inimah😘,289,1711117824,temen gw inimah
7463431349304214280,7331360082644503841,✿★ ྀིྀི 🌸VY🌷 ★ ྀིྀི ✿,"Bạn thật cười, tôi đẫ hài",18,1737715543,"bạn thật cười, tôi đẫ hài"
7536579804544418561,7331360082644503841,lê ngân,khỉ thật hay giả,0,1754746734,khỉ thật hay giả
7468951017532277511,7331360082644503841,bác sĩ chữa bệnh ngu lồn,chắc ca này bác k chữa đc rồi xl các cháu,11,1739000697,chắc ca này bác k chữa đc rồi xl các cháu
7554723374103544583,7331360082644503841,tramnghuyen261116,cái j vậy hoihoang305,1,1758971112,cái j vậy hoihoang305
7498675145284895495,7331360082644503841,Cạp nia 🐍🐍,con trang lớp t,12,1745921372,con trang lớp t
7446400461131465492,7331360082644503841,Brotein🎱,gửi bạn một cái ôm nhé,5,1733750221,gửi bạn một cái ôm nhé
7440719464188166930,7331360082644503841,PHƯỢC,Sao nó nhảy đc vậy,12,1732427507,sao nó nhảy đc vậy
7425106907907785480,7331360082644503841,lili mõ hỗn,khi con bạn thân được khen là nhảy đẹp💀,8,1728792425,khi con bạn thân được khen là nhảy đẹp
7363601072978051858,7331360082644503841,HCR1VN,T đang xem cái j thế này💀💀,8,1714471984,t đang xem cái j thế này
7346608609969029890,7331360082644503841,Châu,Ác mộng lúc 11h đêm,6,1710515625,ác mộng lúc 11h đêm
7349289782930948870,7331360082644503841,Carlos,quien me grabó 😡,5,1711141873,quien me grabó
7364011211010704145,7331360082644503841,Ô Sê,😂😂😂 làm videos giỏi quá,5,1714567485,làm videos giỏi quá
7417816972970623762,7331360082644503841,Chú Cháu Bồ Câu ✅,Hài quá 😂😂😂,5,1727095105,hài quá
7356864105368224517,7331360082644503841,Xyywxz.,lah itu gua jir,14,1712906739,lah itu gua jir
7540883089661625104,7331360082644503841,BẢOAN💟,ôi kooo my oi,0,1755748674,ôi kooo my oi
7552516156687713031,7331360082644503841,Hieu Pham,đang cố nhịn cười🤭🤭🤭🫠,0,1758457321,đang cố nhịn cười
7562528351711609618,7331360082644503841,út cưng,sao giống vậy,0,1760788355,sao giống vậy
7346824932980933377,7331360082644503841,Ngỏc Lòng Mang Dạ Sói 🥀🥀💃🏿,@❤️‍🩹 @Muối Xênh😪 @❤️‍🩹🩹 @🐋iam._qynn🐳 @🐝Chou🐝 @🌸 Sinna_Togukawa 🍑 @Hạ_giang💤 @👁👄👁,5,1710565997,sinna_togukawa
7347637336652350216,7331360082644503841,Tường Vy💎,@Được    Oppo 🐓🐓 bỉ Ngạn ₫ỏ quýnh ₫ổ máu,19,1710755142,bỉ ngạn ỏ quýnh ổ máu
7538376021109490450,7331360082644503841,Gái đẹp bị khùng:)))),Nhắc nhẹ bn Trâm,5,1755164949,nhắc nhẹ bn trâm
7547666327289676560,7331360082644503841,🫶Mỹ Tâm💃,@^_^ G I A.B Ả o £ ^_^,1,1757328020,g i a.b ả o ^_^
7550987552015172360,7331360082644503841,Ủng hộ hùng đi,@୨ৎThuy Tram ᡣ𐭩 @dep gai 1%,1,1758101297,tram %
7544319675141587730,7331360082644503841,H.Trúc 🥚,@:3 @♡Vợ PANGBOJII ♡ @hay cọc @Qhoa💤 @kl. @😡Nhuys💢 @Emdayduboyloveeee✨  thành đạt,2,1756548813,pangbojii thành đạt
7543490661418550024,7331360082644503841,iu ah quí ❤️,@Quí Văn(TIỀN TÀI VÀ DANH VỌNG),1,1756355794,(tiền tài và danh vọng)
7539301497055478546,7331360082644503841,thik thầm ông bve😞,@🍐 (vk top) @권지용,1,1755380443,(vk top)
7549517793239368466,7331360082644503841,Lộc🔥,@𝟭𝙢𝟰𝟴ᡣ𐭩 giống mi,1,1757759094,giống mi
7545729408688472850,7331360082644503841,mơ đi là có tất cả thôi!,video đầu trong hồ sơ coi cap sẽ thấy bớt ngờ:)),1,1756877291,video đầu trong hồ sơ coi cap sẽ thấy bớt ngờ:))
7541014756157555463,7331360082644503841,Bảo Huy 6/7 😖,😂haaaaa,1,1755779323,haaaaa
7535461225530966801,7331360082644503841,đóm chúa🤴,"Ha ha ha ha, bạn đã làm tôi cười rớt nước mắt.",1,1754486294,"ha ha ha ha, bạn đã làm tôi cười rớt nước mắt."
7538329534728258311,7331360082644503841,PTGx⁴⁹⁹💫♈ Casanova,@€©®QuỳnhNhưctee@¶√ nhỏ này khi nhảy,0,1755154121,nhỏ này khi nhảy
7537340488493482760,7331360082644503841,thuhien2308,you are commenting using your Facebook account activity no more you can,0,1754923843,you are commenting using your facebook account activity no more you can
7557531921409213206,7331360082644503841,Phạm Ngọc Dũng,"Trên đời này, điều gì cũng có thể thay đổi, ngoại trừ sự lười biếng của tao.",0,1759625057,"trên đời này, điều gì cũng có thể thay đổi, ngoại trừ sự lười biếng của tao."
7537915116885787399,7331360082644503841,♡,@G.Bảo ᥫ᭡ bảo nhảy j đấy,0,1755057634,bảo nhảy j đấy
7537611588250911496,7331360082644503841,Yên Linh 💤,@trần§đại,0,1754986969,đại
7548067687823246087,7331360082644503841,AT,@Quỳnh🐬❤️ bạn ơi,0,1757421466,bạn ơi
7564413287645152007,7331360082644503841,Ôk🤧,Giống bn đào lớp mik,0,1761227225,giống bn đào lớp mik
7561419983223096120,7331571593426046241,moo deng,I love behemoth,0,1760530296,i love behemoth
7539026891156996871,7331571593426046241,leonaing54,ur,1,1755316491,ur
7542815175343833864,7331571593426046241,বেকার ছেলে,no,0,1756198519,no
7331648263806731009,7331571593426046241,kí ức nhỏ,máy ép chạy bằng cơm,11,1707032415,máy ép chạy bằng cơm
7525980348707472146,7331571593426046241,Nilar Nilar,08877777776,0,1752278871,08877777776
7531619962160628498,7331571593426046241,Tina美髮屋87,con gì vậy troi,0,1753591938,con gì vậy troi
7331941327666463506,7331571593426046241,Hien Lien,roi máy cây răng có tát dung gì,9,1707100636,roi máy cây răng có tát dung gì
7331733456659350290,7331571593426046241,Tài JR,bảo sao heo đen sợ là phải,5,1707052227,bảo sao heo đen sợ là phải
7529738554059391749,7331571593426046241,🪼⋆.ೃ࿔*bana:･🫧𓇼 🌊,te presento a crema dental,1,1753153892,te presento a crema dental
7495023384842748677,7331571593426046241,Omgggg.                     🪳,"а потом : "" Ой, мам, Я случайно телефон уронил""",5,1745071150,": "" , , """
7549368541860217618,7331571593426046241,Yussi Candra Dewie,oo,1,1757724359,oo
7560301775409382164,7331571593426046241,লজাবতি🙈🙈🥰🥰🙈🙈,"🥺@প্রেস করে হোল্ড করলে পিন, পেস্ট এবং ডিলিট করার অপশন আসবে😭যেকোন লেখা বা ছবি কপি করলে ""Recent"" এ আসবে। তবে পিন না করলে ১ ঘন্টা পর মুছে যাবেএকসাথে অনেকগুলো ডিলিট বা পিন করতে অথবা ইচ্ছানুযায়ী নতুন ক্লিপ যোগ করতেযেকোন লেখা বা ছবি কপি করলে ""Recent"" এ আসবে। তবে পিন না করলে ১ ঘন্টা পর মুছে যাবেএকসাথে অনেকগুলো ডিলিট বা পিন করতে অথবা ইচ্ছানুযায়ী নতুন ক্লিপ যোগ করতে ""Manage"" বাটনে চাপুনপ্রেস করে হোল্ড করলে পিন, পেস্ট এবং ডিলিট করার অপশন আসবে ""Manage"" বাটনে চাপুন",0,1760269936,", ""recent"" ""recent"" ""manage"" , ""manage"""
7335307808517112578,7335280452812475650,thuhng3861,trời ơi đỉa cứu con,4,1707884465,trời ơi đỉa cứu con
7375857945378980626,7335280452812475650,Mẹ Su Mun,Ôi nổi hết da gà,0,1717325760,ôi nổi hết da gà
7556891998399529736,7335280452812475650,Tình Dư,nuôi hả trời chứ đòi bây giơ mà đĩa nhiều như nuôi vậy trời,9,1759476038,nuôi hả trời chứ đòi bây giơ mà đĩa nhiều như nuôi vậy trời
7557342548593951496,7335280452812475650,Alchemist,Hoá ra đây là đĩa lền tựa bánh canh…..😅,3,1759580936,hoá ra đây là đĩa lền tựa bánh canh..
7546597760084427528,7335280452812475650,CÔ HAI 🌹Miền Tây 🌹,Ơi trời 😧 má ơi nổi hết da gà luôn 🥹🥹,1,1757079220,ơi trời má ơi nổi hết da gà luôn
7557585046447997712,7335280452812475650,Sóc 🐿️🐿️,chạy đi 🗣️🗣️🏃‍♂️🏃‍♂,0,1759637406,chạy đi
7557450125909148424,7335280452812475650,Lâm Thập Bát,t đi bắt cá cx chả nhiều như vậy 😇,0,1759605991,t đi bắt cá cx chả nhiều như vậy
7556892464662430472,7335280452812475650,hẹ hẹ,người xưa sao sống hay thật,1,1759476143,người xưa sao sống hay thật
7557230204008022802,7335280452812475650,Nguyễn M. Thuận,"rải vôi đi, khiếp quá :(",0,1759554778,"rải vôi đi, khiếp quá :("
7557729848010507015,7335280452812475650,HoaiBaoP,âm ảnh z,0,1759671110,âm ảnh z
7556981424621273874,7335280452812475650,Yên Ổn736,ghê quá,0,1759496854,ghê quá
7561791542009119496,7335280452812475650,Người Việt gốc Tây(Tây Nguyên),khiếp,0,1760616797,khiếp
7558828326597968648,7335280452812475650,addyournickname,nó bám vậy làm sao cho nó rớt ra,0,1759926873,nó bám vậy làm sao cho nó rớt ra
7557976184102650632,7335280452812475650,Harry Trần🍀,"Troi oi ,tôi óc ác nổi 😳",0,1759728469,"troi oi ,tôi óc ác nổi"
7557381216815940368,7335280452812475650,Ni cô chải tóc bên bờ suối,Nhức đầu ngứa mình ngứa mẩy,0,1759589943,nhức đầu ngứa mình ngứa mẩy
7551043152715547400,7335280452812475650,Nguyễn minh phước,Pha vôi ăn chàu tạt cái quéo hết,0,1758114242,pha vôi ăn chàu tạt cái quéo hết
7557778944704611088,7335280452812475650,A3 Trà Cú,nhậu sĩn té xuôg 1 cái là còn bộ xương luôn 😅,0,1759682545,nhậu sĩn té xuôg 1 cái là còn bộ xương luôn
7335768203082171142,7335761712571895072,sara,Amazon though I it scared me😳😂😂,33,1707991652,amazon though i it scared me
7336120904894481157,7335761712571895072,256immaculate,Amazing man,7,1708076508,amazing man
7335876282620347141,7335761712571895072,successfully,which country is this 😂😂,10,1708018970,which country is this
7337531062862594821,7335761712571895072,Nancy akello,i miss,6,1708407380,i miss
7336084145988272902,7335761712571895072,mai mambo,is this a carper🥺,8,1708065208,is this a carper
7336041985999373061,7335761712571895072,N.F Zahra,It scared,7,1708059031,it scared
7336197547557683973,7335761712571895072,Mm koum AyARa,Je veux ce tapis là aussi,10,1708091610,je veux ce tapis là aussi
7335929309636772613,7335761712571895072,Henry Prado,😳😳😳😳😳😳 Pero qué,9,1708031827,pero qué
7336530357510095621,7335761712571895072,maria familia_top❤️,showwww👏🥰,6,1708169097,showwww
7337399163305837317,7335761712571895072,chisomo Atipatsa Maganga,please 🥺,2,1708374053,please
7337436644708647685,7335761712571895072,Nélida Rojas Huamàn,guau que miedo pero muy impresionante,1,1708380119,guau que miedo pero muy impresionante
7336953341526344453,7335761712571895072,onyitexx2,if u watch am 2 times let's gather here,2,1708269647,if u watch am 2 times let's gather here
7337242021382193921,7335761712571895072,David Beckham,cho hỏi giá tiền và mua ở đâu vậy ?,1,1708334811,cho hỏi giá tiền và mua ở đâu vậy ?
7338481029075813125,7335761712571895072,Manathi❤️,AmaChina ke Bawo🙆,1,1708623271,amachina ke bawo
7336281873956930309,7335761712571895072,ranaBurhaan001,I scared😳😅😅😅😅😂😂😂😂,2,1708111251,i scared
7337042920997028613,7335761712571895072,Elva Bethina,ohhhhh,1,1708291154,ohhhhh
7338085052335244038,7335761712571895072,Lesedi Lesedi,🤣🤣🤣🤣🤣🤣🤣🤣🤣🤣🤣😅tiktok huh😳,1,1708531082,tiktok huh
7336197559541170949,7335761712571895072,Mm koum AyARa,Intéressé,2,1708091614,intéressé
7337203419532329733,7335761712571895072,jemima Malamu,montage,1,1708329396,montage
7337580483965223685,7335761712571895072,Mwajuma Mkumba,waongo wakubwa nyie,1,1708413613,waongo wakubwa nyie
7336046976699712261,7335761712571895072,🌹baba mama ki jan❤️❤️,wao,2,1708056554,wao
7337306914547008261,7335761712571895072,favyjohnson6,wawu....,1,1708352954,wawu....
7336984302712341254,7335761712571895072,Jeannette Lopez Castro,que genial la alfombra,4,1708274790,que genial la alfombra
7337071221151941381,7335761712571895072,saiddibane,Wach hadi basa7 kaina bhal haka,1,1708297262,wach hadi basa7 kaina bhal haka
7338566897757963010,7338363354857098498,TỊNH HÂN,xịn lắm shop,1,1708643319,xịn lắm shop
7339524588811322118,7339511932690468102,☆°secrettraa°☆,MALAH CUCI MUKA 😭😭,66771,1708866254,malah cuci muka
7339514453090976518,7339511932690468102,malik,Minyaknya bnyak bgt😭,115313,1708863892,minyaknya bnyak bgt
7339514215638926085,7339511932690468102,🌸zanita🌸,untung isinya buka cabe ci,43366,1708863838,untung isinya buka cabe ci
7495584892849423122,7339511932690468102,່Fánnsz.,gw kesini gara² mursid🗿🗿,1813,1745201882,gw kesini gara mursid
7339515953766908678,7339511932690468102,cyn🍓⁷,langsung jdi cleansing oil😭😭,2304,1708864240,langsung jdi cleansing oil
7339534424260739861,7339511932690468102,WAN PIJIOT,untung gak ada sambel nya😭,1436,1708868596,untung gak ada sambel nya
7339515556070933254,7339511932690468102,indie Galleria,untung belom disambelin😭,21650,1708864148,untung belom disambelin
7368774773541716742,7339511932690468102,kairi,untung bukan bakso mercon,2602,1715676594,untung bukan bakso mercon
7358831573498348293,7339511932690468102,Tutuy DAILYPAINT =͟͟͞͞🕊,untung ga di kasih cabe😭🙏,250,1713361506,untung ga di kasih cabe
7339510954017571590,7339511932690468102,Aldi,setiap review pasti ada kendala tidak terduga😭😭,2763,1708864653,setiap review pasti ada kendala tidak terduga
7361306806372549382,7339511932690468102,ikemyloase✯,"yg kena mata dia,tp gua jg merasa perih😭😔",157,1713937814,"yg kena mata dia,tp gua jg merasa perih"
7339646829619364614,7339511932690468102,`Frolla Del Rey❦,kuah bakso rasa makeup luntur😭,23,1708894713,kuah bakso rasa makeup luntur
7433694922106127110,7339511932690468102,I'm Yours🦋,Mampir kesini karna video gagal estetik core😂😭,661,1730791988,mampir kesini karna video gagal estetik core
7339605192977662726,7339511932690468102,keren,bakso crt😐,1715,1708885015,bakso crt
7339516141533381382,7339511932690468102,upil kudanil✨,untung bukan isi cabe😭🙏,1637,1708864284,untung bukan isi cabe
7339514970387120902,7339511932690468102,Ibnu Setya,aku ikutan kaget😭,202,1708864015,aku ikutan kaget
7339577623113433861,7339511932690468102,tohirsoksoleh,bakso crit,431,1708878599,bakso crit
7367208312431739653,7339511932690468102,🌷~dea?,untung isinya bukan cabe🗿,22,1715311871,untung isinya bukan cabe
7339513978844873477,7339511932690468102,rdt,vidio asli cak imin makan bakso bareng sibungbung,2756,1708863778,vidio asli cak imin makan bakso bareng sibungbung
7339865484349145861,7339511932690468102,numberonegirl_,Muncrat sih tapi banyak bet minyaknya 😭😭,730,1708945622,muncrat sih tapi banyak bet minyaknya
7339502836869645062,7339511932690468102,H for Hoshi🖤,kaget dikit sisanya syok berat,61,1708864063,kaget dikit sisanya syok berat
7371439650755789574,7339511932690468102,Dℹ️S,kena muka jadi pengenn mandi langsung anjirr😭,40,1716297049,kena muka jadi pengenn mandi langsung anjirr
7362759918346306310,7339511932690468102,Diiqq🥷🏻,crt😭🗿,5,1714276143,crt
7495610046006838036,7339511932690468102,D̶i̶a̶s̶ ̶n̶a̶t̶a̶l̶i̶s̶ 🤸,ayo kita balik lagi,10,1745207738,ayo kita balik lagi
7339850397374513925,7339511932690468102,Rollz..,di crt in bakso,5138,1708942107,di crt in bakso
7358068012467192582,7339511932690468102,anak ustadz.,ternyata bukan makhluk idup aja yang crt,9,1713185174,ternyata bukan makhluk idup aja yang crt
7339653783490396933,7339511932690468102,ylghsjakak,Cmshot😭,694,1708896331,cmshot
7339738290692571909,7339511932690468102,244. ᴅᴇʟᴜɴᴇ.,Perih bgt itu😫😫😫,670,1708916013,perih bgt itu
7339515210066297605,7339511932690468102,Karinadinata,Untung bukan beranak cabe ci sampe masuk mata itu loh😭,47,1708864069,untung bukan beranak cabe ci sampe masuk mata itu loh
7495632722608030472,7339511932690468102,𝖆𝖗𝖎 𝖊𝖑-𝖋𝖆𝖙𝖎𝖍 🇵🇭,balik balik yok,5,1745213017,balik balik yok
7495715267490841362,7339511932690468102,🕸🌑,dah tau kan yu balik yu 🗿,10,1745232222,dah tau kan yu balik yu
7352797787396866822,7339511932690468102,່,untung blm di kasih sambell,15,1711956659,untung blm di kasih sambell
7339514523215430406,7339511932690468102,R🌹,kena mata😭,38,1708863909,kena mata
