comment_id,video_id,username,comment_text,digg_count,create_time,clean_text
7510629107018973959,7491560518151392520,MOON-V,t già rồi nên kb hickey là cái gì,15,1748704614,t già rồi nên kb hickey là cái gì
7491564277657486087,7491560518151392520,Văn Ciệt,iu vs chả đương,5,1744265749,iu vs chả đương
7491616405037581074,7491560518151392520,tỷ tỷ 🐬🌻,tui thì thấy nhột nha 😂,10,1744277878,tui thì thấy nhột nha
7511690891162026760,7491560518151392520,YÊN,la gi vay mn🤣,2,1748951829,la gi vay mn
7491711912096465685,7491560518151392520,Kiệt chạy AB,hickey là gì v =))) gần 19t đầu chưa biết hickey là gì,11,1744300128,hickey là gì v =))) gần 19t đầu chưa biết hickey là gì
7491624636237939464,7491560518151392520,ovᴇʀтнιɴκιɴԍ♒,nụ hôn thần chết 😑 cái hôn tử thần,9,1744279801,nụ hôn thần chết cái hôn tử thần
7491640102411830034,7491560518151392520,Mesiuuu,Hickey là sao?,9,1744283405,hickey là sao?
7491570881091486472,7491560518151392520,Bs chữa bệnh LGBT,mấy đứa tag người yêu hay ck vào đây đi,8,1744267285,mấy đứa tag người yêu hay ck vào đây đi
7491641003327079186,7491560518151392520,Quỳnh Vy,ủa là sao hôn không mà thế hả chắc tôi hết dám yêu. yêu mà hôn có thẹo ở cổ thì tôi né trước đây nhường cho các bạn nữ đó,0,1744283614,ủa là sao hôn không mà thế hả chắc tôi hết dám yêu. yêu mà hôn có thẹo ở cổ thì tôi né trước đây nhường cho các bạn nữ đó
7513148721833050898,7491560518151392520,MinhhHảo🐳,nghe cái sợ ngang,1,1749291257,nghe cái sợ ngang
7512540065017676561,7491560518151392520,🇻🇳 Út*1990🇻🇳,đánh dấu chủ quyền tôi cũng đã từng,1,1749149550,đánh dấu chủ quyền tôi cũng đã từng
7513392797879436049,7491560518151392520,Ngọc An,42 cùng câu hỏi tương tự : hickey là gì ???.,1,1749348096,42 cùng câu hỏi tương tự : hickey là gì ???.
7491963871666930450,7491560518151392520,Duyên🇰🇷,Ủa là hit key cũng bị hả ta😢,1,1744358786,ủa là hit key cũng bị hả ta
7513606772855964432,7491560518151392520,Mẹ em Bơ 🥑,Ai giống tui k. Hickey là gì vậy 😳😳😳,1,1749397909,ai giống tui k. hickey là gì vậy
7491738941558735623,7491560518151392520,lật trang sách mới 🍀🍀,tốt nhất là k làm j,1,1744306424,tốt nhất là k làm j
7511620225244594951,7491560518151392520,Huong nguyen,Kg hiểu,1,1748935380,kg hiểu
7492081086756913927,7491560518151392520,na na,hickey là j vậy mn này mình xin hỏi thật ạ,1,1744386079,hickey là j vậy mn này mình xin hỏi thật ạ
7491658076665201429,7491560518151392520,Jun,"mấy đưa hay thắc mắc:""Ngoài kia ko biết thế giới yêu nhau kiểu gì??""",3,1744287590,"mấy đưa hay thắc mắc:""ngoài kia ko biết thế giới yêu nhau kiểu gì??"""
7511390018994144018,7491560518151392520,Như Nguyệt🥰,40t nay tao mới bt hockey 🤔,1,1748881780,40t nay tao mới bt hockey
7511598919085490952,7491560518151392520,Linh Trần,ế đã cứu tui một mạng,1,1748930419,ế đã cứu tui một mạng
7511375826559353607,7491560518151392520,☘️ Nhi ☘️,Hên tui chưa bao giờ chơi trò này 😂,1,1748878475,hên tui chưa bao giờ chơi trò này
7511410230459106055,7491560518151392520,My Nguyễn Nhà Phố,già đầu như tui giờ vào tìm kiếm mới biết hickey là gì 😂 vậy là ế đã cứu tui một mạng,1,1748886483,già đầu như tui giờ vào tìm kiếm mới biết hickey là gì vậy là ế đã cứu tui một mạng
7491643142117131016,7491560518151392520,đang lụy phim 🤭,cái gì đây,1,1744284113,cái gì đây
7491666474856792853,7491560518151392520,thảo hay mít ước 💦,thiẹt hk,2,1744289539,thiẹt hk
7491686188107121426,7491560518151392520,Nhẫn,này thì đánh dấu lãnh thổ,1,1744294138,này thì đánh dấu lãnh thổ
7491672898790621959,7491560518151392520,Nguyễn Văn Nam 🇻🇳,chắc lại học clip trên mạng🤣🤣🤣,1,1744291046,chắc lại học clip trên mạng
7511613866280387346,7491560518151392520,L Ã T U Y Ế T,30 tuổi vào đọc Hickey là gì 😫,2,1748933898,30 tuổi vào đọc hickey là gì
7491953585790403333,7491560518151392520,Thích ăn bánh mì🥖,Ghệ t cũng đòi hickey quài vây trơi🙂,1,1744356414,ghệ t cũng đòi hickey quài vây trơi
7513222408594785040,7491560518151392520,Sùng A Páo 🍀,Hôn hít là tôi năm 15 tuổi bây ạ😂,0,1749308417,hôn hít là tôi năm 15 tuổi bây ạ
7491679625924494098,7491560518151392520,cái đồ mít ướt 🦂,hên t ko có ny :)),0,1744292598,hên t ko có ny :))
7509795700287341330,7491560518151392520,Mr_Bean168,là gì ? hok hiewur,0,1748510576,là gì ? hok hiewur
7492035755923260168,7491560518151392520,iv,"nhiều chỗ cũng vậy ý, mn nên tìm hiểu",0,1744375526,"nhiều chỗ cũng vậy ý, mn nên tìm hiểu"
7491694934278669074,7491560518151392520,Thành,sao TQ toàn tập trung chuyện lạ nhỉ,0,1744296164,sao tq toàn tập trung chuyện lạ nhỉ
7511763826955797266,7491560518151392520,KhDuy,đôi khi độc thân cứu tui một mạng,0,1748968814,đôi khi độc thân cứu tui một mạng
7511724797504684807,7491560518151392520,TRIỆU NAM,Đánh dấu lãnh thổ 😂😂,0,1748959724,đánh dấu lãnh thổ
7507182906461881096,7491560518151392520,huy VP,"thiện tai thiện tai,bần tăng chưa bao giờ hôn ở trên cổ😅😅",0,1747902235,"thiện tai thiện tai,bần tăng chưa bao giờ hôn ở trên cổ"
7512059447083025160,7491560518151392520,Cò,nụ hôn thần chít,0,1749037640,nụ hôn thần chít
7512325292170658568,7491560518151392520,Út Khờ 568,Nụ hôn thần chớt,0,1749099540,nụ hôn thần chớt
7491668029547283255,7491560518151392520,ỘT nè,cho mình hỏi ôg bạn trai có bị bắt ko á,0,1744289927,cho mình hỏi ôg bạn trai có bị bắt ko á
7491677448129659656,7491560518151392520,c.M,Thoiii sợ quá,0,1744292097,thoiii sợ quá
7511642184446608135,7491560518151392520,ッXuɣêղ-Bụi°ᵒ彡,cạo gió có bị hok ta,0,1748940492,cạo gió có bị hok ta
7511954692755850002,7491560518151392520,Chỉ yêu người lạ,Nụ hôn thần chết🤣🤣🤣,0,1749013254,nụ hôn thần chết
7491686714227999495,7491560518151392520,🖤,đã luôn 😂,0,1744294256,đã luôn
7513176191789417232,7491560518151392520,Trần Trường An,Là s v mn s tui tối cổ ngang v,0,1749297655,là s v mn s tui tối cổ ngang v
7507755713126384392,7491560518151392520,๖ۣۜðũทջ☪ɦ¡ϑα₷¹⁹⁹⁶ッ🇯🇵🇻🇳,hickey là không được hôn.cho những ai chưa biết,0,1748035618,hickey là không được hôn.cho những ai chưa biết
7511722839746265863,7491560518151392520,Quách Ngọc Hùng,gần 30 mà còn chưa biết hickey là gì 🤣,0,1748959268,gần 30 mà còn chưa biết hickey là gì
7507805783095247624,7491560518151392520,★彡ᑕᗩᑭTIOᑎ༻꧂,Giới trẻ thời nay xem điều đó là cái trend. Là khẳng định chủ quyền😌,0,1748047270,giới trẻ thời nay xem điều đó là cái trend. là khẳng định chủ quyền
7491641783316644615,7491560518151392520,𓆝,nước ngoài mà lo gì,0,1744283799,nước ngoài mà lo gì
7507777224214561543,7491560518151392520,𝓒𝕳ύ 𝕭ộ 𝕯ộ𝒊,Mấy đứa có ny vào mà xem,0,1748040627,mấy đứa có ny vào mà xem
7491644281409880850,7491560518151392520,CuBin,rồi nó còn yêu ko cưng 😏,0,1744284373,rồi nó còn yêu ko cưng
7492089453348225800,7491560518151392520,Thiên hữu 🇻🇳,F.A bất tử,0,1744388022,f.a bất tử
7491645832846131976,7491560518151392520,Phát,Độc thân là hay nhất,0,1744284740,độc thân là hay nhất
7510554652589818631,7491560518151392520,K&T Aluminium,Sướng tê người hớ hớ🤣,0,1748687282,sướng tê người hớ hớ
7511311608216486674,7491560518151392520,LặnG,hàng triệu triệu người với có 1 trường hơp thôi ông giáo ợ,0,1748863521,hàng triệu triệu người với có 1 trường hơp thôi ông giáo ợ
7511347658672751368,7491560518151392520,1%🪫,tao nghỉ hôn luôn 😂😂😂,0,1748871918,tao nghỉ hôn luôn
7491887355219051272,7491560518151392520,trn cnq phnq,m có ngiu chứ a có đâu,0,1744340980,m có ngiu chứ a có đâu
7491797215968166674,7491560518151392520,Trần Bắc,thật luôn,0,1744320033,thật luôn
7491648330394551041,7491560518151392520,Geen coser,Hic trán động mạch lớn ra :((( đừng hic ở cổ 🥲,0,1744285332,hic trán động mạch lớn ra :((( đừng hic ở cổ
7510519122779210503,7491560518151392520,Dương Thach,xem phim tổng tài quá mà 😂,0,1748679010,xem phim tổng tài quá mà
7491646438166921992,7491560518151392520,Văn Hien Lê,Thk đó ám ảnh suốt cả đời luôn,0,1744284877,thk đó ám ảnh suốt cả đời luôn
7511753271595451143,7491560518151392520,Rong rêu,t đi bl dạo tiktok cả triệu bé rồi mà chưa biet hickey là j 😏😏,0,1748966354,t đi bl dạo tiktok cả triệu bé rồi mà chưa biet hickey là j
7491663177873343239,7491560518151392520,_taun.keit_,Cha là bây. Yêu với đương mang mệt,0,1744288771,cha là bây. yêu với đương mang mệt
7491702952748761863,7491560518151392520,Dũng,May là không có ai hôn 😅😅,0,1744298039,may là không có ai hôn
7491645243792966420,7491560518151392520,má phính 🎀,này đúng là người đàn ông có sức hút thật nè,0,1744284599,này đúng là người đàn ông có sức hút thật nè
7491676571885339399,7491560518151392520,Ngĩa Đây Gòi😗,kakakaakak,0,1744291898,kakakaakak
7511865517222462226,7491560518151392520,🗿🗿👌,hickey là cái j v🤡,0,1748992497,hickey là cái j v
7491644910593098504,7491560518151392520,quangtao,bl thì ko b đi Hickey,0,1744284518,bl thì ko b đi hickey
7513609372711453447,7491560518151392520,Buuu,@Hien🎀 😅 xanh xương,1,1749398511,xanh xương
7491726044782363393,7491560518151392520,Bé Điệu 🎀,@Nguyễn Kha,1,1744303425,ễn kha
7491858363589722881,7491560518151392520,Anh họ Mai tên Khang,@☘️An Nhiên☘️,1,1744334269,nhiên
7491829112639308561,7491560518151392520,𝕿ố𝕹𝕲 𝕯ሆ℺𝕹𝕲 𝑸𝓤Ỳ𝕹𝕳,@N-n0905,1,1744327443,-n0905
7510603960819794696,7491560518151392520,Vuong Trong,@♡~~bé Uyên~~♡ 🙂🙂,1,1748698759,uyên~~
7491672445876241173,7491560518151392520,🌻.TB  Ann.🌻,@SongTử ♊T5 🐣❤️‍🩹,1,1744290934,t5
7491599279095595794,7491592336871361799,☆Nhất☆Arsenal☆,này thì bạn của con người.😁,19,1744273907,này thì bạn của con người.
7491609254852789000,7491592336871361799,17896,ba mẹ kiểu này thì chịu r,4,1744276221,ba mẹ kiểu này thì chịu r
7491598760269038354,7491592336871361799,Bông 🖐️🥹🥹,"rồi mắc mớ gì bị cắn , lại không cho con đi khám ngay . cũng không đi tiem . sợ.",6,1744273793,"rồi mắc mớ gì bị cắn , lại không cho con đi khám ngay . cũng không đi tiem . sợ."
7492328052417856274,7491592336871361799,nhocbuong_,Ủa alo,0,1744443578,ủa alo
7491612984117986066,7491592336871361799,1975 Tiến Trọng Lê,Nghe mà sợ quá,0,1744277089,nghe mà sợ quá
7491682374142001928,7491592336871361799,@ 7Cường  TP,do người nhà,0,1744293242,do người nhà
7492329490103763730,7491592336871361799,nhocbuong_,Thông tin sai sự thật mà mn adua toxic gd họ,1,1744443917,thông tin sai sự thật mà mn adua toxic gd họ
7491656590397014801,7491592336871361799,鄧氏梅🇻🇳🇻🇳,Mình xin đính chính lại là bé đã đk người nhà đưa đi cấp cứu ngay tại lúc đó nhé bài báo viết linh tinh,2,1744287255,mình xin đính chính lại là bé đã đk người nhà đưa đi cấp cứu ngay tại lúc đó nhé bài báo viết linh tinh
7491601259523228424,7491592336871361799,D.Thao,@Tu.Tu @ttt2003 @Tú- Tử vi thất sát 😳,1,1744274360,- tử vi thất sát
7491594766876214023,7491592336871361799,nguyễn công,con đẻ bị con nuôi cắn😁😁😁,1,1744272859,con đẻ bị con nuôi cắn
7491629947398095621,7491592336871361799,Người Từng Thương 💋💋💋,chủ quan đến thế là cùng 😒,0,1744281076,chủ quan đến thế là cùng
7492280461570818823,7491592336871361799,Tiệm ViVu ở quê,"Mẹ mình bị cho cắn xong con đấy cứ chảy dãi rồi nhe răng ra,mẹ mình có đi tiêm và thử độc rồi,nhưng đến nay là nửa tháng,mẹ mình kêu ng nóng và lạnh rồi buồn nôn,liệu còn bị ảnh hưởng k ạ,do ở xa",0,1744432499,"mẹ mình bị cho cắn xong con đấy cứ chảy dãi rồi nhe răng ra,mẹ mình có đi tiêm và thử độc rồi,nhưng đến nay là nửa tháng,mẹ mình kêu ng nóng và lạnh rồi buồn nôn,liệu còn bị ảnh hưởng k ạ,do ở xa"
7491605559684383506,7491592336871361799,maria nhu y,con nào cũng là con sao phân biệt như vậy? làm như con không đẻ á?☹️,0,1744275369,con nào cũng là con sao phân biệt như vậy? làm như con không đẻ á?
7492868589415465736,7491592336871361799,Wild_Beast,"Quả báo là có thật. Nuôi mấy loại này, rồi sẽ có ngày như vậy thôi",0,1744569434,"quả báo là có thật. nuôi mấy loại này, rồi sẽ có ngày như vậy thôi"
7495886980178248490,7491606766451445000,salliesue,Thanks we all needed this,24,1745272211,thanks we all needed this
7493864744911438610,7491606766451445000,Ayesha🫶,TikTok is the best Medicine of Depression 🤯😂,183,1744801363,tiktok is the best medicine of depression
7496563290559496990,7491606766451445000,SweetNana,"Love this, but it's just my goofiness showing through!! 🤣🤣🤣🤣🤣🤣🤣🤣",6,1745429684,"love this, but it's just my goofiness showing through!!"
7495666454018097975,7491606766451445000,kingsboy,and my mind is telling me different things 😂😂😂,9,1745220903,and my mind is telling me different things
7492736278908306198,7491606766451445000,Yvonne Brink,Genau ich hab alles verstanden und meinen Horizont erweitert 😂😂,19,1744538616,genau ich hab alles verstanden und meinen horizont erweitert
7495709632131842862,7491606766451445000,hama_dzs,THIS IS SO ME🤣,5,1745231009,this is so me
7495083705208800031,7491606766451445000,ashmemohammed,too funny❤️❤️❤️❤️❤️❤️💓💓💓💓,5,1745085184,too funny
7493189723386020630,7491606766451445000,Robert Perutka,Parlament. 😂😂😂,6,1744644194,parlament.
7497105449054487326,7491606766451445000,dianaharris939,😂😂😂cute!!,6,1745555920,cute!!
7493193830650479365,7491606766451445000,robertolino416,boa 😂😂😂😂😂😂,8,1744645174,boa
7492802151783072518,7491606766451445000,clau🥰,meus amigos kkk,8,1744553981,meus amigos kkk
7496960345660015391,7491606766451445000,lisatorres1960,❤️❤️❤️❤️Beautiful Babies ❤️❤️❤️❤️,9,1745522124,beautiful babies
7492606046264083201,7491606766451445000,مُحَمَّد اِسْمَاعِیْل حُسَیْن,The smiles of dogs and cats are the most beautiful.🤣😂😅,26,1744508321,the smiles of dogs and cats are the most beautiful.
7495452894671504159,7491606766451445000,All Gone Odor Eliminator,🌸 Adorable 🌸,11,1745171145,adorable
7492563444358513415,7491606766451445000,Adriana hoyos,"I am in love with the buffalo, he is beautiful 🥰🥰",43,1744498422,"i am in love with the buffalo, he is beautiful"
7496007158317630238,7491606766451445000,David Carper,Democrats,16,1745300224,democrats
7492836945115644674,7491606766451445000,robert,Assemblée nationale ?,11,1744562055,assemblée nationale ?
7495651476863451946,7491606766451445000,Sonr♤m☆,heeeeeeyyy😂😂,11,1745217419,heeeeeeyyy
7492447066531513109,7491606766451445000,Jadershope Collection,🤣🤣🤣you make me laugh 🤣🤣🤣😁🥰💖💖💖,32,1744471283,you make me laugh
7495891658006741790,7491606766451445000,April Bloodwash57,😂😂what on earth is happening 😂😂😂,9,1745273305,what on earth is happening
7492808483269411585,7491606766451445000,user84461552838,Cute and funny,17,1744555439,cute and funny
7495838414320665386,7491606766451445000,Larry Taylor,didn't see the bad words,31,1745260928,didn't see the bad words
7495424371117802258,7491606766451445000,Rashmi,woow super👌👌👌,9,1745164491,woow super
7492574204564751121,7491606766451445000,Mr. AR Hossain 💕,Heyyyyyy👏👏👌👌😂😂🥺,31,1744500963,heyyyyyy
7495836857880707871,7491606766451445000,Gloria  Morales fuentes,Omg.🤣🤣🤣🤣🤣🤣🤣🤣🤣🤣🤣,8,1745260539,omg.
7498852865613611782,7491606766451445000,@ Thierry Armand,un coeur pour le Prophète Mohammed,11,1745962777,un coeur pour le prophète mohammed
7492904502443901702,7491606766451445000,228. 7130152,"Florida so
amo un militaire et je vous remercie par KO mais il",10,1744577807,florida so amo un militaire et je vous remercie par ko mais il
7495400487412433710,7491606766451445000,𝓨𝓸𝓾𝓻𝓼 𝓽𝔂𝓫 ✨🦋,Check my new post🥺,17,1745158944,check my new post
7492888625932190469,7491606766451445000,Shaki Mumbeja,tough stuff😸☠️🎃🤖👹👽😻,14,1744574099,tough stuff
7495236081920754440,7491606766451445000,Roxanna14,Jajajajaja...,7,1745120660,jajajajaja...
7492868418736751382,7491606766451445000,catherineshana3,oui... Pas mal ....,7,1744569384,oui... pas mal ....
7492225611491492616,7491606766451445000,chanh,ko lưu đc 😂,11,1744419739,ko lưu đc
7495347988178797330,7491606766451445000,seamen Emon,"outstanding performance,
repost copylink share kore dilam",9,1745146714,"outstanding performance, repost copylink share kore dilam"
7492516040292369174,7491606766451445000,philippelecoq55,les discours à macron 🤣,12,1744487340,les discours à macron
7495241824760742687,7491606766451445000,isi Jimmy,nice follow me 😜,15,1745121996,nice follow me
7492801724177105719,7491606766451445000,Edwin CL NEX,el perrito 😂,14,1744553869,el perrito
7496327621845041962,7491606766451445000,onebigmouth,The Trump administration,7,1745374807,the trump administration
7495968846120583982,7491606766451445000,Cheryl,"o
g love this 😀",15,1745291278,o g love this
7493196581455561493,7491606766451445000,little girl 🧚,my friend's 🤟🤟,31,1744645800,my friend's
7494330048544490247,7491606766451445000,MIKEY〆ᴰᴬᴰᴬꔪ,mero doxt haru hun😂😂😂😂😂😂😂,11,1744909705,mero doxt haru hun
7492861055401968439,7491606766451445000,loruhama,😂jajaja jajaja jajaja,5,1744567686,jajaja jajaja jajaja
7492317033183953672,7491606766451445000,tetehrika,sendiri aja ini🙄,28,1744441009,sendiri aja ini
7492740937396290325,7491606766451445000,Janaki Basyal,Happy new year 2082,8,1744539709,happy new year 2082
7492890020987716407,7491606766451445000,Rosario,hermosos,6,1744574428,hermosos
7496073875676775176,7491606766451445000,มึนจังกู🇹🇭🤟🇹🇭,hayyy. what is your name🤣🤣🤣,8,1745315722,hayyy. what is your name
7496936249070633774,7491606766451445000,Betty,So adorable 🥰,10,1745516529,so adorable
7492413558006825748,7491606766451445000,shooky93,sirkel apa ini 😭,19,1744463489,sirkel apa ini
7491970079553225479,7491606766451445000,Yêu Cuộc Sống,gì vậy làm hết hồn,10,1744360233,gì vậy làm hết hồn
7493179816243184406,7491606766451445000,Anna Digová,haaaaaaa,10,1744641888,haaaaaaa
7492043969317208833,7491606766451445000,🌾 Cô Út Cà Mau 🪷,Sao nó khớp dữ dị chời 😁😁,8,1744377436,sao nó khớp dữ dị chời
7492105583395701522,7491606766451445000,Lộc Nè,con số 3 tui thấy nó là giải trí nhất 😜,5,1744391781,con số 3 tui thấy nó là giải trí nhất
7492664739710976786,7491606766451445000,Cuộc đời buồn,đứa nào củng đáng yêu🥰🥰🥰👍👍👍❤️❤️❤️,5,1744521973,đứa nào củng đáng yêu
7492482913360249618,7491606766451445000,Imam Syafi'e,heeeiiiiyyyyy.....,7,1744479635,heeeiiiiyyyyy.....
7492013596895249160,7491606766451445000,lê Thị thắm,ai dịch hộ tui không,9,1744370364,ai dịch hộ tui không
7492284625210114834,7491606766451445000,Lá,Sao k thấy nút lưu video vậy nhỉ,8,1744433465,sao k thấy nút lưu video vậy nhỉ
7492046883307946770,7491606766451445000,Thảo 🍓1236 🇻🇳,sao nó khớp với gia đình mình vậy trời.gd 5 người ai cũng có nè,11,1744378114,sao nó khớp với gia đình mình vậy trời.gd 5 người ai cũng có nè
7491931104963478279,7491606766451445000,Tạp Hoá Gia Kiệt,mới vừa mở tỷ lên luôn tưởng chuyện gì 😳😳,20,1744351159,mới vừa mở tỷ lên luôn tưởng chuyện gì
7498060781185319711,7491606766451445000,Lil_kinggg_616,Dog:😁,10,1745778351,dog:
7492849456695968545,7491606766451445000,R#€$,look at me name 😂,31,1744565128,look at me name
7492612709059560199,7491606766451445000,freedom happiness🍁,Điệu cừoi vô cảm của NYC,5,1744509864,điệu cừoi vô cảm của nyc
7492282360500159250,7491606766451445000,Pyae Sone,game name,46,1744432940,game name
7492048851898008337,7491606766451445000,cẩm Ngọc,vui vẻ,7,1744378565,vui vẻ
7491630760605549320,7491627950396165384,duy le,Chuyên hàng đểu😂😂😂,177,1744281224,chuyên hàng đểu
7491636746427581205,7491627950396165384,Blossom Tech,tao cũng đến lạy đứa nào mua áo in thằng nhóc này về mặc. 😂,1722,1744282624,tao cũng đến lạy đứa nào mua áo in thằng nhóc này về mặc.
7491652453995692818,7491627950396165384,⁸¹༒ɧôɰ•ɳλɤ•ßạɳ•ổɳ•ƙɧôɳɡ༒꧂🙂‍↔️,1 đứa trẻ thật ngoan 😁😁,186,1744286287,1 đứa trẻ thật ngoan
7491696591784674069,7491627950396165384,Vi,T mua đâu đó cỡ 20c áo thun QL rồi vẫn thấy vải ok thoii . Gần đây nhất áo khoác của QL bán mặc rất ấm luôn tiền nào của đó thôi,34,1744296556,t mua đâu đó cỡ 20c áo thun ql rồi vẫn thấy vải ok thoii . gần đây nhất áo khoác của ql bán mặc rất ấm luôn tiền nào của đó thôi
7491711693291832082,7491627950396165384,Trần Anh Thư,nhìn cách nó bịt miệg thằng pé kìa 😳😳,1184,1744300069,nhìn cách nó bịt miệg thằng pé kìa
7491693099129226002,7491627950396165384,Anh Long Đồ Chơi,"🤣 hiền lành, chất phát",31,1744295742,"hiền lành, chất phát"
7491631682169996053,7491627950396165384,Đi một mìnhh,ôi zời,4,1744281443,ôi zời
7491669886651253522,7491627950396165384,thuongnguyen915,Đi hỏi già về nhà hỏi trẻ 😅😅,151,1744290347,đi hỏi già về nhà hỏi trẻ
7491680188612330260,7491627950396165384,Anh Huần Hoè,Thằng nhỏ đã biết quá nhiều…,21,1744292738,thằng nhỏ đã biết quá nhiều
7491673862209143570,7491627950396165384,user1070012399452,trẻ con ko bao giờ nói dối,60,1744291263,trẻ con ko bao giờ nói dối
7491669240048911112,7491627950396165384,Bách Hoá TikTok Mart  🛒,Người đầu tiên lên tiếng về chất lượng sp của QL.,26,1744290186,người đầu tiên lên tiếng về chất lượng sp của ql.
7491706840641012487,7491627950396165384,🫧🫧,"Hồi đó t coi đc clip này, vô cmt toàn khen Lôi con k chả thấy ai nhắc đến chất lượng áo dù th nhỏ nói thế,",174,1744298938,"hồi đó t coi đc clip này, vô cmt toàn khen lôi con k chả thấy ai nhắc đến chất lượng áo dù th nhỏ nói thế,"
7491739777521074951,7491627950396165384,Hậu Hí,"Ái chà nhìn cái cách chạy lại bịt miệng thằng nhỏ kìa,dị là hiền dữ chưa😅",13,1744306614,"ái chà nhìn cái cách chạy lại bịt miệng thằng nhỏ kìa,dị là hiền dữ chưa"
7491701275748172552,7491627950396165384,Quế Anh,bịt miệng nhỏ hổng kịp hài😂,42,1744297647,bịt miệng nhỏ hổng kịp hài
7491644007837516551,7491627950396165384,Sống Để Trả Thù,coy nó chạy lại bịnh mồm đứa nhỏ kìa,114,1744284317,coy nó chạy lại bịnh mồm đứa nhỏ kìa
7491876136054702856,7491627950396165384,Phạm Diệp Chấn Phong,Con nít ko hề nói dối 😂,9,1744338365,con nít ko hề nói dối
7491651831438705416,7491627950396165384,Thảo Hiền,đã có hành động gian đối từ lâu tại mình ko để ý :))),1206,1744286130,đã có hành động gian đối từ lâu tại mình ko để ý :)))
7491652592007889672,7491627950396165384,bé xinh,trẻ con đâu bt nói dối,105,1744286306,trẻ con đâu bt nói dối
7491642218853303058,7491627950396165384,nguyễn v ũ,Hàng giả hàng nhái hàng kém chất lượng mua đê😂,63,1744283898,hàng giả hàng nhái hàng kém chất lượng mua đê
7491707638527492872,7491627950396165384,Thỏ,"Chuyện nào ra chuyện đó. K phải fan nhưng mua thử vớ theo lời giới thiệu của c bạn, đi 1,5 năm nay k bị mất fom, co dãn tốt, đang tính đặt thêm",123,1744299121,"chuyện nào ra chuyện đó. k phải fan nhưng mua thử vớ theo lời giới thiệu của c bạn, đi 1,5 năm nay k bị mất fom, co dãn tốt, đang tính đặt thêm"
7491730612852916999,7491627950396165384,HNG777,dân 37 thì hiều rồi,22,1744304473,dân 37 thì hiều rồi
7491851324071002888,7491627950396165384,Heo Con 🐷,Sao bịt miệng lôi con lại vậy? 😂😂😂🤣🤣🤣,11,1744332604,sao bịt miệng lôi con lại vậy?
